809145387,Porque Johnny no merece que le quiten lo que por derecho ya es de él.,0,0,Event,25793976,0,comment,2020-11-12T05:24:09Z,,1162261988,1162261988,Madison Nicole,Pellecer Moraga,Madison Nicole,Madison Nicole Pellecer Moraga,Guatemala City,,GT,,es-419,,[],25793976,25793976,Stop Disney removing Jack Sparrow!,2020-11-11T22:05:41Z,,2020-11-11T22:06:04Z,2020-11-13T23:18:23Z,en-GB,['en'],Disney : Stop Disney removing Jack Sparrow!,"<p>Since amber heard has made her terrible claims and lies against Johnny Depp it’s been said he will lose his roles in fantastic beasts and pirates of the Caribbean. <br>It’s also now been claimed Disney will be taking away our beloved Captain Jack Sparrow from their pirates of the Caribbean ride at their Disneyland parks. Captain Jack is everyone’s favourite pirate, and without him Pirates of the Caribbean wouldn’t be as great as what it is! <br>Let’s get justice for Johnny Depp! Let us see him keep his movies we all love and his place in the Disneyland attraction! </p>",Disney,Stop Disney removing Jack Sparrow!,2021-11-13,,,GB,55.3781,-3.43597,,,,,disney-stop-disney-removing-jack-sparrow,published,,,False,False,,False,,"[{'id': 476543, 'locale': 'en-GB', 'name': 'Other', 'slug': 'other-en-gb', 'photo_id': None, 'created_by_owner': True, 'created_by_staff_member': False, 'total_count': 66966}]",True,False,,2300,2300,0,3492,405,0,0,0,0,0,121,,,,,,224849143,photos/4/cp/fl/MkcpFLKRAKdEgkY-fullsize.jpg,//assets.change.org/photos/4/cp/fl/MkcpFLKRAKdEgkY-400x400-noPad.jpg?1605132342,False,400,400,//assets.change.org/photos/4/cp/fl/MkcpFLKRAKdEgkY-400x225-noPad.jpg?1605132342,False,400,225,//assets.change.org/photos/4/cp/fl/MkcpFLKRAKdEgkY-800x450-noPad.jpg?1605132342,False,800,450,//assets.change.org/photos/4/cp/fl/MkcpFLKRAKdEgkY-1600x900-noPad.jpg?1605132342,False,1600,900,photo,962285158,962285158,Lauren,Peddie,Lauren,Lauren Peddie,Peterborough,ENG,GB,,en-GB,,[],3,1653002447,1,1654019886,3,1654340646,5,1654021437,16,1655010290.148,4,1654019781.859,5,1654340703.175,10,1654659292.659,1,1653318137.159,4,1651944514.522,"[{'id': 585843, 'display_name': 'Disney', 'email': None, 'type': 'Custom', 'slug': 'disney-3', 'description': 'The Walt Disney Company is a leading diversified international family entertainment and media enterprise with five business segments: media networks, parks and resorts, studio entertainment, consumer products and interactive media.', 'publicly_visible': False, 'verified_at': None, 'summary': None, 'locale': 'en-US', 'confirmed_at': None, 'is_person': True, 'member_of': {}, 'additional_data': {'first_name': 'Disney', 'last_name': None, 'title': None, 'id': 29785}, 'has_email': False, 'photo': {'id': 11704124, 'url': 'photos/1/fc/sa/OpfCsAdtvgKjfEm-fullsize.jpg', 'sizes': {'small': {'url': '//assets.change.org/photos/1/fc/sa/OpfCsAdtvgKjfEm-48x48-noPad.jpg?1519873711', 'processing': False, 'size': {'width': 48, 'height': 48}}, 'medium': {'url': '//assets.change.org/photos/1/fc/sa/OpfCsAdtvgKjfEm-128x128-noPad.jpg?1519873711', 'processing': False, 'size': {'width': 128, 'height': 128}}, 'large': {'url': '//assets.change.org/photos/1/fc/sa/OpfCsAdtvgKjfEm-400x400-noPad.jpg?1519873711', 'processing': False, 'size': {'width': 400, 'height': 400}}, 'xlarge': {'url': '//assets.change.org/photos/1/fc/sa/OpfCsAdtvgKjfEm-800x800-noPad.jpg?1519873712', 'processing': False, 'size': {'width': 800, 'height': 800}}}}}]",False,False,False,Lauren Peddie,Disney : Stop Disney removing Jack Sparrow!,Disney : Stop Disney removing Jack Sparrow!,active,2500,224849143,photos/4/cp/fl/MkcpFLKRAKdEgkY-fullsize.jpg,//assets.change.org/photos/4/cp/fl/MkcpFLKRAKdEgkY-400x400-noPad.jpg?1605132342,False,400,400,//assets.change.org/photos/4/cp/fl/MkcpFLKRAKdEgkY-400x225-noPad.jpg?1605132342,False,400,225,//assets.change.org/photos/4/cp/fl/MkcpFLKRAKdEgkY-800x450-noPad.jpg?1605132342,False,800,450,//assets.change.org/photos/4/cp/fl/MkcpFLKRAKdEgkY-1600x900-noPad.jpg?1605132342,False,1600,900,photo,585843,Disney,,Custom,disney-3,"The Walt Disney Company is a leading diversified international family entertainment and media enterprise with five business segments: media networks, parks and resorts, studio entertainment, consumer products and interactive media.",False,,,en-US,,True,Disney,,,29785,False,11704124,photos/1/fc/sa/OpfCsAdtvgKjfEm-fullsize.jpg,//assets.change.org/photos/1/fc/sa/OpfCsAdtvgKjfEm-48x48-noPad.jpg?1519873711,False,48,48,//assets.change.org/photos/1/fc/sa/OpfCsAdtvgKjfEm-128x128-noPad.jpg?1519873711,False,128,128,//assets.change.org/photos/1/fc/sa/OpfCsAdtvgKjfEm-400x400-noPad.jpg?1519873711,False,400,400,//assets.change.org/photos/1/fc/sa/OpfCsAdtvgKjfEm-800x800-noPad.jpg?1519873712,False,800,800,92,,,,,,,,,,,,,,,,,,
809143188,Johnny Depp deserves justic!! He is undeserving of all this trash that is held against him. He is a great man and a great Father that deserves Love,0,0,Event,25793976,1,comment,2020-11-12T04:19:12Z,,814229734,814229734,Rezline,Whilliams,Rezline,Rezline Whilliams,Deltona,FL,US,,en-US,"Disney die hard since i was a kid. I am an artist, i am a writer so thus i am an insomniac.",[],25793976,25793976,Stop Disney removing Jack Sparrow!,2020-11-11T22:05:41Z,,2020-11-11T22:06:04Z,2020-11-13T23:18:23Z,en-GB,['en'],Disney : Stop Disney removing Jack Sparrow!,"<p>Since amber heard has made her terrible claims and lies against Johnny Depp it’s been said he will lose his roles in fantastic beasts and pirates of the Caribbean. <br>It’s also now been claimed Disney will be taking away our beloved Captain Jack Sparrow from their pirates of the Caribbean ride at their Disneyland parks. Captain Jack is everyone’s favourite pirate, and without him Pirates of the Caribbean wouldn’t be as great as what it is! <br>Let’s get justice for Johnny Depp! Let us see him keep his movies we all love and his place in the Disneyland attraction! </p>",Disney,Stop Disney removing Jack Sparrow!,2021-11-13,,,GB,55.3781,-3.43597,,,,,disney-stop-disney-removing-jack-sparrow,published,,,False,False,,False,,"[{'id': 476543, 'locale': 'en-GB', 'name': 'Other', 'slug': 'other-en-gb', 'photo_id': None, 'created_by_owner': True, 'created_by_staff_member': False, 'total_count': 66966}]",True,False,,2300,2300,0,3492,405,0,0,0,0,0,121,,,,,,224849143,photos/4/cp/fl/MkcpFLKRAKdEgkY-fullsize.jpg,//assets.change.org/photos/4/cp/fl/MkcpFLKRAKdEgkY-400x400-noPad.jpg?1605132342,False,400,400,//assets.change.org/photos/4/cp/fl/MkcpFLKRAKdEgkY-400x225-noPad.jpg?1605132342,False,400,225,//assets.change.org/photos/4/cp/fl/MkcpFLKRAKdEgkY-800x450-noPad.jpg?1605132342,False,800,450,//assets.change.org/photos/4/cp/fl/MkcpFLKRAKdEgkY-1600x900-noPad.jpg?1605132342,False,1600,900,photo,962285158,962285158,Lauren,Peddie,Lauren,Lauren Peddie,Peterborough,ENG,GB,,en-GB,,[],3,1653002447,1,1654019886,3,1654340646,5,1654021437,16,1655010290.148,4,1654019781.859,5,1654340703.175,10,1654659292.659,1,1653318137.159,4,1651944514.522,"[{'id': 585843, 'display_name': 'Disney', 'email': None, 'type': 'Custom', 'slug': 'disney-3', 'description': 'The Walt Disney Company is a leading diversified international family entertainment and media enterprise with five business segments: media networks, parks and resorts, studio entertainment, consumer products and interactive media.', 'publicly_visible': False, 'verified_at': None, 'summary': None, 'locale': 'en-US', 'confirmed_at': None, 'is_person': True, 'member_of': {}, 'additional_data': {'first_name': 'Disney', 'last_name': None, 'title': None, 'id': 29785}, 'has_email': False, 'photo': {'id': 11704124, 'url': 'photos/1/fc/sa/OpfCsAdtvgKjfEm-fullsize.jpg', 'sizes': {'small': {'url': '//assets.change.org/photos/1/fc/sa/OpfCsAdtvgKjfEm-48x48-noPad.jpg?1519873711', 'processing': False, 'size': {'width': 48, 'height': 48}}, 'medium': {'url': '//assets.change.org/photos/1/fc/sa/OpfCsAdtvgKjfEm-128x128-noPad.jpg?1519873711', 'processing': False, 'size': {'width': 128, 'height': 128}}, 'large': {'url': '//assets.change.org/photos/1/fc/sa/OpfCsAdtvgKjfEm-400x400-noPad.jpg?1519873711', 'processing': False, 'size': {'width': 400, 'height': 400}}, 'xlarge': {'url': '//assets.change.org/photos/1/fc/sa/OpfCsAdtvgKjfEm-800x800-noPad.jpg?1519873712', 'processing': False, 'size': {'width': 800, 'height': 800}}}}}]",False,False,False,Lauren Peddie,Disney : Stop Disney removing Jack Sparrow!,Disney : Stop Disney removing Jack Sparrow!,active,2500,224849143,photos/4/cp/fl/MkcpFLKRAKdEgkY-fullsize.jpg,//assets.change.org/photos/4/cp/fl/MkcpFLKRAKdEgkY-400x400-noPad.jpg?1605132342,False,400,400,//assets.change.org/photos/4/cp/fl/MkcpFLKRAKdEgkY-400x225-noPad.jpg?1605132342,False,400,225,//assets.change.org/photos/4/cp/fl/MkcpFLKRAKdEgkY-800x450-noPad.jpg?1605132342,False,800,450,//assets.change.org/photos/4/cp/fl/MkcpFLKRAKdEgkY-1600x900-noPad.jpg?1605132342,False,1600,900,photo,585843,Disney,,Custom,disney-3,"The Walt Disney Company is a leading diversified international family entertainment and media enterprise with five business segments: media networks, parks and resorts, studio entertainment, consumer products and interactive media.",False,,,en-US,,True,Disney,,,29785,False,11704124,photos/1/fc/sa/OpfCsAdtvgKjfEm-fullsize.jpg,//assets.change.org/photos/1/fc/sa/OpfCsAdtvgKjfEm-48x48-noPad.jpg?1519873711,False,48,48,//assets.change.org/photos/1/fc/sa/OpfCsAdtvgKjfEm-128x128-noPad.jpg?1519873711,False,128,128,//assets.change.org/photos/1/fc/sa/OpfCsAdtvgKjfEm-400x400-noPad.jpg?1519873711,False,400,400,//assets.change.org/photos/1/fc/sa/OpfCsAdtvgKjfEm-800x800-noPad.jpg?1519873712,False,800,800,92,226041462.0,photos/7/lb/rm/CFLbrMXxjThsoxN-fullsize.jpg,//assets.change.org/photos/7/lb/rm/CFLbrMXxjThsoxN-48x48-noPad.jpg?1635291113,False,48.0,48.0,//assets.change.org/photos/7/lb/rm/CFLbrMXxjThsoxN-128x128-noPad.jpg?1635291113,False,128.0,128.0,//assets.change.org/photos/7/lb/rm/CFLbrMXxjThsoxN-400x400-noPad.jpg?1635291113,False,400.0,400.0,//assets.change.org/photos/7/lb/rm/CFLbrMXxjThsoxN-800x800-noPad.jpg?1635291114,False,800.0,800.0
809143140,I stand with Johnny ,0,0,Event,25793976,1,comment,2020-11-12T04:17:46Z,,329153220,329153220,Francellie,Leyva,Francellie,Francellie Leyva,Brownsville,TX,US,,en-US,,[],25793976,25793976,Stop Disney removing Jack Sparrow!,2020-11-11T22:05:41Z,,2020-11-11T22:06:04Z,2020-11-13T23:18:23Z,en-GB,['en'],Disney : Stop Disney removing Jack Sparrow!,"<p>Since amber heard has made her terrible claims and lies against Johnny Depp it’s been said he will lose his roles in fantastic beasts and pirates of the Caribbean. <br>It’s also now been claimed Disney will be taking away our beloved Captain Jack Sparrow from their pirates of the Caribbean ride at their Disneyland parks. Captain Jack is everyone’s favourite pirate, and without him Pirates of the Caribbean wouldn’t be as great as what it is! <br>Let’s get justice for Johnny Depp! Let us see him keep his movies we all love and his place in the Disneyland attraction! </p>",Disney,Stop Disney removing Jack Sparrow!,2021-11-13,,,GB,55.3781,-3.43597,,,,,disney-stop-disney-removing-jack-sparrow,published,,,False,False,,False,,"[{'id': 476543, 'locale': 'en-GB', 'name': 'Other', 'slug': 'other-en-gb', 'photo_id': None, 'created_by_owner': True, 'created_by_staff_member': False, 'total_count': 66966}]",True,False,,2300,2300,0,3492,405,0,0,0,0,0,121,,,,,,224849143,photos/4/cp/fl/MkcpFLKRAKdEgkY-fullsize.jpg,//assets.change.org/photos/4/cp/fl/MkcpFLKRAKdEgkY-400x400-noPad.jpg?1605132342,False,400,400,//assets.change.org/photos/4/cp/fl/MkcpFLKRAKdEgkY-400x225-noPad.jpg?1605132342,False,400,225,//assets.change.org/photos/4/cp/fl/MkcpFLKRAKdEgkY-800x450-noPad.jpg?1605132342,False,800,450,//assets.change.org/photos/4/cp/fl/MkcpFLKRAKdEgkY-1600x900-noPad.jpg?1605132342,False,1600,900,photo,962285158,962285158,Lauren,Peddie,Lauren,Lauren Peddie,Peterborough,ENG,GB,,en-GB,,[],3,1653002447,1,1654019886,3,1654340646,5,1654021437,16,1655010290.148,4,1654019781.859,5,1654340703.175,10,1654659292.659,1,1653318137.159,4,1651944514.522,"[{'id': 585843, 'display_name': 'Disney', 'email': None, 'type': 'Custom', 'slug': 'disney-3', 'description': 'The Walt Disney Company is a leading diversified international family entertainment and media enterprise with five business segments: media networks, parks and resorts, studio entertainment, consumer products and interactive media.', 'publicly_visible': False, 'verified_at': None, 'summary': None, 'locale': 'en-US', 'confirmed_at': None, 'is_person': True, 'member_of': {}, 'additional_data': {'first_name': 'Disney', 'last_name': None, 'title': None, 'id': 29785}, 'has_email': False, 'photo': {'id': 11704124, 'url': 'photos/1/fc/sa/OpfCsAdtvgKjfEm-fullsize.jpg', 'sizes': {'small': {'url': '//assets.change.org/photos/1/fc/sa/OpfCsAdtvgKjfEm-48x48-noPad.jpg?1519873711', 'processing': False, 'size': {'width': 48, 'height': 48}}, 'medium': {'url': '//assets.change.org/photos/1/fc/sa/OpfCsAdtvgKjfEm-128x128-noPad.jpg?1519873711', 'processing': False, 'size': {'width': 128, 'height': 128}}, 'large': {'url': '//assets.change.org/photos/1/fc/sa/OpfCsAdtvgKjfEm-400x400-noPad.jpg?1519873711', 'processing': False, 'size': {'width': 400, 'height': 400}}, 'xlarge': {'url': '//assets.change.org/photos/1/fc/sa/OpfCsAdtvgKjfEm-800x800-noPad.jpg?1519873712', 'processing': False, 'size': {'width': 800, 'height': 800}}}}}]",False,False,False,Lauren Peddie,Disney : Stop Disney removing Jack Sparrow!,Disney : Stop Disney removing Jack Sparrow!,active,2500,224849143,photos/4/cp/fl/MkcpFLKRAKdEgkY-fullsize.jpg,//assets.change.org/photos/4/cp/fl/MkcpFLKRAKdEgkY-400x400-noPad.jpg?1605132342,False,400,400,//assets.change.org/photos/4/cp/fl/MkcpFLKRAKdEgkY-400x225-noPad.jpg?1605132342,False,400,225,//assets.change.org/photos/4/cp/fl/MkcpFLKRAKdEgkY-800x450-noPad.jpg?1605132342,False,800,450,//assets.change.org/photos/4/cp/fl/MkcpFLKRAKdEgkY-1600x900-noPad.jpg?1605132342,False,1600,900,photo,585843,Disney,,Custom,disney-3,"The Walt Disney Company is a leading diversified international family entertainment and media enterprise with five business segments: media networks, parks and resorts, studio entertainment, consumer products and interactive media.",False,,,en-US,,True,Disney,,,29785,False,11704124,photos/1/fc/sa/OpfCsAdtvgKjfEm-fullsize.jpg,//assets.change.org/photos/1/fc/sa/OpfCsAdtvgKjfEm-48x48-noPad.jpg?1519873711,False,48,48,//assets.change.org/photos/1/fc/sa/OpfCsAdtvgKjfEm-128x128-noPad.jpg?1519873711,False,128,128,//assets.change.org/photos/1/fc/sa/OpfCsAdtvgKjfEm-400x400-noPad.jpg?1519873711,False,400,400,//assets.change.org/photos/1/fc/sa/OpfCsAdtvgKjfEm-800x800-noPad.jpg?1519873712,False,800,800,92,224850315.0,photos/6/ri/yb/amRiYBGzyCIjIcn-fullsize.jpg,//assets.change.org/photos/6/ri/yb/amRiYBGzyCIjIcn-48x48-noPad.jpg?1605154309,False,48.0,48.0,//assets.change.org/photos/6/ri/yb/amRiYBGzyCIjIcn-128x128-noPad.jpg?1605154309,False,128.0,128.0,//assets.change.org/photos/6/ri/yb/amRiYBGzyCIjIcn-400x400-noPad.jpg?1605154309,False,400.0,400.0,//assets.change.org/photos/6/ri/yb/amRiYBGzyCIjIcn-800x800-noPad.jpg?1605154309,False,800.0,800.0
809142013,Pirates of the Caribbean is nothing without Johnny Depp.,0,0,Event,25793976,1,comment,2020-11-12T03:49:47Z,,524130152,524130152,Paula,Berrettini,Paula,Paula Berrettini,Mechanicsburg,PA,US,,en-US,,[],25793976,25793976,Stop Disney removing Jack Sparrow!,2020-11-11T22:05:41Z,,2020-11-11T22:06:04Z,2020-11-13T23:18:23Z,en-GB,['en'],Disney : Stop Disney removing Jack Sparrow!,"<p>Since amber heard has made her terrible claims and lies against Johnny Depp it’s been said he will lose his roles in fantastic beasts and pirates of the Caribbean. <br>It’s also now been claimed Disney will be taking away our beloved Captain Jack Sparrow from their pirates of the Caribbean ride at their Disneyland parks. Captain Jack is everyone’s favourite pirate, and without him Pirates of the Caribbean wouldn’t be as great as what it is! <br>Let’s get justice for Johnny Depp! Let us see him keep his movies we all love and his place in the Disneyland attraction! </p>",Disney,Stop Disney removing Jack Sparrow!,2021-11-13,,,GB,55.3781,-3.43597,,,,,disney-stop-disney-removing-jack-sparrow,published,,,False,False,,False,,"[{'id': 476543, 'locale': 'en-GB', 'name': 'Other', 'slug': 'other-en-gb', 'photo_id': None, 'created_by_owner': True, 'created_by_staff_member': False, 'total_count': 66966}]",True,False,,2300,2300,0,3492,405,0,0,0,0,0,121,,,,,,224849143,photos/4/cp/fl/MkcpFLKRAKdEgkY-fullsize.jpg,//assets.change.org/photos/4/cp/fl/MkcpFLKRAKdEgkY-400x400-noPad.jpg?1605132342,False,400,400,//assets.change.org/photos/4/cp/fl/MkcpFLKRAKdEgkY-400x225-noPad.jpg?1605132342,False,400,225,//assets.change.org/photos/4/cp/fl/MkcpFLKRAKdEgkY-800x450-noPad.jpg?1605132342,False,800,450,//assets.change.org/photos/4/cp/fl/MkcpFLKRAKdEgkY-1600x900-noPad.jpg?1605132342,False,1600,900,photo,962285158,962285158,Lauren,Peddie,Lauren,Lauren Peddie,Peterborough,ENG,GB,,en-GB,,[],3,1653002447,1,1654019886,3,1654340646,5,1654021437,16,1655010290.148,4,1654019781.859,5,1654340703.175,10,1654659292.659,1,1653318137.159,4,1651944514.522,"[{'id': 585843, 'display_name': 'Disney', 'email': None, 'type': 'Custom', 'slug': 'disney-3', 'description': 'The Walt Disney Company is a leading diversified international family entertainment and media enterprise with five business segments: media networks, parks and resorts, studio entertainment, consumer products and interactive media.', 'publicly_visible': False, 'verified_at': None, 'summary': None, 'locale': 'en-US', 'confirmed_at': None, 'is_person': True, 'member_of': {}, 'additional_data': {'first_name': 'Disney', 'last_name': None, 'title': None, 'id': 29785}, 'has_email': False, 'photo': {'id': 11704124, 'url': 'photos/1/fc/sa/OpfCsAdtvgKjfEm-fullsize.jpg', 'sizes': {'small': {'url': '//assets.change.org/photos/1/fc/sa/OpfCsAdtvgKjfEm-48x48-noPad.jpg?1519873711', 'processing': False, 'size': {'width': 48, 'height': 48}}, 'medium': {'url': '//assets.change.org/photos/1/fc/sa/OpfCsAdtvgKjfEm-128x128-noPad.jpg?1519873711', 'processing': False, 'size': {'width': 128, 'height': 128}}, 'large': {'url': '//assets.change.org/photos/1/fc/sa/OpfCsAdtvgKjfEm-400x400-noPad.jpg?1519873711', 'processing': False, 'size': {'width': 400, 'height': 400}}, 'xlarge': {'url': '//assets.change.org/photos/1/fc/sa/OpfCsAdtvgKjfEm-800x800-noPad.jpg?1519873712', 'processing': False, 'size': {'width': 800, 'height': 800}}}}}]",False,False,False,Lauren Peddie,Disney : Stop Disney removing Jack Sparrow!,Disney : Stop Disney removing Jack Sparrow!,active,2500,224849143,photos/4/cp/fl/MkcpFLKRAKdEgkY-fullsize.jpg,//assets.change.org/photos/4/cp/fl/MkcpFLKRAKdEgkY-400x400-noPad.jpg?1605132342,False,400,400,//assets.change.org/photos/4/cp/fl/MkcpFLKRAKdEgkY-400x225-noPad.jpg?1605132342,False,400,225,//assets.change.org/photos/4/cp/fl/MkcpFLKRAKdEgkY-800x450-noPad.jpg?1605132342,False,800,450,//assets.change.org/photos/4/cp/fl/MkcpFLKRAKdEgkY-1600x900-noPad.jpg?1605132342,False,1600,900,photo,585843,Disney,,Custom,disney-3,"The Walt Disney Company is a leading diversified international family entertainment and media enterprise with five business segments: media networks, parks and resorts, studio entertainment, consumer products and interactive media.",False,,,en-US,,True,Disney,,,29785,False,11704124,photos/1/fc/sa/OpfCsAdtvgKjfEm-fullsize.jpg,//assets.change.org/photos/1/fc/sa/OpfCsAdtvgKjfEm-48x48-noPad.jpg?1519873711,False,48,48,//assets.change.org/photos/1/fc/sa/OpfCsAdtvgKjfEm-128x128-noPad.jpg?1519873711,False,128,128,//assets.change.org/photos/1/fc/sa/OpfCsAdtvgKjfEm-400x400-noPad.jpg?1519873711,False,400,400,//assets.change.org/photos/1/fc/sa/OpfCsAdtvgKjfEm-800x800-noPad.jpg?1519873712,False,800,800,92,138457757.0,photos/4/gb/bl/yggbBLROZMzeJOu-fullsize.jpg,//assets.change.org/photos/4/gb/bl/yggbBLROZMzeJOu-48x48-noPad.jpg?1529149635,False,48.0,48.0,//assets.change.org/photos/4/gb/bl/yggbBLROZMzeJOu-128x128-noPad.jpg?1529149635,False,128.0,128.0,//assets.change.org/photos/4/gb/bl/yggbBLROZMzeJOu-400x400-noPad.jpg?1529149635,False,400.0,400.0,//assets.change.org/photos/4/gb/bl/yggbBLROZMzeJOu-800x800-noPad.jpg?1529149636,False,800.0,800.0
809140632,I stand with Johnny!,0,0,Event,25793976,1,comment,2020-11-12T03:19:55Z,,288785817,288785817,Sarah,Hutzell,Sarah,Sarah Hutzell,Akron,OH,US,,en-US,,[],25793976,25793976,Stop Disney removing Jack Sparrow!,2020-11-11T22:05:41Z,,2020-11-11T22:06:04Z,2020-11-13T23:18:23Z,en-GB,['en'],Disney : Stop Disney removing Jack Sparrow!,"<p>Since amber heard has made her terrible claims and lies against Johnny Depp it’s been said he will lose his roles in fantastic beasts and pirates of the Caribbean. <br>It’s also now been claimed Disney will be taking away our beloved Captain Jack Sparrow from their pirates of the Caribbean ride at their Disneyland parks. Captain Jack is everyone’s favourite pirate, and without him Pirates of the Caribbean wouldn’t be as great as what it is! <br>Let’s get justice for Johnny Depp! Let us see him keep his movies we all love and his place in the Disneyland attraction! </p>",Disney,Stop Disney removing Jack Sparrow!,2021-11-13,,,GB,55.3781,-3.43597,,,,,disney-stop-disney-removing-jack-sparrow,published,,,False,False,,False,,"[{'id': 476543, 'locale': 'en-GB', 'name': 'Other', 'slug': 'other-en-gb', 'photo_id': None, 'created_by_owner': True, 'created_by_staff_member': False, 'total_count': 66966}]",True,False,,2300,2300,0,3492,405,0,0,0,0,0,121,,,,,,224849143,photos/4/cp/fl/MkcpFLKRAKdEgkY-fullsize.jpg,//assets.change.org/photos/4/cp/fl/MkcpFLKRAKdEgkY-400x400-noPad.jpg?1605132342,False,400,400,//assets.change.org/photos/4/cp/fl/MkcpFLKRAKdEgkY-400x225-noPad.jpg?1605132342,False,400,225,//assets.change.org/photos/4/cp/fl/MkcpFLKRAKdEgkY-800x450-noPad.jpg?1605132342,False,800,450,//assets.change.org/photos/4/cp/fl/MkcpFLKRAKdEgkY-1600x900-noPad.jpg?1605132342,False,1600,900,photo,962285158,962285158,Lauren,Peddie,Lauren,Lauren Peddie,Peterborough,ENG,GB,,en-GB,,[],3,1653002447,1,1654019886,3,1654340646,5,1654021437,16,1655010290.148,4,1654019781.859,5,1654340703.175,10,1654659292.659,1,1653318137.159,4,1651944514.522,"[{'id': 585843, 'display_name': 'Disney', 'email': None, 'type': 'Custom', 'slug': 'disney-3', 'description': 'The Walt Disney Company is a leading diversified international family entertainment and media enterprise with five business segments: media networks, parks and resorts, studio entertainment, consumer products and interactive media.', 'publicly_visible': False, 'verified_at': None, 'summary': None, 'locale': 'en-US', 'confirmed_at': None, 'is_person': True, 'member_of': {}, 'additional_data': {'first_name': 'Disney', 'last_name': None, 'title': None, 'id': 29785}, 'has_email': False, 'photo': {'id': 11704124, 'url': 'photos/1/fc/sa/OpfCsAdtvgKjfEm-fullsize.jpg', 'sizes': {'small': {'url': '//assets.change.org/photos/1/fc/sa/OpfCsAdtvgKjfEm-48x48-noPad.jpg?1519873711', 'processing': False, 'size': {'width': 48, 'height': 48}}, 'medium': {'url': '//assets.change.org/photos/1/fc/sa/OpfCsAdtvgKjfEm-128x128-noPad.jpg?1519873711', 'processing': False, 'size': {'width': 128, 'height': 128}}, 'large': {'url': '//assets.change.org/photos/1/fc/sa/OpfCsAdtvgKjfEm-400x400-noPad.jpg?1519873711', 'processing': False, 'size': {'width': 400, 'height': 400}}, 'xlarge': {'url': '//assets.change.org/photos/1/fc/sa/OpfCsAdtvgKjfEm-800x800-noPad.jpg?1519873712', 'processing': False, 'size': {'width': 800, 'height': 800}}}}}]",False,False,False,Lauren Peddie,Disney : Stop Disney removing Jack Sparrow!,Disney : Stop Disney removing Jack Sparrow!,active,2500,224849143,photos/4/cp/fl/MkcpFLKRAKdEgkY-fullsize.jpg,//assets.change.org/photos/4/cp/fl/MkcpFLKRAKdEgkY-400x400-noPad.jpg?1605132342,False,400,400,//assets.change.org/photos/4/cp/fl/MkcpFLKRAKdEgkY-400x225-noPad.jpg?1605132342,False,400,225,//assets.change.org/photos/4/cp/fl/MkcpFLKRAKdEgkY-800x450-noPad.jpg?1605132342,False,800,450,//assets.change.org/photos/4/cp/fl/MkcpFLKRAKdEgkY-1600x900-noPad.jpg?1605132342,False,1600,900,photo,585843,Disney,,Custom,disney-3,"The Walt Disney Company is a leading diversified international family entertainment and media enterprise with five business segments: media networks, parks and resorts, studio entertainment, consumer products and interactive media.",False,,,en-US,,True,Disney,,,29785,False,11704124,photos/1/fc/sa/OpfCsAdtvgKjfEm-fullsize.jpg,//assets.change.org/photos/1/fc/sa/OpfCsAdtvgKjfEm-48x48-noPad.jpg?1519873711,False,48,48,//assets.change.org/photos/1/fc/sa/OpfCsAdtvgKjfEm-128x128-noPad.jpg?1519873711,False,128,128,//assets.change.org/photos/1/fc/sa/OpfCsAdtvgKjfEm-400x400-noPad.jpg?1519873711,False,400,400,//assets.change.org/photos/1/fc/sa/OpfCsAdtvgKjfEm-800x800-noPad.jpg?1519873712,False,800,800,92,76023087.0,photos/4/hp/sa/EsHpsAuxAEhqBUc-fullsize.jpg,//assets.change.org/photos/4/hp/sa/EsHpsAuxAEhqBUc-48x48-noPad.jpg?1540517695,False,48.0,48.0,//assets.change.org/photos/4/hp/sa/EsHpsAuxAEhqBUc-128x128-noPad.jpg?1540517696,False,128.0,128.0,//assets.change.org/photos/4/hp/sa/EsHpsAuxAEhqBUc-400x400-noPad.jpg?1540517696,False,400.0,400.0,//assets.change.org/photos/4/hp/sa/EsHpsAuxAEhqBUc-800x800-noPad.jpg?1540517696,False,800.0,800.0
