812665927,But she donated the full amount. I mean she has been saying this for years. Pay Amber the only monster here is her.,0,0,Event,26842623,1,comment,2021-01-26T17:28:51Z,,26572020,26572020,Yovannee,Flores,Yovannee,Yovannee Flores,Chicago,IL,US,,en-US,,51664681.0,photos/4/uo/uz/QgUOUZqfJOhxheD-fullsize.jpg,//assets.change.org/photos/4/uo/uz/QgUOUZqfJOhxheD-48x48-noPad.jpg?1565788831,False,48.0,48.0,//assets.change.org/photos/4/uo/uz/QgUOUZqfJOhxheD-128x128-noPad.jpg?1565788831,False,128.0,128.0,//assets.change.org/photos/4/uo/uz/QgUOUZqfJOhxheD-400x400-noPad.jpg?1565788831,False,400.0,400.0,//assets.change.org/photos/4/uo/uz/QgUOUZqfJOhxheD-800x800-noPad.jpg?1565788831,False,800.0,800.0,[],26842623,26842623,"Amber Heard, Honour Your Pledge to CHLA.",2021-01-14T12:15:03Z,,2021-01-14T12:20:43Z,2021-01-14T13:00:43Z,de-DE,['en'],"Petition to Hold Amber Heard Accountable! Amber Heard, Honour Your Pledge To CHLA","<p>For 4 years, Amber Heard has repeatedly claimed that she donated her entire divorce settlement, US 7 million dollars, to the Children's Hospital LA and ACLU. However, last week, we all learned that she not only didn't donate, but the little money she gave to CHLA/ACLU came from Johnny Depp and Elon Musk respectively. </p>
<p>I believe that pledging to help sick children (CHLA) is a serious thing and shouldn't be overlooked. Therefore, I created this petition to pressure Amber Heard to donate the money to help those children with cancer as she promised to do. She's been rewarded several times for donating the money ... She was appointed UN's Human Right Champions and is hailed as an activist and an example of braveness and strength. </p>
<p>Amber Heard already stole the suffering of countless domestic abuse victims/survivors, and it's not right that she also gets to keep the money she promised to give to sick children. </p>","Twitter, Amber Heard","Petition to Hold Amber Heard Accountable! Amber Heard, Honour Your 7M Pledge.",2022-01-22,,,DE,,,,,,,petition-to-hold-amber-heard-accountable-amber-heard-honour-your-pledge-to-chla,published,,,False,False,,False,,"[{'id': 476664, 'locale': 'de-DE', 'name': 'Andere', 'slug': 'andere-de-de', 'photo_id': None, 'created_by_owner': True, 'created_by_staff_member': False, 'total_count': 5983}]",True,False,,285,285,0,687,75,0,1,0,0,0,5,,,,,,225083314,photos/0/hh/jv/uShHJVzAYgRmApu-fullsize.jpg,//assets.change.org/photos/0/hh/jv/uShHJVzAYgRmApu-400x400-noPad.jpg?1610626508,False,400,400,//assets.change.org/photos/0/hh/jv/uShHJVzAYgRmApu-400x225-noPad.jpg?1610626508,False,400,225,//assets.change.org/photos/0/hh/jv/uShHJVzAYgRmApu-800x450-noPad.jpg?1610626509,False,800,450,//assets.change.org/photos/0/hh/jv/uShHJVzAYgRmApu-1600x900-noPad.jpg?1610626509,False,1600,900,photo,6,1656197806.752,1,1652309343.14,1,1651099185.728,1,1651099143.12,3,1653602276.776,1143958395,1143958395,Princess Consuela,Bananahammock,Princess Consuela,Princess Consuela Bananahammock,,,DE,https://www.twitter.com/PrinConsuella_,de-DE,Someone in the right side of the roaring rapids.,225083156,photos/4/vb/cy/egvBCYaPcFribkY-fullsize.jpg,//assets.change.org/photos/4/vb/cy/egvBCYaPcFribkY-48x48-noPad.jpg?1610622599,False,48,48,//assets.change.org/photos/4/vb/cy/egvBCYaPcFribkY-128x128-noPad.jpg?1610622599,False,128,128,//assets.change.org/photos/4/vb/cy/egvBCYaPcFribkY-400x400-noPad.jpg?1610622599,False,400,400,//assets.change.org/photos/4/vb/cy/egvBCYaPcFribkY-800x800-noPad.jpg?1610622599,False,800,800,[],"[{'id': 33678, 'display_name': 'Twitter', 'email': None, 'type': 'Custom', 'slug': 'twitter-2', 'description': 'Twitter is a real-time information network that connects you to the latest stories, ideas, opinions and news about what you find interesting.', 'publicly_visible': True, 'verified_at': None, 'summary': None, 'locale': 'en-US', 'confirmed_at': None, 'is_person': True, 'member_of': {}, 'additional_data': {'first_name': 'Twitter', 'last_name': None, 'title': None, 'id': 42729}, 'has_email': False, 'photo': {'id': 11701415, 'url': 'photos/1/pk/tq/WJpkTqiSAUOusTY-fullsize.jpg', 'sizes': {'small': {'url': '//assets.change.org/photos/1/pk/tq/WJpkTqiSAUOusTY-48x48-noPad.jpg?1519872572', 'processing': False, 'size': {'width': 48, 'height': 48}}, 'medium': {'url': '//assets.change.org/photos/1/pk/tq/WJpkTqiSAUOusTY-128x128-noPad.jpg?1519872572', 'processing': False, 'size': {'width': 128, 'height': 128}}, 'large': {'url': '//assets.change.org/photos/1/pk/tq/WJpkTqiSAUOusTY-400x400-noPad.jpg?1519872572', 'processing': False, 'size': {'width': 400, 'height': 400}}, 'xlarge': {'url': '//assets.change.org/photos/1/pk/tq/WJpkTqiSAUOusTY-800x800-noPad.jpg?1519872572', 'processing': False, 'size': {'width': 800, 'height': 800}}}}}, {'id': 10149883, 'display_name': 'Amber Heard', 'email': None, 'type': 'Custom', 'slug': 'amber-heard', 'description': None, 'photo_id': None, 'publicly_visible': False, 'verified_at': None, 'summary': None, 'locale': None, 'confirmed_at': None, 'is_person': True, 'member_of': {}, 'additional_data': {'first_name': 'Amber', 'last_name': 'Heard', 'title': None, 'id': 10054371}, 'has_email': False}]",False,False,False,Princess Consuela Bananahammock,225083156,photos/4/vb/cy/egvBCYaPcFribkY-fullsize.jpg,//assets.change.org/photos/4/vb/cy/egvBCYaPcFribkY-48x48-noPad.jpg?1610622599,False,48,48,//assets.change.org/photos/4/vb/cy/egvBCYaPcFribkY-128x128-noPad.jpg?1610622599,False,128,128,//assets.change.org/photos/4/vb/cy/egvBCYaPcFribkY-400x400-noPad.jpg?1610622599,False,400,400,//assets.change.org/photos/4/vb/cy/egvBCYaPcFribkY-800x800-noPad.jpg?1610622599,False,800,800,"Petition to Hold Amber Heard Accountable! Amber Heard, Honour Your Pledge To CHLA","Petition to Hold Amber Heard Accountable! Amber Heard, Honour Your Pledge To CHLA",active,500,225083314,photos/0/hh/jv/uShHJVzAYgRmApu-fullsize.jpg,//assets.change.org/photos/0/hh/jv/uShHJVzAYgRmApu-400x400-noPad.jpg?1610626508,False,400,400,//assets.change.org/photos/0/hh/jv/uShHJVzAYgRmApu-400x225-noPad.jpg?1610626508,False,400,225,//assets.change.org/photos/0/hh/jv/uShHJVzAYgRmApu-800x450-noPad.jpg?1610626509,False,800,450,//assets.change.org/photos/0/hh/jv/uShHJVzAYgRmApu-1600x900-noPad.jpg?1610626509,False,1600,900,photo,33678,Twitter,,Custom,twitter-2,"Twitter is a real-time information network that connects you to the latest stories, ideas, opinions and news about what you find interesting.",True,,,en-US,,True,Twitter,,,42729,False,11701415,photos/1/pk/tq/WJpkTqiSAUOusTY-fullsize.jpg,//assets.change.org/photos/1/pk/tq/WJpkTqiSAUOusTY-48x48-noPad.jpg?1519872572,False,48,48,//assets.change.org/photos/1/pk/tq/WJpkTqiSAUOusTY-128x128-noPad.jpg?1519872572,False,128,128,//assets.change.org/photos/1/pk/tq/WJpkTqiSAUOusTY-400x400-noPad.jpg?1519872572,False,400,400,//assets.change.org/photos/1/pk/tq/WJpkTqiSAUOusTY-800x800-noPad.jpg?1519872572,False,800,800,57
812663434,She bold faced lied. She stole from sick and dying children.,0,0,Event,26842623,1,comment,2021-01-26T16:17:20Z,,904356394,904356394,Kerrin,Jameson,Kerrin,Kerrin Jameson,Dover,DE,US,,en-US,,,,,,,,,,,,,,,,,,,,[],26842623,26842623,"Amber Heard, Honour Your Pledge to CHLA.",2021-01-14T12:15:03Z,,2021-01-14T12:20:43Z,2021-01-14T13:00:43Z,de-DE,['en'],"Petition to Hold Amber Heard Accountable! Amber Heard, Honour Your Pledge To CHLA","<p>For 4 years, Amber Heard has repeatedly claimed that she donated her entire divorce settlement, US 7 million dollars, to the Children's Hospital LA and ACLU. However, last week, we all learned that she not only didn't donate, but the little money she gave to CHLA/ACLU came from Johnny Depp and Elon Musk respectively. </p>
<p>I believe that pledging to help sick children (CHLA) is a serious thing and shouldn't be overlooked. Therefore, I created this petition to pressure Amber Heard to donate the money to help those children with cancer as she promised to do. She's been rewarded several times for donating the money ... She was appointed UN's Human Right Champions and is hailed as an activist and an example of braveness and strength. </p>
<p>Amber Heard already stole the suffering of countless domestic abuse victims/survivors, and it's not right that she also gets to keep the money she promised to give to sick children. </p>","Twitter, Amber Heard","Petition to Hold Amber Heard Accountable! Amber Heard, Honour Your 7M Pledge.",2022-01-22,,,DE,,,,,,,petition-to-hold-amber-heard-accountable-amber-heard-honour-your-pledge-to-chla,published,,,False,False,,False,,"[{'id': 476664, 'locale': 'de-DE', 'name': 'Andere', 'slug': 'andere-de-de', 'photo_id': None, 'created_by_owner': True, 'created_by_staff_member': False, 'total_count': 5983}]",True,False,,285,285,0,687,75,0,1,0,0,0,5,,,,,,225083314,photos/0/hh/jv/uShHJVzAYgRmApu-fullsize.jpg,//assets.change.org/photos/0/hh/jv/uShHJVzAYgRmApu-400x400-noPad.jpg?1610626508,False,400,400,//assets.change.org/photos/0/hh/jv/uShHJVzAYgRmApu-400x225-noPad.jpg?1610626508,False,400,225,//assets.change.org/photos/0/hh/jv/uShHJVzAYgRmApu-800x450-noPad.jpg?1610626509,False,800,450,//assets.change.org/photos/0/hh/jv/uShHJVzAYgRmApu-1600x900-noPad.jpg?1610626509,False,1600,900,photo,6,1656197806.752,1,1652309343.14,1,1651099185.728,1,1651099143.12,3,1653602276.776,1143958395,1143958395,Princess Consuela,Bananahammock,Princess Consuela,Princess Consuela Bananahammock,,,DE,https://www.twitter.com/PrinConsuella_,de-DE,Someone in the right side of the roaring rapids.,225083156,photos/4/vb/cy/egvBCYaPcFribkY-fullsize.jpg,//assets.change.org/photos/4/vb/cy/egvBCYaPcFribkY-48x48-noPad.jpg?1610622599,False,48,48,//assets.change.org/photos/4/vb/cy/egvBCYaPcFribkY-128x128-noPad.jpg?1610622599,False,128,128,//assets.change.org/photos/4/vb/cy/egvBCYaPcFribkY-400x400-noPad.jpg?1610622599,False,400,400,//assets.change.org/photos/4/vb/cy/egvBCYaPcFribkY-800x800-noPad.jpg?1610622599,False,800,800,[],"[{'id': 33678, 'display_name': 'Twitter', 'email': None, 'type': 'Custom', 'slug': 'twitter-2', 'description': 'Twitter is a real-time information network that connects you to the latest stories, ideas, opinions and news about what you find interesting.', 'publicly_visible': True, 'verified_at': None, 'summary': None, 'locale': 'en-US', 'confirmed_at': None, 'is_person': True, 'member_of': {}, 'additional_data': {'first_name': 'Twitter', 'last_name': None, 'title': None, 'id': 42729}, 'has_email': False, 'photo': {'id': 11701415, 'url': 'photos/1/pk/tq/WJpkTqiSAUOusTY-fullsize.jpg', 'sizes': {'small': {'url': '//assets.change.org/photos/1/pk/tq/WJpkTqiSAUOusTY-48x48-noPad.jpg?1519872572', 'processing': False, 'size': {'width': 48, 'height': 48}}, 'medium': {'url': '//assets.change.org/photos/1/pk/tq/WJpkTqiSAUOusTY-128x128-noPad.jpg?1519872572', 'processing': False, 'size': {'width': 128, 'height': 128}}, 'large': {'url': '//assets.change.org/photos/1/pk/tq/WJpkTqiSAUOusTY-400x400-noPad.jpg?1519872572', 'processing': False, 'size': {'width': 400, 'height': 400}}, 'xlarge': {'url': '//assets.change.org/photos/1/pk/tq/WJpkTqiSAUOusTY-800x800-noPad.jpg?1519872572', 'processing': False, 'size': {'width': 800, 'height': 800}}}}}, {'id': 10149883, 'display_name': 'Amber Heard', 'email': None, 'type': 'Custom', 'slug': 'amber-heard', 'description': None, 'photo_id': None, 'publicly_visible': False, 'verified_at': None, 'summary': None, 'locale': None, 'confirmed_at': None, 'is_person': True, 'member_of': {}, 'additional_data': {'first_name': 'Amber', 'last_name': 'Heard', 'title': None, 'id': 10054371}, 'has_email': False}]",False,False,False,Princess Consuela Bananahammock,225083156,photos/4/vb/cy/egvBCYaPcFribkY-fullsize.jpg,//assets.change.org/photos/4/vb/cy/egvBCYaPcFribkY-48x48-noPad.jpg?1610622599,False,48,48,//assets.change.org/photos/4/vb/cy/egvBCYaPcFribkY-128x128-noPad.jpg?1610622599,False,128,128,//assets.change.org/photos/4/vb/cy/egvBCYaPcFribkY-400x400-noPad.jpg?1610622599,False,400,400,//assets.change.org/photos/4/vb/cy/egvBCYaPcFribkY-800x800-noPad.jpg?1610622599,False,800,800,"Petition to Hold Amber Heard Accountable! Amber Heard, Honour Your Pledge To CHLA","Petition to Hold Amber Heard Accountable! Amber Heard, Honour Your Pledge To CHLA",active,500,225083314,photos/0/hh/jv/uShHJVzAYgRmApu-fullsize.jpg,//assets.change.org/photos/0/hh/jv/uShHJVzAYgRmApu-400x400-noPad.jpg?1610626508,False,400,400,//assets.change.org/photos/0/hh/jv/uShHJVzAYgRmApu-400x225-noPad.jpg?1610626508,False,400,225,//assets.change.org/photos/0/hh/jv/uShHJVzAYgRmApu-800x450-noPad.jpg?1610626509,False,800,450,//assets.change.org/photos/0/hh/jv/uShHJVzAYgRmApu-1600x900-noPad.jpg?1610626509,False,1600,900,photo,33678,Twitter,,Custom,twitter-2,"Twitter is a real-time information network that connects you to the latest stories, ideas, opinions and news about what you find interesting.",True,,,en-US,,True,Twitter,,,42729,False,11701415,photos/1/pk/tq/WJpkTqiSAUOusTY-fullsize.jpg,//assets.change.org/photos/1/pk/tq/WJpkTqiSAUOusTY-48x48-noPad.jpg?1519872572,False,48,48,//assets.change.org/photos/1/pk/tq/WJpkTqiSAUOusTY-128x128-noPad.jpg?1519872572,False,128,128,//assets.change.org/photos/1/pk/tq/WJpkTqiSAUOusTY-400x400-noPad.jpg?1519872572,False,400,400,//assets.change.org/photos/1/pk/tq/WJpkTqiSAUOusTY-800x800-noPad.jpg?1519872572,False,800,800,57
812663422,"She essentially lied, and stole from sick and dying children. That is extremely very low. She MUST be held accountable and pay those children that money. THEY need it more than she does.
THEY deserve it more than she does.",0,0,Event,26842623,1,comment,2021-01-26T16:17:05Z,,59892479,59892479,Sarah,Kat,Sarah,Sarah Kat,Ottawa,,CA,,en-CA,,225521182.0,photos/8/oq/sn/nNOqsNvxVTRBZAK-fullsize.jpg,//assets.change.org/photos/8/oq/sn/nNOqsNvxVTRBZAK-48x48-noPad.jpg?1620179080,False,48.0,48.0,//assets.change.org/photos/8/oq/sn/nNOqsNvxVTRBZAK-128x128-noPad.jpg?1620179080,False,128.0,128.0,//assets.change.org/photos/8/oq/sn/nNOqsNvxVTRBZAK-400x400-noPad.jpg?1620179080,False,400.0,400.0,//assets.change.org/photos/8/oq/sn/nNOqsNvxVTRBZAK-800x800-noPad.jpg?1620179080,False,800.0,800.0,[],26842623,26842623,"Amber Heard, Honour Your Pledge to CHLA.",2021-01-14T12:15:03Z,,2021-01-14T12:20:43Z,2021-01-14T13:00:43Z,de-DE,['en'],"Petition to Hold Amber Heard Accountable! Amber Heard, Honour Your Pledge To CHLA","<p>For 4 years, Amber Heard has repeatedly claimed that she donated her entire divorce settlement, US 7 million dollars, to the Children's Hospital LA and ACLU. However, last week, we all learned that she not only didn't donate, but the little money she gave to CHLA/ACLU came from Johnny Depp and Elon Musk respectively. </p>
<p>I believe that pledging to help sick children (CHLA) is a serious thing and shouldn't be overlooked. Therefore, I created this petition to pressure Amber Heard to donate the money to help those children with cancer as she promised to do. She's been rewarded several times for donating the money ... She was appointed UN's Human Right Champions and is hailed as an activist and an example of braveness and strength. </p>
<p>Amber Heard already stole the suffering of countless domestic abuse victims/survivors, and it's not right that she also gets to keep the money she promised to give to sick children. </p>","Twitter, Amber Heard","Petition to Hold Amber Heard Accountable! Amber Heard, Honour Your 7M Pledge.",2022-01-22,,,DE,,,,,,,petition-to-hold-amber-heard-accountable-amber-heard-honour-your-pledge-to-chla,published,,,False,False,,False,,"[{'id': 476664, 'locale': 'de-DE', 'name': 'Andere', 'slug': 'andere-de-de', 'photo_id': None, 'created_by_owner': True, 'created_by_staff_member': False, 'total_count': 5983}]",True,False,,285,285,0,687,75,0,1,0,0,0,5,,,,,,225083314,photos/0/hh/jv/uShHJVzAYgRmApu-fullsize.jpg,//assets.change.org/photos/0/hh/jv/uShHJVzAYgRmApu-400x400-noPad.jpg?1610626508,False,400,400,//assets.change.org/photos/0/hh/jv/uShHJVzAYgRmApu-400x225-noPad.jpg?1610626508,False,400,225,//assets.change.org/photos/0/hh/jv/uShHJVzAYgRmApu-800x450-noPad.jpg?1610626509,False,800,450,//assets.change.org/photos/0/hh/jv/uShHJVzAYgRmApu-1600x900-noPad.jpg?1610626509,False,1600,900,photo,6,1656197806.752,1,1652309343.14,1,1651099185.728,1,1651099143.12,3,1653602276.776,1143958395,1143958395,Princess Consuela,Bananahammock,Princess Consuela,Princess Consuela Bananahammock,,,DE,https://www.twitter.com/PrinConsuella_,de-DE,Someone in the right side of the roaring rapids.,225083156,photos/4/vb/cy/egvBCYaPcFribkY-fullsize.jpg,//assets.change.org/photos/4/vb/cy/egvBCYaPcFribkY-48x48-noPad.jpg?1610622599,False,48,48,//assets.change.org/photos/4/vb/cy/egvBCYaPcFribkY-128x128-noPad.jpg?1610622599,False,128,128,//assets.change.org/photos/4/vb/cy/egvBCYaPcFribkY-400x400-noPad.jpg?1610622599,False,400,400,//assets.change.org/photos/4/vb/cy/egvBCYaPcFribkY-800x800-noPad.jpg?1610622599,False,800,800,[],"[{'id': 33678, 'display_name': 'Twitter', 'email': None, 'type': 'Custom', 'slug': 'twitter-2', 'description': 'Twitter is a real-time information network that connects you to the latest stories, ideas, opinions and news about what you find interesting.', 'publicly_visible': True, 'verified_at': None, 'summary': None, 'locale': 'en-US', 'confirmed_at': None, 'is_person': True, 'member_of': {}, 'additional_data': {'first_name': 'Twitter', 'last_name': None, 'title': None, 'id': 42729}, 'has_email': False, 'photo': {'id': 11701415, 'url': 'photos/1/pk/tq/WJpkTqiSAUOusTY-fullsize.jpg', 'sizes': {'small': {'url': '//assets.change.org/photos/1/pk/tq/WJpkTqiSAUOusTY-48x48-noPad.jpg?1519872572', 'processing': False, 'size': {'width': 48, 'height': 48}}, 'medium': {'url': '//assets.change.org/photos/1/pk/tq/WJpkTqiSAUOusTY-128x128-noPad.jpg?1519872572', 'processing': False, 'size': {'width': 128, 'height': 128}}, 'large': {'url': '//assets.change.org/photos/1/pk/tq/WJpkTqiSAUOusTY-400x400-noPad.jpg?1519872572', 'processing': False, 'size': {'width': 400, 'height': 400}}, 'xlarge': {'url': '//assets.change.org/photos/1/pk/tq/WJpkTqiSAUOusTY-800x800-noPad.jpg?1519872572', 'processing': False, 'size': {'width': 800, 'height': 800}}}}}, {'id': 10149883, 'display_name': 'Amber Heard', 'email': None, 'type': 'Custom', 'slug': 'amber-heard', 'description': None, 'photo_id': None, 'publicly_visible': False, 'verified_at': None, 'summary': None, 'locale': None, 'confirmed_at': None, 'is_person': True, 'member_of': {}, 'additional_data': {'first_name': 'Amber', 'last_name': 'Heard', 'title': None, 'id': 10054371}, 'has_email': False}]",False,False,False,Princess Consuela Bananahammock,225083156,photos/4/vb/cy/egvBCYaPcFribkY-fullsize.jpg,//assets.change.org/photos/4/vb/cy/egvBCYaPcFribkY-48x48-noPad.jpg?1610622599,False,48,48,//assets.change.org/photos/4/vb/cy/egvBCYaPcFribkY-128x128-noPad.jpg?1610622599,False,128,128,//assets.change.org/photos/4/vb/cy/egvBCYaPcFribkY-400x400-noPad.jpg?1610622599,False,400,400,//assets.change.org/photos/4/vb/cy/egvBCYaPcFribkY-800x800-noPad.jpg?1610622599,False,800,800,"Petition to Hold Amber Heard Accountable! Amber Heard, Honour Your Pledge To CHLA","Petition to Hold Amber Heard Accountable! Amber Heard, Honour Your Pledge To CHLA",active,500,225083314,photos/0/hh/jv/uShHJVzAYgRmApu-fullsize.jpg,//assets.change.org/photos/0/hh/jv/uShHJVzAYgRmApu-400x400-noPad.jpg?1610626508,False,400,400,//assets.change.org/photos/0/hh/jv/uShHJVzAYgRmApu-400x225-noPad.jpg?1610626508,False,400,225,//assets.change.org/photos/0/hh/jv/uShHJVzAYgRmApu-800x450-noPad.jpg?1610626509,False,800,450,//assets.change.org/photos/0/hh/jv/uShHJVzAYgRmApu-1600x900-noPad.jpg?1610626509,False,1600,900,photo,33678,Twitter,,Custom,twitter-2,"Twitter is a real-time information network that connects you to the latest stories, ideas, opinions and news about what you find interesting.",True,,,en-US,,True,Twitter,,,42729,False,11701415,photos/1/pk/tq/WJpkTqiSAUOusTY-fullsize.jpg,//assets.change.org/photos/1/pk/tq/WJpkTqiSAUOusTY-48x48-noPad.jpg?1519872572,False,48,48,//assets.change.org/photos/1/pk/tq/WJpkTqiSAUOusTY-128x128-noPad.jpg?1519872572,False,128,128,//assets.change.org/photos/1/pk/tq/WJpkTqiSAUOusTY-400x400-noPad.jpg?1519872572,False,400,400,//assets.change.org/photos/1/pk/tq/WJpkTqiSAUOusTY-800x800-noPad.jpg?1519872572,False,800,800,57
