id,comment,parent_id,children_count,commentable_type,commentable_id,likes,role,created_at,deleted_at,user.id,user.slug,user.first_name,user.last_name,user.short_display_name,user.display_name,user.city,user.state_code,user.country_code,user.website,user.locale,user.description,user.roles,commentable_entity.id,commentable_entity.document_id,commentable_entity.ask,commentable_entity.created_at,commentable_entity.deleted_at,commentable_entity.published_at,commentable_entity.last_edited_at,commentable_entity.original_locale,commentable_entity.languages,commentable_entity.title,commentable_entity.description,commentable_entity.targeting_description,commentable_entity.letter_body,commentable_entity.end_date,commentable_entity.goal,commentable_entity.relevant_location.city,commentable_entity.relevant_location.country_code,commentable_entity.relevant_location.lat,commentable_entity.relevant_location.lng,commentable_entity.relevant_location.state_code,commentable_entity.relevant_location.google_places_id,commentable_entity.relevant_location.photo_id,commentable_entity.restricted_location,commentable_entity.slug,commentable_entity.status,commentable_entity.victory_date,commentable_entity.victory_description,commentable_entity.is_verified_victory,commentable_entity.is_victory,commentable_entity.video_id,commentable_entity.is_pledge,commentable_entity.topic,commentable_entity.tags,commentable_entity.discoverable,commentable_entity.sponsored_campaign,commentable_entity.organization_free_email_optins,commentable_entity.displayed_signature_count,commentable_entity.total_signature_count,commentable_entity.weekly_signature_count,commentable_entity.total_page_views,commentable_entity.total_share_count,commentable_entity.daily_signature_count,commentable_entity.monthly_signature_count,commentable_entity.daily_signup_count,commentable_entity.weekly_signup_count,commentable_entity.monthly_signup_count,commentable_entity.total_signup_count,commentable_entity.supporter_message_count,commentable_entity.starter_vanity_url,commentable_entity.featured_title,commentable_entity.media_text,commentable_entity.media_url,commentable_entity.photo.id,commentable_entity.photo.url,commentable_entity.photo.sizes.square.url,commentable_entity.photo.sizes.square.processing,commentable_entity.photo.sizes.square.size.width,commentable_entity.photo.sizes.square.size.height,commentable_entity.photo.sizes.small.url,commentable_entity.photo.sizes.small.processing,commentable_entity.photo.sizes.small.size.width,commentable_entity.photo.sizes.small.size.height,commentable_entity.photo.sizes.medium.url,commentable_entity.photo.sizes.medium.processing,commentable_entity.photo.sizes.medium.size.width,commentable_entity.photo.sizes.medium.size.height,commentable_entity.photo.sizes.large.url,commentable_entity.photo.sizes.large.processing,commentable_entity.photo.sizes.large.size.width,commentable_entity.photo.sizes.large.size.height,commentable_entity.photo.type,commentable_entity.user.id,commentable_entity.user.slug,commentable_entity.user.first_name,commentable_entity.user.last_name,commentable_entity.user.short_display_name,commentable_entity.user.display_name,commentable_entity.user.city,commentable_entity.user.state_code,commentable_entity.user.country_code,commentable_entity.user.website,commentable_entity.user.locale,commentable_entity.user.description,commentable_entity.user.roles,commentable_entity.activity.share.copylink.count,commentable_entity.activity.share.copylink.last_updated,commentable_entity.targets,commentable_entity.hide_comments,commentable_entity.hide_dm_action_panel,commentable_entity.enable_human_verification,commentable_entity.creator_name,commentable_entity.display_title,commentable_entity.petition_title,commentable_entity.petition_status,commentable_entity.calculated_goal,commentable_entity.media.id,commentable_entity.media.url,commentable_entity.media.sizes.square.url,commentable_entity.media.sizes.square.processing,commentable_entity.media.sizes.square.size.width,commentable_entity.media.sizes.square.size.height,commentable_entity.media.sizes.small.url,commentable_entity.media.sizes.small.processing,commentable_entity.media.sizes.small.size.width,commentable_entity.media.sizes.small.size.height,commentable_entity.media.sizes.medium.url,commentable_entity.media.sizes.medium.processing,commentable_entity.media.sizes.medium.size.width,commentable_entity.media.sizes.medium.size.height,commentable_entity.media.sizes.large.url,commentable_entity.media.sizes.large.processing,commentable_entity.media.sizes.large.size.width,commentable_entity.media.sizes.large.size.height,commentable_entity.media.type,commentable_entity.primary_target.id,commentable_entity.primary_target.display_name,commentable_entity.primary_target.email,commentable_entity.primary_target.type,commentable_entity.primary_target.slug,commentable_entity.primary_target.description,commentable_entity.primary_target.photo_id,commentable_entity.primary_target.publicly_visible,commentable_entity.primary_target.verified_at,commentable_entity.primary_target.summary,commentable_entity.primary_target.locale,commentable_entity.primary_target.confirmed_at,commentable_entity.primary_target.is_person,commentable_entity.primary_target.additional_data.first_name,commentable_entity.primary_target.additional_data.last_name,commentable_entity.primary_target.additional_data.title,commentable_entity.primary_target.additional_data.id,commentable_entity.primary_target.has_email,commentable_entity.progress,user.photo.id,user.photo.url,user.photo.sizes.small.url,user.photo.sizes.small.processing,user.photo.sizes.small.size.width,user.photo.sizes.small.size.height,user.photo.sizes.medium.url,user.photo.sizes.medium.processing,user.photo.sizes.medium.size.width,user.photo.sizes.medium.size.height,user.photo.sizes.large.url,user.photo.sizes.large.processing,user.photo.sizes.large.size.width,user.photo.sizes.large.size.height,user.photo.sizes.xlarge.url,user.photo.sizes.xlarge.processing,user.photo.sizes.xlarge.size.width,user.photo.sizes.xlarge.size.height
832227977,Amber Heard is abusive.  Johnny Depp is a great actor.,0,0,Event,25699929,0,comment,2022-04-23T01:20:20Z,,1070943515,1070943515,Vicki,SARAH,Vicki,Vicki SARAH,Virginia Beach,VA,US,,en-US,,[],25699929,25699929,Bring back Johnny Depp as Grindelwald,2020-11-06T17:38:53Z,,2020-11-06T17:39:20Z,2020-11-06T17:39:20Z,en-US,['en'],Warner Bros: Bring back Johnny Depp as Grindelwald,"<p>Johnny Depp was forced by Warner Bros to give up position of Grindelwald in the Fantastic beast franchise due to the loss of his legal case.  The lies and Slander Amber heard has spread even after tons of evidence has been released that she herself is the abuser are costing Johnny Depp his career. I refuse to watch or buy anything Warner Bros until this problem is rectified, please join me in support of Johnny Depp and show Warner Bros what a mistake this is.  Let’s also use this to show our support and speak out against domestic violence against men. </p>","Warner Bros, JK Rowling",Bring back Johnny Depp as Grindelwald,2021-11-09,,,US,,,,,,,warner-bros-bring-back-johnny-depp-as-grindelwald,published,,,False,False,,False,,"[{'id': 476127, 'locale': 'en-US', 'name': 'Other', 'slug': 'other-en-us', 'photo_id': None, 'created_by_owner': True, 'created_by_staff_member': False, 'total_count': 166150}]",True,False,,34,34,0,114,10,0,0,0,0,0,1,,,,,,224823231,photos/9/pn/it/cdpnITmjykrbTeK-fullsize.jpg,//assets.change.org/photos/9/pn/it/cdpnITmjykrbTeK-400x400-noPad.jpg?1604684335,False,400,400,//assets.change.org/photos/9/pn/it/cdpnITmjykrbTeK-400x225-noPad.jpg?1604684335,False,400,225,//assets.change.org/photos/9/pn/it/cdpnITmjykrbTeK-800x450-noPad.jpg?1604684335,False,800,450,//assets.change.org/photos/9/pn/it/cdpnITmjykrbTeK-1600x900-noPad.jpg?1604684336,False,1600,900,photo,530036792,530036792,Andrea,Jarvis,Andrea,Andrea Jarvis,Virginia Beach,VA,US,,en-US,,[],1,1651164601.455,"[{'id': 589918, 'display_name': 'Warner Bros', 'email': None, 'type': 'Custom', 'slug': 'warner-bros-3', 'description': None, 'photo_id': None, 'publicly_visible': False, 'verified_at': None, 'summary': None, 'locale': 'en-GB', 'confirmed_at': None, 'is_person': True, 'member_of': {}, 'additional_data': {'first_name': 'Warner', 'last_name': 'Bros', 'title': None, 'id': 34741}, 'has_email': False}, {'id': 597139, 'display_name': 'JK Rowling', 'email': None, 'type': 'Custom', 'slug': 'jk-rowling', 'description': None, 'photo_id': None, 'publicly_visible': False, 'verified_at': None, 'summary': None, 'locale': 'en-US', 'confirmed_at': None, 'is_person': True, 'member_of': {}, 'additional_data': {'first_name': 'JK', 'last_name': 'Rowling', 'title': None, 'id': 42946}, 'has_email': False}]",False,False,False,Andrea Jarvis,Warner Bros: Bring back Johnny Depp as Grindelwald,Warner Bros: Bring back Johnny Depp as Grindelwald,active,100,224823231,photos/9/pn/it/cdpnITmjykrbTeK-fullsize.jpg,//assets.change.org/photos/9/pn/it/cdpnITmjykrbTeK-400x400-noPad.jpg?1604684335,False,400,400,//assets.change.org/photos/9/pn/it/cdpnITmjykrbTeK-400x225-noPad.jpg?1604684335,False,400,225,//assets.change.org/photos/9/pn/it/cdpnITmjykrbTeK-800x450-noPad.jpg?1604684335,False,800,450,//assets.change.org/photos/9/pn/it/cdpnITmjykrbTeK-1600x900-noPad.jpg?1604684336,False,1600,900,photo,589918,Warner Bros,,Custom,warner-bros-3,,,False,,,en-GB,,True,Warner,Bros,,34741,False,34,,,,,,,,,,,,,,,,,,
