806507890,Amber Heard is a disgrace & so are Loreal for allowing her to represent their products. I will never buy Loreal again.,0,0,Event,14094292,0,comment,2020-10-04T11:25:22Z,,705251282,705251282,Gaye,Murray,Gaye,Gaye Murray,Coulsdon,ENG,GB,,en-GB,,[],14094292,14094292,To remove an unsuitable proven abuser from being an Advocate for domestic violence,2018-12-26T10:25:17Z,,2018-12-26T10:39:35Z,,en-GB,['en'],ACLU: To remove an unsuitable proven abuser from being an Advocate for domestic violence,"<p>Many people men n women suffer at the hands of an abusive spouse. It takes years for them to open n speak n to reach out n get help. Mainly due to mental, physical, emotional n sexual abuse that makes that person left feeling void, humiliated, no self worth, hollow, have a need to protect their abuser through fear of negative retaliation n much more.Having a known abuser such as Amber Heard as an advocate for sufferers and survivors of DV , is not only making a mockery of a subject that is so severe but runs the risk of of having sufferers not trusting an organization in which they should feel they would be able to come forward n trust. Having this person as an advocate could run the risk n damage of sufferers coming foward n that would be a tragedy in itself.</p>",ACLU,To remove an unsuitable proven abuser from being an Advocate for domestic violence,2019-12-27,,,GB,55.3781,-3.43597,,,,,aclu-to-remove-an-unsuitable-proven-abuser-from-being-an-advocate-for-domestic-violence,published,,,False,False,,False,,[],True,False,,489,489,0,1276,215,0,0,0,0,0,45,,,,,,221531924,photos/6/fh/su/DXFhsufkyMCcdxh-fullsize.jpg,//assets.change.org/photos/6/fh/su/DXFhsufkyMCcdxh-400x400-noPad.jpg?1545952177,False,400,400,//assets.change.org/photos/6/fh/su/DXFhsufkyMCcdxh-400x225-noPad.jpg?1545952176,False,400,225,//assets.change.org/photos/6/fh/su/DXFhsufkyMCcdxh-800x450-noPad.jpg?1545952177,False,800,450,//assets.change.org/photos/6/fh/su/DXFhsufkyMCcdxh-1600x900-noPad.jpg?1545952177,False,1600,900,photo,1,1621134803,2,1653775779.115,1,1653343875.612,811097416,811097416,Nikki-jane,Clark,Nikki-jane,Nikki-jane Clark,Rochester,,GB,,en-GB,,221527748,photos/6/xx/du/PVxXDuPAlyZElOq-fullsize.jpg,//assets.change.org/photos/6/xx/du/PVxXDuPAlyZElOq-48x48-noPad.jpg?1545819986,False,48,48,//assets.change.org/photos/6/xx/du/PVxXDuPAlyZElOq-128x128-noPad.jpg?1545819985,False,128,128,//assets.change.org/photos/6/xx/du/PVxXDuPAlyZElOq-400x400-noPad.jpg?1545819985,False,400,400,//assets.change.org/photos/6/xx/du/PVxXDuPAlyZElOq-800x800-noPad.jpg?1545819986,False,800,800,[],"[{'id': 46756, 'display_name': 'ACLU', 'email': None, 'type': 'Custom', 'slug': 'aclu', 'description': None, 'photo_id': None, 'publicly_visible': False, 'verified_at': None, 'summary': None, 'locale': 'en-US', 'confirmed_at': None, 'is_person': True, 'member_of': {}, 'additional_data': {'first_name': 'ACLU', 'last_name': None, 'title': None, 'id': 55116}, 'has_email': False}]",False,False,False,Nikki-jane Clark,221527748,photos/6/xx/du/PVxXDuPAlyZElOq-fullsize.jpg,//assets.change.org/photos/6/xx/du/PVxXDuPAlyZElOq-48x48-noPad.jpg?1545819986,False,48,48,//assets.change.org/photos/6/xx/du/PVxXDuPAlyZElOq-128x128-noPad.jpg?1545819985,False,128,128,//assets.change.org/photos/6/xx/du/PVxXDuPAlyZElOq-400x400-noPad.jpg?1545819985,False,400,400,//assets.change.org/photos/6/xx/du/PVxXDuPAlyZElOq-800x800-noPad.jpg?1545819986,False,800,800,ACLU: To remove an unsuitable proven abuser from being an Advocate for domestic violence,ACLU: To remove an unsuitable proven abuser from being an Advocate for domestic violence,active,500,221531924,photos/6/fh/su/DXFhsufkyMCcdxh-fullsize.jpg,//assets.change.org/photos/6/fh/su/DXFhsufkyMCcdxh-400x400-noPad.jpg?1545952177,False,400,400,//assets.change.org/photos/6/fh/su/DXFhsufkyMCcdxh-400x225-noPad.jpg?1545952176,False,400,225,//assets.change.org/photos/6/fh/su/DXFhsufkyMCcdxh-800x450-noPad.jpg?1545952177,False,800,450,//assets.change.org/photos/6/fh/su/DXFhsufkyMCcdxh-1600x900-noPad.jpg?1545952177,False,1600,900,photo,46756,ACLU,,Custom,aclu,,,False,,,en-US,,True,ACLU,,,55116,False,97.8,172246592.0,photos/8/la/re/vnLArEffuCGHuLH-fullsize.jpg,//assets.change.org/photos/8/la/re/vnLArEffuCGHuLH-48x48-noPad.jpg?1491416509,False,48.0,48.0,//assets.change.org/photos/8/la/re/vnLArEffuCGHuLH-128x128-noPad.jpg?1491416509,False,128.0,128.0,//assets.change.org/photos/8/la/re/vnLArEffuCGHuLH-400x400-noPad.jpg?1491416509,False,400.0,400.0,//assets.change.org/photos/8/la/re/vnLArEffuCGHuLH-800x800-noPad.jpg?1491416509,False,800.0,800.0
806300282,An abuser should not be the face of those suffering from domestic abuse.,0,0,Event,14094292,0,comment,2020-10-01T01:05:06Z,,66281050,66281050,Katie,Davis,Katie,Katie Davis,Richmond,TX,US,,en-US,,[],14094292,14094292,To remove an unsuitable proven abuser from being an Advocate for domestic violence,2018-12-26T10:25:17Z,,2018-12-26T10:39:35Z,,en-GB,['en'],ACLU: To remove an unsuitable proven abuser from being an Advocate for domestic violence,"<p>Many people men n women suffer at the hands of an abusive spouse. It takes years for them to open n speak n to reach out n get help. Mainly due to mental, physical, emotional n sexual abuse that makes that person left feeling void, humiliated, no self worth, hollow, have a need to protect their abuser through fear of negative retaliation n much more.Having a known abuser such as Amber Heard as an advocate for sufferers and survivors of DV , is not only making a mockery of a subject that is so severe but runs the risk of of having sufferers not trusting an organization in which they should feel they would be able to come forward n trust. Having this person as an advocate could run the risk n damage of sufferers coming foward n that would be a tragedy in itself.</p>",ACLU,To remove an unsuitable proven abuser from being an Advocate for domestic violence,2019-12-27,,,GB,55.3781,-3.43597,,,,,aclu-to-remove-an-unsuitable-proven-abuser-from-being-an-advocate-for-domestic-violence,published,,,False,False,,False,,[],True,False,,489,489,0,1276,215,0,0,0,0,0,45,,,,,,221531924,photos/6/fh/su/DXFhsufkyMCcdxh-fullsize.jpg,//assets.change.org/photos/6/fh/su/DXFhsufkyMCcdxh-400x400-noPad.jpg?1545952177,False,400,400,//assets.change.org/photos/6/fh/su/DXFhsufkyMCcdxh-400x225-noPad.jpg?1545952176,False,400,225,//assets.change.org/photos/6/fh/su/DXFhsufkyMCcdxh-800x450-noPad.jpg?1545952177,False,800,450,//assets.change.org/photos/6/fh/su/DXFhsufkyMCcdxh-1600x900-noPad.jpg?1545952177,False,1600,900,photo,1,1621134803,2,1653775779.115,1,1653343875.612,811097416,811097416,Nikki-jane,Clark,Nikki-jane,Nikki-jane Clark,Rochester,,GB,,en-GB,,221527748,photos/6/xx/du/PVxXDuPAlyZElOq-fullsize.jpg,//assets.change.org/photos/6/xx/du/PVxXDuPAlyZElOq-48x48-noPad.jpg?1545819986,False,48,48,//assets.change.org/photos/6/xx/du/PVxXDuPAlyZElOq-128x128-noPad.jpg?1545819985,False,128,128,//assets.change.org/photos/6/xx/du/PVxXDuPAlyZElOq-400x400-noPad.jpg?1545819985,False,400,400,//assets.change.org/photos/6/xx/du/PVxXDuPAlyZElOq-800x800-noPad.jpg?1545819986,False,800,800,[],"[{'id': 46756, 'display_name': 'ACLU', 'email': None, 'type': 'Custom', 'slug': 'aclu', 'description': None, 'photo_id': None, 'publicly_visible': False, 'verified_at': None, 'summary': None, 'locale': 'en-US', 'confirmed_at': None, 'is_person': True, 'member_of': {}, 'additional_data': {'first_name': 'ACLU', 'last_name': None, 'title': None, 'id': 55116}, 'has_email': False}]",False,False,False,Nikki-jane Clark,221527748,photos/6/xx/du/PVxXDuPAlyZElOq-fullsize.jpg,//assets.change.org/photos/6/xx/du/PVxXDuPAlyZElOq-48x48-noPad.jpg?1545819986,False,48,48,//assets.change.org/photos/6/xx/du/PVxXDuPAlyZElOq-128x128-noPad.jpg?1545819985,False,128,128,//assets.change.org/photos/6/xx/du/PVxXDuPAlyZElOq-400x400-noPad.jpg?1545819985,False,400,400,//assets.change.org/photos/6/xx/du/PVxXDuPAlyZElOq-800x800-noPad.jpg?1545819986,False,800,800,ACLU: To remove an unsuitable proven abuser from being an Advocate for domestic violence,ACLU: To remove an unsuitable proven abuser from being an Advocate for domestic violence,active,500,221531924,photos/6/fh/su/DXFhsufkyMCcdxh-fullsize.jpg,//assets.change.org/photos/6/fh/su/DXFhsufkyMCcdxh-400x400-noPad.jpg?1545952177,False,400,400,//assets.change.org/photos/6/fh/su/DXFhsufkyMCcdxh-400x225-noPad.jpg?1545952176,False,400,225,//assets.change.org/photos/6/fh/su/DXFhsufkyMCcdxh-800x450-noPad.jpg?1545952177,False,800,450,//assets.change.org/photos/6/fh/su/DXFhsufkyMCcdxh-1600x900-noPad.jpg?1545952177,False,1600,900,photo,46756,ACLU,,Custom,aclu,,,False,,,en-US,,True,ACLU,,,55116,False,97.8,,,,,,,,,,,,,,,,,,
804720056,"amber heard is mental & needs medical help Urgently, for her abusive attitude to relationships.",0,0,Event,14094292,0,comment,2020-09-07T15:29:41Z,,341577503,341577503,Douglas,Uttley,Douglas,Douglas Uttley,Ryde,ENG,GB,,en-GB,,[],14094292,14094292,To remove an unsuitable proven abuser from being an Advocate for domestic violence,2018-12-26T10:25:17Z,,2018-12-26T10:39:35Z,,en-GB,['en'],ACLU: To remove an unsuitable proven abuser from being an Advocate for domestic violence,"<p>Many people men n women suffer at the hands of an abusive spouse. It takes years for them to open n speak n to reach out n get help. Mainly due to mental, physical, emotional n sexual abuse that makes that person left feeling void, humiliated, no self worth, hollow, have a need to protect their abuser through fear of negative retaliation n much more.Having a known abuser such as Amber Heard as an advocate for sufferers and survivors of DV , is not only making a mockery of a subject that is so severe but runs the risk of of having sufferers not trusting an organization in which they should feel they would be able to come forward n trust. Having this person as an advocate could run the risk n damage of sufferers coming foward n that would be a tragedy in itself.</p>",ACLU,To remove an unsuitable proven abuser from being an Advocate for domestic violence,2019-12-27,,,GB,55.3781,-3.43597,,,,,aclu-to-remove-an-unsuitable-proven-abuser-from-being-an-advocate-for-domestic-violence,published,,,False,False,,False,,[],True,False,,489,489,0,1276,215,0,0,0,0,0,45,,,,,,221531924,photos/6/fh/su/DXFhsufkyMCcdxh-fullsize.jpg,//assets.change.org/photos/6/fh/su/DXFhsufkyMCcdxh-400x400-noPad.jpg?1545952177,False,400,400,//assets.change.org/photos/6/fh/su/DXFhsufkyMCcdxh-400x225-noPad.jpg?1545952176,False,400,225,//assets.change.org/photos/6/fh/su/DXFhsufkyMCcdxh-800x450-noPad.jpg?1545952177,False,800,450,//assets.change.org/photos/6/fh/su/DXFhsufkyMCcdxh-1600x900-noPad.jpg?1545952177,False,1600,900,photo,1,1621134803,2,1653775779.115,1,1653343875.612,811097416,811097416,Nikki-jane,Clark,Nikki-jane,Nikki-jane Clark,Rochester,,GB,,en-GB,,221527748,photos/6/xx/du/PVxXDuPAlyZElOq-fullsize.jpg,//assets.change.org/photos/6/xx/du/PVxXDuPAlyZElOq-48x48-noPad.jpg?1545819986,False,48,48,//assets.change.org/photos/6/xx/du/PVxXDuPAlyZElOq-128x128-noPad.jpg?1545819985,False,128,128,//assets.change.org/photos/6/xx/du/PVxXDuPAlyZElOq-400x400-noPad.jpg?1545819985,False,400,400,//assets.change.org/photos/6/xx/du/PVxXDuPAlyZElOq-800x800-noPad.jpg?1545819986,False,800,800,[],"[{'id': 46756, 'display_name': 'ACLU', 'email': None, 'type': 'Custom', 'slug': 'aclu', 'description': None, 'photo_id': None, 'publicly_visible': False, 'verified_at': None, 'summary': None, 'locale': 'en-US', 'confirmed_at': None, 'is_person': True, 'member_of': {}, 'additional_data': {'first_name': 'ACLU', 'last_name': None, 'title': None, 'id': 55116}, 'has_email': False}]",False,False,False,Nikki-jane Clark,221527748,photos/6/xx/du/PVxXDuPAlyZElOq-fullsize.jpg,//assets.change.org/photos/6/xx/du/PVxXDuPAlyZElOq-48x48-noPad.jpg?1545819986,False,48,48,//assets.change.org/photos/6/xx/du/PVxXDuPAlyZElOq-128x128-noPad.jpg?1545819985,False,128,128,//assets.change.org/photos/6/xx/du/PVxXDuPAlyZElOq-400x400-noPad.jpg?1545819985,False,400,400,//assets.change.org/photos/6/xx/du/PVxXDuPAlyZElOq-800x800-noPad.jpg?1545819986,False,800,800,ACLU: To remove an unsuitable proven abuser from being an Advocate for domestic violence,ACLU: To remove an unsuitable proven abuser from being an Advocate for domestic violence,active,500,221531924,photos/6/fh/su/DXFhsufkyMCcdxh-fullsize.jpg,//assets.change.org/photos/6/fh/su/DXFhsufkyMCcdxh-400x400-noPad.jpg?1545952177,False,400,400,//assets.change.org/photos/6/fh/su/DXFhsufkyMCcdxh-400x225-noPad.jpg?1545952176,False,400,225,//assets.change.org/photos/6/fh/su/DXFhsufkyMCcdxh-800x450-noPad.jpg?1545952177,False,800,450,//assets.change.org/photos/6/fh/su/DXFhsufkyMCcdxh-1600x900-noPad.jpg?1545952177,False,1600,900,photo,46756,ACLU,,Custom,aclu,,,False,,,en-US,,True,ACLU,,,55116,False,97.8,,,,,,,,,,,,,,,,,,
804713917,Get rid now !,0,0,Event,14094292,0,comment,2020-09-07T13:26:49Z,,1046262937,1046262937,CHRISTINE,SELEMBA,CHRISTINE,CHRISTINE SELEMBA,LUTON,ENG,GB,,en-GB,,[],14094292,14094292,To remove an unsuitable proven abuser from being an Advocate for domestic violence,2018-12-26T10:25:17Z,,2018-12-26T10:39:35Z,,en-GB,['en'],ACLU: To remove an unsuitable proven abuser from being an Advocate for domestic violence,"<p>Many people men n women suffer at the hands of an abusive spouse. It takes years for them to open n speak n to reach out n get help. Mainly due to mental, physical, emotional n sexual abuse that makes that person left feeling void, humiliated, no self worth, hollow, have a need to protect their abuser through fear of negative retaliation n much more.Having a known abuser such as Amber Heard as an advocate for sufferers and survivors of DV , is not only making a mockery of a subject that is so severe but runs the risk of of having sufferers not trusting an organization in which they should feel they would be able to come forward n trust. Having this person as an advocate could run the risk n damage of sufferers coming foward n that would be a tragedy in itself.</p>",ACLU,To remove an unsuitable proven abuser from being an Advocate for domestic violence,2019-12-27,,,GB,55.3781,-3.43597,,,,,aclu-to-remove-an-unsuitable-proven-abuser-from-being-an-advocate-for-domestic-violence,published,,,False,False,,False,,[],True,False,,489,489,0,1276,215,0,0,0,0,0,45,,,,,,221531924,photos/6/fh/su/DXFhsufkyMCcdxh-fullsize.jpg,//assets.change.org/photos/6/fh/su/DXFhsufkyMCcdxh-400x400-noPad.jpg?1545952177,False,400,400,//assets.change.org/photos/6/fh/su/DXFhsufkyMCcdxh-400x225-noPad.jpg?1545952176,False,400,225,//assets.change.org/photos/6/fh/su/DXFhsufkyMCcdxh-800x450-noPad.jpg?1545952177,False,800,450,//assets.change.org/photos/6/fh/su/DXFhsufkyMCcdxh-1600x900-noPad.jpg?1545952177,False,1600,900,photo,1,1621134803,2,1653775779.115,1,1653343875.612,811097416,811097416,Nikki-jane,Clark,Nikki-jane,Nikki-jane Clark,Rochester,,GB,,en-GB,,221527748,photos/6/xx/du/PVxXDuPAlyZElOq-fullsize.jpg,//assets.change.org/photos/6/xx/du/PVxXDuPAlyZElOq-48x48-noPad.jpg?1545819986,False,48,48,//assets.change.org/photos/6/xx/du/PVxXDuPAlyZElOq-128x128-noPad.jpg?1545819985,False,128,128,//assets.change.org/photos/6/xx/du/PVxXDuPAlyZElOq-400x400-noPad.jpg?1545819985,False,400,400,//assets.change.org/photos/6/xx/du/PVxXDuPAlyZElOq-800x800-noPad.jpg?1545819986,False,800,800,[],"[{'id': 46756, 'display_name': 'ACLU', 'email': None, 'type': 'Custom', 'slug': 'aclu', 'description': None, 'photo_id': None, 'publicly_visible': False, 'verified_at': None, 'summary': None, 'locale': 'en-US', 'confirmed_at': None, 'is_person': True, 'member_of': {}, 'additional_data': {'first_name': 'ACLU', 'last_name': None, 'title': None, 'id': 55116}, 'has_email': False}]",False,False,False,Nikki-jane Clark,221527748,photos/6/xx/du/PVxXDuPAlyZElOq-fullsize.jpg,//assets.change.org/photos/6/xx/du/PVxXDuPAlyZElOq-48x48-noPad.jpg?1545819986,False,48,48,//assets.change.org/photos/6/xx/du/PVxXDuPAlyZElOq-128x128-noPad.jpg?1545819985,False,128,128,//assets.change.org/photos/6/xx/du/PVxXDuPAlyZElOq-400x400-noPad.jpg?1545819985,False,400,400,//assets.change.org/photos/6/xx/du/PVxXDuPAlyZElOq-800x800-noPad.jpg?1545819986,False,800,800,ACLU: To remove an unsuitable proven abuser from being an Advocate for domestic violence,ACLU: To remove an unsuitable proven abuser from being an Advocate for domestic violence,active,500,221531924,photos/6/fh/su/DXFhsufkyMCcdxh-fullsize.jpg,//assets.change.org/photos/6/fh/su/DXFhsufkyMCcdxh-400x400-noPad.jpg?1545952177,False,400,400,//assets.change.org/photos/6/fh/su/DXFhsufkyMCcdxh-400x225-noPad.jpg?1545952176,False,400,225,//assets.change.org/photos/6/fh/su/DXFhsufkyMCcdxh-800x450-noPad.jpg?1545952177,False,800,450,//assets.change.org/photos/6/fh/su/DXFhsufkyMCcdxh-1600x900-noPad.jpg?1545952177,False,1600,900,photo,46756,ACLU,,Custom,aclu,,,False,,,en-US,,True,ACLU,,,55116,False,97.8,,,,,,,,,,,,,,,,,,
802868082,"Amber Heard is an unstable, violent, abusive, manipulative liar and cheater who has hurt the entire metoo movement by twisting it to fit her agenda of extortion and destruction. She deserves to be fully investigated, and be made to face the social, legal, and financial consequences for her own vile behavior.",0,0,Event,14094292,1,comment,2020-08-15T21:09:07Z,,847337,847337,Joann,Hess,Joann,Joann Hess,LA,CA,US,,en-US,,[],14094292,14094292,To remove an unsuitable proven abuser from being an Advocate for domestic violence,2018-12-26T10:25:17Z,,2018-12-26T10:39:35Z,,en-GB,['en'],ACLU: To remove an unsuitable proven abuser from being an Advocate for domestic violence,"<p>Many people men n women suffer at the hands of an abusive spouse. It takes years for them to open n speak n to reach out n get help. Mainly due to mental, physical, emotional n sexual abuse that makes that person left feeling void, humiliated, no self worth, hollow, have a need to protect their abuser through fear of negative retaliation n much more.Having a known abuser such as Amber Heard as an advocate for sufferers and survivors of DV , is not only making a mockery of a subject that is so severe but runs the risk of of having sufferers not trusting an organization in which they should feel they would be able to come forward n trust. Having this person as an advocate could run the risk n damage of sufferers coming foward n that would be a tragedy in itself.</p>",ACLU,To remove an unsuitable proven abuser from being an Advocate for domestic violence,2019-12-27,,,GB,55.3781,-3.43597,,,,,aclu-to-remove-an-unsuitable-proven-abuser-from-being-an-advocate-for-domestic-violence,published,,,False,False,,False,,[],True,False,,489,489,0,1276,215,0,0,0,0,0,45,,,,,,221531924,photos/6/fh/su/DXFhsufkyMCcdxh-fullsize.jpg,//assets.change.org/photos/6/fh/su/DXFhsufkyMCcdxh-400x400-noPad.jpg?1545952177,False,400,400,//assets.change.org/photos/6/fh/su/DXFhsufkyMCcdxh-400x225-noPad.jpg?1545952176,False,400,225,//assets.change.org/photos/6/fh/su/DXFhsufkyMCcdxh-800x450-noPad.jpg?1545952177,False,800,450,//assets.change.org/photos/6/fh/su/DXFhsufkyMCcdxh-1600x900-noPad.jpg?1545952177,False,1600,900,photo,1,1621134803,2,1653775779.115,1,1653343875.612,811097416,811097416,Nikki-jane,Clark,Nikki-jane,Nikki-jane Clark,Rochester,,GB,,en-GB,,221527748,photos/6/xx/du/PVxXDuPAlyZElOq-fullsize.jpg,//assets.change.org/photos/6/xx/du/PVxXDuPAlyZElOq-48x48-noPad.jpg?1545819986,False,48,48,//assets.change.org/photos/6/xx/du/PVxXDuPAlyZElOq-128x128-noPad.jpg?1545819985,False,128,128,//assets.change.org/photos/6/xx/du/PVxXDuPAlyZElOq-400x400-noPad.jpg?1545819985,False,400,400,//assets.change.org/photos/6/xx/du/PVxXDuPAlyZElOq-800x800-noPad.jpg?1545819986,False,800,800,[],"[{'id': 46756, 'display_name': 'ACLU', 'email': None, 'type': 'Custom', 'slug': 'aclu', 'description': None, 'photo_id': None, 'publicly_visible': False, 'verified_at': None, 'summary': None, 'locale': 'en-US', 'confirmed_at': None, 'is_person': True, 'member_of': {}, 'additional_data': {'first_name': 'ACLU', 'last_name': None, 'title': None, 'id': 55116}, 'has_email': False}]",False,False,False,Nikki-jane Clark,221527748,photos/6/xx/du/PVxXDuPAlyZElOq-fullsize.jpg,//assets.change.org/photos/6/xx/du/PVxXDuPAlyZElOq-48x48-noPad.jpg?1545819986,False,48,48,//assets.change.org/photos/6/xx/du/PVxXDuPAlyZElOq-128x128-noPad.jpg?1545819985,False,128,128,//assets.change.org/photos/6/xx/du/PVxXDuPAlyZElOq-400x400-noPad.jpg?1545819985,False,400,400,//assets.change.org/photos/6/xx/du/PVxXDuPAlyZElOq-800x800-noPad.jpg?1545819986,False,800,800,ACLU: To remove an unsuitable proven abuser from being an Advocate for domestic violence,ACLU: To remove an unsuitable proven abuser from being an Advocate for domestic violence,active,500,221531924,photos/6/fh/su/DXFhsufkyMCcdxh-fullsize.jpg,//assets.change.org/photos/6/fh/su/DXFhsufkyMCcdxh-400x400-noPad.jpg?1545952177,False,400,400,//assets.change.org/photos/6/fh/su/DXFhsufkyMCcdxh-400x225-noPad.jpg?1545952176,False,400,225,//assets.change.org/photos/6/fh/su/DXFhsufkyMCcdxh-800x450-noPad.jpg?1545952177,False,800,450,//assets.change.org/photos/6/fh/su/DXFhsufkyMCcdxh-1600x900-noPad.jpg?1545952177,False,1600,900,photo,46756,ACLU,,Custom,aclu,,,False,,,en-US,,True,ACLU,,,55116,False,97.8,13610671.0,photos/4/cn/lc/mscnLCzmHMenIll-fullsize.jpg,//assets.change.org/photos/4/cn/lc/mscnLCzmHMenIll-48x48-noPad.jpg?1520390516,False,48.0,48.0,//assets.change.org/photos/4/cn/lc/mscnLCzmHMenIll-128x128-noPad.jpg?1520390516,False,128.0,128.0,//assets.change.org/photos/4/cn/lc/mscnLCzmHMenIll-400x400-noPad.jpg?1520390516,False,400.0,400.0,//assets.change.org/photos/4/cn/lc/mscnLCzmHMenIll-800x800-noPad.jpg?1520390516,False,800.0,800.0
