id,comment,parent_id,children_count,commentable_type,commentable_id,likes,role,created_at,deleted_at,user.id,user.slug,user.first_name,user.last_name,user.short_display_name,user.display_name,user.city,user.state_code,user.country_code,user.website,user.locale,user.description,user.roles,commentable_entity.id,commentable_entity.document_id,commentable_entity.ask,commentable_entity.created_at,commentable_entity.deleted_at,commentable_entity.published_at,commentable_entity.last_edited_at,commentable_entity.original_locale,commentable_entity.languages,commentable_entity.title,commentable_entity.description,commentable_entity.targeting_description,commentable_entity.letter_body,commentable_entity.end_date,commentable_entity.goal,commentable_entity.relevant_location.city,commentable_entity.relevant_location.country_code,commentable_entity.relevant_location.lat,commentable_entity.relevant_location.lng,commentable_entity.relevant_location.state_code,commentable_entity.relevant_location.google_places_id,commentable_entity.relevant_location.photo_id,commentable_entity.restricted_location,commentable_entity.slug,commentable_entity.status,commentable_entity.victory_date,commentable_entity.victory_description,commentable_entity.is_verified_victory,commentable_entity.is_victory,commentable_entity.video_id,commentable_entity.is_pledge,commentable_entity.topic,commentable_entity.tags,commentable_entity.discoverable,commentable_entity.sponsored_campaign,commentable_entity.organization_free_email_optins,commentable_entity.displayed_signature_count,commentable_entity.total_signature_count,commentable_entity.weekly_signature_count,commentable_entity.total_page_views,commentable_entity.total_share_count,commentable_entity.daily_signature_count,commentable_entity.monthly_signature_count,commentable_entity.daily_signup_count,commentable_entity.weekly_signup_count,commentable_entity.monthly_signup_count,commentable_entity.total_signup_count,commentable_entity.supporter_message_count,commentable_entity.starter_vanity_url,commentable_entity.featured_title,commentable_entity.media_text,commentable_entity.media_url,commentable_entity.photo.id,commentable_entity.photo.url,commentable_entity.photo.sizes.square.url,commentable_entity.photo.sizes.square.processing,commentable_entity.photo.sizes.square.size.width,commentable_entity.photo.sizes.square.size.height,commentable_entity.photo.sizes.small.url,commentable_entity.photo.sizes.small.processing,commentable_entity.photo.sizes.small.size.width,commentable_entity.photo.sizes.small.size.height,commentable_entity.photo.sizes.medium.url,commentable_entity.photo.sizes.medium.processing,commentable_entity.photo.sizes.medium.size.width,commentable_entity.photo.sizes.medium.size.height,commentable_entity.photo.sizes.large.url,commentable_entity.photo.sizes.large.processing,commentable_entity.photo.sizes.large.size.width,commentable_entity.photo.sizes.large.size.height,commentable_entity.photo.type,commentable_entity.user.id,commentable_entity.user.slug,commentable_entity.user.first_name,commentable_entity.user.last_name,commentable_entity.user.short_display_name,commentable_entity.user.display_name,commentable_entity.user.city,commentable_entity.user.state_code,commentable_entity.user.country_code,commentable_entity.user.website,commentable_entity.user.locale,commentable_entity.user.description,commentable_entity.user.roles,commentable_entity.activity.recruit.copylink.count,commentable_entity.activity.recruit.copylink.last_updated,commentable_entity.activity.recruit.email.count,commentable_entity.activity.recruit.email.last_updated,commentable_entity.activity.recruit.facebook.count,commentable_entity.activity.recruit.facebook.last_updated,commentable_entity.activity.recruit.sms.count,commentable_entity.activity.recruit.sms.last_updated,commentable_entity.activity.share.copylink.count,commentable_entity.activity.share.copylink.last_updated,commentable_entity.activity.share.email.count,commentable_entity.activity.share.email.last_updated,commentable_entity.activity.share.facebook.count,commentable_entity.activity.share.facebook.last_updated,commentable_entity.activity.share.sms.count,commentable_entity.activity.share.sms.last_updated,commentable_entity.activity.share.twitter.count,commentable_entity.activity.share.twitter.last_updated,commentable_entity.activity.share.whatsapp.count,commentable_entity.activity.share.whatsapp.last_updated,commentable_entity.targets,commentable_entity.hide_comments,commentable_entity.hide_dm_action_panel,commentable_entity.enable_human_verification,commentable_entity.creator_name,commentable_entity.display_title,commentable_entity.petition_title,commentable_entity.petition_status,commentable_entity.calculated_goal,commentable_entity.media.id,commentable_entity.media.url,commentable_entity.media.sizes.square.url,commentable_entity.media.sizes.square.processing,commentable_entity.media.sizes.square.size.width,commentable_entity.media.sizes.square.size.height,commentable_entity.media.sizes.small.url,commentable_entity.media.sizes.small.processing,commentable_entity.media.sizes.small.size.width,commentable_entity.media.sizes.small.size.height,commentable_entity.media.sizes.medium.url,commentable_entity.media.sizes.medium.processing,commentable_entity.media.sizes.medium.size.width,commentable_entity.media.sizes.medium.size.height,commentable_entity.media.sizes.large.url,commentable_entity.media.sizes.large.processing,commentable_entity.media.sizes.large.size.width,commentable_entity.media.sizes.large.size.height,commentable_entity.media.type,commentable_entity.primary_target.id,commentable_entity.primary_target.display_name,commentable_entity.primary_target.email,commentable_entity.primary_target.type,commentable_entity.primary_target.slug,commentable_entity.primary_target.description,commentable_entity.primary_target.publicly_visible,commentable_entity.primary_target.verified_at,commentable_entity.primary_target.summary,commentable_entity.primary_target.locale,commentable_entity.primary_target.confirmed_at,commentable_entity.primary_target.is_person,commentable_entity.primary_target.additional_data.first_name,commentable_entity.primary_target.additional_data.last_name,commentable_entity.primary_target.additional_data.title,commentable_entity.primary_target.additional_data.id,commentable_entity.primary_target.has_email,commentable_entity.primary_target.photo.id,commentable_entity.primary_target.photo.url,commentable_entity.primary_target.photo.sizes.small.url,commentable_entity.primary_target.photo.sizes.small.processing,commentable_entity.primary_target.photo.sizes.small.size.width,commentable_entity.primary_target.photo.sizes.small.size.height,commentable_entity.primary_target.photo.sizes.medium.url,commentable_entity.primary_target.photo.sizes.medium.processing,commentable_entity.primary_target.photo.sizes.medium.size.width,commentable_entity.primary_target.photo.sizes.medium.size.height,commentable_entity.primary_target.photo.sizes.large.url,commentable_entity.primary_target.photo.sizes.large.processing,commentable_entity.primary_target.photo.sizes.large.size.width,commentable_entity.primary_target.photo.sizes.large.size.height,commentable_entity.primary_target.photo.sizes.xlarge.url,commentable_entity.primary_target.photo.sizes.xlarge.processing,commentable_entity.primary_target.photo.sizes.xlarge.size.width,commentable_entity.primary_target.photo.sizes.xlarge.size.height,commentable_entity.progress,user.photo.id,user.photo.url,user.photo.sizes.small.url,user.photo.sizes.small.processing,user.photo.sizes.small.size.width,user.photo.sizes.small.size.height,user.photo.sizes.medium.url,user.photo.sizes.medium.processing,user.photo.sizes.medium.size.width,user.photo.sizes.medium.size.height,user.photo.sizes.large.url,user.photo.sizes.large.processing,user.photo.sizes.large.size.width,user.photo.sizes.large.size.height,user.photo.sizes.xlarge.url,user.photo.sizes.xlarge.processing,user.photo.sizes.xlarge.size.width,user.photo.sizes.xlarge.size.height
833856619,THE MOST THING THAT WE WANT IS CAPTAIN JACK SPARROW BACK IS JOHNNY DEPP BACK INTO THIS RIDE PIRATES OF THE CARIBBEAN,0,0,Event,25793976,0,comment,2022-06-23T15:09:37Z,,1269195360,1269195360,RACHEL,O'DRISCOLL,RACHEL,RACHEL O'DRISCOLL,,,US,,en-US,,[],25793976,25793976,Stop Disney removing Jack Sparrow!,2020-11-11T22:05:41Z,,2020-11-11T22:06:04Z,2020-11-13T23:18:23Z,en-GB,['en'],Disney : Stop Disney removing Jack Sparrow!,"<p>Since amber heard has made her terrible claims and lies against Johnny Depp it’s been said he will lose his roles in fantastic beasts and pirates of the Caribbean. <br>It’s also now been claimed Disney will be taking away our beloved Captain Jack Sparrow from their pirates of the Caribbean ride at their Disneyland parks. Captain Jack is everyone’s favourite pirate, and without him Pirates of the Caribbean wouldn’t be as great as what it is! <br>Let’s get justice for Johnny Depp! Let us see him keep his movies we all love and his place in the Disneyland attraction! </p>",Disney,Stop Disney removing Jack Sparrow!,2021-11-13,,,GB,55.3781,-3.43597,,,,,disney-stop-disney-removing-jack-sparrow,published,,,False,False,,False,,"[{'id': 476543, 'locale': 'en-GB', 'name': 'Other', 'slug': 'other-en-gb', 'photo_id': None, 'created_by_owner': True, 'created_by_staff_member': False, 'total_count': 66966}]",True,False,,2300,2300,0,3492,405,0,0,0,0,0,121,,,,,,224849143,photos/4/cp/fl/MkcpFLKRAKdEgkY-fullsize.jpg,//assets.change.org/photos/4/cp/fl/MkcpFLKRAKdEgkY-400x400-noPad.jpg?1605132342,False,400,400,//assets.change.org/photos/4/cp/fl/MkcpFLKRAKdEgkY-400x225-noPad.jpg?1605132342,False,400,225,//assets.change.org/photos/4/cp/fl/MkcpFLKRAKdEgkY-800x450-noPad.jpg?1605132342,False,800,450,//assets.change.org/photos/4/cp/fl/MkcpFLKRAKdEgkY-1600x900-noPad.jpg?1605132342,False,1600,900,photo,962285158,962285158,Lauren,Peddie,Lauren,Lauren Peddie,Peterborough,ENG,GB,,en-GB,,[],3,1653002447,1,1654019886,3,1654340646,5,1654021437,16,1655010290.148,4,1654019781.859,5,1654340703.175,10,1654659292.659,1,1653318137.159,4,1651944514.522,"[{'id': 585843, 'display_name': 'Disney', 'email': None, 'type': 'Custom', 'slug': 'disney-3', 'description': 'The Walt Disney Company is a leading diversified international family entertainment and media enterprise with five business segments: media networks, parks and resorts, studio entertainment, consumer products and interactive media.', 'publicly_visible': False, 'verified_at': None, 'summary': None, 'locale': 'en-US', 'confirmed_at': None, 'is_person': True, 'member_of': {}, 'additional_data': {'first_name': 'Disney', 'last_name': None, 'title': None, 'id': 29785}, 'has_email': False, 'photo': {'id': 11704124, 'url': 'photos/1/fc/sa/OpfCsAdtvgKjfEm-fullsize.jpg', 'sizes': {'small': {'url': '//assets.change.org/photos/1/fc/sa/OpfCsAdtvgKjfEm-48x48-noPad.jpg?1519873711', 'processing': False, 'size': {'width': 48, 'height': 48}}, 'medium': {'url': '//assets.change.org/photos/1/fc/sa/OpfCsAdtvgKjfEm-128x128-noPad.jpg?1519873711', 'processing': False, 'size': {'width': 128, 'height': 128}}, 'large': {'url': '//assets.change.org/photos/1/fc/sa/OpfCsAdtvgKjfEm-400x400-noPad.jpg?1519873711', 'processing': False, 'size': {'width': 400, 'height': 400}}, 'xlarge': {'url': '//assets.change.org/photos/1/fc/sa/OpfCsAdtvgKjfEm-800x800-noPad.jpg?1519873712', 'processing': False, 'size': {'width': 800, 'height': 800}}}}}]",False,False,False,Lauren Peddie,Disney : Stop Disney removing Jack Sparrow!,Disney : Stop Disney removing Jack Sparrow!,active,2500,224849143,photos/4/cp/fl/MkcpFLKRAKdEgkY-fullsize.jpg,//assets.change.org/photos/4/cp/fl/MkcpFLKRAKdEgkY-400x400-noPad.jpg?1605132342,False,400,400,//assets.change.org/photos/4/cp/fl/MkcpFLKRAKdEgkY-400x225-noPad.jpg?1605132342,False,400,225,//assets.change.org/photos/4/cp/fl/MkcpFLKRAKdEgkY-800x450-noPad.jpg?1605132342,False,800,450,//assets.change.org/photos/4/cp/fl/MkcpFLKRAKdEgkY-1600x900-noPad.jpg?1605132342,False,1600,900,photo,585843,Disney,,Custom,disney-3,"The Walt Disney Company is a leading diversified international family entertainment and media enterprise with five business segments: media networks, parks and resorts, studio entertainment, consumer products and interactive media.",False,,,en-US,,True,Disney,,,29785,False,11704124,photos/1/fc/sa/OpfCsAdtvgKjfEm-fullsize.jpg,//assets.change.org/photos/1/fc/sa/OpfCsAdtvgKjfEm-48x48-noPad.jpg?1519873711,False,48,48,//assets.change.org/photos/1/fc/sa/OpfCsAdtvgKjfEm-128x128-noPad.jpg?1519873711,False,128,128,//assets.change.org/photos/1/fc/sa/OpfCsAdtvgKjfEm-400x400-noPad.jpg?1519873711,False,400,400,//assets.change.org/photos/1/fc/sa/OpfCsAdtvgKjfEm-800x800-noPad.jpg?1519873712,False,800,800,92,,,,,,,,,,,,,,,,,,
833706023,we all want jack sparrow back,0,0,Event,25793976,0,comment,2022-06-16T14:29:20Z,,1269039716,1269039716,RACHEL,O'DRISCOLL,RACHEL,RACHEL O'DRISCOLL,,,US,,en-US,,[],25793976,25793976,Stop Disney removing Jack Sparrow!,2020-11-11T22:05:41Z,,2020-11-11T22:06:04Z,2020-11-13T23:18:23Z,en-GB,['en'],Disney : Stop Disney removing Jack Sparrow!,"<p>Since amber heard has made her terrible claims and lies against Johnny Depp it’s been said he will lose his roles in fantastic beasts and pirates of the Caribbean. <br>It’s also now been claimed Disney will be taking away our beloved Captain Jack Sparrow from their pirates of the Caribbean ride at their Disneyland parks. Captain Jack is everyone’s favourite pirate, and without him Pirates of the Caribbean wouldn’t be as great as what it is! <br>Let’s get justice for Johnny Depp! Let us see him keep his movies we all love and his place in the Disneyland attraction! </p>",Disney,Stop Disney removing Jack Sparrow!,2021-11-13,,,GB,55.3781,-3.43597,,,,,disney-stop-disney-removing-jack-sparrow,published,,,False,False,,False,,"[{'id': 476543, 'locale': 'en-GB', 'name': 'Other', 'slug': 'other-en-gb', 'photo_id': None, 'created_by_owner': True, 'created_by_staff_member': False, 'total_count': 66966}]",True,False,,2300,2300,0,3492,405,0,0,0,0,0,121,,,,,,224849143,photos/4/cp/fl/MkcpFLKRAKdEgkY-fullsize.jpg,//assets.change.org/photos/4/cp/fl/MkcpFLKRAKdEgkY-400x400-noPad.jpg?1605132342,False,400,400,//assets.change.org/photos/4/cp/fl/MkcpFLKRAKdEgkY-400x225-noPad.jpg?1605132342,False,400,225,//assets.change.org/photos/4/cp/fl/MkcpFLKRAKdEgkY-800x450-noPad.jpg?1605132342,False,800,450,//assets.change.org/photos/4/cp/fl/MkcpFLKRAKdEgkY-1600x900-noPad.jpg?1605132342,False,1600,900,photo,962285158,962285158,Lauren,Peddie,Lauren,Lauren Peddie,Peterborough,ENG,GB,,en-GB,,[],3,1653002447,1,1654019886,3,1654340646,5,1654021437,16,1655010290.148,4,1654019781.859,5,1654340703.175,10,1654659292.659,1,1653318137.159,4,1651944514.522,"[{'id': 585843, 'display_name': 'Disney', 'email': None, 'type': 'Custom', 'slug': 'disney-3', 'description': 'The Walt Disney Company is a leading diversified international family entertainment and media enterprise with five business segments: media networks, parks and resorts, studio entertainment, consumer products and interactive media.', 'publicly_visible': False, 'verified_at': None, 'summary': None, 'locale': 'en-US', 'confirmed_at': None, 'is_person': True, 'member_of': {}, 'additional_data': {'first_name': 'Disney', 'last_name': None, 'title': None, 'id': 29785}, 'has_email': False, 'photo': {'id': 11704124, 'url': 'photos/1/fc/sa/OpfCsAdtvgKjfEm-fullsize.jpg', 'sizes': {'small': {'url': '//assets.change.org/photos/1/fc/sa/OpfCsAdtvgKjfEm-48x48-noPad.jpg?1519873711', 'processing': False, 'size': {'width': 48, 'height': 48}}, 'medium': {'url': '//assets.change.org/photos/1/fc/sa/OpfCsAdtvgKjfEm-128x128-noPad.jpg?1519873711', 'processing': False, 'size': {'width': 128, 'height': 128}}, 'large': {'url': '//assets.change.org/photos/1/fc/sa/OpfCsAdtvgKjfEm-400x400-noPad.jpg?1519873711', 'processing': False, 'size': {'width': 400, 'height': 400}}, 'xlarge': {'url': '//assets.change.org/photos/1/fc/sa/OpfCsAdtvgKjfEm-800x800-noPad.jpg?1519873712', 'processing': False, 'size': {'width': 800, 'height': 800}}}}}]",False,False,False,Lauren Peddie,Disney : Stop Disney removing Jack Sparrow!,Disney : Stop Disney removing Jack Sparrow!,active,2500,224849143,photos/4/cp/fl/MkcpFLKRAKdEgkY-fullsize.jpg,//assets.change.org/photos/4/cp/fl/MkcpFLKRAKdEgkY-400x400-noPad.jpg?1605132342,False,400,400,//assets.change.org/photos/4/cp/fl/MkcpFLKRAKdEgkY-400x225-noPad.jpg?1605132342,False,400,225,//assets.change.org/photos/4/cp/fl/MkcpFLKRAKdEgkY-800x450-noPad.jpg?1605132342,False,800,450,//assets.change.org/photos/4/cp/fl/MkcpFLKRAKdEgkY-1600x900-noPad.jpg?1605132342,False,1600,900,photo,585843,Disney,,Custom,disney-3,"The Walt Disney Company is a leading diversified international family entertainment and media enterprise with five business segments: media networks, parks and resorts, studio entertainment, consumer products and interactive media.",False,,,en-US,,True,Disney,,,29785,False,11704124,photos/1/fc/sa/OpfCsAdtvgKjfEm-fullsize.jpg,//assets.change.org/photos/1/fc/sa/OpfCsAdtvgKjfEm-48x48-noPad.jpg?1519873711,False,48,48,//assets.change.org/photos/1/fc/sa/OpfCsAdtvgKjfEm-128x128-noPad.jpg?1519873711,False,128,128,//assets.change.org/photos/1/fc/sa/OpfCsAdtvgKjfEm-400x400-noPad.jpg?1519873711,False,400,400,//assets.change.org/photos/1/fc/sa/OpfCsAdtvgKjfEm-800x800-noPad.jpg?1519873712,False,800,800,92,,,,,,,,,,,,,,,,,,
833612819,Disney should not remove captain jack sparrow at all,0,0,Event,25793976,0,comment,2022-06-12T15:03:29Z,,1265577895,1265577895,RACHEL,O'Driscoll,RACHEL,RACHEL O'Driscoll,,UT,US,,en-US,,[],25793976,25793976,Stop Disney removing Jack Sparrow!,2020-11-11T22:05:41Z,,2020-11-11T22:06:04Z,2020-11-13T23:18:23Z,en-GB,['en'],Disney : Stop Disney removing Jack Sparrow!,"<p>Since amber heard has made her terrible claims and lies against Johnny Depp it’s been said he will lose his roles in fantastic beasts and pirates of the Caribbean. <br>It’s also now been claimed Disney will be taking away our beloved Captain Jack Sparrow from their pirates of the Caribbean ride at their Disneyland parks. Captain Jack is everyone’s favourite pirate, and without him Pirates of the Caribbean wouldn’t be as great as what it is! <br>Let’s get justice for Johnny Depp! Let us see him keep his movies we all love and his place in the Disneyland attraction! </p>",Disney,Stop Disney removing Jack Sparrow!,2021-11-13,,,GB,55.3781,-3.43597,,,,,disney-stop-disney-removing-jack-sparrow,published,,,False,False,,False,,"[{'id': 476543, 'locale': 'en-GB', 'name': 'Other', 'slug': 'other-en-gb', 'photo_id': None, 'created_by_owner': True, 'created_by_staff_member': False, 'total_count': 66966}]",True,False,,2300,2300,0,3492,405,0,0,0,0,0,121,,,,,,224849143,photos/4/cp/fl/MkcpFLKRAKdEgkY-fullsize.jpg,//assets.change.org/photos/4/cp/fl/MkcpFLKRAKdEgkY-400x400-noPad.jpg?1605132342,False,400,400,//assets.change.org/photos/4/cp/fl/MkcpFLKRAKdEgkY-400x225-noPad.jpg?1605132342,False,400,225,//assets.change.org/photos/4/cp/fl/MkcpFLKRAKdEgkY-800x450-noPad.jpg?1605132342,False,800,450,//assets.change.org/photos/4/cp/fl/MkcpFLKRAKdEgkY-1600x900-noPad.jpg?1605132342,False,1600,900,photo,962285158,962285158,Lauren,Peddie,Lauren,Lauren Peddie,Peterborough,ENG,GB,,en-GB,,[],3,1653002447,1,1654019886,3,1654340646,5,1654021437,16,1655010290.148,4,1654019781.859,5,1654340703.175,10,1654659292.659,1,1653318137.159,4,1651944514.522,"[{'id': 585843, 'display_name': 'Disney', 'email': None, 'type': 'Custom', 'slug': 'disney-3', 'description': 'The Walt Disney Company is a leading diversified international family entertainment and media enterprise with five business segments: media networks, parks and resorts, studio entertainment, consumer products and interactive media.', 'publicly_visible': False, 'verified_at': None, 'summary': None, 'locale': 'en-US', 'confirmed_at': None, 'is_person': True, 'member_of': {}, 'additional_data': {'first_name': 'Disney', 'last_name': None, 'title': None, 'id': 29785}, 'has_email': False, 'photo': {'id': 11704124, 'url': 'photos/1/fc/sa/OpfCsAdtvgKjfEm-fullsize.jpg', 'sizes': {'small': {'url': '//assets.change.org/photos/1/fc/sa/OpfCsAdtvgKjfEm-48x48-noPad.jpg?1519873711', 'processing': False, 'size': {'width': 48, 'height': 48}}, 'medium': {'url': '//assets.change.org/photos/1/fc/sa/OpfCsAdtvgKjfEm-128x128-noPad.jpg?1519873711', 'processing': False, 'size': {'width': 128, 'height': 128}}, 'large': {'url': '//assets.change.org/photos/1/fc/sa/OpfCsAdtvgKjfEm-400x400-noPad.jpg?1519873711', 'processing': False, 'size': {'width': 400, 'height': 400}}, 'xlarge': {'url': '//assets.change.org/photos/1/fc/sa/OpfCsAdtvgKjfEm-800x800-noPad.jpg?1519873712', 'processing': False, 'size': {'width': 800, 'height': 800}}}}}]",False,False,False,Lauren Peddie,Disney : Stop Disney removing Jack Sparrow!,Disney : Stop Disney removing Jack Sparrow!,active,2500,224849143,photos/4/cp/fl/MkcpFLKRAKdEgkY-fullsize.jpg,//assets.change.org/photos/4/cp/fl/MkcpFLKRAKdEgkY-400x400-noPad.jpg?1605132342,False,400,400,//assets.change.org/photos/4/cp/fl/MkcpFLKRAKdEgkY-400x225-noPad.jpg?1605132342,False,400,225,//assets.change.org/photos/4/cp/fl/MkcpFLKRAKdEgkY-800x450-noPad.jpg?1605132342,False,800,450,//assets.change.org/photos/4/cp/fl/MkcpFLKRAKdEgkY-1600x900-noPad.jpg?1605132342,False,1600,900,photo,585843,Disney,,Custom,disney-3,"The Walt Disney Company is a leading diversified international family entertainment and media enterprise with five business segments: media networks, parks and resorts, studio entertainment, consumer products and interactive media.",False,,,en-US,,True,Disney,,,29785,False,11704124,photos/1/fc/sa/OpfCsAdtvgKjfEm-fullsize.jpg,//assets.change.org/photos/1/fc/sa/OpfCsAdtvgKjfEm-48x48-noPad.jpg?1519873711,False,48,48,//assets.change.org/photos/1/fc/sa/OpfCsAdtvgKjfEm-128x128-noPad.jpg?1519873711,False,128,128,//assets.change.org/photos/1/fc/sa/OpfCsAdtvgKjfEm-400x400-noPad.jpg?1519873711,False,400,400,//assets.change.org/photos/1/fc/sa/OpfCsAdtvgKjfEm-800x800-noPad.jpg?1519873712,False,800,800,92,,,,,,,,,,,,,,,,,,
