809232082,I support Johnny Depp and you cannot replace him,0,0,Event,25793976,1,comment,2020-11-13T16:41:27Z,,9880327,9880327,Pauline,Anne,Pauline,Pauline Anne,San Francisco,CA,US,,en-US,,[],25793976,25793976,Stop Disney removing Jack Sparrow!,2020-11-11T22:05:41Z,,2020-11-11T22:06:04Z,2020-11-13T23:18:23Z,en-GB,['en'],Disney : Stop Disney removing Jack Sparrow!,"<p>Since amber heard has made her terrible claims and lies against Johnny Depp it’s been said he will lose his roles in fantastic beasts and pirates of the Caribbean. <br>It’s also now been claimed Disney will be taking away our beloved Captain Jack Sparrow from their pirates of the Caribbean ride at their Disneyland parks. Captain Jack is everyone’s favourite pirate, and without him Pirates of the Caribbean wouldn’t be as great as what it is! <br>Let’s get justice for Johnny Depp! Let us see him keep his movies we all love and his place in the Disneyland attraction! </p>",Disney,Stop Disney removing Jack Sparrow!,2021-11-13,,,GB,55.3781,-3.43597,,,,,disney-stop-disney-removing-jack-sparrow,published,,,False,False,,False,,"[{'id': 476543, 'locale': 'en-GB', 'name': 'Other', 'slug': 'other-en-gb', 'photo_id': None, 'created_by_owner': True, 'created_by_staff_member': False, 'total_count': 66966}]",True,False,,2300,2300,0,3492,405,0,0,0,0,0,121,,,,,,224849143,photos/4/cp/fl/MkcpFLKRAKdEgkY-fullsize.jpg,//assets.change.org/photos/4/cp/fl/MkcpFLKRAKdEgkY-400x400-noPad.jpg?1605132342,False,400,400,//assets.change.org/photos/4/cp/fl/MkcpFLKRAKdEgkY-400x225-noPad.jpg?1605132342,False,400,225,//assets.change.org/photos/4/cp/fl/MkcpFLKRAKdEgkY-800x450-noPad.jpg?1605132342,False,800,450,//assets.change.org/photos/4/cp/fl/MkcpFLKRAKdEgkY-1600x900-noPad.jpg?1605132342,False,1600,900,photo,962285158,962285158,Lauren,Peddie,Lauren,Lauren Peddie,Peterborough,ENG,GB,,en-GB,,[],3,1653002447,1,1654019886,3,1654340646,5,1654021437,16,1655010290.148,4,1654019781.859,5,1654340703.175,10,1654659292.659,1,1653318137.159,4,1651944514.522,"[{'id': 585843, 'display_name': 'Disney', 'email': None, 'type': 'Custom', 'slug': 'disney-3', 'description': 'The Walt Disney Company is a leading diversified international family entertainment and media enterprise with five business segments: media networks, parks and resorts, studio entertainment, consumer products and interactive media.', 'publicly_visible': False, 'verified_at': None, 'summary': None, 'locale': 'en-US', 'confirmed_at': None, 'is_person': True, 'member_of': {}, 'additional_data': {'first_name': 'Disney', 'last_name': None, 'title': None, 'id': 29785}, 'has_email': False, 'photo': {'id': 11704124, 'url': 'photos/1/fc/sa/OpfCsAdtvgKjfEm-fullsize.jpg', 'sizes': {'small': {'url': '//assets.change.org/photos/1/fc/sa/OpfCsAdtvgKjfEm-48x48-noPad.jpg?1519873711', 'processing': False, 'size': {'width': 48, 'height': 48}}, 'medium': {'url': '//assets.change.org/photos/1/fc/sa/OpfCsAdtvgKjfEm-128x128-noPad.jpg?1519873711', 'processing': False, 'size': {'width': 128, 'height': 128}}, 'large': {'url': '//assets.change.org/photos/1/fc/sa/OpfCsAdtvgKjfEm-400x400-noPad.jpg?1519873711', 'processing': False, 'size': {'width': 400, 'height': 400}}, 'xlarge': {'url': '//assets.change.org/photos/1/fc/sa/OpfCsAdtvgKjfEm-800x800-noPad.jpg?1519873712', 'processing': False, 'size': {'width': 800, 'height': 800}}}}}]",False,False,False,Lauren Peddie,Disney : Stop Disney removing Jack Sparrow!,Disney : Stop Disney removing Jack Sparrow!,active,2500,224849143,photos/4/cp/fl/MkcpFLKRAKdEgkY-fullsize.jpg,//assets.change.org/photos/4/cp/fl/MkcpFLKRAKdEgkY-400x400-noPad.jpg?1605132342,False,400,400,//assets.change.org/photos/4/cp/fl/MkcpFLKRAKdEgkY-400x225-noPad.jpg?1605132342,False,400,225,//assets.change.org/photos/4/cp/fl/MkcpFLKRAKdEgkY-800x450-noPad.jpg?1605132342,False,800,450,//assets.change.org/photos/4/cp/fl/MkcpFLKRAKdEgkY-1600x900-noPad.jpg?1605132342,False,1600,900,photo,585843,Disney,,Custom,disney-3,"The Walt Disney Company is a leading diversified international family entertainment and media enterprise with five business segments: media networks, parks and resorts, studio entertainment, consumer products and interactive media.",False,,,en-US,,True,Disney,,,29785,False,11704124,photos/1/fc/sa/OpfCsAdtvgKjfEm-fullsize.jpg,//assets.change.org/photos/1/fc/sa/OpfCsAdtvgKjfEm-48x48-noPad.jpg?1519873711,False,48,48,//assets.change.org/photos/1/fc/sa/OpfCsAdtvgKjfEm-128x128-noPad.jpg?1519873711,False,128,128,//assets.change.org/photos/1/fc/sa/OpfCsAdtvgKjfEm-400x400-noPad.jpg?1519873711,False,400,400,//assets.change.org/photos/1/fc/sa/OpfCsAdtvgKjfEm-800x800-noPad.jpg?1519873712,False,800,800,92,1001184.0,photos/6/al/ft/awalFTNADjGUFWo-fullsize.jpg,//assets.change.org/photos/6/al/ft/awalFTNADjGUFWo-48x48-noPad.jpg?1574613579,False,48.0,48.0,//assets.change.org/photos/6/al/ft/awalFTNADjGUFWo-128x128-noPad.jpg?1574613579,False,128.0,128.0,//assets.change.org/photos/6/al/ft/awalFTNADjGUFWo-400x400-noPad.jpg?1574613579,False,400.0,400.0,//assets.change.org/photos/6/al/ft/awalFTNADjGUFWo-800x800-noPad.jpg?1574613579,False,800.0,800.0
809230533,Justice for Johnny Depp,0,0,Event,25793976,1,comment,2020-11-13T16:02:59Z,,809652199,809652199,Alexandra,Lugo,Alexandra,Alexandra Lugo,Federal Way,WA,US,,en-US,,[],25793976,25793976,Stop Disney removing Jack Sparrow!,2020-11-11T22:05:41Z,,2020-11-11T22:06:04Z,2020-11-13T23:18:23Z,en-GB,['en'],Disney : Stop Disney removing Jack Sparrow!,"<p>Since amber heard has made her terrible claims and lies against Johnny Depp it’s been said he will lose his roles in fantastic beasts and pirates of the Caribbean. <br>It’s also now been claimed Disney will be taking away our beloved Captain Jack Sparrow from their pirates of the Caribbean ride at their Disneyland parks. Captain Jack is everyone’s favourite pirate, and without him Pirates of the Caribbean wouldn’t be as great as what it is! <br>Let’s get justice for Johnny Depp! Let us see him keep his movies we all love and his place in the Disneyland attraction! </p>",Disney,Stop Disney removing Jack Sparrow!,2021-11-13,,,GB,55.3781,-3.43597,,,,,disney-stop-disney-removing-jack-sparrow,published,,,False,False,,False,,"[{'id': 476543, 'locale': 'en-GB', 'name': 'Other', 'slug': 'other-en-gb', 'photo_id': None, 'created_by_owner': True, 'created_by_staff_member': False, 'total_count': 66966}]",True,False,,2300,2300,0,3492,405,0,0,0,0,0,121,,,,,,224849143,photos/4/cp/fl/MkcpFLKRAKdEgkY-fullsize.jpg,//assets.change.org/photos/4/cp/fl/MkcpFLKRAKdEgkY-400x400-noPad.jpg?1605132342,False,400,400,//assets.change.org/photos/4/cp/fl/MkcpFLKRAKdEgkY-400x225-noPad.jpg?1605132342,False,400,225,//assets.change.org/photos/4/cp/fl/MkcpFLKRAKdEgkY-800x450-noPad.jpg?1605132342,False,800,450,//assets.change.org/photos/4/cp/fl/MkcpFLKRAKdEgkY-1600x900-noPad.jpg?1605132342,False,1600,900,photo,962285158,962285158,Lauren,Peddie,Lauren,Lauren Peddie,Peterborough,ENG,GB,,en-GB,,[],3,1653002447,1,1654019886,3,1654340646,5,1654021437,16,1655010290.148,4,1654019781.859,5,1654340703.175,10,1654659292.659,1,1653318137.159,4,1651944514.522,"[{'id': 585843, 'display_name': 'Disney', 'email': None, 'type': 'Custom', 'slug': 'disney-3', 'description': 'The Walt Disney Company is a leading diversified international family entertainment and media enterprise with five business segments: media networks, parks and resorts, studio entertainment, consumer products and interactive media.', 'publicly_visible': False, 'verified_at': None, 'summary': None, 'locale': 'en-US', 'confirmed_at': None, 'is_person': True, 'member_of': {}, 'additional_data': {'first_name': 'Disney', 'last_name': None, 'title': None, 'id': 29785}, 'has_email': False, 'photo': {'id': 11704124, 'url': 'photos/1/fc/sa/OpfCsAdtvgKjfEm-fullsize.jpg', 'sizes': {'small': {'url': '//assets.change.org/photos/1/fc/sa/OpfCsAdtvgKjfEm-48x48-noPad.jpg?1519873711', 'processing': False, 'size': {'width': 48, 'height': 48}}, 'medium': {'url': '//assets.change.org/photos/1/fc/sa/OpfCsAdtvgKjfEm-128x128-noPad.jpg?1519873711', 'processing': False, 'size': {'width': 128, 'height': 128}}, 'large': {'url': '//assets.change.org/photos/1/fc/sa/OpfCsAdtvgKjfEm-400x400-noPad.jpg?1519873711', 'processing': False, 'size': {'width': 400, 'height': 400}}, 'xlarge': {'url': '//assets.change.org/photos/1/fc/sa/OpfCsAdtvgKjfEm-800x800-noPad.jpg?1519873712', 'processing': False, 'size': {'width': 800, 'height': 800}}}}}]",False,False,False,Lauren Peddie,Disney : Stop Disney removing Jack Sparrow!,Disney : Stop Disney removing Jack Sparrow!,active,2500,224849143,photos/4/cp/fl/MkcpFLKRAKdEgkY-fullsize.jpg,//assets.change.org/photos/4/cp/fl/MkcpFLKRAKdEgkY-400x400-noPad.jpg?1605132342,False,400,400,//assets.change.org/photos/4/cp/fl/MkcpFLKRAKdEgkY-400x225-noPad.jpg?1605132342,False,400,225,//assets.change.org/photos/4/cp/fl/MkcpFLKRAKdEgkY-800x450-noPad.jpg?1605132342,False,800,450,//assets.change.org/photos/4/cp/fl/MkcpFLKRAKdEgkY-1600x900-noPad.jpg?1605132342,False,1600,900,photo,585843,Disney,,Custom,disney-3,"The Walt Disney Company is a leading diversified international family entertainment and media enterprise with five business segments: media networks, parks and resorts, studio entertainment, consumer products and interactive media.",False,,,en-US,,True,Disney,,,29785,False,11704124,photos/1/fc/sa/OpfCsAdtvgKjfEm-fullsize.jpg,//assets.change.org/photos/1/fc/sa/OpfCsAdtvgKjfEm-48x48-noPad.jpg?1519873711,False,48,48,//assets.change.org/photos/1/fc/sa/OpfCsAdtvgKjfEm-128x128-noPad.jpg?1519873711,False,128,128,//assets.change.org/photos/1/fc/sa/OpfCsAdtvgKjfEm-400x400-noPad.jpg?1519873711,False,400,400,//assets.change.org/photos/1/fc/sa/OpfCsAdtvgKjfEm-800x800-noPad.jpg?1519873712,False,800,800,92,204849103.0,photos/8/pn/ym/CQPnyMTKELbWMPd-fullsize.jpg,//assets.change.org/photos/8/pn/ym/CQPnyMTKELbWMPd-48x48-noPad.jpg?1507753628,False,48.0,48.0,//assets.change.org/photos/8/pn/ym/CQPnyMTKELbWMPd-128x128-noPad.jpg?1507753628,False,128.0,128.0,//assets.change.org/photos/8/pn/ym/CQPnyMTKELbWMPd-400x400-noPad.jpg?1507753628,False,400.0,400.0,//assets.change.org/photos/8/pn/ym/CQPnyMTKELbWMPd-800x800-noPad.jpg?1507753628,False,800.0,800.0
809229189,"The success of these movies lies with Depp’s incredible talent! To remove him is not only a travesty, but also implies tacit support of his abuser.",0,0,Event,25793976,1,comment,2020-11-13T15:27:42Z,,62335876,62335876,Rebecca,Norman,Rebecca,Rebecca Norman,Manning,,AU,,en-AU,,[],25793976,25793976,Stop Disney removing Jack Sparrow!,2020-11-11T22:05:41Z,,2020-11-11T22:06:04Z,2020-11-13T23:18:23Z,en-GB,['en'],Disney : Stop Disney removing Jack Sparrow!,"<p>Since amber heard has made her terrible claims and lies against Johnny Depp it’s been said he will lose his roles in fantastic beasts and pirates of the Caribbean. <br>It’s also now been claimed Disney will be taking away our beloved Captain Jack Sparrow from their pirates of the Caribbean ride at their Disneyland parks. Captain Jack is everyone’s favourite pirate, and without him Pirates of the Caribbean wouldn’t be as great as what it is! <br>Let’s get justice for Johnny Depp! Let us see him keep his movies we all love and his place in the Disneyland attraction! </p>",Disney,Stop Disney removing Jack Sparrow!,2021-11-13,,,GB,55.3781,-3.43597,,,,,disney-stop-disney-removing-jack-sparrow,published,,,False,False,,False,,"[{'id': 476543, 'locale': 'en-GB', 'name': 'Other', 'slug': 'other-en-gb', 'photo_id': None, 'created_by_owner': True, 'created_by_staff_member': False, 'total_count': 66966}]",True,False,,2300,2300,0,3492,405,0,0,0,0,0,121,,,,,,224849143,photos/4/cp/fl/MkcpFLKRAKdEgkY-fullsize.jpg,//assets.change.org/photos/4/cp/fl/MkcpFLKRAKdEgkY-400x400-noPad.jpg?1605132342,False,400,400,//assets.change.org/photos/4/cp/fl/MkcpFLKRAKdEgkY-400x225-noPad.jpg?1605132342,False,400,225,//assets.change.org/photos/4/cp/fl/MkcpFLKRAKdEgkY-800x450-noPad.jpg?1605132342,False,800,450,//assets.change.org/photos/4/cp/fl/MkcpFLKRAKdEgkY-1600x900-noPad.jpg?1605132342,False,1600,900,photo,962285158,962285158,Lauren,Peddie,Lauren,Lauren Peddie,Peterborough,ENG,GB,,en-GB,,[],3,1653002447,1,1654019886,3,1654340646,5,1654021437,16,1655010290.148,4,1654019781.859,5,1654340703.175,10,1654659292.659,1,1653318137.159,4,1651944514.522,"[{'id': 585843, 'display_name': 'Disney', 'email': None, 'type': 'Custom', 'slug': 'disney-3', 'description': 'The Walt Disney Company is a leading diversified international family entertainment and media enterprise with five business segments: media networks, parks and resorts, studio entertainment, consumer products and interactive media.', 'publicly_visible': False, 'verified_at': None, 'summary': None, 'locale': 'en-US', 'confirmed_at': None, 'is_person': True, 'member_of': {}, 'additional_data': {'first_name': 'Disney', 'last_name': None, 'title': None, 'id': 29785}, 'has_email': False, 'photo': {'id': 11704124, 'url': 'photos/1/fc/sa/OpfCsAdtvgKjfEm-fullsize.jpg', 'sizes': {'small': {'url': '//assets.change.org/photos/1/fc/sa/OpfCsAdtvgKjfEm-48x48-noPad.jpg?1519873711', 'processing': False, 'size': {'width': 48, 'height': 48}}, 'medium': {'url': '//assets.change.org/photos/1/fc/sa/OpfCsAdtvgKjfEm-128x128-noPad.jpg?1519873711', 'processing': False, 'size': {'width': 128, 'height': 128}}, 'large': {'url': '//assets.change.org/photos/1/fc/sa/OpfCsAdtvgKjfEm-400x400-noPad.jpg?1519873711', 'processing': False, 'size': {'width': 400, 'height': 400}}, 'xlarge': {'url': '//assets.change.org/photos/1/fc/sa/OpfCsAdtvgKjfEm-800x800-noPad.jpg?1519873712', 'processing': False, 'size': {'width': 800, 'height': 800}}}}}]",False,False,False,Lauren Peddie,Disney : Stop Disney removing Jack Sparrow!,Disney : Stop Disney removing Jack Sparrow!,active,2500,224849143,photos/4/cp/fl/MkcpFLKRAKdEgkY-fullsize.jpg,//assets.change.org/photos/4/cp/fl/MkcpFLKRAKdEgkY-400x400-noPad.jpg?1605132342,False,400,400,//assets.change.org/photos/4/cp/fl/MkcpFLKRAKdEgkY-400x225-noPad.jpg?1605132342,False,400,225,//assets.change.org/photos/4/cp/fl/MkcpFLKRAKdEgkY-800x450-noPad.jpg?1605132342,False,800,450,//assets.change.org/photos/4/cp/fl/MkcpFLKRAKdEgkY-1600x900-noPad.jpg?1605132342,False,1600,900,photo,585843,Disney,,Custom,disney-3,"The Walt Disney Company is a leading diversified international family entertainment and media enterprise with five business segments: media networks, parks and resorts, studio entertainment, consumer products and interactive media.",False,,,en-US,,True,Disney,,,29785,False,11704124,photos/1/fc/sa/OpfCsAdtvgKjfEm-fullsize.jpg,//assets.change.org/photos/1/fc/sa/OpfCsAdtvgKjfEm-48x48-noPad.jpg?1519873711,False,48,48,//assets.change.org/photos/1/fc/sa/OpfCsAdtvgKjfEm-128x128-noPad.jpg?1519873711,False,128,128,//assets.change.org/photos/1/fc/sa/OpfCsAdtvgKjfEm-400x400-noPad.jpg?1519873711,False,400,400,//assets.change.org/photos/1/fc/sa/OpfCsAdtvgKjfEm-800x800-noPad.jpg?1519873712,False,800,800,92,10698582.0,photos/9/tx/gt/yXTXgtkrFUkXuPK-fullsize.jpg,//assets.change.org/photos/9/tx/gt/yXTXgtkrFUkXuPK-48x48-noPad.jpg?1522498982,False,48.0,48.0,//assets.change.org/photos/9/tx/gt/yXTXgtkrFUkXuPK-128x128-noPad.jpg?1522498982,False,128.0,128.0,//assets.change.org/photos/9/tx/gt/yXTXgtkrFUkXuPK-400x400-noPad.jpg?1522498982,False,400.0,400.0,//assets.change.org/photos/9/tx/gt/yXTXgtkrFUkXuPK-800x800-noPad.jpg?1522498982,False,800.0,800.0
809227945,Johnny depp is the best of all!! Do not remove him!!,0,0,Event,25793976,1,comment,2020-11-13T14:55:12Z,,588877373,588877373,Kara,Macejak,Kara,Kara Macejak,Kissimmee,FL,US,,en-US,,[],25793976,25793976,Stop Disney removing Jack Sparrow!,2020-11-11T22:05:41Z,,2020-11-11T22:06:04Z,2020-11-13T23:18:23Z,en-GB,['en'],Disney : Stop Disney removing Jack Sparrow!,"<p>Since amber heard has made her terrible claims and lies against Johnny Depp it’s been said he will lose his roles in fantastic beasts and pirates of the Caribbean. <br>It’s also now been claimed Disney will be taking away our beloved Captain Jack Sparrow from their pirates of the Caribbean ride at their Disneyland parks. Captain Jack is everyone’s favourite pirate, and without him Pirates of the Caribbean wouldn’t be as great as what it is! <br>Let’s get justice for Johnny Depp! Let us see him keep his movies we all love and his place in the Disneyland attraction! </p>",Disney,Stop Disney removing Jack Sparrow!,2021-11-13,,,GB,55.3781,-3.43597,,,,,disney-stop-disney-removing-jack-sparrow,published,,,False,False,,False,,"[{'id': 476543, 'locale': 'en-GB', 'name': 'Other', 'slug': 'other-en-gb', 'photo_id': None, 'created_by_owner': True, 'created_by_staff_member': False, 'total_count': 66966}]",True,False,,2300,2300,0,3492,405,0,0,0,0,0,121,,,,,,224849143,photos/4/cp/fl/MkcpFLKRAKdEgkY-fullsize.jpg,//assets.change.org/photos/4/cp/fl/MkcpFLKRAKdEgkY-400x400-noPad.jpg?1605132342,False,400,400,//assets.change.org/photos/4/cp/fl/MkcpFLKRAKdEgkY-400x225-noPad.jpg?1605132342,False,400,225,//assets.change.org/photos/4/cp/fl/MkcpFLKRAKdEgkY-800x450-noPad.jpg?1605132342,False,800,450,//assets.change.org/photos/4/cp/fl/MkcpFLKRAKdEgkY-1600x900-noPad.jpg?1605132342,False,1600,900,photo,962285158,962285158,Lauren,Peddie,Lauren,Lauren Peddie,Peterborough,ENG,GB,,en-GB,,[],3,1653002447,1,1654019886,3,1654340646,5,1654021437,16,1655010290.148,4,1654019781.859,5,1654340703.175,10,1654659292.659,1,1653318137.159,4,1651944514.522,"[{'id': 585843, 'display_name': 'Disney', 'email': None, 'type': 'Custom', 'slug': 'disney-3', 'description': 'The Walt Disney Company is a leading diversified international family entertainment and media enterprise with five business segments: media networks, parks and resorts, studio entertainment, consumer products and interactive media.', 'publicly_visible': False, 'verified_at': None, 'summary': None, 'locale': 'en-US', 'confirmed_at': None, 'is_person': True, 'member_of': {}, 'additional_data': {'first_name': 'Disney', 'last_name': None, 'title': None, 'id': 29785}, 'has_email': False, 'photo': {'id': 11704124, 'url': 'photos/1/fc/sa/OpfCsAdtvgKjfEm-fullsize.jpg', 'sizes': {'small': {'url': '//assets.change.org/photos/1/fc/sa/OpfCsAdtvgKjfEm-48x48-noPad.jpg?1519873711', 'processing': False, 'size': {'width': 48, 'height': 48}}, 'medium': {'url': '//assets.change.org/photos/1/fc/sa/OpfCsAdtvgKjfEm-128x128-noPad.jpg?1519873711', 'processing': False, 'size': {'width': 128, 'height': 128}}, 'large': {'url': '//assets.change.org/photos/1/fc/sa/OpfCsAdtvgKjfEm-400x400-noPad.jpg?1519873711', 'processing': False, 'size': {'width': 400, 'height': 400}}, 'xlarge': {'url': '//assets.change.org/photos/1/fc/sa/OpfCsAdtvgKjfEm-800x800-noPad.jpg?1519873712', 'processing': False, 'size': {'width': 800, 'height': 800}}}}}]",False,False,False,Lauren Peddie,Disney : Stop Disney removing Jack Sparrow!,Disney : Stop Disney removing Jack Sparrow!,active,2500,224849143,photos/4/cp/fl/MkcpFLKRAKdEgkY-fullsize.jpg,//assets.change.org/photos/4/cp/fl/MkcpFLKRAKdEgkY-400x400-noPad.jpg?1605132342,False,400,400,//assets.change.org/photos/4/cp/fl/MkcpFLKRAKdEgkY-400x225-noPad.jpg?1605132342,False,400,225,//assets.change.org/photos/4/cp/fl/MkcpFLKRAKdEgkY-800x450-noPad.jpg?1605132342,False,800,450,//assets.change.org/photos/4/cp/fl/MkcpFLKRAKdEgkY-1600x900-noPad.jpg?1605132342,False,1600,900,photo,585843,Disney,,Custom,disney-3,"The Walt Disney Company is a leading diversified international family entertainment and media enterprise with five business segments: media networks, parks and resorts, studio entertainment, consumer products and interactive media.",False,,,en-US,,True,Disney,,,29785,False,11704124,photos/1/fc/sa/OpfCsAdtvgKjfEm-fullsize.jpg,//assets.change.org/photos/1/fc/sa/OpfCsAdtvgKjfEm-48x48-noPad.jpg?1519873711,False,48,48,//assets.change.org/photos/1/fc/sa/OpfCsAdtvgKjfEm-128x128-noPad.jpg?1519873711,False,128,128,//assets.change.org/photos/1/fc/sa/OpfCsAdtvgKjfEm-400x400-noPad.jpg?1519873711,False,400,400,//assets.change.org/photos/1/fc/sa/OpfCsAdtvgKjfEm-800x800-noPad.jpg?1519873712,False,800,800,92,,,,,,,,,,,,,,,,,,
809215722,"Johnny is the most caring person in the world, do not victim Shame! The truth is smacking you in the face. Johnny has helped so many children and they ADORE him. Do not try to erase him!",0,0,Event,25793976,1,comment,2020-11-13T07:30:46Z,,768503080,768503080,Danielle,Stachewicz,Danielle,Danielle Stachewicz,Rhinelander,,US,,en-US,,[],25793976,25793976,Stop Disney removing Jack Sparrow!,2020-11-11T22:05:41Z,,2020-11-11T22:06:04Z,2020-11-13T23:18:23Z,en-GB,['en'],Disney : Stop Disney removing Jack Sparrow!,"<p>Since amber heard has made her terrible claims and lies against Johnny Depp it’s been said he will lose his roles in fantastic beasts and pirates of the Caribbean. <br>It’s also now been claimed Disney will be taking away our beloved Captain Jack Sparrow from their pirates of the Caribbean ride at their Disneyland parks. Captain Jack is everyone’s favourite pirate, and without him Pirates of the Caribbean wouldn’t be as great as what it is! <br>Let’s get justice for Johnny Depp! Let us see him keep his movies we all love and his place in the Disneyland attraction! </p>",Disney,Stop Disney removing Jack Sparrow!,2021-11-13,,,GB,55.3781,-3.43597,,,,,disney-stop-disney-removing-jack-sparrow,published,,,False,False,,False,,"[{'id': 476543, 'locale': 'en-GB', 'name': 'Other', 'slug': 'other-en-gb', 'photo_id': None, 'created_by_owner': True, 'created_by_staff_member': False, 'total_count': 66966}]",True,False,,2300,2300,0,3492,405,0,0,0,0,0,121,,,,,,224849143,photos/4/cp/fl/MkcpFLKRAKdEgkY-fullsize.jpg,//assets.change.org/photos/4/cp/fl/MkcpFLKRAKdEgkY-400x400-noPad.jpg?1605132342,False,400,400,//assets.change.org/photos/4/cp/fl/MkcpFLKRAKdEgkY-400x225-noPad.jpg?1605132342,False,400,225,//assets.change.org/photos/4/cp/fl/MkcpFLKRAKdEgkY-800x450-noPad.jpg?1605132342,False,800,450,//assets.change.org/photos/4/cp/fl/MkcpFLKRAKdEgkY-1600x900-noPad.jpg?1605132342,False,1600,900,photo,962285158,962285158,Lauren,Peddie,Lauren,Lauren Peddie,Peterborough,ENG,GB,,en-GB,,[],3,1653002447,1,1654019886,3,1654340646,5,1654021437,16,1655010290.148,4,1654019781.859,5,1654340703.175,10,1654659292.659,1,1653318137.159,4,1651944514.522,"[{'id': 585843, 'display_name': 'Disney', 'email': None, 'type': 'Custom', 'slug': 'disney-3', 'description': 'The Walt Disney Company is a leading diversified international family entertainment and media enterprise with five business segments: media networks, parks and resorts, studio entertainment, consumer products and interactive media.', 'publicly_visible': False, 'verified_at': None, 'summary': None, 'locale': 'en-US', 'confirmed_at': None, 'is_person': True, 'member_of': {}, 'additional_data': {'first_name': 'Disney', 'last_name': None, 'title': None, 'id': 29785}, 'has_email': False, 'photo': {'id': 11704124, 'url': 'photos/1/fc/sa/OpfCsAdtvgKjfEm-fullsize.jpg', 'sizes': {'small': {'url': '//assets.change.org/photos/1/fc/sa/OpfCsAdtvgKjfEm-48x48-noPad.jpg?1519873711', 'processing': False, 'size': {'width': 48, 'height': 48}}, 'medium': {'url': '//assets.change.org/photos/1/fc/sa/OpfCsAdtvgKjfEm-128x128-noPad.jpg?1519873711', 'processing': False, 'size': {'width': 128, 'height': 128}}, 'large': {'url': '//assets.change.org/photos/1/fc/sa/OpfCsAdtvgKjfEm-400x400-noPad.jpg?1519873711', 'processing': False, 'size': {'width': 400, 'height': 400}}, 'xlarge': {'url': '//assets.change.org/photos/1/fc/sa/OpfCsAdtvgKjfEm-800x800-noPad.jpg?1519873712', 'processing': False, 'size': {'width': 800, 'height': 800}}}}}]",False,False,False,Lauren Peddie,Disney : Stop Disney removing Jack Sparrow!,Disney : Stop Disney removing Jack Sparrow!,active,2500,224849143,photos/4/cp/fl/MkcpFLKRAKdEgkY-fullsize.jpg,//assets.change.org/photos/4/cp/fl/MkcpFLKRAKdEgkY-400x400-noPad.jpg?1605132342,False,400,400,//assets.change.org/photos/4/cp/fl/MkcpFLKRAKdEgkY-400x225-noPad.jpg?1605132342,False,400,225,//assets.change.org/photos/4/cp/fl/MkcpFLKRAKdEgkY-800x450-noPad.jpg?1605132342,False,800,450,//assets.change.org/photos/4/cp/fl/MkcpFLKRAKdEgkY-1600x900-noPad.jpg?1605132342,False,1600,900,photo,585843,Disney,,Custom,disney-3,"The Walt Disney Company is a leading diversified international family entertainment and media enterprise with five business segments: media networks, parks and resorts, studio entertainment, consumer products and interactive media.",False,,,en-US,,True,Disney,,,29785,False,11704124,photos/1/fc/sa/OpfCsAdtvgKjfEm-fullsize.jpg,//assets.change.org/photos/1/fc/sa/OpfCsAdtvgKjfEm-48x48-noPad.jpg?1519873711,False,48,48,//assets.change.org/photos/1/fc/sa/OpfCsAdtvgKjfEm-128x128-noPad.jpg?1519873711,False,128,128,//assets.change.org/photos/1/fc/sa/OpfCsAdtvgKjfEm-400x400-noPad.jpg?1519873711,False,400,400,//assets.change.org/photos/1/fc/sa/OpfCsAdtvgKjfEm-800x800-noPad.jpg?1519873712,False,800,800,92,189663127.0,photos/3/dv/gd/GfdVGdrLxPNqYxr-fullsize.jpg,//assets.change.org/photos/3/dv/gd/GfdVGdrLxPNqYxr-48x48-noPad.jpg?1509823937,False,48.0,48.0,//assets.change.org/photos/3/dv/gd/GfdVGdrLxPNqYxr-128x128-noPad.jpg?1509823937,False,128.0,128.0,//assets.change.org/photos/3/dv/gd/GfdVGdrLxPNqYxr-400x400-noPad.jpg?1509823938,False,400.0,400.0,//assets.change.org/photos/3/dv/gd/GfdVGdrLxPNqYxr-800x800-noPad.jpg?1509823938,False,800.0,800.0
