id,comment,parent_id,children_count,commentable_type,commentable_id,likes,role,created_at,deleted_at,user.id,user.slug,user.first_name,user.last_name,user.short_display_name,user.display_name,user.city,user.state_code,user.country_code,user.website,user.locale,user.description,user.roles,commentable_entity.id,commentable_entity.document_id,commentable_entity.ask,commentable_entity.created_at,commentable_entity.deleted_at,commentable_entity.published_at,commentable_entity.last_edited_at,commentable_entity.original_locale,commentable_entity.languages,commentable_entity.title,commentable_entity.description,commentable_entity.targeting_description,commentable_entity.letter_body,commentable_entity.end_date,commentable_entity.goal,commentable_entity.relevant_location.city,commentable_entity.relevant_location.country_code,commentable_entity.relevant_location.lat,commentable_entity.relevant_location.lng,commentable_entity.relevant_location.state_code,commentable_entity.relevant_location.google_places_id,commentable_entity.relevant_location.photo_id,commentable_entity.restricted_location,commentable_entity.slug,commentable_entity.status,commentable_entity.victory_date,commentable_entity.victory_description,commentable_entity.is_verified_victory,commentable_entity.is_victory,commentable_entity.video_id,commentable_entity.is_pledge,commentable_entity.topic,commentable_entity.tags,commentable_entity.discoverable,commentable_entity.sponsored_campaign,commentable_entity.organization_free_email_optins,commentable_entity.displayed_signature_count,commentable_entity.total_signature_count,commentable_entity.weekly_signature_count,commentable_entity.total_page_views,commentable_entity.total_share_count,commentable_entity.daily_signature_count,commentable_entity.monthly_signature_count,commentable_entity.daily_signup_count,commentable_entity.weekly_signup_count,commentable_entity.monthly_signup_count,commentable_entity.total_signup_count,commentable_entity.supporter_message_count,commentable_entity.starter_vanity_url,commentable_entity.featured_title,commentable_entity.media_text,commentable_entity.media_url,commentable_entity.photo.id,commentable_entity.photo.url,commentable_entity.photo.sizes.square.url,commentable_entity.photo.sizes.square.processing,commentable_entity.photo.sizes.square.size.width,commentable_entity.photo.sizes.square.size.height,commentable_entity.photo.sizes.small.url,commentable_entity.photo.sizes.small.processing,commentable_entity.photo.sizes.small.size.width,commentable_entity.photo.sizes.small.size.height,commentable_entity.photo.sizes.medium.url,commentable_entity.photo.sizes.medium.processing,commentable_entity.photo.sizes.medium.size.width,commentable_entity.photo.sizes.medium.size.height,commentable_entity.photo.sizes.large.url,commentable_entity.photo.sizes.large.processing,commentable_entity.photo.sizes.large.size.width,commentable_entity.photo.sizes.large.size.height,commentable_entity.photo.type,commentable_entity.activity.recruit.twitter.count,commentable_entity.activity.recruit.twitter.last_updated,commentable_entity.activity.share.copylink.count,commentable_entity.activity.share.copylink.last_updated,commentable_entity.activity.share.sms.count,commentable_entity.activity.share.sms.last_updated,commentable_entity.user.id,commentable_entity.user.slug,commentable_entity.user.first_name,commentable_entity.user.last_name,commentable_entity.user.short_display_name,commentable_entity.user.display_name,commentable_entity.user.city,commentable_entity.user.state_code,commentable_entity.user.country_code,commentable_entity.user.website,commentable_entity.user.locale,commentable_entity.user.description,commentable_entity.user.photo.id,commentable_entity.user.photo.url,commentable_entity.user.photo.sizes.small.url,commentable_entity.user.photo.sizes.small.processing,commentable_entity.user.photo.sizes.small.size.width,commentable_entity.user.photo.sizes.small.size.height,commentable_entity.user.photo.sizes.medium.url,commentable_entity.user.photo.sizes.medium.processing,commentable_entity.user.photo.sizes.medium.size.width,commentable_entity.user.photo.sizes.medium.size.height,commentable_entity.user.photo.sizes.large.url,commentable_entity.user.photo.sizes.large.processing,commentable_entity.user.photo.sizes.large.size.width,commentable_entity.user.photo.sizes.large.size.height,commentable_entity.user.photo.sizes.xlarge.url,commentable_entity.user.photo.sizes.xlarge.processing,commentable_entity.user.photo.sizes.xlarge.size.width,commentable_entity.user.photo.sizes.xlarge.size.height,commentable_entity.user.roles,commentable_entity.targets,commentable_entity.hide_comments,commentable_entity.hide_dm_action_panel,commentable_entity.enable_human_verification,commentable_entity.creator_name,commentable_entity.creator_photo.id,commentable_entity.creator_photo.url,commentable_entity.creator_photo.sizes.small.url,commentable_entity.creator_photo.sizes.small.processing,commentable_entity.creator_photo.sizes.small.size.width,commentable_entity.creator_photo.sizes.small.size.height,commentable_entity.creator_photo.sizes.medium.url,commentable_entity.creator_photo.sizes.medium.processing,commentable_entity.creator_photo.sizes.medium.size.width,commentable_entity.creator_photo.sizes.medium.size.height,commentable_entity.creator_photo.sizes.large.url,commentable_entity.creator_photo.sizes.large.processing,commentable_entity.creator_photo.sizes.large.size.width,commentable_entity.creator_photo.sizes.large.size.height,commentable_entity.creator_photo.sizes.xlarge.url,commentable_entity.creator_photo.sizes.xlarge.processing,commentable_entity.creator_photo.sizes.xlarge.size.width,commentable_entity.creator_photo.sizes.xlarge.size.height,commentable_entity.display_title,commentable_entity.petition_title,commentable_entity.petition_status,commentable_entity.calculated_goal,commentable_entity.media.id,commentable_entity.media.url,commentable_entity.media.sizes.square.url,commentable_entity.media.sizes.square.processing,commentable_entity.media.sizes.square.size.width,commentable_entity.media.sizes.square.size.height,commentable_entity.media.sizes.small.url,commentable_entity.media.sizes.small.processing,commentable_entity.media.sizes.small.size.width,commentable_entity.media.sizes.small.size.height,commentable_entity.media.sizes.medium.url,commentable_entity.media.sizes.medium.processing,commentable_entity.media.sizes.medium.size.width,commentable_entity.media.sizes.medium.size.height,commentable_entity.media.sizes.large.url,commentable_entity.media.sizes.large.processing,commentable_entity.media.sizes.large.size.width,commentable_entity.media.sizes.large.size.height,commentable_entity.media.type,commentable_entity.primary_target.id,commentable_entity.primary_target.display_name,commentable_entity.primary_target.email,commentable_entity.primary_target.type,commentable_entity.primary_target.slug,commentable_entity.primary_target.description,commentable_entity.primary_target.photo_id,commentable_entity.primary_target.publicly_visible,commentable_entity.primary_target.verified_at,commentable_entity.primary_target.summary,commentable_entity.primary_target.locale,commentable_entity.primary_target.confirmed_at,commentable_entity.primary_target.is_person,commentable_entity.primary_target.additional_data.first_name,commentable_entity.primary_target.additional_data.last_name,commentable_entity.primary_target.additional_data.title,commentable_entity.primary_target.additional_data.id,commentable_entity.primary_target.has_email,commentable_entity.progress,user.photo.id,user.photo.url,user.photo.sizes.small.url,user.photo.sizes.small.processing,user.photo.sizes.small.size.width,user.photo.sizes.small.size.height,user.photo.sizes.medium.url,user.photo.sizes.medium.processing,user.photo.sizes.medium.size.width,user.photo.sizes.medium.size.height,user.photo.sizes.large.url,user.photo.sizes.large.processing,user.photo.sizes.large.size.width,user.photo.sizes.large.size.height,user.photo.sizes.xlarge.url,user.photo.sizes.xlarge.processing,user.photo.sizes.xlarge.size.width,user.photo.sizes.xlarge.size.height
833256562,Cancel Amber Turd!,0,0,Event,14094292,0,comment,2022-05-28T22:09:32Z,,1267341765,1267341765,Kera,Lanisky,Kera,Kera Lanisky,London,OH,US,,en-US,,[],14094292,14094292,To remove an unsuitable proven abuser from being an Advocate for domestic violence,2018-12-26T10:25:17Z,,2018-12-26T10:39:35Z,,en-GB,['en'],ACLU: To remove an unsuitable proven abuser from being an Advocate for domestic violence,"<p>Many people men n women suffer at the hands of an abusive spouse. It takes years for them to open n speak n to reach out n get help. Mainly due to mental, physical, emotional n sexual abuse that makes that person left feeling void, humiliated, no self worth, hollow, have a need to protect their abuser through fear of negative retaliation n much more.Having a known abuser such as Amber Heard as an advocate for sufferers and survivors of DV , is not only making a mockery of a subject that is so severe but runs the risk of of having sufferers not trusting an organization in which they should feel they would be able to come forward n trust. Having this person as an advocate could run the risk n damage of sufferers coming foward n that would be a tragedy in itself.</p>",ACLU,To remove an unsuitable proven abuser from being an Advocate for domestic violence,2019-12-27,,,GB,55.3781,-3.43597,,,,,aclu-to-remove-an-unsuitable-proven-abuser-from-being-an-advocate-for-domestic-violence,published,,,False,False,,False,,[],True,False,,489,489,0,1276,215,0,0,0,0,0,45,,,,,,221531924,photos/6/fh/su/DXFhsufkyMCcdxh-fullsize.jpg,//assets.change.org/photos/6/fh/su/DXFhsufkyMCcdxh-400x400-noPad.jpg?1545952177,False,400,400,//assets.change.org/photos/6/fh/su/DXFhsufkyMCcdxh-400x225-noPad.jpg?1545952176,False,400,225,//assets.change.org/photos/6/fh/su/DXFhsufkyMCcdxh-800x450-noPad.jpg?1545952177,False,800,450,//assets.change.org/photos/6/fh/su/DXFhsufkyMCcdxh-1600x900-noPad.jpg?1545952177,False,1600,900,photo,1,1621134803,2,1653775779.115,1,1653343875.612,811097416,811097416,Nikki-jane,Clark,Nikki-jane,Nikki-jane Clark,Rochester,,GB,,en-GB,,221527748,photos/6/xx/du/PVxXDuPAlyZElOq-fullsize.jpg,//assets.change.org/photos/6/xx/du/PVxXDuPAlyZElOq-48x48-noPad.jpg?1545819986,False,48,48,//assets.change.org/photos/6/xx/du/PVxXDuPAlyZElOq-128x128-noPad.jpg?1545819985,False,128,128,//assets.change.org/photos/6/xx/du/PVxXDuPAlyZElOq-400x400-noPad.jpg?1545819985,False,400,400,//assets.change.org/photos/6/xx/du/PVxXDuPAlyZElOq-800x800-noPad.jpg?1545819986,False,800,800,[],"[{'id': 46756, 'display_name': 'ACLU', 'email': None, 'type': 'Custom', 'slug': 'aclu', 'description': None, 'photo_id': None, 'publicly_visible': False, 'verified_at': None, 'summary': None, 'locale': 'en-US', 'confirmed_at': None, 'is_person': True, 'member_of': {}, 'additional_data': {'first_name': 'ACLU', 'last_name': None, 'title': None, 'id': 55116}, 'has_email': False}]",False,False,False,Nikki-jane Clark,221527748,photos/6/xx/du/PVxXDuPAlyZElOq-fullsize.jpg,//assets.change.org/photos/6/xx/du/PVxXDuPAlyZElOq-48x48-noPad.jpg?1545819986,False,48,48,//assets.change.org/photos/6/xx/du/PVxXDuPAlyZElOq-128x128-noPad.jpg?1545819985,False,128,128,//assets.change.org/photos/6/xx/du/PVxXDuPAlyZElOq-400x400-noPad.jpg?1545819985,False,400,400,//assets.change.org/photos/6/xx/du/PVxXDuPAlyZElOq-800x800-noPad.jpg?1545819986,False,800,800,ACLU: To remove an unsuitable proven abuser from being an Advocate for domestic violence,ACLU: To remove an unsuitable proven abuser from being an Advocate for domestic violence,active,500,221531924,photos/6/fh/su/DXFhsufkyMCcdxh-fullsize.jpg,//assets.change.org/photos/6/fh/su/DXFhsufkyMCcdxh-400x400-noPad.jpg?1545952177,False,400,400,//assets.change.org/photos/6/fh/su/DXFhsufkyMCcdxh-400x225-noPad.jpg?1545952176,False,400,225,//assets.change.org/photos/6/fh/su/DXFhsufkyMCcdxh-800x450-noPad.jpg?1545952177,False,800,450,//assets.change.org/photos/6/fh/su/DXFhsufkyMCcdxh-1600x900-noPad.jpg?1545952177,False,1600,900,photo,46756,ACLU,,Custom,aclu,,,False,,,en-US,,True,ACLU,,,55116,False,97.8,,,,,,,,,,,,,,,,,,
833160888,Amber Heard is a self-admitted abuser.,0,0,Event,14094292,0,comment,2022-05-24T20:22:44Z,,1266964115,1266964115,Emma,Miller-Toddlin,Emma,Emma Miller-Toddlin,Houston,TX,US,,en-US,,[],14094292,14094292,To remove an unsuitable proven abuser from being an Advocate for domestic violence,2018-12-26T10:25:17Z,,2018-12-26T10:39:35Z,,en-GB,['en'],ACLU: To remove an unsuitable proven abuser from being an Advocate for domestic violence,"<p>Many people men n women suffer at the hands of an abusive spouse. It takes years for them to open n speak n to reach out n get help. Mainly due to mental, physical, emotional n sexual abuse that makes that person left feeling void, humiliated, no self worth, hollow, have a need to protect their abuser through fear of negative retaliation n much more.Having a known abuser such as Amber Heard as an advocate for sufferers and survivors of DV , is not only making a mockery of a subject that is so severe but runs the risk of of having sufferers not trusting an organization in which they should feel they would be able to come forward n trust. Having this person as an advocate could run the risk n damage of sufferers coming foward n that would be a tragedy in itself.</p>",ACLU,To remove an unsuitable proven abuser from being an Advocate for domestic violence,2019-12-27,,,GB,55.3781,-3.43597,,,,,aclu-to-remove-an-unsuitable-proven-abuser-from-being-an-advocate-for-domestic-violence,published,,,False,False,,False,,[],True,False,,489,489,0,1276,215,0,0,0,0,0,45,,,,,,221531924,photos/6/fh/su/DXFhsufkyMCcdxh-fullsize.jpg,//assets.change.org/photos/6/fh/su/DXFhsufkyMCcdxh-400x400-noPad.jpg?1545952177,False,400,400,//assets.change.org/photos/6/fh/su/DXFhsufkyMCcdxh-400x225-noPad.jpg?1545952176,False,400,225,//assets.change.org/photos/6/fh/su/DXFhsufkyMCcdxh-800x450-noPad.jpg?1545952177,False,800,450,//assets.change.org/photos/6/fh/su/DXFhsufkyMCcdxh-1600x900-noPad.jpg?1545952177,False,1600,900,photo,1,1621134803,2,1653775779.115,1,1653343875.612,811097416,811097416,Nikki-jane,Clark,Nikki-jane,Nikki-jane Clark,Rochester,,GB,,en-GB,,221527748,photos/6/xx/du/PVxXDuPAlyZElOq-fullsize.jpg,//assets.change.org/photos/6/xx/du/PVxXDuPAlyZElOq-48x48-noPad.jpg?1545819986,False,48,48,//assets.change.org/photos/6/xx/du/PVxXDuPAlyZElOq-128x128-noPad.jpg?1545819985,False,128,128,//assets.change.org/photos/6/xx/du/PVxXDuPAlyZElOq-400x400-noPad.jpg?1545819985,False,400,400,//assets.change.org/photos/6/xx/du/PVxXDuPAlyZElOq-800x800-noPad.jpg?1545819986,False,800,800,[],"[{'id': 46756, 'display_name': 'ACLU', 'email': None, 'type': 'Custom', 'slug': 'aclu', 'description': None, 'photo_id': None, 'publicly_visible': False, 'verified_at': None, 'summary': None, 'locale': 'en-US', 'confirmed_at': None, 'is_person': True, 'member_of': {}, 'additional_data': {'first_name': 'ACLU', 'last_name': None, 'title': None, 'id': 55116}, 'has_email': False}]",False,False,False,Nikki-jane Clark,221527748,photos/6/xx/du/PVxXDuPAlyZElOq-fullsize.jpg,//assets.change.org/photos/6/xx/du/PVxXDuPAlyZElOq-48x48-noPad.jpg?1545819986,False,48,48,//assets.change.org/photos/6/xx/du/PVxXDuPAlyZElOq-128x128-noPad.jpg?1545819985,False,128,128,//assets.change.org/photos/6/xx/du/PVxXDuPAlyZElOq-400x400-noPad.jpg?1545819985,False,400,400,//assets.change.org/photos/6/xx/du/PVxXDuPAlyZElOq-800x800-noPad.jpg?1545819986,False,800,800,ACLU: To remove an unsuitable proven abuser from being an Advocate for domestic violence,ACLU: To remove an unsuitable proven abuser from being an Advocate for domestic violence,active,500,221531924,photos/6/fh/su/DXFhsufkyMCcdxh-fullsize.jpg,//assets.change.org/photos/6/fh/su/DXFhsufkyMCcdxh-400x400-noPad.jpg?1545952177,False,400,400,//assets.change.org/photos/6/fh/su/DXFhsufkyMCcdxh-400x225-noPad.jpg?1545952176,False,400,225,//assets.change.org/photos/6/fh/su/DXFhsufkyMCcdxh-800x450-noPad.jpg?1545952177,False,800,450,//assets.change.org/photos/6/fh/su/DXFhsufkyMCcdxh-1600x900-noPad.jpg?1545952177,False,1600,900,photo,46756,ACLU,,Custom,aclu,,,False,,,en-US,,True,ACLU,,,55116,False,97.8,,,,,,,,,,,,,,,,,,
832381268,Amber Heard should not be a representative for victims of abuse given her own violent behavior.,0,0,Event,14094292,0,comment,2022-04-29T05:23:57Z,,6021991,6021991,Georgia,Ota,Georgia,Georgia Ota,Wheat Ridge,CO,US,,en-US,,[],14094292,14094292,To remove an unsuitable proven abuser from being an Advocate for domestic violence,2018-12-26T10:25:17Z,,2018-12-26T10:39:35Z,,en-GB,['en'],ACLU: To remove an unsuitable proven abuser from being an Advocate for domestic violence,"<p>Many people men n women suffer at the hands of an abusive spouse. It takes years for them to open n speak n to reach out n get help. Mainly due to mental, physical, emotional n sexual abuse that makes that person left feeling void, humiliated, no self worth, hollow, have a need to protect their abuser through fear of negative retaliation n much more.Having a known abuser such as Amber Heard as an advocate for sufferers and survivors of DV , is not only making a mockery of a subject that is so severe but runs the risk of of having sufferers not trusting an organization in which they should feel they would be able to come forward n trust. Having this person as an advocate could run the risk n damage of sufferers coming foward n that would be a tragedy in itself.</p>",ACLU,To remove an unsuitable proven abuser from being an Advocate for domestic violence,2019-12-27,,,GB,55.3781,-3.43597,,,,,aclu-to-remove-an-unsuitable-proven-abuser-from-being-an-advocate-for-domestic-violence,published,,,False,False,,False,,[],True,False,,489,489,0,1276,215,0,0,0,0,0,45,,,,,,221531924,photos/6/fh/su/DXFhsufkyMCcdxh-fullsize.jpg,//assets.change.org/photos/6/fh/su/DXFhsufkyMCcdxh-400x400-noPad.jpg?1545952177,False,400,400,//assets.change.org/photos/6/fh/su/DXFhsufkyMCcdxh-400x225-noPad.jpg?1545952176,False,400,225,//assets.change.org/photos/6/fh/su/DXFhsufkyMCcdxh-800x450-noPad.jpg?1545952177,False,800,450,//assets.change.org/photos/6/fh/su/DXFhsufkyMCcdxh-1600x900-noPad.jpg?1545952177,False,1600,900,photo,1,1621134803,2,1653775779.115,1,1653343875.612,811097416,811097416,Nikki-jane,Clark,Nikki-jane,Nikki-jane Clark,Rochester,,GB,,en-GB,,221527748,photos/6/xx/du/PVxXDuPAlyZElOq-fullsize.jpg,//assets.change.org/photos/6/xx/du/PVxXDuPAlyZElOq-48x48-noPad.jpg?1545819986,False,48,48,//assets.change.org/photos/6/xx/du/PVxXDuPAlyZElOq-128x128-noPad.jpg?1545819985,False,128,128,//assets.change.org/photos/6/xx/du/PVxXDuPAlyZElOq-400x400-noPad.jpg?1545819985,False,400,400,//assets.change.org/photos/6/xx/du/PVxXDuPAlyZElOq-800x800-noPad.jpg?1545819986,False,800,800,[],"[{'id': 46756, 'display_name': 'ACLU', 'email': None, 'type': 'Custom', 'slug': 'aclu', 'description': None, 'photo_id': None, 'publicly_visible': False, 'verified_at': None, 'summary': None, 'locale': 'en-US', 'confirmed_at': None, 'is_person': True, 'member_of': {}, 'additional_data': {'first_name': 'ACLU', 'last_name': None, 'title': None, 'id': 55116}, 'has_email': False}]",False,False,False,Nikki-jane Clark,221527748,photos/6/xx/du/PVxXDuPAlyZElOq-fullsize.jpg,//assets.change.org/photos/6/xx/du/PVxXDuPAlyZElOq-48x48-noPad.jpg?1545819986,False,48,48,//assets.change.org/photos/6/xx/du/PVxXDuPAlyZElOq-128x128-noPad.jpg?1545819985,False,128,128,//assets.change.org/photos/6/xx/du/PVxXDuPAlyZElOq-400x400-noPad.jpg?1545819985,False,400,400,//assets.change.org/photos/6/xx/du/PVxXDuPAlyZElOq-800x800-noPad.jpg?1545819986,False,800,800,ACLU: To remove an unsuitable proven abuser from being an Advocate for domestic violence,ACLU: To remove an unsuitable proven abuser from being an Advocate for domestic violence,active,500,221531924,photos/6/fh/su/DXFhsufkyMCcdxh-fullsize.jpg,//assets.change.org/photos/6/fh/su/DXFhsufkyMCcdxh-400x400-noPad.jpg?1545952177,False,400,400,//assets.change.org/photos/6/fh/su/DXFhsufkyMCcdxh-400x225-noPad.jpg?1545952176,False,400,225,//assets.change.org/photos/6/fh/su/DXFhsufkyMCcdxh-800x450-noPad.jpg?1545952177,False,800,450,//assets.change.org/photos/6/fh/su/DXFhsufkyMCcdxh-1600x900-noPad.jpg?1545952177,False,1600,900,photo,46756,ACLU,,Custom,aclu,,,False,,,en-US,,True,ACLU,,,55116,False,97.8,215978692.0,photos/4/rn/dh/MMRnDHHbRdZoCWu-fullsize.jpg,//assets.change.org/photos/4/rn/dh/MMRnDHHbRdZoCWu-48x48-noPad.jpg?1516582206,False,48.0,48.0,//assets.change.org/photos/4/rn/dh/MMRnDHHbRdZoCWu-128x128-noPad.jpg?1516582244,False,128.0,128.0,//assets.change.org/photos/4/rn/dh/MMRnDHHbRdZoCWu-400x400-noPad.jpg?1516582245,False,400.0,400.0,//assets.change.org/photos/4/rn/dh/MMRnDHHbRdZoCWu-800x800-noPad.jpg?1516582245,False,800.0,800.0
832227670,Amber Heard is abusive.,0,0,Event,14094292,0,comment,2022-04-23T01:03:08Z,,1070943515,1070943515,Vicki,SARAH,Vicki,Vicki SARAH,Virginia Beach,VA,US,,en-US,,[],14094292,14094292,To remove an unsuitable proven abuser from being an Advocate for domestic violence,2018-12-26T10:25:17Z,,2018-12-26T10:39:35Z,,en-GB,['en'],ACLU: To remove an unsuitable proven abuser from being an Advocate for domestic violence,"<p>Many people men n women suffer at the hands of an abusive spouse. It takes years for them to open n speak n to reach out n get help. Mainly due to mental, physical, emotional n sexual abuse that makes that person left feeling void, humiliated, no self worth, hollow, have a need to protect their abuser through fear of negative retaliation n much more.Having a known abuser such as Amber Heard as an advocate for sufferers and survivors of DV , is not only making a mockery of a subject that is so severe but runs the risk of of having sufferers not trusting an organization in which they should feel they would be able to come forward n trust. Having this person as an advocate could run the risk n damage of sufferers coming foward n that would be a tragedy in itself.</p>",ACLU,To remove an unsuitable proven abuser from being an Advocate for domestic violence,2019-12-27,,,GB,55.3781,-3.43597,,,,,aclu-to-remove-an-unsuitable-proven-abuser-from-being-an-advocate-for-domestic-violence,published,,,False,False,,False,,[],True,False,,489,489,0,1276,215,0,0,0,0,0,45,,,,,,221531924,photos/6/fh/su/DXFhsufkyMCcdxh-fullsize.jpg,//assets.change.org/photos/6/fh/su/DXFhsufkyMCcdxh-400x400-noPad.jpg?1545952177,False,400,400,//assets.change.org/photos/6/fh/su/DXFhsufkyMCcdxh-400x225-noPad.jpg?1545952176,False,400,225,//assets.change.org/photos/6/fh/su/DXFhsufkyMCcdxh-800x450-noPad.jpg?1545952177,False,800,450,//assets.change.org/photos/6/fh/su/DXFhsufkyMCcdxh-1600x900-noPad.jpg?1545952177,False,1600,900,photo,1,1621134803,2,1653775779.115,1,1653343875.612,811097416,811097416,Nikki-jane,Clark,Nikki-jane,Nikki-jane Clark,Rochester,,GB,,en-GB,,221527748,photos/6/xx/du/PVxXDuPAlyZElOq-fullsize.jpg,//assets.change.org/photos/6/xx/du/PVxXDuPAlyZElOq-48x48-noPad.jpg?1545819986,False,48,48,//assets.change.org/photos/6/xx/du/PVxXDuPAlyZElOq-128x128-noPad.jpg?1545819985,False,128,128,//assets.change.org/photos/6/xx/du/PVxXDuPAlyZElOq-400x400-noPad.jpg?1545819985,False,400,400,//assets.change.org/photos/6/xx/du/PVxXDuPAlyZElOq-800x800-noPad.jpg?1545819986,False,800,800,[],"[{'id': 46756, 'display_name': 'ACLU', 'email': None, 'type': 'Custom', 'slug': 'aclu', 'description': None, 'photo_id': None, 'publicly_visible': False, 'verified_at': None, 'summary': None, 'locale': 'en-US', 'confirmed_at': None, 'is_person': True, 'member_of': {}, 'additional_data': {'first_name': 'ACLU', 'last_name': None, 'title': None, 'id': 55116}, 'has_email': False}]",False,False,False,Nikki-jane Clark,221527748,photos/6/xx/du/PVxXDuPAlyZElOq-fullsize.jpg,//assets.change.org/photos/6/xx/du/PVxXDuPAlyZElOq-48x48-noPad.jpg?1545819986,False,48,48,//assets.change.org/photos/6/xx/du/PVxXDuPAlyZElOq-128x128-noPad.jpg?1545819985,False,128,128,//assets.change.org/photos/6/xx/du/PVxXDuPAlyZElOq-400x400-noPad.jpg?1545819985,False,400,400,//assets.change.org/photos/6/xx/du/PVxXDuPAlyZElOq-800x800-noPad.jpg?1545819986,False,800,800,ACLU: To remove an unsuitable proven abuser from being an Advocate for domestic violence,ACLU: To remove an unsuitable proven abuser from being an Advocate for domestic violence,active,500,221531924,photos/6/fh/su/DXFhsufkyMCcdxh-fullsize.jpg,//assets.change.org/photos/6/fh/su/DXFhsufkyMCcdxh-400x400-noPad.jpg?1545952177,False,400,400,//assets.change.org/photos/6/fh/su/DXFhsufkyMCcdxh-400x225-noPad.jpg?1545952176,False,400,225,//assets.change.org/photos/6/fh/su/DXFhsufkyMCcdxh-800x450-noPad.jpg?1545952177,False,800,450,//assets.change.org/photos/6/fh/su/DXFhsufkyMCcdxh-1600x900-noPad.jpg?1545952177,False,1600,900,photo,46756,ACLU,,Custom,aclu,,,False,,,en-US,,True,ACLU,,,55116,False,97.8,,,,,,,,,,,,,,,,,,
