747742396,Because she’s a demon and can suck my arse,0,0,Event,14094292,1,comment,2018-12-28T11:17:34Z,,458941342,458941342,Alex,Graham,Alex,Alex Graham,Derby,,GB,,en-GB,,[],14094292,14094292,To remove an unsuitable proven abuser from being an Advocate for domestic violence,2018-12-26T10:25:17Z,,2018-12-26T10:39:35Z,,en-GB,['en'],ACLU: To remove an unsuitable proven abuser from being an Advocate for domestic violence,"<p>Many people men n women suffer at the hands of an abusive spouse. It takes years for them to open n speak n to reach out n get help. Mainly due to mental, physical, emotional n sexual abuse that makes that person left feeling void, humiliated, no self worth, hollow, have a need to protect their abuser through fear of negative retaliation n much more.Having a known abuser such as Amber Heard as an advocate for sufferers and survivors of DV , is not only making a mockery of a subject that is so severe but runs the risk of of having sufferers not trusting an organization in which they should feel they would be able to come forward n trust. Having this person as an advocate could run the risk n damage of sufferers coming foward n that would be a tragedy in itself.</p>",ACLU,To remove an unsuitable proven abuser from being an Advocate for domestic violence,2019-12-27,,,GB,55.3781,-3.43597,,,,,aclu-to-remove-an-unsuitable-proven-abuser-from-being-an-advocate-for-domestic-violence,published,,,False,False,,False,,[],True,False,,489,489,0,1276,215,0,0,0,0,0,45,,,,,,221531924,photos/6/fh/su/DXFhsufkyMCcdxh-fullsize.jpg,//assets.change.org/photos/6/fh/su/DXFhsufkyMCcdxh-400x400-noPad.jpg?1545952177,False,400,400,//assets.change.org/photos/6/fh/su/DXFhsufkyMCcdxh-400x225-noPad.jpg?1545952176,False,400,225,//assets.change.org/photos/6/fh/su/DXFhsufkyMCcdxh-800x450-noPad.jpg?1545952177,False,800,450,//assets.change.org/photos/6/fh/su/DXFhsufkyMCcdxh-1600x900-noPad.jpg?1545952177,False,1600,900,photo,1,1621134803,2,1653775779.115,1,1653343875.612,811097416,811097416,Nikki-jane,Clark,Nikki-jane,Nikki-jane Clark,Rochester,,GB,,en-GB,,221527748,photos/6/xx/du/PVxXDuPAlyZElOq-fullsize.jpg,//assets.change.org/photos/6/xx/du/PVxXDuPAlyZElOq-48x48-noPad.jpg?1545819986,False,48,48,//assets.change.org/photos/6/xx/du/PVxXDuPAlyZElOq-128x128-noPad.jpg?1545819985,False,128,128,//assets.change.org/photos/6/xx/du/PVxXDuPAlyZElOq-400x400-noPad.jpg?1545819985,False,400,400,//assets.change.org/photos/6/xx/du/PVxXDuPAlyZElOq-800x800-noPad.jpg?1545819986,False,800,800,[],"[{'id': 46756, 'display_name': 'ACLU', 'email': None, 'type': 'Custom', 'slug': 'aclu', 'description': None, 'photo_id': None, 'publicly_visible': False, 'verified_at': None, 'summary': None, 'locale': 'en-US', 'confirmed_at': None, 'is_person': True, 'member_of': {}, 'additional_data': {'first_name': 'ACLU', 'last_name': None, 'title': None, 'id': 55116}, 'has_email': False}]",False,False,False,Nikki-jane Clark,221527748,photos/6/xx/du/PVxXDuPAlyZElOq-fullsize.jpg,//assets.change.org/photos/6/xx/du/PVxXDuPAlyZElOq-48x48-noPad.jpg?1545819986,False,48,48,//assets.change.org/photos/6/xx/du/PVxXDuPAlyZElOq-128x128-noPad.jpg?1545819985,False,128,128,//assets.change.org/photos/6/xx/du/PVxXDuPAlyZElOq-400x400-noPad.jpg?1545819985,False,400,400,//assets.change.org/photos/6/xx/du/PVxXDuPAlyZElOq-800x800-noPad.jpg?1545819986,False,800,800,ACLU: To remove an unsuitable proven abuser from being an Advocate for domestic violence,ACLU: To remove an unsuitable proven abuser from being an Advocate for domestic violence,active,500,221531924,photos/6/fh/su/DXFhsufkyMCcdxh-fullsize.jpg,//assets.change.org/photos/6/fh/su/DXFhsufkyMCcdxh-400x400-noPad.jpg?1545952177,False,400,400,//assets.change.org/photos/6/fh/su/DXFhsufkyMCcdxh-400x225-noPad.jpg?1545952176,False,400,225,//assets.change.org/photos/6/fh/su/DXFhsufkyMCcdxh-800x450-noPad.jpg?1545952177,False,800,450,//assets.change.org/photos/6/fh/su/DXFhsufkyMCcdxh-1600x900-noPad.jpg?1545952177,False,1600,900,photo,46756,ACLU,,Custom,aclu,,,False,,,en-US,,True,ACLU,,,55116,False,97.8,221533364.0,photos/2/gp/ua/ZfGPuaENIEcZgmv-fullsize.jpg,//assets.change.org/photos/2/gp/ua/ZfGPuaENIEcZgmv-48x48-noPad.jpg?1545995789,False,48.0,48.0,//assets.change.org/photos/2/gp/ua/ZfGPuaENIEcZgmv-128x128-noPad.jpg?1545995789,False,128.0,128.0,//assets.change.org/photos/2/gp/ua/ZfGPuaENIEcZgmv-400x400-noPad.jpg?1545995790,False,400.0,400.0,//assets.change.org/photos/2/gp/ua/ZfGPuaENIEcZgmv-800x800-noPad.jpg?1545995791,False,800.0,800.0
747722226,"No one who has been arrested and held in a jail cell and found guilty of a spouse should be allowed to be an advocate for DV. It is making a mockery of a truely serious n sensitive subject. More harm could b done than good sufferers need honest, soul bearing people as advocates not proven abusers that r being overlooked because of allegations made regarding a high status man which will bring notoriety to the group itself instead of the trust sufferers need",0,0,Event,14094292,0,comment,2018-12-27T22:06:50Z,,811097416,811097416,Nikki-jane,Clark,Nikki-jane,Nikki-jane Clark,Rochester,,GB,,en-GB,,[],14094292,14094292,To remove an unsuitable proven abuser from being an Advocate for domestic violence,2018-12-26T10:25:17Z,,2018-12-26T10:39:35Z,,en-GB,['en'],ACLU: To remove an unsuitable proven abuser from being an Advocate for domestic violence,"<p>Many people men n women suffer at the hands of an abusive spouse. It takes years for them to open n speak n to reach out n get help. Mainly due to mental, physical, emotional n sexual abuse that makes that person left feeling void, humiliated, no self worth, hollow, have a need to protect their abuser through fear of negative retaliation n much more.Having a known abuser such as Amber Heard as an advocate for sufferers and survivors of DV , is not only making a mockery of a subject that is so severe but runs the risk of of having sufferers not trusting an organization in which they should feel they would be able to come forward n trust. Having this person as an advocate could run the risk n damage of sufferers coming foward n that would be a tragedy in itself.</p>",ACLU,To remove an unsuitable proven abuser from being an Advocate for domestic violence,2019-12-27,,,GB,55.3781,-3.43597,,,,,aclu-to-remove-an-unsuitable-proven-abuser-from-being-an-advocate-for-domestic-violence,published,,,False,False,,False,,[],True,False,,489,489,0,1276,215,0,0,0,0,0,45,,,,,,221531924,photos/6/fh/su/DXFhsufkyMCcdxh-fullsize.jpg,//assets.change.org/photos/6/fh/su/DXFhsufkyMCcdxh-400x400-noPad.jpg?1545952177,False,400,400,//assets.change.org/photos/6/fh/su/DXFhsufkyMCcdxh-400x225-noPad.jpg?1545952176,False,400,225,//assets.change.org/photos/6/fh/su/DXFhsufkyMCcdxh-800x450-noPad.jpg?1545952177,False,800,450,//assets.change.org/photos/6/fh/su/DXFhsufkyMCcdxh-1600x900-noPad.jpg?1545952177,False,1600,900,photo,1,1621134803,2,1653775779.115,1,1653343875.612,811097416,811097416,Nikki-jane,Clark,Nikki-jane,Nikki-jane Clark,Rochester,,GB,,en-GB,,221527748,photos/6/xx/du/PVxXDuPAlyZElOq-fullsize.jpg,//assets.change.org/photos/6/xx/du/PVxXDuPAlyZElOq-48x48-noPad.jpg?1545819986,False,48,48,//assets.change.org/photos/6/xx/du/PVxXDuPAlyZElOq-128x128-noPad.jpg?1545819985,False,128,128,//assets.change.org/photos/6/xx/du/PVxXDuPAlyZElOq-400x400-noPad.jpg?1545819985,False,400,400,//assets.change.org/photos/6/xx/du/PVxXDuPAlyZElOq-800x800-noPad.jpg?1545819986,False,800,800,[],"[{'id': 46756, 'display_name': 'ACLU', 'email': None, 'type': 'Custom', 'slug': 'aclu', 'description': None, 'photo_id': None, 'publicly_visible': False, 'verified_at': None, 'summary': None, 'locale': 'en-US', 'confirmed_at': None, 'is_person': True, 'member_of': {}, 'additional_data': {'first_name': 'ACLU', 'last_name': None, 'title': None, 'id': 55116}, 'has_email': False}]",False,False,False,Nikki-jane Clark,221527748,photos/6/xx/du/PVxXDuPAlyZElOq-fullsize.jpg,//assets.change.org/photos/6/xx/du/PVxXDuPAlyZElOq-48x48-noPad.jpg?1545819986,False,48,48,//assets.change.org/photos/6/xx/du/PVxXDuPAlyZElOq-128x128-noPad.jpg?1545819985,False,128,128,//assets.change.org/photos/6/xx/du/PVxXDuPAlyZElOq-400x400-noPad.jpg?1545819985,False,400,400,//assets.change.org/photos/6/xx/du/PVxXDuPAlyZElOq-800x800-noPad.jpg?1545819986,False,800,800,ACLU: To remove an unsuitable proven abuser from being an Advocate for domestic violence,ACLU: To remove an unsuitable proven abuser from being an Advocate for domestic violence,active,500,221531924,photos/6/fh/su/DXFhsufkyMCcdxh-fullsize.jpg,//assets.change.org/photos/6/fh/su/DXFhsufkyMCcdxh-400x400-noPad.jpg?1545952177,False,400,400,//assets.change.org/photos/6/fh/su/DXFhsufkyMCcdxh-400x225-noPad.jpg?1545952176,False,400,225,//assets.change.org/photos/6/fh/su/DXFhsufkyMCcdxh-800x450-noPad.jpg?1545952177,False,800,450,//assets.change.org/photos/6/fh/su/DXFhsufkyMCcdxh-1600x900-noPad.jpg?1545952177,False,1600,900,photo,46756,ACLU,,Custom,aclu,,,False,,,en-US,,True,ACLU,,,55116,False,97.8,221527748.0,photos/6/xx/du/PVxXDuPAlyZElOq-fullsize.jpg,//assets.change.org/photos/6/xx/du/PVxXDuPAlyZElOq-48x48-noPad.jpg?1545819986,False,48.0,48.0,//assets.change.org/photos/6/xx/du/PVxXDuPAlyZElOq-128x128-noPad.jpg?1545819985,False,128.0,128.0,//assets.change.org/photos/6/xx/du/PVxXDuPAlyZElOq-400x400-noPad.jpg?1545819985,False,400.0,400.0,//assets.change.org/photos/6/xx/du/PVxXDuPAlyZElOq-800x800-noPad.jpg?1545819986,False,800.0,800.0
747713869,She is the real abuser and it's proven with evidence and all,0,0,Event,14094292,0,comment,2018-12-27T18:18:25Z,,735006650,735006650,Himaya,nirmani,Himaya,Himaya nirmani,Anuradhapura,,LK,,en-GB,,[],14094292,14094292,To remove an unsuitable proven abuser from being an Advocate for domestic violence,2018-12-26T10:25:17Z,,2018-12-26T10:39:35Z,,en-GB,['en'],ACLU: To remove an unsuitable proven abuser from being an Advocate for domestic violence,"<p>Many people men n women suffer at the hands of an abusive spouse. It takes years for them to open n speak n to reach out n get help. Mainly due to mental, physical, emotional n sexual abuse that makes that person left feeling void, humiliated, no self worth, hollow, have a need to protect their abuser through fear of negative retaliation n much more.Having a known abuser such as Amber Heard as an advocate for sufferers and survivors of DV , is not only making a mockery of a subject that is so severe but runs the risk of of having sufferers not trusting an organization in which they should feel they would be able to come forward n trust. Having this person as an advocate could run the risk n damage of sufferers coming foward n that would be a tragedy in itself.</p>",ACLU,To remove an unsuitable proven abuser from being an Advocate for domestic violence,2019-12-27,,,GB,55.3781,-3.43597,,,,,aclu-to-remove-an-unsuitable-proven-abuser-from-being-an-advocate-for-domestic-violence,published,,,False,False,,False,,[],True,False,,489,489,0,1276,215,0,0,0,0,0,45,,,,,,221531924,photos/6/fh/su/DXFhsufkyMCcdxh-fullsize.jpg,//assets.change.org/photos/6/fh/su/DXFhsufkyMCcdxh-400x400-noPad.jpg?1545952177,False,400,400,//assets.change.org/photos/6/fh/su/DXFhsufkyMCcdxh-400x225-noPad.jpg?1545952176,False,400,225,//assets.change.org/photos/6/fh/su/DXFhsufkyMCcdxh-800x450-noPad.jpg?1545952177,False,800,450,//assets.change.org/photos/6/fh/su/DXFhsufkyMCcdxh-1600x900-noPad.jpg?1545952177,False,1600,900,photo,1,1621134803,2,1653775779.115,1,1653343875.612,811097416,811097416,Nikki-jane,Clark,Nikki-jane,Nikki-jane Clark,Rochester,,GB,,en-GB,,221527748,photos/6/xx/du/PVxXDuPAlyZElOq-fullsize.jpg,//assets.change.org/photos/6/xx/du/PVxXDuPAlyZElOq-48x48-noPad.jpg?1545819986,False,48,48,//assets.change.org/photos/6/xx/du/PVxXDuPAlyZElOq-128x128-noPad.jpg?1545819985,False,128,128,//assets.change.org/photos/6/xx/du/PVxXDuPAlyZElOq-400x400-noPad.jpg?1545819985,False,400,400,//assets.change.org/photos/6/xx/du/PVxXDuPAlyZElOq-800x800-noPad.jpg?1545819986,False,800,800,[],"[{'id': 46756, 'display_name': 'ACLU', 'email': None, 'type': 'Custom', 'slug': 'aclu', 'description': None, 'photo_id': None, 'publicly_visible': False, 'verified_at': None, 'summary': None, 'locale': 'en-US', 'confirmed_at': None, 'is_person': True, 'member_of': {}, 'additional_data': {'first_name': 'ACLU', 'last_name': None, 'title': None, 'id': 55116}, 'has_email': False}]",False,False,False,Nikki-jane Clark,221527748,photos/6/xx/du/PVxXDuPAlyZElOq-fullsize.jpg,//assets.change.org/photos/6/xx/du/PVxXDuPAlyZElOq-48x48-noPad.jpg?1545819986,False,48,48,//assets.change.org/photos/6/xx/du/PVxXDuPAlyZElOq-128x128-noPad.jpg?1545819985,False,128,128,//assets.change.org/photos/6/xx/du/PVxXDuPAlyZElOq-400x400-noPad.jpg?1545819985,False,400,400,//assets.change.org/photos/6/xx/du/PVxXDuPAlyZElOq-800x800-noPad.jpg?1545819986,False,800,800,ACLU: To remove an unsuitable proven abuser from being an Advocate for domestic violence,ACLU: To remove an unsuitable proven abuser from being an Advocate for domestic violence,active,500,221531924,photos/6/fh/su/DXFhsufkyMCcdxh-fullsize.jpg,//assets.change.org/photos/6/fh/su/DXFhsufkyMCcdxh-400x400-noPad.jpg?1545952177,False,400,400,//assets.change.org/photos/6/fh/su/DXFhsufkyMCcdxh-400x225-noPad.jpg?1545952176,False,400,225,//assets.change.org/photos/6/fh/su/DXFhsufkyMCcdxh-800x450-noPad.jpg?1545952177,False,800,450,//assets.change.org/photos/6/fh/su/DXFhsufkyMCcdxh-1600x900-noPad.jpg?1545952177,False,1600,900,photo,46756,ACLU,,Custom,aclu,,,False,,,en-US,,True,ACLU,,,55116,False,97.8,,,,,,,,,,,,,,,,,,
747712457,"Just because I am a Domestic Violence Advocate against any gender/child. I worked at the D.A. Offices in Los Angeles Family Law! It is unnecessary & Do Not condone it in any way, shape or form. Someone needs serious HELP if it's a continuous behaviour. Period. Get help to those who need it! Have a blessed day!",0,0,Event,14094292,0,comment,2018-12-27T17:48:37Z,,904236989,904236989,Tina,Evans,Tina,Tina Evans,Sandy,UT,US,https://www.twitter.com/TinaJoEvans2522,en-US,"Madly in love with My Everything, My Love Bug, Sweetheart 4Ever! God brought me my son and my love, Love is a powerful thing thru God's blessings!",[],14094292,14094292,To remove an unsuitable proven abuser from being an Advocate for domestic violence,2018-12-26T10:25:17Z,,2018-12-26T10:39:35Z,,en-GB,['en'],ACLU: To remove an unsuitable proven abuser from being an Advocate for domestic violence,"<p>Many people men n women suffer at the hands of an abusive spouse. It takes years for them to open n speak n to reach out n get help. Mainly due to mental, physical, emotional n sexual abuse that makes that person left feeling void, humiliated, no self worth, hollow, have a need to protect their abuser through fear of negative retaliation n much more.Having a known abuser such as Amber Heard as an advocate for sufferers and survivors of DV , is not only making a mockery of a subject that is so severe but runs the risk of of having sufferers not trusting an organization in which they should feel they would be able to come forward n trust. Having this person as an advocate could run the risk n damage of sufferers coming foward n that would be a tragedy in itself.</p>",ACLU,To remove an unsuitable proven abuser from being an Advocate for domestic violence,2019-12-27,,,GB,55.3781,-3.43597,,,,,aclu-to-remove-an-unsuitable-proven-abuser-from-being-an-advocate-for-domestic-violence,published,,,False,False,,False,,[],True,False,,489,489,0,1276,215,0,0,0,0,0,45,,,,,,221531924,photos/6/fh/su/DXFhsufkyMCcdxh-fullsize.jpg,//assets.change.org/photos/6/fh/su/DXFhsufkyMCcdxh-400x400-noPad.jpg?1545952177,False,400,400,//assets.change.org/photos/6/fh/su/DXFhsufkyMCcdxh-400x225-noPad.jpg?1545952176,False,400,225,//assets.change.org/photos/6/fh/su/DXFhsufkyMCcdxh-800x450-noPad.jpg?1545952177,False,800,450,//assets.change.org/photos/6/fh/su/DXFhsufkyMCcdxh-1600x900-noPad.jpg?1545952177,False,1600,900,photo,1,1621134803,2,1653775779.115,1,1653343875.612,811097416,811097416,Nikki-jane,Clark,Nikki-jane,Nikki-jane Clark,Rochester,,GB,,en-GB,,221527748,photos/6/xx/du/PVxXDuPAlyZElOq-fullsize.jpg,//assets.change.org/photos/6/xx/du/PVxXDuPAlyZElOq-48x48-noPad.jpg?1545819986,False,48,48,//assets.change.org/photos/6/xx/du/PVxXDuPAlyZElOq-128x128-noPad.jpg?1545819985,False,128,128,//assets.change.org/photos/6/xx/du/PVxXDuPAlyZElOq-400x400-noPad.jpg?1545819985,False,400,400,//assets.change.org/photos/6/xx/du/PVxXDuPAlyZElOq-800x800-noPad.jpg?1545819986,False,800,800,[],"[{'id': 46756, 'display_name': 'ACLU', 'email': None, 'type': 'Custom', 'slug': 'aclu', 'description': None, 'photo_id': None, 'publicly_visible': False, 'verified_at': None, 'summary': None, 'locale': 'en-US', 'confirmed_at': None, 'is_person': True, 'member_of': {}, 'additional_data': {'first_name': 'ACLU', 'last_name': None, 'title': None, 'id': 55116}, 'has_email': False}]",False,False,False,Nikki-jane Clark,221527748,photos/6/xx/du/PVxXDuPAlyZElOq-fullsize.jpg,//assets.change.org/photos/6/xx/du/PVxXDuPAlyZElOq-48x48-noPad.jpg?1545819986,False,48,48,//assets.change.org/photos/6/xx/du/PVxXDuPAlyZElOq-128x128-noPad.jpg?1545819985,False,128,128,//assets.change.org/photos/6/xx/du/PVxXDuPAlyZElOq-400x400-noPad.jpg?1545819985,False,400,400,//assets.change.org/photos/6/xx/du/PVxXDuPAlyZElOq-800x800-noPad.jpg?1545819986,False,800,800,ACLU: To remove an unsuitable proven abuser from being an Advocate for domestic violence,ACLU: To remove an unsuitable proven abuser from being an Advocate for domestic violence,active,500,221531924,photos/6/fh/su/DXFhsufkyMCcdxh-fullsize.jpg,//assets.change.org/photos/6/fh/su/DXFhsufkyMCcdxh-400x400-noPad.jpg?1545952177,False,400,400,//assets.change.org/photos/6/fh/su/DXFhsufkyMCcdxh-400x225-noPad.jpg?1545952176,False,400,225,//assets.change.org/photos/6/fh/su/DXFhsufkyMCcdxh-800x450-noPad.jpg?1545952177,False,800,450,//assets.change.org/photos/6/fh/su/DXFhsufkyMCcdxh-1600x900-noPad.jpg?1545952177,False,1600,900,photo,46756,ACLU,,Custom,aclu,,,False,,,en-US,,True,ACLU,,,55116,False,97.8,221162918.0,photos/3/sg/ma/iDSGmAkFfXutuqx-fullsize.jpg,//assets.change.org/photos/3/sg/ma/iDSGmAkFfXutuqx-48x48-noPad.jpg?1539038952,False,48.0,48.0,//assets.change.org/photos/3/sg/ma/iDSGmAkFfXutuqx-128x128-noPad.jpg?1539038952,False,128.0,128.0,//assets.change.org/photos/3/sg/ma/iDSGmAkFfXutuqx-400x400-noPad.jpg?1539038952,False,400.0,400.0,//assets.change.org/photos/3/sg/ma/iDSGmAkFfXutuqx-800x800-noPad.jpg?1539038953,False,800.0,800.0
747712367,"Just because I am a Domestic Violence Adbocate against any gender/child. I worked at the D.A. Offices in Los Angeles Family Law! It is unnecessary & Do Not condone it in any way, shape or form. Someone needs serious HELP if it's a continuous behaviour. Period. Get help to those who need it! Have a blessed day! �",0,0,Event,14094292,0,comment,2018-12-27T17:46:36Z,,904236989,904236989,Tina,Evans,Tina,Tina Evans,Sandy,UT,US,https://www.twitter.com/TinaJoEvans2522,en-US,"Madly in love with My Everything, My Love Bug, Sweetheart 4Ever! God brought me my son and my love, Love is a powerful thing thru God's blessings!",[],14094292,14094292,To remove an unsuitable proven abuser from being an Advocate for domestic violence,2018-12-26T10:25:17Z,,2018-12-26T10:39:35Z,,en-GB,['en'],ACLU: To remove an unsuitable proven abuser from being an Advocate for domestic violence,"<p>Many people men n women suffer at the hands of an abusive spouse. It takes years for them to open n speak n to reach out n get help. Mainly due to mental, physical, emotional n sexual abuse that makes that person left feeling void, humiliated, no self worth, hollow, have a need to protect their abuser through fear of negative retaliation n much more.Having a known abuser such as Amber Heard as an advocate for sufferers and survivors of DV , is not only making a mockery of a subject that is so severe but runs the risk of of having sufferers not trusting an organization in which they should feel they would be able to come forward n trust. Having this person as an advocate could run the risk n damage of sufferers coming foward n that would be a tragedy in itself.</p>",ACLU,To remove an unsuitable proven abuser from being an Advocate for domestic violence,2019-12-27,,,GB,55.3781,-3.43597,,,,,aclu-to-remove-an-unsuitable-proven-abuser-from-being-an-advocate-for-domestic-violence,published,,,False,False,,False,,[],True,False,,489,489,0,1276,215,0,0,0,0,0,45,,,,,,221531924,photos/6/fh/su/DXFhsufkyMCcdxh-fullsize.jpg,//assets.change.org/photos/6/fh/su/DXFhsufkyMCcdxh-400x400-noPad.jpg?1545952177,False,400,400,//assets.change.org/photos/6/fh/su/DXFhsufkyMCcdxh-400x225-noPad.jpg?1545952176,False,400,225,//assets.change.org/photos/6/fh/su/DXFhsufkyMCcdxh-800x450-noPad.jpg?1545952177,False,800,450,//assets.change.org/photos/6/fh/su/DXFhsufkyMCcdxh-1600x900-noPad.jpg?1545952177,False,1600,900,photo,1,1621134803,2,1653775779.115,1,1653343875.612,811097416,811097416,Nikki-jane,Clark,Nikki-jane,Nikki-jane Clark,Rochester,,GB,,en-GB,,221527748,photos/6/xx/du/PVxXDuPAlyZElOq-fullsize.jpg,//assets.change.org/photos/6/xx/du/PVxXDuPAlyZElOq-48x48-noPad.jpg?1545819986,False,48,48,//assets.change.org/photos/6/xx/du/PVxXDuPAlyZElOq-128x128-noPad.jpg?1545819985,False,128,128,//assets.change.org/photos/6/xx/du/PVxXDuPAlyZElOq-400x400-noPad.jpg?1545819985,False,400,400,//assets.change.org/photos/6/xx/du/PVxXDuPAlyZElOq-800x800-noPad.jpg?1545819986,False,800,800,[],"[{'id': 46756, 'display_name': 'ACLU', 'email': None, 'type': 'Custom', 'slug': 'aclu', 'description': None, 'photo_id': None, 'publicly_visible': False, 'verified_at': None, 'summary': None, 'locale': 'en-US', 'confirmed_at': None, 'is_person': True, 'member_of': {}, 'additional_data': {'first_name': 'ACLU', 'last_name': None, 'title': None, 'id': 55116}, 'has_email': False}]",False,False,False,Nikki-jane Clark,221527748,photos/6/xx/du/PVxXDuPAlyZElOq-fullsize.jpg,//assets.change.org/photos/6/xx/du/PVxXDuPAlyZElOq-48x48-noPad.jpg?1545819986,False,48,48,//assets.change.org/photos/6/xx/du/PVxXDuPAlyZElOq-128x128-noPad.jpg?1545819985,False,128,128,//assets.change.org/photos/6/xx/du/PVxXDuPAlyZElOq-400x400-noPad.jpg?1545819985,False,400,400,//assets.change.org/photos/6/xx/du/PVxXDuPAlyZElOq-800x800-noPad.jpg?1545819986,False,800,800,ACLU: To remove an unsuitable proven abuser from being an Advocate for domestic violence,ACLU: To remove an unsuitable proven abuser from being an Advocate for domestic violence,active,500,221531924,photos/6/fh/su/DXFhsufkyMCcdxh-fullsize.jpg,//assets.change.org/photos/6/fh/su/DXFhsufkyMCcdxh-400x400-noPad.jpg?1545952177,False,400,400,//assets.change.org/photos/6/fh/su/DXFhsufkyMCcdxh-400x225-noPad.jpg?1545952176,False,400,225,//assets.change.org/photos/6/fh/su/DXFhsufkyMCcdxh-800x450-noPad.jpg?1545952177,False,800,450,//assets.change.org/photos/6/fh/su/DXFhsufkyMCcdxh-1600x900-noPad.jpg?1545952177,False,1600,900,photo,46756,ACLU,,Custom,aclu,,,False,,,en-US,,True,ACLU,,,55116,False,97.8,221162918.0,photos/3/sg/ma/iDSGmAkFfXutuqx-fullsize.jpg,//assets.change.org/photos/3/sg/ma/iDSGmAkFfXutuqx-48x48-noPad.jpg?1539038952,False,48.0,48.0,//assets.change.org/photos/3/sg/ma/iDSGmAkFfXutuqx-128x128-noPad.jpg?1539038952,False,128.0,128.0,//assets.change.org/photos/3/sg/ma/iDSGmAkFfXutuqx-400x400-noPad.jpg?1539038952,False,400.0,400.0,//assets.change.org/photos/3/sg/ma/iDSGmAkFfXutuqx-800x800-noPad.jpg?1539038953,False,800.0,800.0
