id,comment,parent_id,children_count,commentable_type,commentable_id,likes,role,created_at,deleted_at,user.id,user.slug,user.first_name,user.last_name,user.short_display_name,user.display_name,user.city,user.state_code,user.country_code,user.website,user.locale,user.description,user.photo.id,user.photo.url,user.photo.sizes.small.url,user.photo.sizes.small.processing,user.photo.sizes.small.size.width,user.photo.sizes.small.size.height,user.photo.sizes.medium.url,user.photo.sizes.medium.processing,user.photo.sizes.medium.size.width,user.photo.sizes.medium.size.height,user.photo.sizes.large.url,user.photo.sizes.large.processing,user.photo.sizes.large.size.width,user.photo.sizes.large.size.height,user.photo.sizes.xlarge.url,user.photo.sizes.xlarge.processing,user.photo.sizes.xlarge.size.width,user.photo.sizes.xlarge.size.height,user.roles,commentable_entity.id,commentable_entity.document_id,commentable_entity.ask,commentable_entity.created_at,commentable_entity.deleted_at,commentable_entity.published_at,commentable_entity.last_edited_at,commentable_entity.original_locale,commentable_entity.languages,commentable_entity.title,commentable_entity.description,commentable_entity.targeting_description,commentable_entity.letter_body,commentable_entity.end_date,commentable_entity.goal,commentable_entity.relevant_location.city,commentable_entity.relevant_location.country_code,commentable_entity.relevant_location.lat,commentable_entity.relevant_location.lng,commentable_entity.relevant_location.state_code,commentable_entity.relevant_location.google_places_id,commentable_entity.relevant_location.photo_id,commentable_entity.restricted_location,commentable_entity.slug,commentable_entity.status,commentable_entity.victory_date,commentable_entity.victory_description,commentable_entity.is_verified_victory,commentable_entity.is_victory,commentable_entity.video_id,commentable_entity.is_pledge,commentable_entity.topic,commentable_entity.tags,commentable_entity.discoverable,commentable_entity.sponsored_campaign,commentable_entity.organization_free_email_optins,commentable_entity.displayed_signature_count,commentable_entity.total_signature_count,commentable_entity.weekly_signature_count,commentable_entity.total_page_views,commentable_entity.total_share_count,commentable_entity.daily_signature_count,commentable_entity.monthly_signature_count,commentable_entity.daily_signup_count,commentable_entity.weekly_signup_count,commentable_entity.monthly_signup_count,commentable_entity.total_signup_count,commentable_entity.supporter_message_count,commentable_entity.starter_vanity_url,commentable_entity.featured_title,commentable_entity.media_text,commentable_entity.media_url,commentable_entity.photo.id,commentable_entity.photo.url,commentable_entity.photo.sizes.square.url,commentable_entity.photo.sizes.square.processing,commentable_entity.photo.sizes.square.size.width,commentable_entity.photo.sizes.square.size.height,commentable_entity.photo.sizes.small.url,commentable_entity.photo.sizes.small.processing,commentable_entity.photo.sizes.small.size.width,commentable_entity.photo.sizes.small.size.height,commentable_entity.photo.sizes.medium.url,commentable_entity.photo.sizes.medium.processing,commentable_entity.photo.sizes.medium.size.width,commentable_entity.photo.sizes.medium.size.height,commentable_entity.photo.sizes.large.url,commentable_entity.photo.sizes.large.processing,commentable_entity.photo.sizes.large.size.width,commentable_entity.photo.sizes.large.size.height,commentable_entity.photo.type,commentable_entity.activity.share.copylink.count,commentable_entity.activity.share.copylink.last_updated,commentable_entity.activity.share.facebook.count,commentable_entity.activity.share.facebook.last_updated,commentable_entity.activity.share.facebook_messenger.count,commentable_entity.activity.share.facebook_messenger.last_updated,commentable_entity.activity.share.twitter.count,commentable_entity.activity.share.twitter.last_updated,commentable_entity.activity.share.whatsapp.count,commentable_entity.activity.share.whatsapp.last_updated,commentable_entity.user.id,commentable_entity.user.slug,commentable_entity.user.first_name,commentable_entity.user.last_name,commentable_entity.user.short_display_name,commentable_entity.user.display_name,commentable_entity.user.city,commentable_entity.user.state_code,commentable_entity.user.country_code,commentable_entity.user.website,commentable_entity.user.locale,commentable_entity.user.description,commentable_entity.user.photo.id,commentable_entity.user.photo.url,commentable_entity.user.photo.sizes.small.url,commentable_entity.user.photo.sizes.small.processing,commentable_entity.user.photo.sizes.small.size.width,commentable_entity.user.photo.sizes.small.size.height,commentable_entity.user.photo.sizes.medium.url,commentable_entity.user.photo.sizes.medium.processing,commentable_entity.user.photo.sizes.medium.size.width,commentable_entity.user.photo.sizes.medium.size.height,commentable_entity.user.photo.sizes.large.url,commentable_entity.user.photo.sizes.large.processing,commentable_entity.user.photo.sizes.large.size.width,commentable_entity.user.photo.sizes.large.size.height,commentable_entity.user.photo.sizes.xlarge.url,commentable_entity.user.photo.sizes.xlarge.processing,commentable_entity.user.photo.sizes.xlarge.size.width,commentable_entity.user.photo.sizes.xlarge.size.height,commentable_entity.user.roles,commentable_entity.targets,commentable_entity.hide_comments,commentable_entity.hide_dm_action_panel,commentable_entity.enable_human_verification,commentable_entity.creator_name,commentable_entity.creator_photo.id,commentable_entity.creator_photo.url,commentable_entity.creator_photo.sizes.small.url,commentable_entity.creator_photo.sizes.small.processing,commentable_entity.creator_photo.sizes.small.size.width,commentable_entity.creator_photo.sizes.small.size.height,commentable_entity.creator_photo.sizes.medium.url,commentable_entity.creator_photo.sizes.medium.processing,commentable_entity.creator_photo.sizes.medium.size.width,commentable_entity.creator_photo.sizes.medium.size.height,commentable_entity.creator_photo.sizes.large.url,commentable_entity.creator_photo.sizes.large.processing,commentable_entity.creator_photo.sizes.large.size.width,commentable_entity.creator_photo.sizes.large.size.height,commentable_entity.creator_photo.sizes.xlarge.url,commentable_entity.creator_photo.sizes.xlarge.processing,commentable_entity.creator_photo.sizes.xlarge.size.width,commentable_entity.creator_photo.sizes.xlarge.size.height,commentable_entity.display_title,commentable_entity.petition_title,commentable_entity.petition_status,commentable_entity.calculated_goal,commentable_entity.media.id,commentable_entity.media.url,commentable_entity.media.sizes.square.url,commentable_entity.media.sizes.square.processing,commentable_entity.media.sizes.square.size.width,commentable_entity.media.sizes.square.size.height,commentable_entity.media.sizes.small.url,commentable_entity.media.sizes.small.processing,commentable_entity.media.sizes.small.size.width,commentable_entity.media.sizes.small.size.height,commentable_entity.media.sizes.medium.url,commentable_entity.media.sizes.medium.processing,commentable_entity.media.sizes.medium.size.width,commentable_entity.media.sizes.medium.size.height,commentable_entity.media.sizes.large.url,commentable_entity.media.sizes.large.processing,commentable_entity.media.sizes.large.size.width,commentable_entity.media.sizes.large.size.height,commentable_entity.media.type,commentable_entity.primary_target.id,commentable_entity.primary_target.display_name,commentable_entity.primary_target.email,commentable_entity.primary_target.type,commentable_entity.primary_target.slug,commentable_entity.primary_target.description,commentable_entity.primary_target.publicly_visible,commentable_entity.primary_target.verified_at,commentable_entity.primary_target.summary,commentable_entity.primary_target.locale,commentable_entity.primary_target.confirmed_at,commentable_entity.primary_target.is_person,commentable_entity.primary_target.additional_data.first_name,commentable_entity.primary_target.additional_data.last_name,commentable_entity.primary_target.additional_data.title,commentable_entity.primary_target.additional_data.id,commentable_entity.primary_target.has_email,commentable_entity.primary_target.photo.id,commentable_entity.primary_target.photo.url,commentable_entity.primary_target.photo.sizes.small.url,commentable_entity.primary_target.photo.sizes.small.processing,commentable_entity.primary_target.photo.sizes.small.size.width,commentable_entity.primary_target.photo.sizes.small.size.height,commentable_entity.primary_target.photo.sizes.medium.url,commentable_entity.primary_target.photo.sizes.medium.processing,commentable_entity.primary_target.photo.sizes.medium.size.width,commentable_entity.primary_target.photo.sizes.medium.size.height,commentable_entity.primary_target.photo.sizes.large.url,commentable_entity.primary_target.photo.sizes.large.processing,commentable_entity.primary_target.photo.sizes.large.size.width,commentable_entity.primary_target.photo.sizes.large.size.height,commentable_entity.primary_target.photo.sizes.xlarge.url,commentable_entity.primary_target.photo.sizes.xlarge.processing,commentable_entity.primary_target.photo.sizes.xlarge.size.width,commentable_entity.primary_target.photo.sizes.xlarge.size.height,commentable_entity.progress
833375769,"Turd is a compulsive LIAR CHEATER ABUSER UGLY PERSON
GET HER DOGS AND DAUGHTER AWAY FROM HER!!!!",0,0,Event,26842623,0,comment,2022-06-02T19:16:48Z,,955602089,955602089,MiMi,bowerman,MiMi,MiMi bowerman,"Sacramento, CA",CA,US,,en-US,,226662854.0,photos/5/pp/kz/DuPpkZouTKdrVkn-fullsize.jpg,//assets.change.org/photos/5/pp/kz/DuPpkZouTKdrVkn-48x48-noPad.jpg?1654191414,False,48.0,48.0,//assets.change.org/photos/5/pp/kz/DuPpkZouTKdrVkn-128x128-noPad.jpg?1654191414,False,128.0,128.0,//assets.change.org/photos/5/pp/kz/DuPpkZouTKdrVkn-400x400-noPad.jpg?1654191414,False,400.0,400.0,//assets.change.org/photos/5/pp/kz/DuPpkZouTKdrVkn-800x800-noPad.jpg?1654191414,False,800.0,800.0,[],26842623,26842623,"Amber Heard, Honour Your Pledge to CHLA.",2021-01-14T12:15:03Z,,2021-01-14T12:20:43Z,2021-01-14T13:00:43Z,de-DE,['en'],"Petition to Hold Amber Heard Accountable! Amber Heard, Honour Your Pledge To CHLA","<p>For 4 years, Amber Heard has repeatedly claimed that she donated her entire divorce settlement, US 7 million dollars, to the Children's Hospital LA and ACLU. However, last week, we all learned that she not only didn't donate, but the little money she gave to CHLA/ACLU came from Johnny Depp and Elon Musk respectively. </p>
<p>I believe that pledging to help sick children (CHLA) is a serious thing and shouldn't be overlooked. Therefore, I created this petition to pressure Amber Heard to donate the money to help those children with cancer as she promised to do. She's been rewarded several times for donating the money ... She was appointed UN's Human Right Champions and is hailed as an activist and an example of braveness and strength. </p>
<p>Amber Heard already stole the suffering of countless domestic abuse victims/survivors, and it's not right that she also gets to keep the money she promised to give to sick children. </p>","Twitter, Amber Heard","Petition to Hold Amber Heard Accountable! Amber Heard, Honour Your 7M Pledge.",2022-01-22,,,DE,,,,,,,petition-to-hold-amber-heard-accountable-amber-heard-honour-your-pledge-to-chla,published,,,False,False,,False,,"[{'id': 476664, 'locale': 'de-DE', 'name': 'Andere', 'slug': 'andere-de-de', 'photo_id': None, 'created_by_owner': True, 'created_by_staff_member': False, 'total_count': 5983}]",True,False,,285,285,0,687,75,0,1,0,0,0,5,,,,,,225083314,photos/0/hh/jv/uShHJVzAYgRmApu-fullsize.jpg,//assets.change.org/photos/0/hh/jv/uShHJVzAYgRmApu-400x400-noPad.jpg?1610626508,False,400,400,//assets.change.org/photos/0/hh/jv/uShHJVzAYgRmApu-400x225-noPad.jpg?1610626508,False,400,225,//assets.change.org/photos/0/hh/jv/uShHJVzAYgRmApu-800x450-noPad.jpg?1610626509,False,800,450,//assets.change.org/photos/0/hh/jv/uShHJVzAYgRmApu-1600x900-noPad.jpg?1610626509,False,1600,900,photo,6,1656197806.752,1,1652309343.14,1,1651099185.728,1,1651099143.12,3,1653602276.776,1143958395,1143958395,Princess Consuela,Bananahammock,Princess Consuela,Princess Consuela Bananahammock,,,DE,https://www.twitter.com/PrinConsuella_,de-DE,Someone in the right side of the roaring rapids.,225083156,photos/4/vb/cy/egvBCYaPcFribkY-fullsize.jpg,//assets.change.org/photos/4/vb/cy/egvBCYaPcFribkY-48x48-noPad.jpg?1610622599,False,48,48,//assets.change.org/photos/4/vb/cy/egvBCYaPcFribkY-128x128-noPad.jpg?1610622599,False,128,128,//assets.change.org/photos/4/vb/cy/egvBCYaPcFribkY-400x400-noPad.jpg?1610622599,False,400,400,//assets.change.org/photos/4/vb/cy/egvBCYaPcFribkY-800x800-noPad.jpg?1610622599,False,800,800,[],"[{'id': 33678, 'display_name': 'Twitter', 'email': None, 'type': 'Custom', 'slug': 'twitter-2', 'description': 'Twitter is a real-time information network that connects you to the latest stories, ideas, opinions and news about what you find interesting.', 'publicly_visible': True, 'verified_at': None, 'summary': None, 'locale': 'en-US', 'confirmed_at': None, 'is_person': True, 'member_of': {}, 'additional_data': {'first_name': 'Twitter', 'last_name': None, 'title': None, 'id': 42729}, 'has_email': False, 'photo': {'id': 11701415, 'url': 'photos/1/pk/tq/WJpkTqiSAUOusTY-fullsize.jpg', 'sizes': {'small': {'url': '//assets.change.org/photos/1/pk/tq/WJpkTqiSAUOusTY-48x48-noPad.jpg?1519872572', 'processing': False, 'size': {'width': 48, 'height': 48}}, 'medium': {'url': '//assets.change.org/photos/1/pk/tq/WJpkTqiSAUOusTY-128x128-noPad.jpg?1519872572', 'processing': False, 'size': {'width': 128, 'height': 128}}, 'large': {'url': '//assets.change.org/photos/1/pk/tq/WJpkTqiSAUOusTY-400x400-noPad.jpg?1519872572', 'processing': False, 'size': {'width': 400, 'height': 400}}, 'xlarge': {'url': '//assets.change.org/photos/1/pk/tq/WJpkTqiSAUOusTY-800x800-noPad.jpg?1519872572', 'processing': False, 'size': {'width': 800, 'height': 800}}}}}, {'id': 10149883, 'display_name': 'Amber Heard', 'email': None, 'type': 'Custom', 'slug': 'amber-heard', 'description': None, 'photo_id': None, 'publicly_visible': False, 'verified_at': None, 'summary': None, 'locale': None, 'confirmed_at': None, 'is_person': True, 'member_of': {}, 'additional_data': {'first_name': 'Amber', 'last_name': 'Heard', 'title': None, 'id': 10054371}, 'has_email': False}]",False,False,False,Princess Consuela Bananahammock,225083156,photos/4/vb/cy/egvBCYaPcFribkY-fullsize.jpg,//assets.change.org/photos/4/vb/cy/egvBCYaPcFribkY-48x48-noPad.jpg?1610622599,False,48,48,//assets.change.org/photos/4/vb/cy/egvBCYaPcFribkY-128x128-noPad.jpg?1610622599,False,128,128,//assets.change.org/photos/4/vb/cy/egvBCYaPcFribkY-400x400-noPad.jpg?1610622599,False,400,400,//assets.change.org/photos/4/vb/cy/egvBCYaPcFribkY-800x800-noPad.jpg?1610622599,False,800,800,"Petition to Hold Amber Heard Accountable! Amber Heard, Honour Your Pledge To CHLA","Petition to Hold Amber Heard Accountable! Amber Heard, Honour Your Pledge To CHLA",active,500,225083314,photos/0/hh/jv/uShHJVzAYgRmApu-fullsize.jpg,//assets.change.org/photos/0/hh/jv/uShHJVzAYgRmApu-400x400-noPad.jpg?1610626508,False,400,400,//assets.change.org/photos/0/hh/jv/uShHJVzAYgRmApu-400x225-noPad.jpg?1610626508,False,400,225,//assets.change.org/photos/0/hh/jv/uShHJVzAYgRmApu-800x450-noPad.jpg?1610626509,False,800,450,//assets.change.org/photos/0/hh/jv/uShHJVzAYgRmApu-1600x900-noPad.jpg?1610626509,False,1600,900,photo,33678,Twitter,,Custom,twitter-2,"Twitter is a real-time information network that connects you to the latest stories, ideas, opinions and news about what you find interesting.",True,,,en-US,,True,Twitter,,,42729,False,11701415,photos/1/pk/tq/WJpkTqiSAUOusTY-fullsize.jpg,//assets.change.org/photos/1/pk/tq/WJpkTqiSAUOusTY-48x48-noPad.jpg?1519872572,False,48,48,//assets.change.org/photos/1/pk/tq/WJpkTqiSAUOusTY-128x128-noPad.jpg?1519872572,False,128,128,//assets.change.org/photos/1/pk/tq/WJpkTqiSAUOusTY-400x400-noPad.jpg?1519872572,False,400,400,//assets.change.org/photos/1/pk/tq/WJpkTqiSAUOusTY-800x800-noPad.jpg?1519872572,False,800,800,57
833256583,Amber Turd is a liar!,0,0,Event,26842623,0,comment,2022-05-28T22:10:45Z,,1267341765,1267341765,Kera,Lanisky,Kera,Kera Lanisky,London,OH,US,,en-US,,,,,,,,,,,,,,,,,,,,[],26842623,26842623,"Amber Heard, Honour Your Pledge to CHLA.",2021-01-14T12:15:03Z,,2021-01-14T12:20:43Z,2021-01-14T13:00:43Z,de-DE,['en'],"Petition to Hold Amber Heard Accountable! Amber Heard, Honour Your Pledge To CHLA","<p>For 4 years, Amber Heard has repeatedly claimed that she donated her entire divorce settlement, US 7 million dollars, to the Children's Hospital LA and ACLU. However, last week, we all learned that she not only didn't donate, but the little money she gave to CHLA/ACLU came from Johnny Depp and Elon Musk respectively. </p>
<p>I believe that pledging to help sick children (CHLA) is a serious thing and shouldn't be overlooked. Therefore, I created this petition to pressure Amber Heard to donate the money to help those children with cancer as she promised to do. She's been rewarded several times for donating the money ... She was appointed UN's Human Right Champions and is hailed as an activist and an example of braveness and strength. </p>
<p>Amber Heard already stole the suffering of countless domestic abuse victims/survivors, and it's not right that she also gets to keep the money she promised to give to sick children. </p>","Twitter, Amber Heard","Petition to Hold Amber Heard Accountable! Amber Heard, Honour Your 7M Pledge.",2022-01-22,,,DE,,,,,,,petition-to-hold-amber-heard-accountable-amber-heard-honour-your-pledge-to-chla,published,,,False,False,,False,,"[{'id': 476664, 'locale': 'de-DE', 'name': 'Andere', 'slug': 'andere-de-de', 'photo_id': None, 'created_by_owner': True, 'created_by_staff_member': False, 'total_count': 5983}]",True,False,,285,285,0,687,75,0,1,0,0,0,5,,,,,,225083314,photos/0/hh/jv/uShHJVzAYgRmApu-fullsize.jpg,//assets.change.org/photos/0/hh/jv/uShHJVzAYgRmApu-400x400-noPad.jpg?1610626508,False,400,400,//assets.change.org/photos/0/hh/jv/uShHJVzAYgRmApu-400x225-noPad.jpg?1610626508,False,400,225,//assets.change.org/photos/0/hh/jv/uShHJVzAYgRmApu-800x450-noPad.jpg?1610626509,False,800,450,//assets.change.org/photos/0/hh/jv/uShHJVzAYgRmApu-1600x900-noPad.jpg?1610626509,False,1600,900,photo,6,1656197806.752,1,1652309343.14,1,1651099185.728,1,1651099143.12,3,1653602276.776,1143958395,1143958395,Princess Consuela,Bananahammock,Princess Consuela,Princess Consuela Bananahammock,,,DE,https://www.twitter.com/PrinConsuella_,de-DE,Someone in the right side of the roaring rapids.,225083156,photos/4/vb/cy/egvBCYaPcFribkY-fullsize.jpg,//assets.change.org/photos/4/vb/cy/egvBCYaPcFribkY-48x48-noPad.jpg?1610622599,False,48,48,//assets.change.org/photos/4/vb/cy/egvBCYaPcFribkY-128x128-noPad.jpg?1610622599,False,128,128,//assets.change.org/photos/4/vb/cy/egvBCYaPcFribkY-400x400-noPad.jpg?1610622599,False,400,400,//assets.change.org/photos/4/vb/cy/egvBCYaPcFribkY-800x800-noPad.jpg?1610622599,False,800,800,[],"[{'id': 33678, 'display_name': 'Twitter', 'email': None, 'type': 'Custom', 'slug': 'twitter-2', 'description': 'Twitter is a real-time information network that connects you to the latest stories, ideas, opinions and news about what you find interesting.', 'publicly_visible': True, 'verified_at': None, 'summary': None, 'locale': 'en-US', 'confirmed_at': None, 'is_person': True, 'member_of': {}, 'additional_data': {'first_name': 'Twitter', 'last_name': None, 'title': None, 'id': 42729}, 'has_email': False, 'photo': {'id': 11701415, 'url': 'photos/1/pk/tq/WJpkTqiSAUOusTY-fullsize.jpg', 'sizes': {'small': {'url': '//assets.change.org/photos/1/pk/tq/WJpkTqiSAUOusTY-48x48-noPad.jpg?1519872572', 'processing': False, 'size': {'width': 48, 'height': 48}}, 'medium': {'url': '//assets.change.org/photos/1/pk/tq/WJpkTqiSAUOusTY-128x128-noPad.jpg?1519872572', 'processing': False, 'size': {'width': 128, 'height': 128}}, 'large': {'url': '//assets.change.org/photos/1/pk/tq/WJpkTqiSAUOusTY-400x400-noPad.jpg?1519872572', 'processing': False, 'size': {'width': 400, 'height': 400}}, 'xlarge': {'url': '//assets.change.org/photos/1/pk/tq/WJpkTqiSAUOusTY-800x800-noPad.jpg?1519872572', 'processing': False, 'size': {'width': 800, 'height': 800}}}}}, {'id': 10149883, 'display_name': 'Amber Heard', 'email': None, 'type': 'Custom', 'slug': 'amber-heard', 'description': None, 'photo_id': None, 'publicly_visible': False, 'verified_at': None, 'summary': None, 'locale': None, 'confirmed_at': None, 'is_person': True, 'member_of': {}, 'additional_data': {'first_name': 'Amber', 'last_name': 'Heard', 'title': None, 'id': 10054371}, 'has_email': False}]",False,False,False,Princess Consuela Bananahammock,225083156,photos/4/vb/cy/egvBCYaPcFribkY-fullsize.jpg,//assets.change.org/photos/4/vb/cy/egvBCYaPcFribkY-48x48-noPad.jpg?1610622599,False,48,48,//assets.change.org/photos/4/vb/cy/egvBCYaPcFribkY-128x128-noPad.jpg?1610622599,False,128,128,//assets.change.org/photos/4/vb/cy/egvBCYaPcFribkY-400x400-noPad.jpg?1610622599,False,400,400,//assets.change.org/photos/4/vb/cy/egvBCYaPcFribkY-800x800-noPad.jpg?1610622599,False,800,800,"Petition to Hold Amber Heard Accountable! Amber Heard, Honour Your Pledge To CHLA","Petition to Hold Amber Heard Accountable! Amber Heard, Honour Your Pledge To CHLA",active,500,225083314,photos/0/hh/jv/uShHJVzAYgRmApu-fullsize.jpg,//assets.change.org/photos/0/hh/jv/uShHJVzAYgRmApu-400x400-noPad.jpg?1610626508,False,400,400,//assets.change.org/photos/0/hh/jv/uShHJVzAYgRmApu-400x225-noPad.jpg?1610626508,False,400,225,//assets.change.org/photos/0/hh/jv/uShHJVzAYgRmApu-800x450-noPad.jpg?1610626509,False,800,450,//assets.change.org/photos/0/hh/jv/uShHJVzAYgRmApu-1600x900-noPad.jpg?1610626509,False,1600,900,photo,33678,Twitter,,Custom,twitter-2,"Twitter is a real-time information network that connects you to the latest stories, ideas, opinions and news about what you find interesting.",True,,,en-US,,True,Twitter,,,42729,False,11701415,photos/1/pk/tq/WJpkTqiSAUOusTY-fullsize.jpg,//assets.change.org/photos/1/pk/tq/WJpkTqiSAUOusTY-48x48-noPad.jpg?1519872572,False,48,48,//assets.change.org/photos/1/pk/tq/WJpkTqiSAUOusTY-128x128-noPad.jpg?1519872572,False,128,128,//assets.change.org/photos/1/pk/tq/WJpkTqiSAUOusTY-400x400-noPad.jpg?1519872572,False,400,400,//assets.change.org/photos/1/pk/tq/WJpkTqiSAUOusTY-800x800-noPad.jpg?1519872572,False,800,800,57
