809129436,"Johnny Depp does not deserve to be reprimanded for speaking up against his abuser. He is the victim, and you taking away his characters and career opportunities make you aligned with his abuser- making you a toxic nasty company perpetuating victim shame.",0,0,Event,25793976,1,comment,2020-11-11T23:36:21Z,,1163648327,1163648327,Cayla,Gaddis,Cayla,Cayla Gaddis,Corvallis,OR,US,,en-US,,[],25793976,25793976,Stop Disney removing Jack Sparrow!,2020-11-11T22:05:41Z,,2020-11-11T22:06:04Z,2020-11-13T23:18:23Z,en-GB,['en'],Disney : Stop Disney removing Jack Sparrow!,"<p>Since amber heard has made her terrible claims and lies against Johnny Depp it’s been said he will lose his roles in fantastic beasts and pirates of the Caribbean. <br>It’s also now been claimed Disney will be taking away our beloved Captain Jack Sparrow from their pirates of the Caribbean ride at their Disneyland parks. Captain Jack is everyone’s favourite pirate, and without him Pirates of the Caribbean wouldn’t be as great as what it is! <br>Let’s get justice for Johnny Depp! Let us see him keep his movies we all love and his place in the Disneyland attraction! </p>",Disney,Stop Disney removing Jack Sparrow!,2021-11-13,,,GB,55.3781,-3.43597,,,,,disney-stop-disney-removing-jack-sparrow,published,,,False,False,,False,,"[{'id': 476543, 'locale': 'en-GB', 'name': 'Other', 'slug': 'other-en-gb', 'photo_id': None, 'created_by_owner': True, 'created_by_staff_member': False, 'total_count': 66966}]",True,False,,2300,2300,0,3492,405,0,0,0,0,0,121,,,,,,224849143,photos/4/cp/fl/MkcpFLKRAKdEgkY-fullsize.jpg,//assets.change.org/photos/4/cp/fl/MkcpFLKRAKdEgkY-400x400-noPad.jpg?1605132342,False,400,400,//assets.change.org/photos/4/cp/fl/MkcpFLKRAKdEgkY-400x225-noPad.jpg?1605132342,False,400,225,//assets.change.org/photos/4/cp/fl/MkcpFLKRAKdEgkY-800x450-noPad.jpg?1605132342,False,800,450,//assets.change.org/photos/4/cp/fl/MkcpFLKRAKdEgkY-1600x900-noPad.jpg?1605132342,False,1600,900,photo,962285158,962285158,Lauren,Peddie,Lauren,Lauren Peddie,Peterborough,ENG,GB,,en-GB,,[],3,1653002447,1,1654019886,3,1654340646,5,1654021437,16,1655010290.148,4,1654019781.859,5,1654340703.175,10,1654659292.659,1,1653318137.159,4,1651944514.522,"[{'id': 585843, 'display_name': 'Disney', 'email': None, 'type': 'Custom', 'slug': 'disney-3', 'description': 'The Walt Disney Company is a leading diversified international family entertainment and media enterprise with five business segments: media networks, parks and resorts, studio entertainment, consumer products and interactive media.', 'publicly_visible': False, 'verified_at': None, 'summary': None, 'locale': 'en-US', 'confirmed_at': None, 'is_person': True, 'member_of': {}, 'additional_data': {'first_name': 'Disney', 'last_name': None, 'title': None, 'id': 29785}, 'has_email': False, 'photo': {'id': 11704124, 'url': 'photos/1/fc/sa/OpfCsAdtvgKjfEm-fullsize.jpg', 'sizes': {'small': {'url': '//assets.change.org/photos/1/fc/sa/OpfCsAdtvgKjfEm-48x48-noPad.jpg?1519873711', 'processing': False, 'size': {'width': 48, 'height': 48}}, 'medium': {'url': '//assets.change.org/photos/1/fc/sa/OpfCsAdtvgKjfEm-128x128-noPad.jpg?1519873711', 'processing': False, 'size': {'width': 128, 'height': 128}}, 'large': {'url': '//assets.change.org/photos/1/fc/sa/OpfCsAdtvgKjfEm-400x400-noPad.jpg?1519873711', 'processing': False, 'size': {'width': 400, 'height': 400}}, 'xlarge': {'url': '//assets.change.org/photos/1/fc/sa/OpfCsAdtvgKjfEm-800x800-noPad.jpg?1519873712', 'processing': False, 'size': {'width': 800, 'height': 800}}}}}]",False,False,False,Lauren Peddie,Disney : Stop Disney removing Jack Sparrow!,Disney : Stop Disney removing Jack Sparrow!,active,2500,224849143,photos/4/cp/fl/MkcpFLKRAKdEgkY-fullsize.jpg,//assets.change.org/photos/4/cp/fl/MkcpFLKRAKdEgkY-400x400-noPad.jpg?1605132342,False,400,400,//assets.change.org/photos/4/cp/fl/MkcpFLKRAKdEgkY-400x225-noPad.jpg?1605132342,False,400,225,//assets.change.org/photos/4/cp/fl/MkcpFLKRAKdEgkY-800x450-noPad.jpg?1605132342,False,800,450,//assets.change.org/photos/4/cp/fl/MkcpFLKRAKdEgkY-1600x900-noPad.jpg?1605132342,False,1600,900,photo,585843,Disney,,Custom,disney-3,"The Walt Disney Company is a leading diversified international family entertainment and media enterprise with five business segments: media networks, parks and resorts, studio entertainment, consumer products and interactive media.",False,,,en-US,,True,Disney,,,29785,False,11704124,photos/1/fc/sa/OpfCsAdtvgKjfEm-fullsize.jpg,//assets.change.org/photos/1/fc/sa/OpfCsAdtvgKjfEm-48x48-noPad.jpg?1519873711,False,48,48,//assets.change.org/photos/1/fc/sa/OpfCsAdtvgKjfEm-128x128-noPad.jpg?1519873711,False,128,128,//assets.change.org/photos/1/fc/sa/OpfCsAdtvgKjfEm-400x400-noPad.jpg?1519873711,False,400,400,//assets.change.org/photos/1/fc/sa/OpfCsAdtvgKjfEm-800x800-noPad.jpg?1519873712,False,800,800,92,,,,,,,,,,,,,,,,,,
809129429,Don't remove it!!!,0,0,Event,25793976,1,comment,2020-11-11T23:36:10Z,,77698649,77698649,Cecily,Jackson,Cecily,Cecily Jackson,fayetteville,AR,US,,en-US,,[],25793976,25793976,Stop Disney removing Jack Sparrow!,2020-11-11T22:05:41Z,,2020-11-11T22:06:04Z,2020-11-13T23:18:23Z,en-GB,['en'],Disney : Stop Disney removing Jack Sparrow!,"<p>Since amber heard has made her terrible claims and lies against Johnny Depp it’s been said he will lose his roles in fantastic beasts and pirates of the Caribbean. <br>It’s also now been claimed Disney will be taking away our beloved Captain Jack Sparrow from their pirates of the Caribbean ride at their Disneyland parks. Captain Jack is everyone’s favourite pirate, and without him Pirates of the Caribbean wouldn’t be as great as what it is! <br>Let’s get justice for Johnny Depp! Let us see him keep his movies we all love and his place in the Disneyland attraction! </p>",Disney,Stop Disney removing Jack Sparrow!,2021-11-13,,,GB,55.3781,-3.43597,,,,,disney-stop-disney-removing-jack-sparrow,published,,,False,False,,False,,"[{'id': 476543, 'locale': 'en-GB', 'name': 'Other', 'slug': 'other-en-gb', 'photo_id': None, 'created_by_owner': True, 'created_by_staff_member': False, 'total_count': 66966}]",True,False,,2300,2300,0,3492,405,0,0,0,0,0,121,,,,,,224849143,photos/4/cp/fl/MkcpFLKRAKdEgkY-fullsize.jpg,//assets.change.org/photos/4/cp/fl/MkcpFLKRAKdEgkY-400x400-noPad.jpg?1605132342,False,400,400,//assets.change.org/photos/4/cp/fl/MkcpFLKRAKdEgkY-400x225-noPad.jpg?1605132342,False,400,225,//assets.change.org/photos/4/cp/fl/MkcpFLKRAKdEgkY-800x450-noPad.jpg?1605132342,False,800,450,//assets.change.org/photos/4/cp/fl/MkcpFLKRAKdEgkY-1600x900-noPad.jpg?1605132342,False,1600,900,photo,962285158,962285158,Lauren,Peddie,Lauren,Lauren Peddie,Peterborough,ENG,GB,,en-GB,,[],3,1653002447,1,1654019886,3,1654340646,5,1654021437,16,1655010290.148,4,1654019781.859,5,1654340703.175,10,1654659292.659,1,1653318137.159,4,1651944514.522,"[{'id': 585843, 'display_name': 'Disney', 'email': None, 'type': 'Custom', 'slug': 'disney-3', 'description': 'The Walt Disney Company is a leading diversified international family entertainment and media enterprise with five business segments: media networks, parks and resorts, studio entertainment, consumer products and interactive media.', 'publicly_visible': False, 'verified_at': None, 'summary': None, 'locale': 'en-US', 'confirmed_at': None, 'is_person': True, 'member_of': {}, 'additional_data': {'first_name': 'Disney', 'last_name': None, 'title': None, 'id': 29785}, 'has_email': False, 'photo': {'id': 11704124, 'url': 'photos/1/fc/sa/OpfCsAdtvgKjfEm-fullsize.jpg', 'sizes': {'small': {'url': '//assets.change.org/photos/1/fc/sa/OpfCsAdtvgKjfEm-48x48-noPad.jpg?1519873711', 'processing': False, 'size': {'width': 48, 'height': 48}}, 'medium': {'url': '//assets.change.org/photos/1/fc/sa/OpfCsAdtvgKjfEm-128x128-noPad.jpg?1519873711', 'processing': False, 'size': {'width': 128, 'height': 128}}, 'large': {'url': '//assets.change.org/photos/1/fc/sa/OpfCsAdtvgKjfEm-400x400-noPad.jpg?1519873711', 'processing': False, 'size': {'width': 400, 'height': 400}}, 'xlarge': {'url': '//assets.change.org/photos/1/fc/sa/OpfCsAdtvgKjfEm-800x800-noPad.jpg?1519873712', 'processing': False, 'size': {'width': 800, 'height': 800}}}}}]",False,False,False,Lauren Peddie,Disney : Stop Disney removing Jack Sparrow!,Disney : Stop Disney removing Jack Sparrow!,active,2500,224849143,photos/4/cp/fl/MkcpFLKRAKdEgkY-fullsize.jpg,//assets.change.org/photos/4/cp/fl/MkcpFLKRAKdEgkY-400x400-noPad.jpg?1605132342,False,400,400,//assets.change.org/photos/4/cp/fl/MkcpFLKRAKdEgkY-400x225-noPad.jpg?1605132342,False,400,225,//assets.change.org/photos/4/cp/fl/MkcpFLKRAKdEgkY-800x450-noPad.jpg?1605132342,False,800,450,//assets.change.org/photos/4/cp/fl/MkcpFLKRAKdEgkY-1600x900-noPad.jpg?1605132342,False,1600,900,photo,585843,Disney,,Custom,disney-3,"The Walt Disney Company is a leading diversified international family entertainment and media enterprise with five business segments: media networks, parks and resorts, studio entertainment, consumer products and interactive media.",False,,,en-US,,True,Disney,,,29785,False,11704124,photos/1/fc/sa/OpfCsAdtvgKjfEm-fullsize.jpg,//assets.change.org/photos/1/fc/sa/OpfCsAdtvgKjfEm-48x48-noPad.jpg?1519873711,False,48,48,//assets.change.org/photos/1/fc/sa/OpfCsAdtvgKjfEm-128x128-noPad.jpg?1519873711,False,128,128,//assets.change.org/photos/1/fc/sa/OpfCsAdtvgKjfEm-400x400-noPad.jpg?1519873711,False,400,400,//assets.change.org/photos/1/fc/sa/OpfCsAdtvgKjfEm-800x800-noPad.jpg?1519873712,False,800,800,92,43732606.0,photos/5/zh/hf/wtZHhFPLnudkBaS-fullsize.jpg,//assets.change.org/photos/5/zh/hf/wtZHhFPLnudkBaS-48x48-noPad.jpg?1522975626,False,48.0,48.0,//assets.change.org/photos/5/zh/hf/wtZHhFPLnudkBaS-128x128-noPad.jpg?1522975626,False,128.0,128.0,//assets.change.org/photos/5/zh/hf/wtZHhFPLnudkBaS-400x400-noPad.jpg?1522975626,False,400.0,400.0,//assets.change.org/photos/5/zh/hf/wtZHhFPLnudkBaS-800x800-noPad.jpg?1522975626,False,800.0,800.0
809129349,"He is not the abuser! She is, #justiceforjohnny",0,0,Event,25793976,1,comment,2020-11-11T23:34:45Z,,627930422,627930422,Rebecca,Gurrola,Rebecca,Rebecca Gurrola,Las Cruces,NM,US,,en-US,,[],25793976,25793976,Stop Disney removing Jack Sparrow!,2020-11-11T22:05:41Z,,2020-11-11T22:06:04Z,2020-11-13T23:18:23Z,en-GB,['en'],Disney : Stop Disney removing Jack Sparrow!,"<p>Since amber heard has made her terrible claims and lies against Johnny Depp it’s been said he will lose his roles in fantastic beasts and pirates of the Caribbean. <br>It’s also now been claimed Disney will be taking away our beloved Captain Jack Sparrow from their pirates of the Caribbean ride at their Disneyland parks. Captain Jack is everyone’s favourite pirate, and without him Pirates of the Caribbean wouldn’t be as great as what it is! <br>Let’s get justice for Johnny Depp! Let us see him keep his movies we all love and his place in the Disneyland attraction! </p>",Disney,Stop Disney removing Jack Sparrow!,2021-11-13,,,GB,55.3781,-3.43597,,,,,disney-stop-disney-removing-jack-sparrow,published,,,False,False,,False,,"[{'id': 476543, 'locale': 'en-GB', 'name': 'Other', 'slug': 'other-en-gb', 'photo_id': None, 'created_by_owner': True, 'created_by_staff_member': False, 'total_count': 66966}]",True,False,,2300,2300,0,3492,405,0,0,0,0,0,121,,,,,,224849143,photos/4/cp/fl/MkcpFLKRAKdEgkY-fullsize.jpg,//assets.change.org/photos/4/cp/fl/MkcpFLKRAKdEgkY-400x400-noPad.jpg?1605132342,False,400,400,//assets.change.org/photos/4/cp/fl/MkcpFLKRAKdEgkY-400x225-noPad.jpg?1605132342,False,400,225,//assets.change.org/photos/4/cp/fl/MkcpFLKRAKdEgkY-800x450-noPad.jpg?1605132342,False,800,450,//assets.change.org/photos/4/cp/fl/MkcpFLKRAKdEgkY-1600x900-noPad.jpg?1605132342,False,1600,900,photo,962285158,962285158,Lauren,Peddie,Lauren,Lauren Peddie,Peterborough,ENG,GB,,en-GB,,[],3,1653002447,1,1654019886,3,1654340646,5,1654021437,16,1655010290.148,4,1654019781.859,5,1654340703.175,10,1654659292.659,1,1653318137.159,4,1651944514.522,"[{'id': 585843, 'display_name': 'Disney', 'email': None, 'type': 'Custom', 'slug': 'disney-3', 'description': 'The Walt Disney Company is a leading diversified international family entertainment and media enterprise with five business segments: media networks, parks and resorts, studio entertainment, consumer products and interactive media.', 'publicly_visible': False, 'verified_at': None, 'summary': None, 'locale': 'en-US', 'confirmed_at': None, 'is_person': True, 'member_of': {}, 'additional_data': {'first_name': 'Disney', 'last_name': None, 'title': None, 'id': 29785}, 'has_email': False, 'photo': {'id': 11704124, 'url': 'photos/1/fc/sa/OpfCsAdtvgKjfEm-fullsize.jpg', 'sizes': {'small': {'url': '//assets.change.org/photos/1/fc/sa/OpfCsAdtvgKjfEm-48x48-noPad.jpg?1519873711', 'processing': False, 'size': {'width': 48, 'height': 48}}, 'medium': {'url': '//assets.change.org/photos/1/fc/sa/OpfCsAdtvgKjfEm-128x128-noPad.jpg?1519873711', 'processing': False, 'size': {'width': 128, 'height': 128}}, 'large': {'url': '//assets.change.org/photos/1/fc/sa/OpfCsAdtvgKjfEm-400x400-noPad.jpg?1519873711', 'processing': False, 'size': {'width': 400, 'height': 400}}, 'xlarge': {'url': '//assets.change.org/photos/1/fc/sa/OpfCsAdtvgKjfEm-800x800-noPad.jpg?1519873712', 'processing': False, 'size': {'width': 800, 'height': 800}}}}}]",False,False,False,Lauren Peddie,Disney : Stop Disney removing Jack Sparrow!,Disney : Stop Disney removing Jack Sparrow!,active,2500,224849143,photos/4/cp/fl/MkcpFLKRAKdEgkY-fullsize.jpg,//assets.change.org/photos/4/cp/fl/MkcpFLKRAKdEgkY-400x400-noPad.jpg?1605132342,False,400,400,//assets.change.org/photos/4/cp/fl/MkcpFLKRAKdEgkY-400x225-noPad.jpg?1605132342,False,400,225,//assets.change.org/photos/4/cp/fl/MkcpFLKRAKdEgkY-800x450-noPad.jpg?1605132342,False,800,450,//assets.change.org/photos/4/cp/fl/MkcpFLKRAKdEgkY-1600x900-noPad.jpg?1605132342,False,1600,900,photo,585843,Disney,,Custom,disney-3,"The Walt Disney Company is a leading diversified international family entertainment and media enterprise with five business segments: media networks, parks and resorts, studio entertainment, consumer products and interactive media.",False,,,en-US,,True,Disney,,,29785,False,11704124,photos/1/fc/sa/OpfCsAdtvgKjfEm-fullsize.jpg,//assets.change.org/photos/1/fc/sa/OpfCsAdtvgKjfEm-48x48-noPad.jpg?1519873711,False,48,48,//assets.change.org/photos/1/fc/sa/OpfCsAdtvgKjfEm-128x128-noPad.jpg?1519873711,False,128,128,//assets.change.org/photos/1/fc/sa/OpfCsAdtvgKjfEm-400x400-noPad.jpg?1519873711,False,400,400,//assets.change.org/photos/1/fc/sa/OpfCsAdtvgKjfEm-800x800-noPad.jpg?1519873712,False,800,800,92,,,,,,,,,,,,,,,,,,
809129275,"I love Johnny depp, he has made my childhood so great and I would never be able to watch pirates of the Caribbean if he wasn't Jack sparrow",0,0,Event,25793976,1,comment,2020-11-11T23:33:36Z,,797286685,797286685,Tara,Canniff,Tara,Tara Canniff,Trenton,,CA,,en-CA,,[],25793976,25793976,Stop Disney removing Jack Sparrow!,2020-11-11T22:05:41Z,,2020-11-11T22:06:04Z,2020-11-13T23:18:23Z,en-GB,['en'],Disney : Stop Disney removing Jack Sparrow!,"<p>Since amber heard has made her terrible claims and lies against Johnny Depp it’s been said he will lose his roles in fantastic beasts and pirates of the Caribbean. <br>It’s also now been claimed Disney will be taking away our beloved Captain Jack Sparrow from their pirates of the Caribbean ride at their Disneyland parks. Captain Jack is everyone’s favourite pirate, and without him Pirates of the Caribbean wouldn’t be as great as what it is! <br>Let’s get justice for Johnny Depp! Let us see him keep his movies we all love and his place in the Disneyland attraction! </p>",Disney,Stop Disney removing Jack Sparrow!,2021-11-13,,,GB,55.3781,-3.43597,,,,,disney-stop-disney-removing-jack-sparrow,published,,,False,False,,False,,"[{'id': 476543, 'locale': 'en-GB', 'name': 'Other', 'slug': 'other-en-gb', 'photo_id': None, 'created_by_owner': True, 'created_by_staff_member': False, 'total_count': 66966}]",True,False,,2300,2300,0,3492,405,0,0,0,0,0,121,,,,,,224849143,photos/4/cp/fl/MkcpFLKRAKdEgkY-fullsize.jpg,//assets.change.org/photos/4/cp/fl/MkcpFLKRAKdEgkY-400x400-noPad.jpg?1605132342,False,400,400,//assets.change.org/photos/4/cp/fl/MkcpFLKRAKdEgkY-400x225-noPad.jpg?1605132342,False,400,225,//assets.change.org/photos/4/cp/fl/MkcpFLKRAKdEgkY-800x450-noPad.jpg?1605132342,False,800,450,//assets.change.org/photos/4/cp/fl/MkcpFLKRAKdEgkY-1600x900-noPad.jpg?1605132342,False,1600,900,photo,962285158,962285158,Lauren,Peddie,Lauren,Lauren Peddie,Peterborough,ENG,GB,,en-GB,,[],3,1653002447,1,1654019886,3,1654340646,5,1654021437,16,1655010290.148,4,1654019781.859,5,1654340703.175,10,1654659292.659,1,1653318137.159,4,1651944514.522,"[{'id': 585843, 'display_name': 'Disney', 'email': None, 'type': 'Custom', 'slug': 'disney-3', 'description': 'The Walt Disney Company is a leading diversified international family entertainment and media enterprise with five business segments: media networks, parks and resorts, studio entertainment, consumer products and interactive media.', 'publicly_visible': False, 'verified_at': None, 'summary': None, 'locale': 'en-US', 'confirmed_at': None, 'is_person': True, 'member_of': {}, 'additional_data': {'first_name': 'Disney', 'last_name': None, 'title': None, 'id': 29785}, 'has_email': False, 'photo': {'id': 11704124, 'url': 'photos/1/fc/sa/OpfCsAdtvgKjfEm-fullsize.jpg', 'sizes': {'small': {'url': '//assets.change.org/photos/1/fc/sa/OpfCsAdtvgKjfEm-48x48-noPad.jpg?1519873711', 'processing': False, 'size': {'width': 48, 'height': 48}}, 'medium': {'url': '//assets.change.org/photos/1/fc/sa/OpfCsAdtvgKjfEm-128x128-noPad.jpg?1519873711', 'processing': False, 'size': {'width': 128, 'height': 128}}, 'large': {'url': '//assets.change.org/photos/1/fc/sa/OpfCsAdtvgKjfEm-400x400-noPad.jpg?1519873711', 'processing': False, 'size': {'width': 400, 'height': 400}}, 'xlarge': {'url': '//assets.change.org/photos/1/fc/sa/OpfCsAdtvgKjfEm-800x800-noPad.jpg?1519873712', 'processing': False, 'size': {'width': 800, 'height': 800}}}}}]",False,False,False,Lauren Peddie,Disney : Stop Disney removing Jack Sparrow!,Disney : Stop Disney removing Jack Sparrow!,active,2500,224849143,photos/4/cp/fl/MkcpFLKRAKdEgkY-fullsize.jpg,//assets.change.org/photos/4/cp/fl/MkcpFLKRAKdEgkY-400x400-noPad.jpg?1605132342,False,400,400,//assets.change.org/photos/4/cp/fl/MkcpFLKRAKdEgkY-400x225-noPad.jpg?1605132342,False,400,225,//assets.change.org/photos/4/cp/fl/MkcpFLKRAKdEgkY-800x450-noPad.jpg?1605132342,False,800,450,//assets.change.org/photos/4/cp/fl/MkcpFLKRAKdEgkY-1600x900-noPad.jpg?1605132342,False,1600,900,photo,585843,Disney,,Custom,disney-3,"The Walt Disney Company is a leading diversified international family entertainment and media enterprise with five business segments: media networks, parks and resorts, studio entertainment, consumer products and interactive media.",False,,,en-US,,True,Disney,,,29785,False,11704124,photos/1/fc/sa/OpfCsAdtvgKjfEm-fullsize.jpg,//assets.change.org/photos/1/fc/sa/OpfCsAdtvgKjfEm-48x48-noPad.jpg?1519873711,False,48,48,//assets.change.org/photos/1/fc/sa/OpfCsAdtvgKjfEm-128x128-noPad.jpg?1519873711,False,128,128,//assets.change.org/photos/1/fc/sa/OpfCsAdtvgKjfEm-400x400-noPad.jpg?1519873711,False,400,400,//assets.change.org/photos/1/fc/sa/OpfCsAdtvgKjfEm-800x800-noPad.jpg?1519873712,False,800,800,92,200249548.0,photos/1/ws/io/JMWSIOHNIyzuQdt-fullsize.jpg,//assets.change.org/photos/1/ws/io/JMWSIOHNIyzuQdt-48x48-noPad.jpg?1514814363,False,48.0,48.0,//assets.change.org/photos/1/ws/io/JMWSIOHNIyzuQdt-128x128-noPad.jpg?1514814363,False,128.0,128.0,//assets.change.org/photos/1/ws/io/JMWSIOHNIyzuQdt-400x400-noPad.jpg?1514814363,False,400.0,400.0,//assets.change.org/photos/1/ws/io/JMWSIOHNIyzuQdt-800x800-noPad.jpg?1514814363,False,800.0,800.0
809128811,We want Johnny deep back !,0,0,Event,25793976,1,comment,2020-11-11T23:24:21Z,,1163648770,1163648770,Tristan,Olivarez,Tristan,Tristan Olivarez,Houston,TX,US,,en-US,,[],25793976,25793976,Stop Disney removing Jack Sparrow!,2020-11-11T22:05:41Z,,2020-11-11T22:06:04Z,2020-11-13T23:18:23Z,en-GB,['en'],Disney : Stop Disney removing Jack Sparrow!,"<p>Since amber heard has made her terrible claims and lies against Johnny Depp it’s been said he will lose his roles in fantastic beasts and pirates of the Caribbean. <br>It’s also now been claimed Disney will be taking away our beloved Captain Jack Sparrow from their pirates of the Caribbean ride at their Disneyland parks. Captain Jack is everyone’s favourite pirate, and without him Pirates of the Caribbean wouldn’t be as great as what it is! <br>Let’s get justice for Johnny Depp! Let us see him keep his movies we all love and his place in the Disneyland attraction! </p>",Disney,Stop Disney removing Jack Sparrow!,2021-11-13,,,GB,55.3781,-3.43597,,,,,disney-stop-disney-removing-jack-sparrow,published,,,False,False,,False,,"[{'id': 476543, 'locale': 'en-GB', 'name': 'Other', 'slug': 'other-en-gb', 'photo_id': None, 'created_by_owner': True, 'created_by_staff_member': False, 'total_count': 66966}]",True,False,,2300,2300,0,3492,405,0,0,0,0,0,121,,,,,,224849143,photos/4/cp/fl/MkcpFLKRAKdEgkY-fullsize.jpg,//assets.change.org/photos/4/cp/fl/MkcpFLKRAKdEgkY-400x400-noPad.jpg?1605132342,False,400,400,//assets.change.org/photos/4/cp/fl/MkcpFLKRAKdEgkY-400x225-noPad.jpg?1605132342,False,400,225,//assets.change.org/photos/4/cp/fl/MkcpFLKRAKdEgkY-800x450-noPad.jpg?1605132342,False,800,450,//assets.change.org/photos/4/cp/fl/MkcpFLKRAKdEgkY-1600x900-noPad.jpg?1605132342,False,1600,900,photo,962285158,962285158,Lauren,Peddie,Lauren,Lauren Peddie,Peterborough,ENG,GB,,en-GB,,[],3,1653002447,1,1654019886,3,1654340646,5,1654021437,16,1655010290.148,4,1654019781.859,5,1654340703.175,10,1654659292.659,1,1653318137.159,4,1651944514.522,"[{'id': 585843, 'display_name': 'Disney', 'email': None, 'type': 'Custom', 'slug': 'disney-3', 'description': 'The Walt Disney Company is a leading diversified international family entertainment and media enterprise with five business segments: media networks, parks and resorts, studio entertainment, consumer products and interactive media.', 'publicly_visible': False, 'verified_at': None, 'summary': None, 'locale': 'en-US', 'confirmed_at': None, 'is_person': True, 'member_of': {}, 'additional_data': {'first_name': 'Disney', 'last_name': None, 'title': None, 'id': 29785}, 'has_email': False, 'photo': {'id': 11704124, 'url': 'photos/1/fc/sa/OpfCsAdtvgKjfEm-fullsize.jpg', 'sizes': {'small': {'url': '//assets.change.org/photos/1/fc/sa/OpfCsAdtvgKjfEm-48x48-noPad.jpg?1519873711', 'processing': False, 'size': {'width': 48, 'height': 48}}, 'medium': {'url': '//assets.change.org/photos/1/fc/sa/OpfCsAdtvgKjfEm-128x128-noPad.jpg?1519873711', 'processing': False, 'size': {'width': 128, 'height': 128}}, 'large': {'url': '//assets.change.org/photos/1/fc/sa/OpfCsAdtvgKjfEm-400x400-noPad.jpg?1519873711', 'processing': False, 'size': {'width': 400, 'height': 400}}, 'xlarge': {'url': '//assets.change.org/photos/1/fc/sa/OpfCsAdtvgKjfEm-800x800-noPad.jpg?1519873712', 'processing': False, 'size': {'width': 800, 'height': 800}}}}}]",False,False,False,Lauren Peddie,Disney : Stop Disney removing Jack Sparrow!,Disney : Stop Disney removing Jack Sparrow!,active,2500,224849143,photos/4/cp/fl/MkcpFLKRAKdEgkY-fullsize.jpg,//assets.change.org/photos/4/cp/fl/MkcpFLKRAKdEgkY-400x400-noPad.jpg?1605132342,False,400,400,//assets.change.org/photos/4/cp/fl/MkcpFLKRAKdEgkY-400x225-noPad.jpg?1605132342,False,400,225,//assets.change.org/photos/4/cp/fl/MkcpFLKRAKdEgkY-800x450-noPad.jpg?1605132342,False,800,450,//assets.change.org/photos/4/cp/fl/MkcpFLKRAKdEgkY-1600x900-noPad.jpg?1605132342,False,1600,900,photo,585843,Disney,,Custom,disney-3,"The Walt Disney Company is a leading diversified international family entertainment and media enterprise with five business segments: media networks, parks and resorts, studio entertainment, consumer products and interactive media.",False,,,en-US,,True,Disney,,,29785,False,11704124,photos/1/fc/sa/OpfCsAdtvgKjfEm-fullsize.jpg,//assets.change.org/photos/1/fc/sa/OpfCsAdtvgKjfEm-48x48-noPad.jpg?1519873711,False,48,48,//assets.change.org/photos/1/fc/sa/OpfCsAdtvgKjfEm-128x128-noPad.jpg?1519873711,False,128,128,//assets.change.org/photos/1/fc/sa/OpfCsAdtvgKjfEm-400x400-noPad.jpg?1519873711,False,400,400,//assets.change.org/photos/1/fc/sa/OpfCsAdtvgKjfEm-800x800-noPad.jpg?1519873712,False,800,800,92,,,,,,,,,,,,,,,,,,
