id,comment,parent_id,children_count,commentable_type,commentable_id,likes,role,created_at,deleted_at,user.id,user.slug,user.first_name,user.last_name,user.short_display_name,user.display_name,user.city,user.state_code,user.country_code,user.website,user.locale,user.description,user.roles,commentable_entity.id,commentable_entity.document_id,commentable_entity.ask,commentable_entity.created_at,commentable_entity.deleted_at,commentable_entity.published_at,commentable_entity.last_edited_at,commentable_entity.original_locale,commentable_entity.languages,commentable_entity.title,commentable_entity.description,commentable_entity.targeting_description,commentable_entity.letter_body,commentable_entity.end_date,commentable_entity.goal,commentable_entity.relevant_location.city,commentable_entity.relevant_location.country_code,commentable_entity.relevant_location.lat,commentable_entity.relevant_location.lng,commentable_entity.relevant_location.state_code,commentable_entity.relevant_location.google_places_id,commentable_entity.relevant_location.photo_id,commentable_entity.restricted_location,commentable_entity.slug,commentable_entity.status,commentable_entity.victory_date,commentable_entity.victory_description,commentable_entity.is_verified_victory,commentable_entity.is_victory,commentable_entity.video_id,commentable_entity.is_pledge,commentable_entity.topic,commentable_entity.tags,commentable_entity.discoverable,commentable_entity.sponsored_campaign,commentable_entity.organization_free_email_optins,commentable_entity.displayed_signature_count,commentable_entity.total_signature_count,commentable_entity.weekly_signature_count,commentable_entity.total_page_views,commentable_entity.total_share_count,commentable_entity.daily_signature_count,commentable_entity.monthly_signature_count,commentable_entity.daily_signup_count,commentable_entity.weekly_signup_count,commentable_entity.monthly_signup_count,commentable_entity.total_signup_count,commentable_entity.supporter_message_count,commentable_entity.starter_vanity_url,commentable_entity.featured_title,commentable_entity.media_text,commentable_entity.media_url,commentable_entity.photo.id,commentable_entity.photo.url,commentable_entity.photo.sizes.square.url,commentable_entity.photo.sizes.square.processing,commentable_entity.photo.sizes.square.size.width,commentable_entity.photo.sizes.square.size.height,commentable_entity.photo.sizes.small.url,commentable_entity.photo.sizes.small.processing,commentable_entity.photo.sizes.small.size.width,commentable_entity.photo.sizes.small.size.height,commentable_entity.photo.sizes.medium.url,commentable_entity.photo.sizes.medium.processing,commentable_entity.photo.sizes.medium.size.width,commentable_entity.photo.sizes.medium.size.height,commentable_entity.photo.sizes.large.url,commentable_entity.photo.sizes.large.processing,commentable_entity.photo.sizes.large.size.width,commentable_entity.photo.sizes.large.size.height,commentable_entity.photo.type,commentable_entity.user.id,commentable_entity.user.slug,commentable_entity.user.first_name,commentable_entity.user.last_name,commentable_entity.user.short_display_name,commentable_entity.user.display_name,commentable_entity.user.city,commentable_entity.user.state_code,commentable_entity.user.country_code,commentable_entity.user.website,commentable_entity.user.locale,commentable_entity.user.description,commentable_entity.user.photo.id,commentable_entity.user.photo.url,commentable_entity.user.photo.sizes.small.url,commentable_entity.user.photo.sizes.small.processing,commentable_entity.user.photo.sizes.small.size.width,commentable_entity.user.photo.sizes.small.size.height,commentable_entity.user.photo.sizes.medium.url,commentable_entity.user.photo.sizes.medium.processing,commentable_entity.user.photo.sizes.medium.size.width,commentable_entity.user.photo.sizes.medium.size.height,commentable_entity.user.photo.sizes.large.url,commentable_entity.user.photo.sizes.large.processing,commentable_entity.user.photo.sizes.large.size.width,commentable_entity.user.photo.sizes.large.size.height,commentable_entity.user.photo.sizes.xlarge.url,commentable_entity.user.photo.sizes.xlarge.processing,commentable_entity.user.photo.sizes.xlarge.size.width,commentable_entity.user.photo.sizes.xlarge.size.height,commentable_entity.user.roles,commentable_entity.targets,commentable_entity.hide_comments,commentable_entity.hide_dm_action_panel,commentable_entity.enable_human_verification,commentable_entity.creator_name,commentable_entity.creator_photo.id,commentable_entity.creator_photo.url,commentable_entity.creator_photo.sizes.small.url,commentable_entity.creator_photo.sizes.small.processing,commentable_entity.creator_photo.sizes.small.size.width,commentable_entity.creator_photo.sizes.small.size.height,commentable_entity.creator_photo.sizes.medium.url,commentable_entity.creator_photo.sizes.medium.processing,commentable_entity.creator_photo.sizes.medium.size.width,commentable_entity.creator_photo.sizes.medium.size.height,commentable_entity.creator_photo.sizes.large.url,commentable_entity.creator_photo.sizes.large.processing,commentable_entity.creator_photo.sizes.large.size.width,commentable_entity.creator_photo.sizes.large.size.height,commentable_entity.creator_photo.sizes.xlarge.url,commentable_entity.creator_photo.sizes.xlarge.processing,commentable_entity.creator_photo.sizes.xlarge.size.width,commentable_entity.creator_photo.sizes.xlarge.size.height,commentable_entity.display_title,commentable_entity.petition_title,commentable_entity.petition_status,commentable_entity.calculated_goal,commentable_entity.media.id,commentable_entity.media.url,commentable_entity.media.sizes.square.url,commentable_entity.media.sizes.square.processing,commentable_entity.media.sizes.square.size.width,commentable_entity.media.sizes.square.size.height,commentable_entity.media.sizes.small.url,commentable_entity.media.sizes.small.processing,commentable_entity.media.sizes.small.size.width,commentable_entity.media.sizes.small.size.height,commentable_entity.media.sizes.medium.url,commentable_entity.media.sizes.medium.processing,commentable_entity.media.sizes.medium.size.width,commentable_entity.media.sizes.medium.size.height,commentable_entity.media.sizes.large.url,commentable_entity.media.sizes.large.processing,commentable_entity.media.sizes.large.size.width,commentable_entity.media.sizes.large.size.height,commentable_entity.media.type,commentable_entity.primary_target.id,commentable_entity.primary_target.display_name,commentable_entity.primary_target.email,commentable_entity.primary_target.type,commentable_entity.primary_target.slug,commentable_entity.primary_target.description,commentable_entity.primary_target.photo_id,commentable_entity.primary_target.publicly_visible,commentable_entity.primary_target.verified_at,commentable_entity.primary_target.summary,commentable_entity.primary_target.locale,commentable_entity.primary_target.confirmed_at,commentable_entity.primary_target.is_person,commentable_entity.primary_target.additional_data.first_name,commentable_entity.primary_target.additional_data.last_name,commentable_entity.primary_target.additional_data.title,commentable_entity.primary_target.additional_data.id,commentable_entity.primary_target.has_email,commentable_entity.progress,user.photo.id,user.photo.url,user.photo.sizes.small.url,user.photo.sizes.small.processing,user.photo.sizes.small.size.width,user.photo.sizes.small.size.height,user.photo.sizes.medium.url,user.photo.sizes.medium.processing,user.photo.sizes.medium.size.width,user.photo.sizes.medium.size.height,user.photo.sizes.large.url,user.photo.sizes.large.processing,user.photo.sizes.large.size.width,user.photo.sizes.large.size.height,user.photo.sizes.xlarge.url,user.photo.sizes.xlarge.processing,user.photo.sizes.xlarge.size.width,user.photo.sizes.xlarge.size.height
834609094,"I’m signing because it needs to be a truthful, full-exposure, documentary and YES, CALL OUT THE UK CORRUPTION!  If this is one that portrays the correct info then I’ll support, but I refuse to back another JD not piece or another MSM ATurd-shill piece!",0,0,Event,28461196,0,comment,2022-07-25T01:00:36Z,,1067992963,1067992963,Shada,Roberts,Shada,Shada Roberts,Little Rock,AR,US,,en-US,,[],28461196,28461196,Stop Johnny Depp Documentary by ITV,2021-04-19T15:41:14Z,,2021-04-19T15:42:31Z,2022-01-26T20:48:41Z,en-US,['en'],Optomen: Stop Johnny Depp Documentary by ITV,"<p>A documentary should not be made about Johnny Depp. He is still fighting for the truth. To make a documentary when his evidence has been disregarded in the UK, is criminal. The UK Judge Nicol based his judgement on Amber Heard donating 7 million to charity which she lied about, and never donated. These dv allegations happened because Johnny Depp wouldn’t comply to her monetary demands. Police cam footage proved she lied about May 21, 2016 DV allegation. She had no bruises there was no damage.</p>",Optomen,Stop Johnny Depp Documentary by ITV,,,,US,,,,,,,optomen-stop-johnny-depp-documentary-by-itv,published,,,False,False,,False,,"[{'id': 476127, 'locale': 'en-US', 'name': 'Other', 'slug': 'other-en-us', 'photo_id': None, 'created_by_owner': True, 'created_by_staff_member': False, 'total_count': 166150}]",True,False,,14,14,0,75,9,0,0,0,0,0,0,,,,,,225457160,photos/3/za/ix/crZaiXmkqdEoANQ-fullsize.jpg,//assets.change.org/photos/3/za/ix/crZaiXmkqdEoANQ-400x400-noPad.jpg?1618846876,False,400,400,//assets.change.org/photos/3/za/ix/crZaiXmkqdEoANQ-400x225-noPad.jpg?1618846876,False,400,225,//assets.change.org/photos/3/za/ix/crZaiXmkqdEoANQ-800x450-noPad.jpg?1618846876,False,800,450,//assets.change.org/photos/3/za/ix/crZaiXmkqdEoANQ-1600x900-noPad.jpg?1618846876,False,1600,900,photo,630317936,630317936,Laura,Azarowicz,Laura,Laura Azarowicz,Verona,NJ,US,,en-US,,193121923,photos/0/cf/yt/qMCFYtqcqVYGnif-fullsize.jpg,//assets.change.org/photos/0/cf/yt/qMCFYtqcqVYGnif-48x48-noPad.jpg?1509908190,False,48,48,//assets.change.org/photos/0/cf/yt/qMCFYtqcqVYGnif-128x128-noPad.jpg?1509908190,False,128,128,//assets.change.org/photos/0/cf/yt/qMCFYtqcqVYGnif-400x400-noPad.jpg?1509908190,False,400,400,//assets.change.org/photos/0/cf/yt/qMCFYtqcqVYGnif-800x800-noPad.jpg?1509908190,False,800,800,[],"[{'id': 12281524, 'display_name': 'Optomen ', 'email': None, 'type': 'Custom', 'slug': 'optomen', 'description': None, 'photo_id': None, 'publicly_visible': False, 'verified_at': None, 'summary': None, 'locale': None, 'confirmed_at': None, 'is_person': True, 'member_of': {}, 'additional_data': {'first_name': 'Optomen', 'last_name': None, 'title': None, 'id': 12179654}, 'has_email': False}]",False,False,False,Laura Azarowicz,193121923,photos/0/cf/yt/qMCFYtqcqVYGnif-fullsize.jpg,//assets.change.org/photos/0/cf/yt/qMCFYtqcqVYGnif-48x48-noPad.jpg?1509908190,False,48,48,//assets.change.org/photos/0/cf/yt/qMCFYtqcqVYGnif-128x128-noPad.jpg?1509908190,False,128,128,//assets.change.org/photos/0/cf/yt/qMCFYtqcqVYGnif-400x400-noPad.jpg?1509908190,False,400,400,//assets.change.org/photos/0/cf/yt/qMCFYtqcqVYGnif-800x800-noPad.jpg?1509908190,False,800,800,Optomen: Stop Johnny Depp Documentary by ITV,Optomen: Stop Johnny Depp Documentary by ITV,active,100,225457160,photos/3/za/ix/crZaiXmkqdEoANQ-fullsize.jpg,//assets.change.org/photos/3/za/ix/crZaiXmkqdEoANQ-400x400-noPad.jpg?1618846876,False,400,400,//assets.change.org/photos/3/za/ix/crZaiXmkqdEoANQ-400x225-noPad.jpg?1618846876,False,400,225,//assets.change.org/photos/3/za/ix/crZaiXmkqdEoANQ-800x450-noPad.jpg?1618846876,False,800,450,//assets.change.org/photos/3/za/ix/crZaiXmkqdEoANQ-1600x900-noPad.jpg?1618846876,False,1600,900,photo,12281524,Optomen ,,Custom,optomen,,,False,,,,,True,Optomen,,,12179654,False,14,,,,,,,,,,,,,,,,,,
833824509,"Discovery is owned by Time Warner.  Any documentaries regarding Depp vs Heard on Discovery will probably not only favor AH, but, will trash JD.  Aquaman 2 is being released in 2023 and Time Warner is trying to change public opinion about AH.  They have a lot to lose.",0,0,Event,28461196,0,comment,2022-06-22T11:27:18Z,,1263386663,1263386663,Mae,Mello,Mae,Mae Mello,Southbury,CT,US,,en-US,,[],28461196,28461196,Stop Johnny Depp Documentary by ITV,2021-04-19T15:41:14Z,,2021-04-19T15:42:31Z,2022-01-26T20:48:41Z,en-US,['en'],Optomen: Stop Johnny Depp Documentary by ITV,"<p>A documentary should not be made about Johnny Depp. He is still fighting for the truth. To make a documentary when his evidence has been disregarded in the UK, is criminal. The UK Judge Nicol based his judgement on Amber Heard donating 7 million to charity which she lied about, and never donated. These dv allegations happened because Johnny Depp wouldn’t comply to her monetary demands. Police cam footage proved she lied about May 21, 2016 DV allegation. She had no bruises there was no damage.</p>",Optomen,Stop Johnny Depp Documentary by ITV,,,,US,,,,,,,optomen-stop-johnny-depp-documentary-by-itv,published,,,False,False,,False,,"[{'id': 476127, 'locale': 'en-US', 'name': 'Other', 'slug': 'other-en-us', 'photo_id': None, 'created_by_owner': True, 'created_by_staff_member': False, 'total_count': 166150}]",True,False,,14,14,0,75,9,0,0,0,0,0,0,,,,,,225457160,photos/3/za/ix/crZaiXmkqdEoANQ-fullsize.jpg,//assets.change.org/photos/3/za/ix/crZaiXmkqdEoANQ-400x400-noPad.jpg?1618846876,False,400,400,//assets.change.org/photos/3/za/ix/crZaiXmkqdEoANQ-400x225-noPad.jpg?1618846876,False,400,225,//assets.change.org/photos/3/za/ix/crZaiXmkqdEoANQ-800x450-noPad.jpg?1618846876,False,800,450,//assets.change.org/photos/3/za/ix/crZaiXmkqdEoANQ-1600x900-noPad.jpg?1618846876,False,1600,900,photo,630317936,630317936,Laura,Azarowicz,Laura,Laura Azarowicz,Verona,NJ,US,,en-US,,193121923,photos/0/cf/yt/qMCFYtqcqVYGnif-fullsize.jpg,//assets.change.org/photos/0/cf/yt/qMCFYtqcqVYGnif-48x48-noPad.jpg?1509908190,False,48,48,//assets.change.org/photos/0/cf/yt/qMCFYtqcqVYGnif-128x128-noPad.jpg?1509908190,False,128,128,//assets.change.org/photos/0/cf/yt/qMCFYtqcqVYGnif-400x400-noPad.jpg?1509908190,False,400,400,//assets.change.org/photos/0/cf/yt/qMCFYtqcqVYGnif-800x800-noPad.jpg?1509908190,False,800,800,[],"[{'id': 12281524, 'display_name': 'Optomen ', 'email': None, 'type': 'Custom', 'slug': 'optomen', 'description': None, 'photo_id': None, 'publicly_visible': False, 'verified_at': None, 'summary': None, 'locale': None, 'confirmed_at': None, 'is_person': True, 'member_of': {}, 'additional_data': {'first_name': 'Optomen', 'last_name': None, 'title': None, 'id': 12179654}, 'has_email': False}]",False,False,False,Laura Azarowicz,193121923,photos/0/cf/yt/qMCFYtqcqVYGnif-fullsize.jpg,//assets.change.org/photos/0/cf/yt/qMCFYtqcqVYGnif-48x48-noPad.jpg?1509908190,False,48,48,//assets.change.org/photos/0/cf/yt/qMCFYtqcqVYGnif-128x128-noPad.jpg?1509908190,False,128,128,//assets.change.org/photos/0/cf/yt/qMCFYtqcqVYGnif-400x400-noPad.jpg?1509908190,False,400,400,//assets.change.org/photos/0/cf/yt/qMCFYtqcqVYGnif-800x800-noPad.jpg?1509908190,False,800,800,Optomen: Stop Johnny Depp Documentary by ITV,Optomen: Stop Johnny Depp Documentary by ITV,active,100,225457160,photos/3/za/ix/crZaiXmkqdEoANQ-fullsize.jpg,//assets.change.org/photos/3/za/ix/crZaiXmkqdEoANQ-400x400-noPad.jpg?1618846876,False,400,400,//assets.change.org/photos/3/za/ix/crZaiXmkqdEoANQ-400x225-noPad.jpg?1618846876,False,400,225,//assets.change.org/photos/3/za/ix/crZaiXmkqdEoANQ-800x450-noPad.jpg?1618846876,False,800,450,//assets.change.org/photos/3/za/ix/crZaiXmkqdEoANQ-1600x900-noPad.jpg?1618846876,False,1600,900,photo,12281524,Optomen ,,Custom,optomen,,,False,,,,,True,Optomen,,,12179654,False,14,,,,,,,,,,,,,,,,,,
832228097,Amber Heard is abusive.  Johnny Depp is a great actor.,0,0,Event,28461196,0,comment,2022-04-23T01:27:25Z,,1070943515,1070943515,Vicki,SARAH,Vicki,Vicki SARAH,Virginia Beach,VA,US,,en-US,,[],28461196,28461196,Stop Johnny Depp Documentary by ITV,2021-04-19T15:41:14Z,,2021-04-19T15:42:31Z,2022-01-26T20:48:41Z,en-US,['en'],Optomen: Stop Johnny Depp Documentary by ITV,"<p>A documentary should not be made about Johnny Depp. He is still fighting for the truth. To make a documentary when his evidence has been disregarded in the UK, is criminal. The UK Judge Nicol based his judgement on Amber Heard donating 7 million to charity which she lied about, and never donated. These dv allegations happened because Johnny Depp wouldn’t comply to her monetary demands. Police cam footage proved she lied about May 21, 2016 DV allegation. She had no bruises there was no damage.</p>",Optomen,Stop Johnny Depp Documentary by ITV,,,,US,,,,,,,optomen-stop-johnny-depp-documentary-by-itv,published,,,False,False,,False,,"[{'id': 476127, 'locale': 'en-US', 'name': 'Other', 'slug': 'other-en-us', 'photo_id': None, 'created_by_owner': True, 'created_by_staff_member': False, 'total_count': 166150}]",True,False,,14,14,0,75,9,0,0,0,0,0,0,,,,,,225457160,photos/3/za/ix/crZaiXmkqdEoANQ-fullsize.jpg,//assets.change.org/photos/3/za/ix/crZaiXmkqdEoANQ-400x400-noPad.jpg?1618846876,False,400,400,//assets.change.org/photos/3/za/ix/crZaiXmkqdEoANQ-400x225-noPad.jpg?1618846876,False,400,225,//assets.change.org/photos/3/za/ix/crZaiXmkqdEoANQ-800x450-noPad.jpg?1618846876,False,800,450,//assets.change.org/photos/3/za/ix/crZaiXmkqdEoANQ-1600x900-noPad.jpg?1618846876,False,1600,900,photo,630317936,630317936,Laura,Azarowicz,Laura,Laura Azarowicz,Verona,NJ,US,,en-US,,193121923,photos/0/cf/yt/qMCFYtqcqVYGnif-fullsize.jpg,//assets.change.org/photos/0/cf/yt/qMCFYtqcqVYGnif-48x48-noPad.jpg?1509908190,False,48,48,//assets.change.org/photos/0/cf/yt/qMCFYtqcqVYGnif-128x128-noPad.jpg?1509908190,False,128,128,//assets.change.org/photos/0/cf/yt/qMCFYtqcqVYGnif-400x400-noPad.jpg?1509908190,False,400,400,//assets.change.org/photos/0/cf/yt/qMCFYtqcqVYGnif-800x800-noPad.jpg?1509908190,False,800,800,[],"[{'id': 12281524, 'display_name': 'Optomen ', 'email': None, 'type': 'Custom', 'slug': 'optomen', 'description': None, 'photo_id': None, 'publicly_visible': False, 'verified_at': None, 'summary': None, 'locale': None, 'confirmed_at': None, 'is_person': True, 'member_of': {}, 'additional_data': {'first_name': 'Optomen', 'last_name': None, 'title': None, 'id': 12179654}, 'has_email': False}]",False,False,False,Laura Azarowicz,193121923,photos/0/cf/yt/qMCFYtqcqVYGnif-fullsize.jpg,//assets.change.org/photos/0/cf/yt/qMCFYtqcqVYGnif-48x48-noPad.jpg?1509908190,False,48,48,//assets.change.org/photos/0/cf/yt/qMCFYtqcqVYGnif-128x128-noPad.jpg?1509908190,False,128,128,//assets.change.org/photos/0/cf/yt/qMCFYtqcqVYGnif-400x400-noPad.jpg?1509908190,False,400,400,//assets.change.org/photos/0/cf/yt/qMCFYtqcqVYGnif-800x800-noPad.jpg?1509908190,False,800,800,Optomen: Stop Johnny Depp Documentary by ITV,Optomen: Stop Johnny Depp Documentary by ITV,active,100,225457160,photos/3/za/ix/crZaiXmkqdEoANQ-fullsize.jpg,//assets.change.org/photos/3/za/ix/crZaiXmkqdEoANQ-400x400-noPad.jpg?1618846876,False,400,400,//assets.change.org/photos/3/za/ix/crZaiXmkqdEoANQ-400x225-noPad.jpg?1618846876,False,400,225,//assets.change.org/photos/3/za/ix/crZaiXmkqdEoANQ-800x450-noPad.jpg?1618846876,False,800,450,//assets.change.org/photos/3/za/ix/crZaiXmkqdEoANQ-1600x900-noPad.jpg?1618846876,False,1600,900,photo,12281524,Optomen ,,Custom,optomen,,,False,,,,,True,Optomen,,,12179654,False,14,,,,,,,,,,,,,,,,,,
