id,comment,parent_id,children_count,commentable_type,commentable_id,likes,role,created_at,deleted_at,user.id,user.slug,user.first_name,user.last_name,user.short_display_name,user.display_name,user.city,user.state_code,user.country_code,user.website,user.locale,user.description,user.photo.id,user.photo.url,user.photo.sizes.small.url,user.photo.sizes.small.processing,user.photo.sizes.small.size.width,user.photo.sizes.small.size.height,user.photo.sizes.medium.url,user.photo.sizes.medium.processing,user.photo.sizes.medium.size.width,user.photo.sizes.medium.size.height,user.photo.sizes.large.url,user.photo.sizes.large.processing,user.photo.sizes.large.size.width,user.photo.sizes.large.size.height,user.photo.sizes.xlarge.url,user.photo.sizes.xlarge.processing,user.photo.sizes.xlarge.size.width,user.photo.sizes.xlarge.size.height,user.roles,commentable_entity.id,commentable_entity.document_id,commentable_entity.ask,commentable_entity.created_at,commentable_entity.deleted_at,commentable_entity.published_at,commentable_entity.last_edited_at,commentable_entity.original_locale,commentable_entity.languages,commentable_entity.title,commentable_entity.description,commentable_entity.targeting_description,commentable_entity.letter_body,commentable_entity.end_date,commentable_entity.goal,commentable_entity.relevant_location.city,commentable_entity.relevant_location.country_code,commentable_entity.relevant_location.lat,commentable_entity.relevant_location.lng,commentable_entity.relevant_location.state_code,commentable_entity.relevant_location.google_places_id,commentable_entity.relevant_location.photo_id,commentable_entity.restricted_location,commentable_entity.slug,commentable_entity.status,commentable_entity.victory_date,commentable_entity.victory_description,commentable_entity.is_verified_victory,commentable_entity.is_victory,commentable_entity.video_id,commentable_entity.is_pledge,commentable_entity.topic,commentable_entity.tags,commentable_entity.discoverable,commentable_entity.sponsored_campaign,commentable_entity.organization_free_email_optins,commentable_entity.displayed_signature_count,commentable_entity.total_signature_count,commentable_entity.weekly_signature_count,commentable_entity.total_page_views,commentable_entity.total_share_count,commentable_entity.daily_signature_count,commentable_entity.monthly_signature_count,commentable_entity.daily_signup_count,commentable_entity.weekly_signup_count,commentable_entity.monthly_signup_count,commentable_entity.total_signup_count,commentable_entity.supporter_message_count,commentable_entity.starter_vanity_url,commentable_entity.featured_title,commentable_entity.media_text,commentable_entity.media_url,commentable_entity.photo.id,commentable_entity.photo.url,commentable_entity.photo.sizes.square.url,commentable_entity.photo.sizes.square.processing,commentable_entity.photo.sizes.square.size.width,commentable_entity.photo.sizes.square.size.height,commentable_entity.photo.sizes.small.url,commentable_entity.photo.sizes.small.processing,commentable_entity.photo.sizes.small.size.width,commentable_entity.photo.sizes.small.size.height,commentable_entity.photo.sizes.medium.url,commentable_entity.photo.sizes.medium.processing,commentable_entity.photo.sizes.medium.size.width,commentable_entity.photo.sizes.medium.size.height,commentable_entity.photo.sizes.large.url,commentable_entity.photo.sizes.large.processing,commentable_entity.photo.sizes.large.size.width,commentable_entity.photo.sizes.large.size.height,commentable_entity.photo.type,commentable_entity.user.id,commentable_entity.user.slug,commentable_entity.user.first_name,commentable_entity.user.last_name,commentable_entity.user.short_display_name,commentable_entity.user.display_name,commentable_entity.user.city,commentable_entity.user.state_code,commentable_entity.user.country_code,commentable_entity.user.website,commentable_entity.user.locale,commentable_entity.user.description,commentable_entity.user.roles,commentable_entity.activity.share.copylink.count,commentable_entity.activity.share.copylink.last_updated,commentable_entity.targets,commentable_entity.hide_comments,commentable_entity.hide_dm_action_panel,commentable_entity.enable_human_verification,commentable_entity.creator_name,commentable_entity.display_title,commentable_entity.petition_title,commentable_entity.petition_status,commentable_entity.calculated_goal,commentable_entity.media.id,commentable_entity.media.url,commentable_entity.media.sizes.square.url,commentable_entity.media.sizes.square.processing,commentable_entity.media.sizes.square.size.width,commentable_entity.media.sizes.square.size.height,commentable_entity.media.sizes.small.url,commentable_entity.media.sizes.small.processing,commentable_entity.media.sizes.small.size.width,commentable_entity.media.sizes.small.size.height,commentable_entity.media.sizes.medium.url,commentable_entity.media.sizes.medium.processing,commentable_entity.media.sizes.medium.size.width,commentable_entity.media.sizes.medium.size.height,commentable_entity.media.sizes.large.url,commentable_entity.media.sizes.large.processing,commentable_entity.media.sizes.large.size.width,commentable_entity.media.sizes.large.size.height,commentable_entity.media.type,commentable_entity.primary_target.id,commentable_entity.primary_target.display_name,commentable_entity.primary_target.email,commentable_entity.primary_target.type,commentable_entity.primary_target.slug,commentable_entity.primary_target.description,commentable_entity.primary_target.publicly_visible,commentable_entity.primary_target.verified_at,commentable_entity.primary_target.summary,commentable_entity.primary_target.locale,commentable_entity.primary_target.confirmed_at,commentable_entity.primary_target.is_person,commentable_entity.primary_target.additional_data.first_name,commentable_entity.primary_target.additional_data.last_name,commentable_entity.primary_target.additional_data.title,commentable_entity.primary_target.additional_data.id,commentable_entity.primary_target.has_email,commentable_entity.primary_target.photo.id,commentable_entity.primary_target.photo.url,commentable_entity.primary_target.photo.sizes.small.url,commentable_entity.primary_target.photo.sizes.small.processing,commentable_entity.primary_target.photo.sizes.small.size.width,commentable_entity.primary_target.photo.sizes.small.size.height,commentable_entity.primary_target.photo.sizes.medium.url,commentable_entity.primary_target.photo.sizes.medium.processing,commentable_entity.primary_target.photo.sizes.medium.size.width,commentable_entity.primary_target.photo.sizes.medium.size.height,commentable_entity.primary_target.photo.sizes.large.url,commentable_entity.primary_target.photo.sizes.large.processing,commentable_entity.primary_target.photo.sizes.large.size.width,commentable_entity.primary_target.photo.sizes.large.size.height,commentable_entity.primary_target.photo.sizes.xlarge.url,commentable_entity.primary_target.photo.sizes.xlarge.processing,commentable_entity.primary_target.photo.sizes.xlarge.size.width,commentable_entity.primary_target.photo.sizes.xlarge.size.height,commentable_entity.progress
832847269,"Even Jason Momoa suggested Emilia Clarke.  I agree, she would be Great!",0,0,Event,25806087,0,comment,2022-05-13T15:56:16Z,,8065143,8065143,Charlene,Benz,Charlene,Charlene Benz,San Jose,CA,US,,en-US,,14985095.0,photos/2/zy/kb/fZzyKbPkAaKjonD-fullsize.jpg,//assets.change.org/photos/2/zy/kb/fZzyKbPkAaKjonD-48x48-noPad.jpg?1521994023,False,48.0,48.0,//assets.change.org/photos/2/zy/kb/fZzyKbPkAaKjonD-128x128-noPad.jpg?1521994023,False,128.0,128.0,//assets.change.org/photos/2/zy/kb/fZzyKbPkAaKjonD-400x400-noPad.jpg?1521994023,False,400.0,400.0,//assets.change.org/photos/2/zy/kb/fZzyKbPkAaKjonD-800x800-noPad.jpg?1521994024,False,800.0,800.0,[],25806087,25806087,Replace Amber Heard with a different actress in Aquaman 2,2020-11-12T14:21:37Z,,2020-11-12T14:32:35Z,2020-11-12T14:32:35Z,en-US,['en'],Warner Brothers: Change Amber Heard to a different actress in Aquaman 2,"<p>If Warner Bros are going to be brave enough to film and run Aquaman 2, we demand that Amber Heard be replaced with a different actress.</p>
<p>Preferably Emilia Clarke if she wants that role.</p>
<p>This is to help bring to Justice what has happened to Johnny Depp because Amber Heard has beaten him, cut off part of his finger, lied a significant amount of times, and tried to ruin his life and career. Let's not forget that Warner Brothers have also asked Johnny Depp to resign his role on Fantastic Beasts as Grindelwald.</p>
<p>Please help sign this  petition so that we can get enough signatures to get Amber Heard replaced with a different actress for Aquaman 2! </p>","Warner Brothers, dc",Change Amber Heard to a different actress in Aquaman 2,2021-11-12,,,US,,,,,,,warner-brothers-change-amber-heard-to-a-different-actress-in-aquaman-2,published,,,False,False,,False,,"[{'id': 476127, 'locale': 'en-US', 'name': 'Other', 'slug': 'other-en-us', 'photo_id': None, 'created_by_owner': True, 'created_by_staff_member': False, 'total_count': 166150}]",True,False,,120,120,0,510,28,0,0,0,0,0,6,,,,,,224851977,photos/0/zv/uk/sAZvUkxSiEHayyk-fullsize.jpg,//assets.change.org/photos/0/zv/uk/sAZvUkxSiEHayyk-400x400-noPad.jpg?1605190899,False,400,400,//assets.change.org/photos/0/zv/uk/sAZvUkxSiEHayyk-400x225-noPad.jpg?1605190899,False,400,225,//assets.change.org/photos/0/zv/uk/sAZvUkxSiEHayyk-800x450-noPad.jpg?1605190899,False,800,450,//assets.change.org/photos/0/zv/uk/sAZvUkxSiEHayyk-1600x900-noPad.jpg?1605190899,False,1600,900,photo,1163945224,1163945224,Francesca,Miller,Francesca,Francesca Miller,,,US,,en-US,,[],6,1656199887.671,"[{'id': 886222, 'display_name': 'Warner Brothers', 'email': None, 'type': 'Custom', 'slug': 'warner-brothers-7', 'description': None, 'publicly_visible': False, 'verified_at': None, 'summary': None, 'locale': 'en-US', 'confirmed_at': '2013-12-16T22:34:23Z', 'is_person': False, 'member_of': {}, 'additional_data': {'first_name': 'Warner', 'last_name': 'Brothers', 'title': None, 'id': 818294}, 'has_email': True, 'photo': {'id': 13419973, 'url': 'photos/5/yr/fx/CDYrFXRWHJehAmW-fullsize.jpg', 'sizes': {'small': {'url': '//assets.change.org/photos/5/yr/fx/CDYrFXRWHJehAmW-48x48-noPad.jpg?1520335246', 'processing': False, 'size': {'width': 48, 'height': 48}}, 'medium': {'url': '//assets.change.org/photos/5/yr/fx/CDYrFXRWHJehAmW-128x128-noPad.jpg?1520335247', 'processing': False, 'size': {'width': 128, 'height': 128}}, 'large': {'url': '//assets.change.org/photos/5/yr/fx/CDYrFXRWHJehAmW-400x400-noPad.jpg?1520335246', 'processing': False, 'size': {'width': 400, 'height': 400}}, 'xlarge': {'url': '//assets.change.org/photos/5/yr/fx/CDYrFXRWHJehAmW-800x800-noPad.jpg?1520335246', 'processing': False, 'size': {'width': 800, 'height': 800}}}}}, {'id': 653216, 'display_name': 'dc', 'email': None, 'type': 'Custom', 'slug': 'dc-4', 'description': None, 'photo_id': None, 'publicly_visible': False, 'verified_at': None, 'summary': None, 'locale': 'en-US', 'confirmed_at': None, 'is_person': True, 'member_of': {}, 'additional_data': {'first_name': 'dc', 'last_name': None, 'title': None, 'id': 104173}, 'has_email': False}]",False,False,False,Francesca Miller,Warner Brothers: Change Amber Heard to a different actress in Aquaman 2,Warner Brothers: Change Amber Heard to a different actress in Aquaman 2,active,200,224851977,photos/0/zv/uk/sAZvUkxSiEHayyk-fullsize.jpg,//assets.change.org/photos/0/zv/uk/sAZvUkxSiEHayyk-400x400-noPad.jpg?1605190899,False,400,400,//assets.change.org/photos/0/zv/uk/sAZvUkxSiEHayyk-400x225-noPad.jpg?1605190899,False,400,225,//assets.change.org/photos/0/zv/uk/sAZvUkxSiEHayyk-800x450-noPad.jpg?1605190899,False,800,450,//assets.change.org/photos/0/zv/uk/sAZvUkxSiEHayyk-1600x900-noPad.jpg?1605190899,False,1600,900,photo,886222,Warner Brothers,,Custom,warner-brothers-7,,False,,,en-US,2013-12-16T22:34:23Z,False,Warner,Brothers,,818294,True,13419973,photos/5/yr/fx/CDYrFXRWHJehAmW-fullsize.jpg,//assets.change.org/photos/5/yr/fx/CDYrFXRWHJehAmW-48x48-noPad.jpg?1520335246,False,48,48,//assets.change.org/photos/5/yr/fx/CDYrFXRWHJehAmW-128x128-noPad.jpg?1520335247,False,128,128,//assets.change.org/photos/5/yr/fx/CDYrFXRWHJehAmW-400x400-noPad.jpg?1520335246,False,400,400,//assets.change.org/photos/5/yr/fx/CDYrFXRWHJehAmW-800x800-noPad.jpg?1520335246,False,800,800,60
832558121,"Amber Heard should not have opportunities after it has been shown that she lied, gaslit, and manipulated everyone into thinking she was an abuser victim, when she was the perpetrator of the abuse. If a film company supports Amber Heard, then I can’t support the film company. Nor can I support a film company who doesn’t restore JD’s roles, as he was terminated without due process. Replace AH with another actress.",0,0,Event,25806087,0,comment,2022-05-04T16:49:33Z,,1263197945,1263197945,Julie,Zuniga,Julie,Julie Zuniga,Antioch,CA,US,,en-US,,,,,,,,,,,,,,,,,,,,[],25806087,25806087,Replace Amber Heard with a different actress in Aquaman 2,2020-11-12T14:21:37Z,,2020-11-12T14:32:35Z,2020-11-12T14:32:35Z,en-US,['en'],Warner Brothers: Change Amber Heard to a different actress in Aquaman 2,"<p>If Warner Bros are going to be brave enough to film and run Aquaman 2, we demand that Amber Heard be replaced with a different actress.</p>
<p>Preferably Emilia Clarke if she wants that role.</p>
<p>This is to help bring to Justice what has happened to Johnny Depp because Amber Heard has beaten him, cut off part of his finger, lied a significant amount of times, and tried to ruin his life and career. Let's not forget that Warner Brothers have also asked Johnny Depp to resign his role on Fantastic Beasts as Grindelwald.</p>
<p>Please help sign this  petition so that we can get enough signatures to get Amber Heard replaced with a different actress for Aquaman 2! </p>","Warner Brothers, dc",Change Amber Heard to a different actress in Aquaman 2,2021-11-12,,,US,,,,,,,warner-brothers-change-amber-heard-to-a-different-actress-in-aquaman-2,published,,,False,False,,False,,"[{'id': 476127, 'locale': 'en-US', 'name': 'Other', 'slug': 'other-en-us', 'photo_id': None, 'created_by_owner': True, 'created_by_staff_member': False, 'total_count': 166150}]",True,False,,120,120,0,510,28,0,0,0,0,0,6,,,,,,224851977,photos/0/zv/uk/sAZvUkxSiEHayyk-fullsize.jpg,//assets.change.org/photos/0/zv/uk/sAZvUkxSiEHayyk-400x400-noPad.jpg?1605190899,False,400,400,//assets.change.org/photos/0/zv/uk/sAZvUkxSiEHayyk-400x225-noPad.jpg?1605190899,False,400,225,//assets.change.org/photos/0/zv/uk/sAZvUkxSiEHayyk-800x450-noPad.jpg?1605190899,False,800,450,//assets.change.org/photos/0/zv/uk/sAZvUkxSiEHayyk-1600x900-noPad.jpg?1605190899,False,1600,900,photo,1163945224,1163945224,Francesca,Miller,Francesca,Francesca Miller,,,US,,en-US,,[],6,1656199887.671,"[{'id': 886222, 'display_name': 'Warner Brothers', 'email': None, 'type': 'Custom', 'slug': 'warner-brothers-7', 'description': None, 'publicly_visible': False, 'verified_at': None, 'summary': None, 'locale': 'en-US', 'confirmed_at': '2013-12-16T22:34:23Z', 'is_person': False, 'member_of': {}, 'additional_data': {'first_name': 'Warner', 'last_name': 'Brothers', 'title': None, 'id': 818294}, 'has_email': True, 'photo': {'id': 13419973, 'url': 'photos/5/yr/fx/CDYrFXRWHJehAmW-fullsize.jpg', 'sizes': {'small': {'url': '//assets.change.org/photos/5/yr/fx/CDYrFXRWHJehAmW-48x48-noPad.jpg?1520335246', 'processing': False, 'size': {'width': 48, 'height': 48}}, 'medium': {'url': '//assets.change.org/photos/5/yr/fx/CDYrFXRWHJehAmW-128x128-noPad.jpg?1520335247', 'processing': False, 'size': {'width': 128, 'height': 128}}, 'large': {'url': '//assets.change.org/photos/5/yr/fx/CDYrFXRWHJehAmW-400x400-noPad.jpg?1520335246', 'processing': False, 'size': {'width': 400, 'height': 400}}, 'xlarge': {'url': '//assets.change.org/photos/5/yr/fx/CDYrFXRWHJehAmW-800x800-noPad.jpg?1520335246', 'processing': False, 'size': {'width': 800, 'height': 800}}}}}, {'id': 653216, 'display_name': 'dc', 'email': None, 'type': 'Custom', 'slug': 'dc-4', 'description': None, 'photo_id': None, 'publicly_visible': False, 'verified_at': None, 'summary': None, 'locale': 'en-US', 'confirmed_at': None, 'is_person': True, 'member_of': {}, 'additional_data': {'first_name': 'dc', 'last_name': None, 'title': None, 'id': 104173}, 'has_email': False}]",False,False,False,Francesca Miller,Warner Brothers: Change Amber Heard to a different actress in Aquaman 2,Warner Brothers: Change Amber Heard to a different actress in Aquaman 2,active,200,224851977,photos/0/zv/uk/sAZvUkxSiEHayyk-fullsize.jpg,//assets.change.org/photos/0/zv/uk/sAZvUkxSiEHayyk-400x400-noPad.jpg?1605190899,False,400,400,//assets.change.org/photos/0/zv/uk/sAZvUkxSiEHayyk-400x225-noPad.jpg?1605190899,False,400,225,//assets.change.org/photos/0/zv/uk/sAZvUkxSiEHayyk-800x450-noPad.jpg?1605190899,False,800,450,//assets.change.org/photos/0/zv/uk/sAZvUkxSiEHayyk-1600x900-noPad.jpg?1605190899,False,1600,900,photo,886222,Warner Brothers,,Custom,warner-brothers-7,,False,,,en-US,2013-12-16T22:34:23Z,False,Warner,Brothers,,818294,True,13419973,photos/5/yr/fx/CDYrFXRWHJehAmW-fullsize.jpg,//assets.change.org/photos/5/yr/fx/CDYrFXRWHJehAmW-48x48-noPad.jpg?1520335246,False,48,48,//assets.change.org/photos/5/yr/fx/CDYrFXRWHJehAmW-128x128-noPad.jpg?1520335247,False,128,128,//assets.change.org/photos/5/yr/fx/CDYrFXRWHJehAmW-400x400-noPad.jpg?1520335246,False,400,400,//assets.change.org/photos/5/yr/fx/CDYrFXRWHJehAmW-800x800-noPad.jpg?1520335246,False,800,800,60
832227317,Amber Heard is abusive.,0,0,Event,25806087,0,comment,2022-04-23T00:39:38Z,,1070943515,1070943515,Vicki,SARAH,Vicki,Vicki SARAH,Virginia Beach,VA,US,,en-US,,,,,,,,,,,,,,,,,,,,[],25806087,25806087,Replace Amber Heard with a different actress in Aquaman 2,2020-11-12T14:21:37Z,,2020-11-12T14:32:35Z,2020-11-12T14:32:35Z,en-US,['en'],Warner Brothers: Change Amber Heard to a different actress in Aquaman 2,"<p>If Warner Bros are going to be brave enough to film and run Aquaman 2, we demand that Amber Heard be replaced with a different actress.</p>
<p>Preferably Emilia Clarke if she wants that role.</p>
<p>This is to help bring to Justice what has happened to Johnny Depp because Amber Heard has beaten him, cut off part of his finger, lied a significant amount of times, and tried to ruin his life and career. Let's not forget that Warner Brothers have also asked Johnny Depp to resign his role on Fantastic Beasts as Grindelwald.</p>
<p>Please help sign this  petition so that we can get enough signatures to get Amber Heard replaced with a different actress for Aquaman 2! </p>","Warner Brothers, dc",Change Amber Heard to a different actress in Aquaman 2,2021-11-12,,,US,,,,,,,warner-brothers-change-amber-heard-to-a-different-actress-in-aquaman-2,published,,,False,False,,False,,"[{'id': 476127, 'locale': 'en-US', 'name': 'Other', 'slug': 'other-en-us', 'photo_id': None, 'created_by_owner': True, 'created_by_staff_member': False, 'total_count': 166150}]",True,False,,120,120,0,510,28,0,0,0,0,0,6,,,,,,224851977,photos/0/zv/uk/sAZvUkxSiEHayyk-fullsize.jpg,//assets.change.org/photos/0/zv/uk/sAZvUkxSiEHayyk-400x400-noPad.jpg?1605190899,False,400,400,//assets.change.org/photos/0/zv/uk/sAZvUkxSiEHayyk-400x225-noPad.jpg?1605190899,False,400,225,//assets.change.org/photos/0/zv/uk/sAZvUkxSiEHayyk-800x450-noPad.jpg?1605190899,False,800,450,//assets.change.org/photos/0/zv/uk/sAZvUkxSiEHayyk-1600x900-noPad.jpg?1605190899,False,1600,900,photo,1163945224,1163945224,Francesca,Miller,Francesca,Francesca Miller,,,US,,en-US,,[],6,1656199887.671,"[{'id': 886222, 'display_name': 'Warner Brothers', 'email': None, 'type': 'Custom', 'slug': 'warner-brothers-7', 'description': None, 'publicly_visible': False, 'verified_at': None, 'summary': None, 'locale': 'en-US', 'confirmed_at': '2013-12-16T22:34:23Z', 'is_person': False, 'member_of': {}, 'additional_data': {'first_name': 'Warner', 'last_name': 'Brothers', 'title': None, 'id': 818294}, 'has_email': True, 'photo': {'id': 13419973, 'url': 'photos/5/yr/fx/CDYrFXRWHJehAmW-fullsize.jpg', 'sizes': {'small': {'url': '//assets.change.org/photos/5/yr/fx/CDYrFXRWHJehAmW-48x48-noPad.jpg?1520335246', 'processing': False, 'size': {'width': 48, 'height': 48}}, 'medium': {'url': '//assets.change.org/photos/5/yr/fx/CDYrFXRWHJehAmW-128x128-noPad.jpg?1520335247', 'processing': False, 'size': {'width': 128, 'height': 128}}, 'large': {'url': '//assets.change.org/photos/5/yr/fx/CDYrFXRWHJehAmW-400x400-noPad.jpg?1520335246', 'processing': False, 'size': {'width': 400, 'height': 400}}, 'xlarge': {'url': '//assets.change.org/photos/5/yr/fx/CDYrFXRWHJehAmW-800x800-noPad.jpg?1520335246', 'processing': False, 'size': {'width': 800, 'height': 800}}}}}, {'id': 653216, 'display_name': 'dc', 'email': None, 'type': 'Custom', 'slug': 'dc-4', 'description': None, 'photo_id': None, 'publicly_visible': False, 'verified_at': None, 'summary': None, 'locale': 'en-US', 'confirmed_at': None, 'is_person': True, 'member_of': {}, 'additional_data': {'first_name': 'dc', 'last_name': None, 'title': None, 'id': 104173}, 'has_email': False}]",False,False,False,Francesca Miller,Warner Brothers: Change Amber Heard to a different actress in Aquaman 2,Warner Brothers: Change Amber Heard to a different actress in Aquaman 2,active,200,224851977,photos/0/zv/uk/sAZvUkxSiEHayyk-fullsize.jpg,//assets.change.org/photos/0/zv/uk/sAZvUkxSiEHayyk-400x400-noPad.jpg?1605190899,False,400,400,//assets.change.org/photos/0/zv/uk/sAZvUkxSiEHayyk-400x225-noPad.jpg?1605190899,False,400,225,//assets.change.org/photos/0/zv/uk/sAZvUkxSiEHayyk-800x450-noPad.jpg?1605190899,False,800,450,//assets.change.org/photos/0/zv/uk/sAZvUkxSiEHayyk-1600x900-noPad.jpg?1605190899,False,1600,900,photo,886222,Warner Brothers,,Custom,warner-brothers-7,,False,,,en-US,2013-12-16T22:34:23Z,False,Warner,Brothers,,818294,True,13419973,photos/5/yr/fx/CDYrFXRWHJehAmW-fullsize.jpg,//assets.change.org/photos/5/yr/fx/CDYrFXRWHJehAmW-48x48-noPad.jpg?1520335246,False,48,48,//assets.change.org/photos/5/yr/fx/CDYrFXRWHJehAmW-128x128-noPad.jpg?1520335247,False,128,128,//assets.change.org/photos/5/yr/fx/CDYrFXRWHJehAmW-400x400-noPad.jpg?1520335246,False,400,400,//assets.change.org/photos/5/yr/fx/CDYrFXRWHJehAmW-800x800-noPad.jpg?1520335246,False,800,800,60
