__typename,id,createdAt,title,description,photo,video,embeddedMedia,signatureCount
StarterPetitionUpdate,30644323,2022-06-10T00:54:45.000Z,"Save Amber Heard's Life - Tampering, Hollywood Fixers - #PurpleForAmber","<p><strong>Keep supporting Amber Heard and her life! How to Help below</strong>... We have evidence of hollywood fixers tampering with witnesses during Amber Heard's trial and since 2019.<br><em><strong>Movements are growing to support Amber...</strong></em></p>
<p>Reporter Nick Wallis asked us for conclusive evidence of Depp hiring services to harm Amber, and we've obtained that and obtaining more of it. <br>Though we gave <strong>Reporters</strong> halfway into her trial in-person the information on Fixers, we obtained more showing Barresi working against Amber.<br>There are emails, messages, audio files, and financial statements.<br><br>Hollywood Fixer Paul Barresi worked with Adam Waldman to prevent witnesses, e.g., workers of The Viper Room, from testifying and to prevent support for Amber. They sent harmful information to reporters, suppressed those who did support her, and monitored.<br><br>Beyond suspicions of reading into Barresi's Fixer background of his specialization of harming victims of sexual abuse from actors (from a 2008 Adweek interview and a 2019 interview with Barresi from <a href=""https://www.podchaser.com/podcasts/the-opperman-report-191214/episodes/hollywood-pi-bagman-paul-barre-41088929"" target=""_blank"" rel=""nofollow"">Opperman Report</a>), and posting of a woman that died that didn't recant against Eddie Murphy during AH's trial, we have the conclusive evidence he was working against Amber to do her in.<br>Barresi emailed Waldman on April 18.<br><br>We need to <a href=""https://docs.google.com/document/u/1/d/13lgNL2l9N45ZTb5wupeSiW6lbxhoVzSP/edit"" target=""_blank"" rel=""nofollow"">report the Judge and show the issues which require an Appeal</a>. 2nd, email a template of support of Amber where ever you can.</p>
<p><em>""<strong>Amber Heard is a Human Rights Activist</strong> that's being punished for trying to do humanitarian work. The article was written when she was an ambassador for the ACLU, <a href=""https://web.archive.org/web/20180921235815/https://www.standup4humanrights.org/en/hr-champions-aheard.html"" target=""_blank"" rel=""nofollow"">Human Rights Champion for the United Nations</a>, advocate for World Identity Network, and had a long history of volunteering for causes since she was 15.</em></p>
<p><em>Hollywood Fixers, services, and operations caused tampering with witnesses, illegal intimidation, and harmed her case...""</em></p>
<p>We gave Amber hope during this trial that became an unstoppable storm.<br><br><em><strong>How to Help:</strong></em><br><strong>Sign a banner in support of her</strong> (pictured here at the court with 40+ signers), contact this account:<br><a href=""https://twitter.com/mitchinnyeon"" rel=""nofollow"">https://twitter.com/mitchinnyeon</a><br><br><strong>A template for Complaint vs Judge Penney Azcarate Template - Amber Heard Case:</strong> <a href=""https://docs.google.com/document/d/1g5yFmidr9205mEE35khbrisJYcdSFUe9wr4yVYvbrlo/edit?usp=sharing"" rel=""nofollow"">https://docs.google.com/document/d/1g5yFmidr9205mEE35khbrisJYcdSFUe9wr4yVYvbrlo/edit?usp=sharing</a> <br>Site with form for compliant: <a href=""https://vacourts.gov/agencies/jirc/home.html"" rel=""nofollow"">https://vacourts.gov/agencies/jirc/home.html</a><br><br><strong>BelieveAmberHeard.com Organizing:</strong><br>""We need to pass stronger anti-SLAPP laws in VA and also try to hold the judge accountable. I'm coordinating with other people at <a href=""http://believeamberheard.com"" rel=""nofollow"">http://believeamberheard.com</a> to organize a protest but we really need Virginia residents to pull it off.""<br><br><strong>Reddit Group - DeppDelusion - an Action Plan:</strong><br><a href=""https://www.reddit.com/r/DeppDelusion/comments/v6shvg/action_plan_to_make_sure_this_doesnt_happen_again/"" rel=""nofollow"">https://www.reddit.com/r/DeppDelusion/comments/v6shvg/action_plan_to_make_sure_this_doesnt_happen_again/</a><br><br><strong>PurpleForAmber Causes</strong> -<br><a href=""https://twitter.com/purpleforamber"" rel=""nofollow"">https://twitter.com/purpleforamber</a><br><br><strong>Donate to support National Coalition Against Domestic Violence in Amber's honor:</strong><br><a href=""https://www.gofundme.com/f/purple-for-amber-donations-for-the-ncadv"" rel=""nofollow"">https://www.gofundme.com/f/purple-for-amber-donations-for-the-ncadv</a></p>
<p><strong>Speak to Reporters to Support Amber!<br><br>Ask Organizations to file an Amicus Curiae brief onto Amber Heard's Appeal to Support her</strong> - <em>On long-term social effects</em><br><br>We further need to report the online operations and in-person tampering, and currently working on that. </p>
<p>""Internet Journalists"" were used by both Waldman and Barresi. They learned from each other on how to harm Amber Heard.<br>Waldman admitted he had no previous clients involved with domestic violence. The longstanding tradition of harming women and victims with ""Fixers"" was increased during this to be both <a href=""https://github.com/RescueSocialTech/Amber-Heard_Disinformation_Operations_Bots"" target=""_blank"" rel=""nofollow"">online</a> and in-person.</p>
<p>We showed earlier that we have evidence of online operations harming Amber with persuasive science that we gave to Reporters.</p>
<p>The online issues are in essence extortion and illegal intimidation, saying to her since the ""Amber Heard's 2020 Takeaway: <a href=""https://github.com/RescueSocialTech/Amber-Heard_Disinformation_Operations_Bots/tree/main/Adapt%20and%20Survive%20Amber%20Heard%20-%20YouTube%20Video"" target=""_blank"" rel=""nofollow"">Adapt and Survive</a>"" video in 2020 where she won in that case then saw 43K bot texts 'not a victim' then tens of thousands more switching texts, that she must recant or be destroyed/killed for it.<br>We wanted CSOs to look into it months before the trial. During her trial, it was 3-10x worse in metrics than any other previous time. Supposedly, a juror went onto one of the social media sites afterwards.</p>
<p><a href=""https://docs.google.com/document/d/13lgNL2l9N45ZTb5wupeSiW6lbxhoVzSP/edit"" target=""_blank"" rel=""nofollow"">In our report of the Judge</a>, we state:<br><em>""The misconduct, neglect, and suppression [by the Judge and Court] that increased danger led to thousands of death threats increasingly reaching Amber Heard and her witnesses during the trial as in testimony. </em></p>
<p><em>In-person, witnesses became threatened and tampered with before testifying on both sides of the trial. E.g., Jennifer Howell had her door drilled in and a witness of the Viper Room Richard Albertini was given death threats by a Hollywood Fixer... </em><em>[This witness is listed as the leading first source by Richard Schwartz as witnessing a cigarette put out on a woman similar to Amber's fears in the recording]</em></p>
<p><em>It is rational to conclude that jurors could have been afraid to provide a positive verdict for Amber Heard due to the dangers discussed during the trial that persist no matter the outcomes and lack of protections. Multiple attacks on the UK Judge from the 2020 verdict persisted after he stated that Amber Heard had been abused with a verdict helping her survival.</em><br><em>The jurors could have been hunted as were the witnesses and defendant. Although Amber Heard requested protections of the juror’s identities, it is clear that many attending in the court room could have identified the jurors.""<br></em></p>
<p>Although Empire Media Group has 12+ publications and 'new' not previously approved witnesses were brought into the end of the trial, this from her past friends, tracked by the Fixer and not referred to support Amber, only appeared in 1 site.</p>
<p>""Now working for an Austin-based security company, [Joshua] Cruz told Hollywood [Fixer] Paul Barresi: <a href=""https://radaronline.com/p/amber-heard-johnny-depp-trial-friends-dispute-borderline-personality-disorder/"" target=""_blank"" rel=""nofollow"">“Amber was always a sweet, considerate and lovely, little girl growing up and she's never changed. I've never known Amber to have ever caused a moment of sorrow for anyone.”</a> “Honestly, I don't believe she ever really knew, as we were growing up, how beautiful she was.” - Joshua Cruz, who has known Heard since childhood.</p>
<p>We have the <strong>email that Barresi sent Waldman on April 18</strong> to shut down Richard Albertini (first witness of Viper Room). There are <a href=""https://mobile.twitter.com/AmberHeardIT/status/1537412652464578562"" target=""_blank"" rel=""nofollow"">3 cooperating witnesses so far (Video testimony)</a> to Barresi tampering, threatening, bribing, misleading, and possibly a 4th witness if cooperating. Albertini texted on May 19th (during the trial) that he would have testified for Amber's behalf.</p>
<p>2nd, Barresi emailed Elon Musk's lawyer on May 13 to remove this witness knowing of violence, crime, and tampering from social media, and disturbingly referred to murdered Amie Harwick who was referred to Barresi and Wayne Ketaily when she had cyber-stalking.<br>Neither Amber Heard's nor Amie Harwick's deaths after cyber-stalking are being stopped.<br><br><em>***Update:</em> We have Audio files from 2019 of Adam Waldman in negotiations with (originally Team Amber) witness Albertini and Albertini's lawyer of how to harm Amber Heard in the media by using Fixer Barresi, and of pay offs both for the media articles and after the trial. The payoffs after trial explains why Barresi and others became so bloodthirsty, intimidating, and tampering during Amber's trial.<br>Waldman states Depp is 'perfectly safe' with his Security. Sadly, this wasn't obtained by Amber's lawyers for the case.</p>
<p>Right now, many pages of Amber showing her good work are being deleted. It's heartbreaking and wrong. Criminal investigations should have been started a year ago, but were thwarted. It only increased in the intimidation and harms...<br><br><strong>The positive impact Amber has done for the world</strong> - we showed Reporters her <a href=""http://web.archive.org/web/20120118112943/http://amberheardofficial.com/"" target=""_blank"" rel=""nofollow"">AmberHeardOfficial.com</a> site showing her causes and activism which she deleted at the beginning of the relationship in 2012 - will always continue.</p>
<p>Remember that.<br><br><strong>We now have the in-person evidence, but as said as before, <em>it's crucial for you to support her</em> as Amber Heard has many insider threats around her.</strong><br><br><strong>Thank you to everyone who have returned to sign this petition. These comments are wonderful and we hope she will see them.</strong></p>
<p><strong>We've always wanted to save Amber Heard's life and it is still possible!<br><br>Don't give up, Amber! We know many who support you.</strong></p>","{'id': '226680063', 'petitionMedium': {'url': '//assets.change.org/photos/1/qo/ue/JkqOUEcnmeiBKZB-800x450-noPad.jpg?1654822491', 'processing': False}}",,,
MilestonePetitionUpdate,30642341,2022-06-09T14:01:51.000Z,,,,,,9000.0
MilestonePetitionUpdate,30625700,2022-06-04T15:06:21.000Z,,,,,,8000.0
MilestonePetitionUpdate,30601442,2022-05-28T06:08:36.000Z,,,,,,7500.0
MilestonePetitionUpdate,30575609,2022-05-21T02:17:29.000Z,,,,,,7000.0
StarterPetitionUpdate,30182152,2022-02-08T15:35:44.000Z,Thanks & Public GitHub of 6 Platforms of Analysis on Amber Heard's Social Media Data & Disinfo Op,"<p><strong>Thanks for signing support still! A New GitHub of 6 Social Media Platforms of analysis on Amber Heard's Data is Public:</strong> <a href=""https://github.com/RescueSocialTech/Amber-Heard_Disinformation_Operations_Bots"" rel=""nofollow"">https://github.com/RescueSocialTech/Amber-Heard_Disinformation_Operations_Bots</a><br><br><strong>There are numerous takeaways in it, one being is that it's clearly now enough evidence of operations, however, analysis is continuing.</strong><br><strong>YouTube especially is damaging.</strong> <br>Not only is it the most voluminous of the platforms in texts and accounts, exception being Change.org, but there are Bots even using Johnny Depp and Michael Keaton's name using the exact same praising texts thousands of times.<br><br>I don't know about you, but posting 15K+ times the exact texts like with auto-notifications anytime a video is uploaded against AH or pro-him is difficult for any human being...<br><br><strong>Millions of Texts and accounts, with analysis showing evidence on every platform of anomalies.</strong><br><br><strong>If you find/read this, if you see this evidence, please report about it and try to point this out. <br><br></strong><strong>Do you even remember what Amber Heard used to do 3 years ago? </strong><br><strong>She took numerous stances asking people to help change culture to help, </strong><br><strong>however, there are numerous people suppressing her, claiming to be keeping tabs on the cyber abuse, actually working against her to slice footage and try to remove supporters doing due diligence that are still left, but without outside pressure there will be no case.</strong><br><br><strong>Another point: Peter Pan.</strong><br>The name ""Peter Pan"" signing Change.org petitions supposedly showed up twice when both an independent team and BotSentinel were testing petitions, at two different times. Interestingly, the opposition's supporting accounts screenshotted it/mentioned it.<br>Nov 23, 2020: ""Peter Pan? Really?"" <a href=""https://twitter.com/JustAJDSupporta/status/1331005067772780547"" rel=""nofollow"">https://twitter.com/JustAJDSupporta/status/1331005067772780547</a><br>2ndly, a JD photo account on Twitter donated $500 to BotSentinel, and communications turned to the worst (non-existent). Note - The team that did this on AH's data is not compensated by her, and genuinely wants to help. It's unprofessional to charge victims.<br><br>Symbols of Disinformation Operations:<br>Sure, you can confuse victims/witnesses with symbols like 'devils, truth, prejudice, monsters, skeletons, dead flesh/dead hearts, hunting hounds, mermaids, coding/tech icons' and more which requires a CYBER INTELLIGENCE ANALYST to understand (and real ones, not with fake suits)... (4 BotNets alone and 'preliminary effects' show this)... <br><strong><em>But Data is Data, and it shows the 'real truth' IF it is collected and IF it is analyzed.</em></strong></p>
<p>See below example from YouTube on 6893 videos on AH:<br><a href=""https://github.com/RescueSocialTech/Amber-Heard_Disinformation_Operations_Bots/tree/main/YouTube%20Analysis"" rel=""nofollow"">https://github.com/RescueSocialTech/Amber-Heard_Disinformation_Operations_Bots/tree/main/YouTube%20Analysis</a><br><br>Data Collections:<br>YouTube: (1) 2,176,926 Comments (1,693,341 Comments with 483,585 Replies), 6,893 Videos (with dislike ratios), 1,152,868 Accounts, Cross-Platform Links</p>
<p>At minimum Tens of Thousands of Repeated Same/Exact Comments...<br>Higher amounts of comments against Amber Heard correlate with increased threats seen in Heat Maps. Correlate to dangers in-person.</p>
<p><strong>Threat Analysis:</strong><br>Threat Analysis is shown above of comments with:<br>Threat - 149,810 - 6.88%<br>Hate-Speech - 351,399 - 16.1%<br>Others - 1,675,334 - 77%</p>
<p>Threat Keywords:<br>Kill &amp; Death 52,232 - 33.2%<br>Crime &amp; Jail 75,830 - 48.2%<br>Hell &amp; Burn 29,214 - 18.6%</p>
<p><em>High Volume of Repeated Exact Comments - Unlike as high volume as other platforms, on <strong>YouTube the exact phrases blatantly repeat with bot-like actions (exception: Instagram 136 times of ""i am inevitable"" with 136 accounts in May 2019). YouTube removed dislikes on their entire platform around a year after the start of the ""Amber Heard's 2020 Takeaway: Adapt and Survive"" with same exact comments and 479K dislikes. 4 other videos, e.g., Gully trailer with 92K dislikes and settlement video receive higher dislikes.</strong></em><br><em>The operations focus on many accounts, wide spread, less so the same accounts, yet, even on YouTube, there are praising texts blatantly using the same usernames pointing to the source and are of the same accounts. Each platform serves different purposes.<br><br></em><strong>Really look forward to seeing Amber Heard in Aquaman 2, and since this is a Category 6 operation inciting violence, we suggest bringing Megaphones to her trial in 2 months with Sirens. <br></strong>- We're very appreciative of you continuing to support her and even finding this petition! With companies hired to harm AH, it's very difficult. Thankfully, it's the 21st century, so when cultures in one region won't help - Another one WILL, and DID!<br>Feel free to share our potent research: <a href=""https://github.com/RescueSocialTech/Amber-Heard_Disinformation_Operations_Bots"" rel=""nofollow"">https://github.com/RescueSocialTech/Amber-Heard_Disinformation_Operations_Bots</a><br><br><strong>With Bots &amp; Disinfo Op on 6 Platforms of evidence, why doesn't Warner Bros sue JD for harming their billion-dollar movie Aquaman and Amber Heard?!</strong><br><strong>Employee emails of WBPictures were posted on Reddit, possibly in multiple years like coordination. They harassed these businesses and their workers.</strong> <br>The most potent of evidence is multiple platforms, since because Twitter is the most researched platform, they are sloppier on the other platforms with YouTube the most blatant, then Instagram, Reddit sandbox, etc. All platforms have their own purposes.</p>","{'id': '226358467', 'petitionMedium': {'url': '//assets.change.org/photos/8/ud/hc/bZUdhcvVninOIVB-800x450-noPad.jpg?1644334546', 'processing': False}}",,,
StarterPetitionUpdate,29981741,2021-12-20T03:10:09.000Z,"Amber Heard is Mera & Bots - 6,000 accounts & Aquaman finishes filming!","<p><strong>Hello all! Aquaman finished filming in Hawaii Dec 9, &amp; 6,000 Bot Accounts were found by BotSentinel in Early 2020.</strong><br><strong>If you noticed, Amber was posting many Photos in her Mera character red hair during filming for the past few months! </strong></p>
<p>In a Scene of a Documentary, a Disinformation/Influence Operation is referred to and we see a million unit graph and 3D pie chart.</p>
<p><a href=""https://www.youtube.com/watch?v=bb2bC04OEPw"" target=""_blank"" rel=""nofollow""><strong>""6000 fake or inauthentic accounts that were targeting Amber Heard."" - says Chris Bouzy, CEO of Botsentinel to Discovery Plus UK (Watch Here).</strong></a> <br><br><em><strong>""Disinformation campaign... a coordinated influence campaign...you really didn't have to be a pro to see it... one of the most sophisticated online targeted attacks we'd seen.""</strong></em><br>Context - 9,000 accounts in Azerbaijan operation on Facebook found by Sophie Zhang. <br>Meaning: Johnny Depp hired Adam Waldman who worked for a Foreign Minister of Russia &amp; Russian Oligarch, &amp; JD recently met Serbia's leadership... he's using ""dictator-level"" disinformation operations. <br><br><em><strong>Q: Why do you think 6,000 accounts was never said prior and further analysis did not continue on their end?</strong></em><br><br>By the way, information on the 181 petitions of information (including the two large ones) are actually accessible via the GraphQL endpoint. An <a href=""https://www.effectivealtruism.org/"" target=""_blank"" rel=""nofollow"">Ex-Google Research Intern</a> helped us obtain it.<br><br>We're a younger generation and sorry that they're not removing the operations against Amber Heard yet. It's quite hard, as explained through internal discrimination behind the scenes in these companies, hence, Bouzy continually shows screenshots of accounts exploiting Meghan Markle with frustration.<br><br><strong>Do you want to see over <em>10,000 Compliments Generated on Amber Heard via Prompts based on Jason Momoa?</em><br>Here are videos of a top AI Researcher creating them in 2 hours <em>(and could do it 10x faster):</em><br></strong><em><a href=""https://asciinema.org/a/w5ayuAEGGpgsxTCKWbAGRPfvZ"" rel=""nofollow"">https://asciinema.org/a/w5ayuAEGGpgsxTCKWbAGRPfvZ</a><strong><br></strong>Funny 3-Way Bots Chat of Amber Heard, Tom Cruise, and Christopher Nolan - <a href=""https://semiosis.github.io/apostrophe"" rel=""nofollow"">https://semiosis.github.io/apostrophe</a></em></p>
<p>We're planning on a studious research GitHub in the future. For now, researchers/analysts aren't on Twitter or most sites, of course.</p>
<p>- In perspective, with dozens of researchers/analysts all seeing anomalies (it was very hard to get people to research at first, which is very sad, because data is data and it's clear here it needed analysis), it will be very clearly reinforced and set a precedent for others...</p>
<p>We're going to use her case example for good to help other domestic abuse and coercive control victims.<br><br>It's <a href=""https://legaldictionary.net/abuse-of-process/"" target=""_blank"" rel=""nofollow""><em>Abuse of Process</em></a> to use Bots/Disinformation Operations to intimidate and damage. That should have given more reasons to do forensics.<br>“(1) the use of process in a judicial proceeding that would be improper in the regular prosecution or defense of a claim or charge; (2) a primary motive in the use of process to accomplish an illegitimate end; and (3) damages.”<br>The Ex-Google Intern had a friend who was harmed by NLG bots. Abuse of Process and telling a leader in AI Governance was as far as they went. They did not use Social Network Analysis evidence. Unlike AH, she cannot be named.<br><br>More evidence in recordings have been shown, however, the point remains here about the online activities. <em>Regardless of thoughts on domestic abuse against women, the bots and cyberabuse, the science, is what interests everyone.</em></p>
<ul>
<li>E.g., YouTube removed dislikes recently (it was a year ago we reported the ""Adapt and Survive"" video). In 2021, we can also see them attacking Gully, which is not even a well known movie...</li>
<li>2nd: Interestingly, ""I am inevitable"" text shows 136 times on Instagram in 3 consecutive days from 136 accounts in May 2019. It was from a cyber intelligence researcher's data collections. Italy is far ahead of USA analysts.</li>
</ul>
<p><strong>We hope Amber Heard knows that her experiences aren't in vain - <em>not when we're creating the technology!</em></strong></p>
<p><strong>We hope she has amazing scenes in Aquaman and the Lost Kingdom, with many more coming!</strong><br>Watch some of her scenes in her older movies too, they're great!</p>",,,,
