id,comment,parent_id,children_count,commentable_type,commentable_id,likes,role,created_at,deleted_at,user.id,user.slug,user.first_name,user.last_name,user.short_display_name,user.display_name,user.city,user.state_code,user.country_code,user.website,user.locale,user.description,user.photo.id,user.photo.url,user.photo.sizes.small.url,user.photo.sizes.small.processing,user.photo.sizes.small.size.width,user.photo.sizes.small.size.height,user.photo.sizes.medium.url,user.photo.sizes.medium.processing,user.photo.sizes.medium.size.width,user.photo.sizes.medium.size.height,user.photo.sizes.large.url,user.photo.sizes.large.processing,user.photo.sizes.large.size.width,user.photo.sizes.large.size.height,user.photo.sizes.xlarge.url,user.photo.sizes.xlarge.processing,user.photo.sizes.xlarge.size.width,user.photo.sizes.xlarge.size.height,user.roles,commentable_entity.id,commentable_entity.document_id,commentable_entity.ask,commentable_entity.created_at,commentable_entity.deleted_at,commentable_entity.published_at,commentable_entity.last_edited_at,commentable_entity.original_locale,commentable_entity.languages,commentable_entity.title,commentable_entity.description,commentable_entity.targeting_description,commentable_entity.letter_body,commentable_entity.end_date,commentable_entity.goal,commentable_entity.relevant_location.city,commentable_entity.relevant_location.country_code,commentable_entity.relevant_location.lat,commentable_entity.relevant_location.lng,commentable_entity.relevant_location.state_code,commentable_entity.relevant_location.google_places_id,commentable_entity.relevant_location.photo_id,commentable_entity.restricted_location,commentable_entity.slug,commentable_entity.status,commentable_entity.victory_date,commentable_entity.victory_description,commentable_entity.is_verified_victory,commentable_entity.is_victory,commentable_entity.video_id,commentable_entity.is_pledge,commentable_entity.topic,commentable_entity.tags,commentable_entity.discoverable,commentable_entity.sponsored_campaign,commentable_entity.organization_free_email_optins,commentable_entity.displayed_signature_count,commentable_entity.total_signature_count,commentable_entity.weekly_signature_count,commentable_entity.total_page_views,commentable_entity.total_share_count,commentable_entity.daily_signature_count,commentable_entity.monthly_signature_count,commentable_entity.daily_signup_count,commentable_entity.weekly_signup_count,commentable_entity.monthly_signup_count,commentable_entity.total_signup_count,commentable_entity.supporter_message_count,commentable_entity.starter_vanity_url,commentable_entity.featured_title,commentable_entity.media_text,commentable_entity.media_url,commentable_entity.photo.id,commentable_entity.photo.url,commentable_entity.photo.sizes.square.url,commentable_entity.photo.sizes.square.processing,commentable_entity.photo.sizes.square.size.width,commentable_entity.photo.sizes.square.size.height,commentable_entity.photo.sizes.small.url,commentable_entity.photo.sizes.small.processing,commentable_entity.photo.sizes.small.size.width,commentable_entity.photo.sizes.small.size.height,commentable_entity.photo.sizes.medium.url,commentable_entity.photo.sizes.medium.processing,commentable_entity.photo.sizes.medium.size.width,commentable_entity.photo.sizes.medium.size.height,commentable_entity.photo.sizes.large.url,commentable_entity.photo.sizes.large.processing,commentable_entity.photo.sizes.large.size.width,commentable_entity.photo.sizes.large.size.height,commentable_entity.photo.type,commentable_entity.user.id,commentable_entity.user.slug,commentable_entity.user.first_name,commentable_entity.user.last_name,commentable_entity.user.short_display_name,commentable_entity.user.display_name,commentable_entity.user.city,commentable_entity.user.state_code,commentable_entity.user.country_code,commentable_entity.user.website,commentable_entity.user.locale,commentable_entity.user.description,commentable_entity.user.roles,commentable_entity.activity.recruit.facebook.count,commentable_entity.activity.recruit.facebook.last_updated,commentable_entity.activity.recruit.sms.count,commentable_entity.activity.recruit.sms.last_updated,commentable_entity.activity.recruit.twitter.count,commentable_entity.activity.recruit.twitter.last_updated,commentable_entity.activity.share.copylink.count,commentable_entity.activity.share.copylink.last_updated,commentable_entity.activity.share.email.count,commentable_entity.activity.share.email.last_updated,commentable_entity.activity.share.facebook.count,commentable_entity.activity.share.facebook.last_updated,commentable_entity.activity.share.sms.count,commentable_entity.activity.share.sms.last_updated,commentable_entity.activity.share.twitter.count,commentable_entity.activity.share.twitter.last_updated,commentable_entity.activity.share.whatsapp.count,commentable_entity.activity.share.whatsapp.last_updated,commentable_entity.targets,commentable_entity.hide_comments,commentable_entity.hide_dm_action_panel,commentable_entity.enable_human_verification,commentable_entity.creator_name,commentable_entity.display_title,commentable_entity.petition_title,commentable_entity.petition_status,commentable_entity.calculated_goal,commentable_entity.media.id,commentable_entity.media.url,commentable_entity.media.sizes.square.url,commentable_entity.media.sizes.square.processing,commentable_entity.media.sizes.square.size.width,commentable_entity.media.sizes.square.size.height,commentable_entity.media.sizes.small.url,commentable_entity.media.sizes.small.processing,commentable_entity.media.sizes.small.size.width,commentable_entity.media.sizes.small.size.height,commentable_entity.media.sizes.medium.url,commentable_entity.media.sizes.medium.processing,commentable_entity.media.sizes.medium.size.width,commentable_entity.media.sizes.medium.size.height,commentable_entity.media.sizes.large.url,commentable_entity.media.sizes.large.processing,commentable_entity.media.sizes.large.size.width,commentable_entity.media.sizes.large.size.height,commentable_entity.media.type,commentable_entity.primary_target.id,commentable_entity.primary_target.display_name,commentable_entity.primary_target.email,commentable_entity.primary_target.type,commentable_entity.primary_target.slug,commentable_entity.primary_target.description,commentable_entity.primary_target.publicly_visible,commentable_entity.primary_target.verified_at,commentable_entity.primary_target.summary,commentable_entity.primary_target.locale,commentable_entity.primary_target.confirmed_at,commentable_entity.primary_target.is_person,commentable_entity.primary_target.additional_data.first_name,commentable_entity.primary_target.additional_data.last_name,commentable_entity.primary_target.additional_data.title,commentable_entity.primary_target.additional_data.id,commentable_entity.primary_target.has_email,commentable_entity.primary_target.photo.id,commentable_entity.primary_target.photo.url,commentable_entity.primary_target.photo.sizes.small.url,commentable_entity.primary_target.photo.sizes.small.processing,commentable_entity.primary_target.photo.sizes.small.size.width,commentable_entity.primary_target.photo.sizes.small.size.height,commentable_entity.primary_target.photo.sizes.medium.url,commentable_entity.primary_target.photo.sizes.medium.processing,commentable_entity.primary_target.photo.sizes.medium.size.width,commentable_entity.primary_target.photo.sizes.medium.size.height,commentable_entity.primary_target.photo.sizes.large.url,commentable_entity.primary_target.photo.sizes.large.processing,commentable_entity.primary_target.photo.sizes.large.size.width,commentable_entity.primary_target.photo.sizes.large.size.height,commentable_entity.primary_target.photo.sizes.xlarge.url,commentable_entity.primary_target.photo.sizes.xlarge.processing,commentable_entity.primary_target.photo.sizes.xlarge.size.width,commentable_entity.primary_target.photo.sizes.xlarge.size.height,commentable_entity.progress
834395386,She tried to ruin someone's life abd does not care who she hurts in the process,0,0,Event,14891960,0,comment,2022-07-14T19:16:29Z,,502128455,502128455,Kerry,Messer,Kerry,Kerry Messer,Bunnlevel,NC,US,,en-US,,126368537.0,photos/7/tf/iv/CntFiVTOyIBIDHQ-fullsize.jpg,//assets.change.org/photos/7/tf/iv/CntFiVTOyIBIDHQ-48x48-noPad.jpg?1556757547,False,48.0,48.0,//assets.change.org/photos/7/tf/iv/CntFiVTOyIBIDHQ-128x128-noPad.jpg?1556757547,False,128.0,128.0,//assets.change.org/photos/7/tf/iv/CntFiVTOyIBIDHQ-400x400-noPad.jpg?1556757547,False,400.0,400.0,//assets.change.org/photos/7/tf/iv/CntFiVTOyIBIDHQ-800x800-noPad.jpg?1556757547,False,800.0,800.0,[],14891960,14891960,"Cancel/Blacklist Amber Heard, Clear Depp's Name #JusticeForJohnnyDepp",2019-04-11T19:29:22Z,,2020-02-03T23:44:03Z,,en-US,['en'],"Warner Brothers: Fire/Cancel/Blacklist Amber Heard, Clear Depp's Name #JohnnyDeppIsInnocent","<p>The public has been aware of Johnny Depp's marriage/divorce to Amber Heard, where Heard accused Depp of domestic violence &amp; became a darling of the #MeToo Mvmt even though there was no proof &amp; he had no history of violence with any previous partner &amp; Heard had.<br><br>She became a Human Rights Champion of the United Nations Human Rights Office, was appointed ambassador on women's rights at the American Civil Liberties Union, and was hired by L'Oreal Paris as its global spokesperson<br><br>There is overwhelming evidence that she was the perpetrator of domestic violence against him all along as well as concocting an elaborate hoax to slander his name and to elevate her status and primarily to stretch her 15mins of fame/gain money. She took advantage of the mvmt to come out the victim when she completely victimized him.<br><br>Here's all the evidence against her (for a comprehensive view with documentation/proof watch these videos from youtuber ""Autumn On Venus"" provided below):<br><br>* <a href=""https://www.tinyurl.com/JDAMV2"" rel=""nofollow"">https://www.tinyurl.com/JDAMV2</a><br>* <a href=""https://www.tinyurl.com/JDAHV1"" rel=""nofollow"">https://www.tinyurl.com/JDAHV1</a><br>* <a href=""https://www.tinyurl.com/JDAMV3"" rel=""nofollow"">https://www.tinyurl.com/JDAMV3</a><br>Exes Defending Him:<br>* <a href=""https://www.tinyurl.com/JDXDefend"" rel=""nofollow"">https://www.tinyurl.com/JDXDefend</a><br>* <a href=""https://www.tinyurl.com/JDXDefend2"" rel=""nofollow"">https://www.tinyurl.com/JDXDefend2</a><br>More Including Audio:</p>
<p>* <a href=""https://www.youtube.com/watch?v=aca0KWoHtqQ"" rel=""nofollow"">https://www.youtube.com/watch?v=aca0KWoHtqQ</a></p>
<p>* <a href=""https://www.youtube.com/watch?v=eWijmDzZeJU&amp;t=2s"" rel=""nofollow"">https://www.youtube.com/watch?v=eWijmDzZeJU&amp;t=2s</a></p>
<p><a href=""https://www.youtube.com/watch?v=aca0KWoHtqQ"" rel=""nofollow"">https://www.youtube.com/watch?v=aca0KWoHtqQ</a><br>My observations, all in videos: <br>* She blackmailed him, <br>* She has a history of domestic violence whereas JD doesn't <br>* The police reported no marks/bruises on AH on the night of the alleged attack <br>* She never acted like a trauma victim: i.e immediately getting into another relationship, trying to get spousal support, dragging out the situation, not willing to sit down for a deposition, etc<br>* He on the other hand withdrew from public eye, started drinking again, became disheveled, etc<br>* He now has 87 surveillance cam footage &amp; many witnesses <br>* She has a video begging him to come home when she feared for her life? <br>* Victims don't constantly talk about this, she can't stop<br>* 4,000 more pieces of evidence he submitted </p>
<p>Blacklist this abuser, please! <br><br><br>Please Remove Amber Heard from any future DC property &amp; as any spokesperson for domestic violence. Just as any man would under the same circumstances. <br><br><strong>I started this petition because...</strong><br>I believe in justice no matter who is the accuser/accused. If you do too, please sign</p>","Warner Brothers, United Nations Human Rights Office, AMERICAN CIVIL LIBERTIES UNION, L'Oreal Paris, SVP Of Publicity & Communications For DC Warner Brothers","Fire/Cancel/Blacklist Amber Heard, Clear Depp's Name #JohnnyDeppIsInnocent",2021-02-04,,,US,,,,,,,warner-brothers-fire-cancel-blacklist-amber-heard-clear-depp-s-name-johnnydeppisinnocent,published,,,False,False,,False,,"[{'id': 7984, 'locale': 'en-US', 'name': 'domestic violence', 'slug': 'domestic-violence-en-us', 'photo_id': None, 'created_by_owner': True, 'created_by_staff_member': False, 'total_count': 465}, {'id': 491651, 'locale': 'en-US', 'name': 'Abused Men', 'slug': 'abused-men-en-us', 'photo_id': None, 'created_by_owner': True, 'created_by_staff_member': False, 'total_count': 2}, {'id': 2342, 'locale': 'en-US', 'name': 'abuse', 'slug': 'abuse-en-us', 'photo_id': None, 'created_by_owner': True, 'created_by_staff_member': False, 'total_count': 290}]",True,False,,383,383,0,1284,103,0,1,0,0,0,20,,,,,,223067678,photos/5/bm/zq/abbmzQOlXnOcqln-fullsize.jpg,//assets.change.org/photos/5/bm/zq/abbmzQOlXnOcqln-400x400-noPad.jpg?1580773446,False,400,400,//assets.change.org/photos/5/bm/zq/abbmzQOlXnOcqln-400x225-noPad.jpg?1580773445,False,400,225,//assets.change.org/photos/5/bm/zq/abbmzQOlXnOcqln-800x450-noPad.jpg?1580773447,False,800,450,//assets.change.org/photos/5/bm/zq/abbmzQOlXnOcqln-1600x900-noPad.jpg?1580773447,False,1600,900,photo,891208805,891208805,Rebecca,F,Rebecca,Rebecca F,Chanhassen,MN,US,,en-US,,[],3,1653413747,2,1656606631,1,1627176797,25,1656592653.383,5,1652609628.794,4,1654196575.722,7,1656606665.781,2,1653436292.805,4,1656592650.752,"[{'id': 886222, 'display_name': 'Warner Brothers', 'email': None, 'type': 'Custom', 'slug': 'warner-brothers-7', 'description': None, 'publicly_visible': False, 'verified_at': None, 'summary': None, 'locale': 'en-US', 'confirmed_at': '2013-12-16T22:34:23Z', 'is_person': False, 'member_of': {}, 'additional_data': {'first_name': 'Warner', 'last_name': 'Brothers', 'title': None, 'id': 818294}, 'has_email': True, 'photo': {'id': 13419973, 'url': 'photos/5/yr/fx/CDYrFXRWHJehAmW-fullsize.jpg', 'sizes': {'small': {'url': '//assets.change.org/photos/5/yr/fx/CDYrFXRWHJehAmW-48x48-noPad.jpg?1520335246', 'processing': False, 'size': {'width': 48, 'height': 48}}, 'medium': {'url': '//assets.change.org/photos/5/yr/fx/CDYrFXRWHJehAmW-128x128-noPad.jpg?1520335247', 'processing': False, 'size': {'width': 128, 'height': 128}}, 'large': {'url': '//assets.change.org/photos/5/yr/fx/CDYrFXRWHJehAmW-400x400-noPad.jpg?1520335246', 'processing': False, 'size': {'width': 400, 'height': 400}}, 'xlarge': {'url': '//assets.change.org/photos/5/yr/fx/CDYrFXRWHJehAmW-800x800-noPad.jpg?1520335246', 'processing': False, 'size': {'width': 800, 'height': 800}}}}}, {'id': 10789401, 'display_name': 'United Nations Human Rights Office', 'email': None, 'type': 'Custom', 'slug': 'united-nations-human-rights-office', 'description': None, 'photo_id': None, 'publicly_visible': False, 'verified_at': None, 'summary': None, 'locale': None, 'confirmed_at': None, 'is_person': True, 'member_of': {}, 'additional_data': {'first_name': 'United', 'last_name': 'Nations Human Rights Office', 'title': None, 'id': 10690110}, 'has_email': False}, {'id': 50582, 'display_name': 'AMERICAN CIVIL LIBERTIES UNION', 'email': None, 'type': 'Custom', 'slug': 'american-civil-liberties-union-3', 'description': None, 'photo_id': None, 'publicly_visible': False, 'verified_at': None, 'summary': None, 'locale': 'en-US', 'confirmed_at': None, 'is_person': True, 'member_of': {}, 'additional_data': {'first_name': 'AMERICAN', 'last_name': 'CIVIL LIBERTIES UNION', 'title': None, 'id': 37777}, 'has_email': False}, {'id': 121774, 'display_name': ""L'Oreal Paris"", 'email': None, 'type': 'Custom', 'slug': 'l-oreal-paris', 'description': None, 'photo_id': None, 'publicly_visible': False, 'verified_at': None, 'summary': None, 'locale': None, 'confirmed_at': None, 'is_person': True, 'member_of': {}, 'additional_data': {'first_name': ""L'Oreal"", 'last_name': 'Paris', 'title': None, 'id': 259708}, 'has_email': False}, {'id': 11281344, 'display_name': 'SVP Of Publicity & Communications For DC Warner Brothers', 'email': None, 'type': 'Custom', 'slug': 'svp-of-publicity-communications-for-dc-warner-brothers', 'description': None, 'photo_id': None, 'publicly_visible': False, 'verified_at': None, 'summary': None, 'locale': None, 'confirmed_at': None, 'is_person': True, 'member_of': {}, 'additional_data': {'first_name': 'SVP', 'last_name': 'Of Publicity & Communications For DC Warner Brothers', 'title': None, 'id': 11181724}, 'has_email': False}]",False,False,False,Rebecca F,"Warner Brothers: Fire/Cancel/Blacklist Amber Heard, Clear Depp's Name #JohnnyDeppIsInnocent","Warner Brothers: Fire/Cancel/Blacklist Amber Heard, Clear Depp's Name #JohnnyDeppIsInnocent",active,500,223067678,photos/5/bm/zq/abbmzQOlXnOcqln-fullsize.jpg,//assets.change.org/photos/5/bm/zq/abbmzQOlXnOcqln-400x400-noPad.jpg?1580773446,False,400,400,//assets.change.org/photos/5/bm/zq/abbmzQOlXnOcqln-400x225-noPad.jpg?1580773445,False,400,225,//assets.change.org/photos/5/bm/zq/abbmzQOlXnOcqln-800x450-noPad.jpg?1580773447,False,800,450,//assets.change.org/photos/5/bm/zq/abbmzQOlXnOcqln-1600x900-noPad.jpg?1580773447,False,1600,900,photo,886222,Warner Brothers,,Custom,warner-brothers-7,,False,,,en-US,2013-12-16T22:34:23Z,False,Warner,Brothers,,818294,True,13419973,photos/5/yr/fx/CDYrFXRWHJehAmW-fullsize.jpg,//assets.change.org/photos/5/yr/fx/CDYrFXRWHJehAmW-48x48-noPad.jpg?1520335246,False,48,48,//assets.change.org/photos/5/yr/fx/CDYrFXRWHJehAmW-128x128-noPad.jpg?1520335247,False,128,128,//assets.change.org/photos/5/yr/fx/CDYrFXRWHJehAmW-400x400-noPad.jpg?1520335246,False,400,400,//assets.change.org/photos/5/yr/fx/CDYrFXRWHJehAmW-800x800-noPad.jpg?1520335246,False,800,800,76.6
