809243944,she is the ABUSER she should not be an advocate for Domestic Violence especially what she did if fount of Johnnys kids,0,0,Event,14094292,0,comment,2020-11-13T22:08:03Z,,848630835,848630835,Lucinda,Trillo,Lucinda,Lucinda Trillo,,,US,,en-US,,[],14094292,14094292,To remove an unsuitable proven abuser from being an Advocate for domestic violence,2018-12-26T10:25:17Z,,2018-12-26T10:39:35Z,,en-GB,['en'],ACLU: To remove an unsuitable proven abuser from being an Advocate for domestic violence,"<p>Many people men n women suffer at the hands of an abusive spouse. It takes years for them to open n speak n to reach out n get help. Mainly due to mental, physical, emotional n sexual abuse that makes that person left feeling void, humiliated, no self worth, hollow, have a need to protect their abuser through fear of negative retaliation n much more.Having a known abuser such as Amber Heard as an advocate for sufferers and survivors of DV , is not only making a mockery of a subject that is so severe but runs the risk of of having sufferers not trusting an organization in which they should feel they would be able to come forward n trust. Having this person as an advocate could run the risk n damage of sufferers coming foward n that would be a tragedy in itself.</p>",ACLU,To remove an unsuitable proven abuser from being an Advocate for domestic violence,2019-12-27,,,GB,55.3781,-3.43597,,,,,aclu-to-remove-an-unsuitable-proven-abuser-from-being-an-advocate-for-domestic-violence,published,,,False,False,,False,,[],True,False,,489,489,0,1276,215,0,0,0,0,0,45,,,,,,221531924,photos/6/fh/su/DXFhsufkyMCcdxh-fullsize.jpg,//assets.change.org/photos/6/fh/su/DXFhsufkyMCcdxh-400x400-noPad.jpg?1545952177,False,400,400,//assets.change.org/photos/6/fh/su/DXFhsufkyMCcdxh-400x225-noPad.jpg?1545952176,False,400,225,//assets.change.org/photos/6/fh/su/DXFhsufkyMCcdxh-800x450-noPad.jpg?1545952177,False,800,450,//assets.change.org/photos/6/fh/su/DXFhsufkyMCcdxh-1600x900-noPad.jpg?1545952177,False,1600,900,photo,1,1621134803,2,1653775779.115,1,1653343875.612,811097416,811097416,Nikki-jane,Clark,Nikki-jane,Nikki-jane Clark,Rochester,,GB,,en-GB,,221527748,photos/6/xx/du/PVxXDuPAlyZElOq-fullsize.jpg,//assets.change.org/photos/6/xx/du/PVxXDuPAlyZElOq-48x48-noPad.jpg?1545819986,False,48,48,//assets.change.org/photos/6/xx/du/PVxXDuPAlyZElOq-128x128-noPad.jpg?1545819985,False,128,128,//assets.change.org/photos/6/xx/du/PVxXDuPAlyZElOq-400x400-noPad.jpg?1545819985,False,400,400,//assets.change.org/photos/6/xx/du/PVxXDuPAlyZElOq-800x800-noPad.jpg?1545819986,False,800,800,[],"[{'id': 46756, 'display_name': 'ACLU', 'email': None, 'type': 'Custom', 'slug': 'aclu', 'description': None, 'photo_id': None, 'publicly_visible': False, 'verified_at': None, 'summary': None, 'locale': 'en-US', 'confirmed_at': None, 'is_person': True, 'member_of': {}, 'additional_data': {'first_name': 'ACLU', 'last_name': None, 'title': None, 'id': 55116}, 'has_email': False}]",False,False,False,Nikki-jane Clark,221527748,photos/6/xx/du/PVxXDuPAlyZElOq-fullsize.jpg,//assets.change.org/photos/6/xx/du/PVxXDuPAlyZElOq-48x48-noPad.jpg?1545819986,False,48,48,//assets.change.org/photos/6/xx/du/PVxXDuPAlyZElOq-128x128-noPad.jpg?1545819985,False,128,128,//assets.change.org/photos/6/xx/du/PVxXDuPAlyZElOq-400x400-noPad.jpg?1545819985,False,400,400,//assets.change.org/photos/6/xx/du/PVxXDuPAlyZElOq-800x800-noPad.jpg?1545819986,False,800,800,ACLU: To remove an unsuitable proven abuser from being an Advocate for domestic violence,ACLU: To remove an unsuitable proven abuser from being an Advocate for domestic violence,active,500,221531924,photos/6/fh/su/DXFhsufkyMCcdxh-fullsize.jpg,//assets.change.org/photos/6/fh/su/DXFhsufkyMCcdxh-400x400-noPad.jpg?1545952177,False,400,400,//assets.change.org/photos/6/fh/su/DXFhsufkyMCcdxh-400x225-noPad.jpg?1545952176,False,400,225,//assets.change.org/photos/6/fh/su/DXFhsufkyMCcdxh-800x450-noPad.jpg?1545952177,False,800,450,//assets.change.org/photos/6/fh/su/DXFhsufkyMCcdxh-1600x900-noPad.jpg?1545952177,False,1600,900,photo,46756,ACLU,,Custom,aclu,,,False,,,en-US,,True,ACLU,,,55116,False,97.8,215395260.0,photos/2/gb/yz/LBgbyzqyUfCYfRu-fullsize.jpg,//assets.change.org/photos/2/gb/yz/LBgbyzqyUfCYfRu-48x48-noPad.jpg?1515599804,False,48.0,48.0,//assets.change.org/photos/2/gb/yz/LBgbyzqyUfCYfRu-128x128-noPad.jpg?1515599881,False,128.0,128.0,//assets.change.org/photos/2/gb/yz/LBgbyzqyUfCYfRu-400x400-noPad.jpg?1515599881,False,400.0,400.0,//assets.change.org/photos/2/gb/yz/LBgbyzqyUfCYfRu-800x800-noPad.jpg?1515599881,False,800.0,800.0
809243157,"She lied, she's a domestic abuser not a survivor.",0,0,Event,14094292,0,comment,2020-11-13T21:42:34Z,,986939709,986939709,Helen,Ibrahim,Helen,Helen Ibrahim,Malmö,,SE,,en-US,,[],14094292,14094292,To remove an unsuitable proven abuser from being an Advocate for domestic violence,2018-12-26T10:25:17Z,,2018-12-26T10:39:35Z,,en-GB,['en'],ACLU: To remove an unsuitable proven abuser from being an Advocate for domestic violence,"<p>Many people men n women suffer at the hands of an abusive spouse. It takes years for them to open n speak n to reach out n get help. Mainly due to mental, physical, emotional n sexual abuse that makes that person left feeling void, humiliated, no self worth, hollow, have a need to protect their abuser through fear of negative retaliation n much more.Having a known abuser such as Amber Heard as an advocate for sufferers and survivors of DV , is not only making a mockery of a subject that is so severe but runs the risk of of having sufferers not trusting an organization in which they should feel they would be able to come forward n trust. Having this person as an advocate could run the risk n damage of sufferers coming foward n that would be a tragedy in itself.</p>",ACLU,To remove an unsuitable proven abuser from being an Advocate for domestic violence,2019-12-27,,,GB,55.3781,-3.43597,,,,,aclu-to-remove-an-unsuitable-proven-abuser-from-being-an-advocate-for-domestic-violence,published,,,False,False,,False,,[],True,False,,489,489,0,1276,215,0,0,0,0,0,45,,,,,,221531924,photos/6/fh/su/DXFhsufkyMCcdxh-fullsize.jpg,//assets.change.org/photos/6/fh/su/DXFhsufkyMCcdxh-400x400-noPad.jpg?1545952177,False,400,400,//assets.change.org/photos/6/fh/su/DXFhsufkyMCcdxh-400x225-noPad.jpg?1545952176,False,400,225,//assets.change.org/photos/6/fh/su/DXFhsufkyMCcdxh-800x450-noPad.jpg?1545952177,False,800,450,//assets.change.org/photos/6/fh/su/DXFhsufkyMCcdxh-1600x900-noPad.jpg?1545952177,False,1600,900,photo,1,1621134803,2,1653775779.115,1,1653343875.612,811097416,811097416,Nikki-jane,Clark,Nikki-jane,Nikki-jane Clark,Rochester,,GB,,en-GB,,221527748,photos/6/xx/du/PVxXDuPAlyZElOq-fullsize.jpg,//assets.change.org/photos/6/xx/du/PVxXDuPAlyZElOq-48x48-noPad.jpg?1545819986,False,48,48,//assets.change.org/photos/6/xx/du/PVxXDuPAlyZElOq-128x128-noPad.jpg?1545819985,False,128,128,//assets.change.org/photos/6/xx/du/PVxXDuPAlyZElOq-400x400-noPad.jpg?1545819985,False,400,400,//assets.change.org/photos/6/xx/du/PVxXDuPAlyZElOq-800x800-noPad.jpg?1545819986,False,800,800,[],"[{'id': 46756, 'display_name': 'ACLU', 'email': None, 'type': 'Custom', 'slug': 'aclu', 'description': None, 'photo_id': None, 'publicly_visible': False, 'verified_at': None, 'summary': None, 'locale': 'en-US', 'confirmed_at': None, 'is_person': True, 'member_of': {}, 'additional_data': {'first_name': 'ACLU', 'last_name': None, 'title': None, 'id': 55116}, 'has_email': False}]",False,False,False,Nikki-jane Clark,221527748,photos/6/xx/du/PVxXDuPAlyZElOq-fullsize.jpg,//assets.change.org/photos/6/xx/du/PVxXDuPAlyZElOq-48x48-noPad.jpg?1545819986,False,48,48,//assets.change.org/photos/6/xx/du/PVxXDuPAlyZElOq-128x128-noPad.jpg?1545819985,False,128,128,//assets.change.org/photos/6/xx/du/PVxXDuPAlyZElOq-400x400-noPad.jpg?1545819985,False,400,400,//assets.change.org/photos/6/xx/du/PVxXDuPAlyZElOq-800x800-noPad.jpg?1545819986,False,800,800,ACLU: To remove an unsuitable proven abuser from being an Advocate for domestic violence,ACLU: To remove an unsuitable proven abuser from being an Advocate for domestic violence,active,500,221531924,photos/6/fh/su/DXFhsufkyMCcdxh-fullsize.jpg,//assets.change.org/photos/6/fh/su/DXFhsufkyMCcdxh-400x400-noPad.jpg?1545952177,False,400,400,//assets.change.org/photos/6/fh/su/DXFhsufkyMCcdxh-400x225-noPad.jpg?1545952176,False,400,225,//assets.change.org/photos/6/fh/su/DXFhsufkyMCcdxh-800x450-noPad.jpg?1545952177,False,800,450,//assets.change.org/photos/6/fh/su/DXFhsufkyMCcdxh-1600x900-noPad.jpg?1545952177,False,1600,900,photo,46756,ACLU,,Custom,aclu,,,False,,,en-US,,True,ACLU,,,55116,False,97.8,,,,,,,,,,,,,,,,,,
809239881,She is a abuser,0,0,Event,14094292,0,comment,2020-11-13T20:07:19Z,,469822998,469822998,Lyn,Gee,Lyn,Lyn Gee,Oldham,ENG,GB,,en-GB,,[],14094292,14094292,To remove an unsuitable proven abuser from being an Advocate for domestic violence,2018-12-26T10:25:17Z,,2018-12-26T10:39:35Z,,en-GB,['en'],ACLU: To remove an unsuitable proven abuser from being an Advocate for domestic violence,"<p>Many people men n women suffer at the hands of an abusive spouse. It takes years for them to open n speak n to reach out n get help. Mainly due to mental, physical, emotional n sexual abuse that makes that person left feeling void, humiliated, no self worth, hollow, have a need to protect their abuser through fear of negative retaliation n much more.Having a known abuser such as Amber Heard as an advocate for sufferers and survivors of DV , is not only making a mockery of a subject that is so severe but runs the risk of of having sufferers not trusting an organization in which they should feel they would be able to come forward n trust. Having this person as an advocate could run the risk n damage of sufferers coming foward n that would be a tragedy in itself.</p>",ACLU,To remove an unsuitable proven abuser from being an Advocate for domestic violence,2019-12-27,,,GB,55.3781,-3.43597,,,,,aclu-to-remove-an-unsuitable-proven-abuser-from-being-an-advocate-for-domestic-violence,published,,,False,False,,False,,[],True,False,,489,489,0,1276,215,0,0,0,0,0,45,,,,,,221531924,photos/6/fh/su/DXFhsufkyMCcdxh-fullsize.jpg,//assets.change.org/photos/6/fh/su/DXFhsufkyMCcdxh-400x400-noPad.jpg?1545952177,False,400,400,//assets.change.org/photos/6/fh/su/DXFhsufkyMCcdxh-400x225-noPad.jpg?1545952176,False,400,225,//assets.change.org/photos/6/fh/su/DXFhsufkyMCcdxh-800x450-noPad.jpg?1545952177,False,800,450,//assets.change.org/photos/6/fh/su/DXFhsufkyMCcdxh-1600x900-noPad.jpg?1545952177,False,1600,900,photo,1,1621134803,2,1653775779.115,1,1653343875.612,811097416,811097416,Nikki-jane,Clark,Nikki-jane,Nikki-jane Clark,Rochester,,GB,,en-GB,,221527748,photos/6/xx/du/PVxXDuPAlyZElOq-fullsize.jpg,//assets.change.org/photos/6/xx/du/PVxXDuPAlyZElOq-48x48-noPad.jpg?1545819986,False,48,48,//assets.change.org/photos/6/xx/du/PVxXDuPAlyZElOq-128x128-noPad.jpg?1545819985,False,128,128,//assets.change.org/photos/6/xx/du/PVxXDuPAlyZElOq-400x400-noPad.jpg?1545819985,False,400,400,//assets.change.org/photos/6/xx/du/PVxXDuPAlyZElOq-800x800-noPad.jpg?1545819986,False,800,800,[],"[{'id': 46756, 'display_name': 'ACLU', 'email': None, 'type': 'Custom', 'slug': 'aclu', 'description': None, 'photo_id': None, 'publicly_visible': False, 'verified_at': None, 'summary': None, 'locale': 'en-US', 'confirmed_at': None, 'is_person': True, 'member_of': {}, 'additional_data': {'first_name': 'ACLU', 'last_name': None, 'title': None, 'id': 55116}, 'has_email': False}]",False,False,False,Nikki-jane Clark,221527748,photos/6/xx/du/PVxXDuPAlyZElOq-fullsize.jpg,//assets.change.org/photos/6/xx/du/PVxXDuPAlyZElOq-48x48-noPad.jpg?1545819986,False,48,48,//assets.change.org/photos/6/xx/du/PVxXDuPAlyZElOq-128x128-noPad.jpg?1545819985,False,128,128,//assets.change.org/photos/6/xx/du/PVxXDuPAlyZElOq-400x400-noPad.jpg?1545819985,False,400,400,//assets.change.org/photos/6/xx/du/PVxXDuPAlyZElOq-800x800-noPad.jpg?1545819986,False,800,800,ACLU: To remove an unsuitable proven abuser from being an Advocate for domestic violence,ACLU: To remove an unsuitable proven abuser from being an Advocate for domestic violence,active,500,221531924,photos/6/fh/su/DXFhsufkyMCcdxh-fullsize.jpg,//assets.change.org/photos/6/fh/su/DXFhsufkyMCcdxh-400x400-noPad.jpg?1545952177,False,400,400,//assets.change.org/photos/6/fh/su/DXFhsufkyMCcdxh-400x225-noPad.jpg?1545952176,False,400,225,//assets.change.org/photos/6/fh/su/DXFhsufkyMCcdxh-800x450-noPad.jpg?1545952177,False,800,450,//assets.change.org/photos/6/fh/su/DXFhsufkyMCcdxh-1600x900-noPad.jpg?1545952177,False,1600,900,photo,46756,ACLU,,Custom,aclu,,,False,,,en-US,,True,ACLU,,,55116,False,97.8,223323700.0,photos/8/fz/qa/oCfzQanyBdsTYeb-fullsize.jpg,//assets.change.org/photos/8/fz/qa/oCfzQanyBdsTYeb-48x48-noPad.jpg?1584713266,False,48.0,48.0,//assets.change.org/photos/8/fz/qa/oCfzQanyBdsTYeb-128x128-noPad.jpg?1584713266,False,128.0,128.0,//assets.change.org/photos/8/fz/qa/oCfzQanyBdsTYeb-400x400-noPad.jpg?1584713266,False,400.0,400.0,//assets.change.org/photos/8/fz/qa/oCfzQanyBdsTYeb-800x800-noPad.jpg?1584713266,False,800.0,800.0
809221833,Amber heard is a abuser,0,0,Event,14094292,0,comment,2020-11-13T11:57:34Z,,812863996,812863996,Abrar,Cheema,Abrar,Abrar Cheema,Lahore,,PK,,en-IN,,[],14094292,14094292,To remove an unsuitable proven abuser from being an Advocate for domestic violence,2018-12-26T10:25:17Z,,2018-12-26T10:39:35Z,,en-GB,['en'],ACLU: To remove an unsuitable proven abuser from being an Advocate for domestic violence,"<p>Many people men n women suffer at the hands of an abusive spouse. It takes years for them to open n speak n to reach out n get help. Mainly due to mental, physical, emotional n sexual abuse that makes that person left feeling void, humiliated, no self worth, hollow, have a need to protect their abuser through fear of negative retaliation n much more.Having a known abuser such as Amber Heard as an advocate for sufferers and survivors of DV , is not only making a mockery of a subject that is so severe but runs the risk of of having sufferers not trusting an organization in which they should feel they would be able to come forward n trust. Having this person as an advocate could run the risk n damage of sufferers coming foward n that would be a tragedy in itself.</p>",ACLU,To remove an unsuitable proven abuser from being an Advocate for domestic violence,2019-12-27,,,GB,55.3781,-3.43597,,,,,aclu-to-remove-an-unsuitable-proven-abuser-from-being-an-advocate-for-domestic-violence,published,,,False,False,,False,,[],True,False,,489,489,0,1276,215,0,0,0,0,0,45,,,,,,221531924,photos/6/fh/su/DXFhsufkyMCcdxh-fullsize.jpg,//assets.change.org/photos/6/fh/su/DXFhsufkyMCcdxh-400x400-noPad.jpg?1545952177,False,400,400,//assets.change.org/photos/6/fh/su/DXFhsufkyMCcdxh-400x225-noPad.jpg?1545952176,False,400,225,//assets.change.org/photos/6/fh/su/DXFhsufkyMCcdxh-800x450-noPad.jpg?1545952177,False,800,450,//assets.change.org/photos/6/fh/su/DXFhsufkyMCcdxh-1600x900-noPad.jpg?1545952177,False,1600,900,photo,1,1621134803,2,1653775779.115,1,1653343875.612,811097416,811097416,Nikki-jane,Clark,Nikki-jane,Nikki-jane Clark,Rochester,,GB,,en-GB,,221527748,photos/6/xx/du/PVxXDuPAlyZElOq-fullsize.jpg,//assets.change.org/photos/6/xx/du/PVxXDuPAlyZElOq-48x48-noPad.jpg?1545819986,False,48,48,//assets.change.org/photos/6/xx/du/PVxXDuPAlyZElOq-128x128-noPad.jpg?1545819985,False,128,128,//assets.change.org/photos/6/xx/du/PVxXDuPAlyZElOq-400x400-noPad.jpg?1545819985,False,400,400,//assets.change.org/photos/6/xx/du/PVxXDuPAlyZElOq-800x800-noPad.jpg?1545819986,False,800,800,[],"[{'id': 46756, 'display_name': 'ACLU', 'email': None, 'type': 'Custom', 'slug': 'aclu', 'description': None, 'photo_id': None, 'publicly_visible': False, 'verified_at': None, 'summary': None, 'locale': 'en-US', 'confirmed_at': None, 'is_person': True, 'member_of': {}, 'additional_data': {'first_name': 'ACLU', 'last_name': None, 'title': None, 'id': 55116}, 'has_email': False}]",False,False,False,Nikki-jane Clark,221527748,photos/6/xx/du/PVxXDuPAlyZElOq-fullsize.jpg,//assets.change.org/photos/6/xx/du/PVxXDuPAlyZElOq-48x48-noPad.jpg?1545819986,False,48,48,//assets.change.org/photos/6/xx/du/PVxXDuPAlyZElOq-128x128-noPad.jpg?1545819985,False,128,128,//assets.change.org/photos/6/xx/du/PVxXDuPAlyZElOq-400x400-noPad.jpg?1545819985,False,400,400,//assets.change.org/photos/6/xx/du/PVxXDuPAlyZElOq-800x800-noPad.jpg?1545819986,False,800,800,ACLU: To remove an unsuitable proven abuser from being an Advocate for domestic violence,ACLU: To remove an unsuitable proven abuser from being an Advocate for domestic violence,active,500,221531924,photos/6/fh/su/DXFhsufkyMCcdxh-fullsize.jpg,//assets.change.org/photos/6/fh/su/DXFhsufkyMCcdxh-400x400-noPad.jpg?1545952177,False,400,400,//assets.change.org/photos/6/fh/su/DXFhsufkyMCcdxh-400x225-noPad.jpg?1545952176,False,400,225,//assets.change.org/photos/6/fh/su/DXFhsufkyMCcdxh-800x450-noPad.jpg?1545952177,False,800,450,//assets.change.org/photos/6/fh/su/DXFhsufkyMCcdxh-1600x900-noPad.jpg?1545952177,False,1600,900,photo,46756,ACLU,,Custom,aclu,,,False,,,en-US,,True,ACLU,,,55116,False,97.8,,,,,,,,,,,,,,,,,,
809210600,Amber abused both of her spouses.,0,0,Event,14094292,0,comment,2020-11-13T04:18:49Z,,875666836,875666836,Tina,Clark,Tina,Tina Clark,West Hollywood,CA,US,,en-US,,[],14094292,14094292,To remove an unsuitable proven abuser from being an Advocate for domestic violence,2018-12-26T10:25:17Z,,2018-12-26T10:39:35Z,,en-GB,['en'],ACLU: To remove an unsuitable proven abuser from being an Advocate for domestic violence,"<p>Many people men n women suffer at the hands of an abusive spouse. It takes years for them to open n speak n to reach out n get help. Mainly due to mental, physical, emotional n sexual abuse that makes that person left feeling void, humiliated, no self worth, hollow, have a need to protect their abuser through fear of negative retaliation n much more.Having a known abuser such as Amber Heard as an advocate for sufferers and survivors of DV , is not only making a mockery of a subject that is so severe but runs the risk of of having sufferers not trusting an organization in which they should feel they would be able to come forward n trust. Having this person as an advocate could run the risk n damage of sufferers coming foward n that would be a tragedy in itself.</p>",ACLU,To remove an unsuitable proven abuser from being an Advocate for domestic violence,2019-12-27,,,GB,55.3781,-3.43597,,,,,aclu-to-remove-an-unsuitable-proven-abuser-from-being-an-advocate-for-domestic-violence,published,,,False,False,,False,,[],True,False,,489,489,0,1276,215,0,0,0,0,0,45,,,,,,221531924,photos/6/fh/su/DXFhsufkyMCcdxh-fullsize.jpg,//assets.change.org/photos/6/fh/su/DXFhsufkyMCcdxh-400x400-noPad.jpg?1545952177,False,400,400,//assets.change.org/photos/6/fh/su/DXFhsufkyMCcdxh-400x225-noPad.jpg?1545952176,False,400,225,//assets.change.org/photos/6/fh/su/DXFhsufkyMCcdxh-800x450-noPad.jpg?1545952177,False,800,450,//assets.change.org/photos/6/fh/su/DXFhsufkyMCcdxh-1600x900-noPad.jpg?1545952177,False,1600,900,photo,1,1621134803,2,1653775779.115,1,1653343875.612,811097416,811097416,Nikki-jane,Clark,Nikki-jane,Nikki-jane Clark,Rochester,,GB,,en-GB,,221527748,photos/6/xx/du/PVxXDuPAlyZElOq-fullsize.jpg,//assets.change.org/photos/6/xx/du/PVxXDuPAlyZElOq-48x48-noPad.jpg?1545819986,False,48,48,//assets.change.org/photos/6/xx/du/PVxXDuPAlyZElOq-128x128-noPad.jpg?1545819985,False,128,128,//assets.change.org/photos/6/xx/du/PVxXDuPAlyZElOq-400x400-noPad.jpg?1545819985,False,400,400,//assets.change.org/photos/6/xx/du/PVxXDuPAlyZElOq-800x800-noPad.jpg?1545819986,False,800,800,[],"[{'id': 46756, 'display_name': 'ACLU', 'email': None, 'type': 'Custom', 'slug': 'aclu', 'description': None, 'photo_id': None, 'publicly_visible': False, 'verified_at': None, 'summary': None, 'locale': 'en-US', 'confirmed_at': None, 'is_person': True, 'member_of': {}, 'additional_data': {'first_name': 'ACLU', 'last_name': None, 'title': None, 'id': 55116}, 'has_email': False}]",False,False,False,Nikki-jane Clark,221527748,photos/6/xx/du/PVxXDuPAlyZElOq-fullsize.jpg,//assets.change.org/photos/6/xx/du/PVxXDuPAlyZElOq-48x48-noPad.jpg?1545819986,False,48,48,//assets.change.org/photos/6/xx/du/PVxXDuPAlyZElOq-128x128-noPad.jpg?1545819985,False,128,128,//assets.change.org/photos/6/xx/du/PVxXDuPAlyZElOq-400x400-noPad.jpg?1545819985,False,400,400,//assets.change.org/photos/6/xx/du/PVxXDuPAlyZElOq-800x800-noPad.jpg?1545819986,False,800,800,ACLU: To remove an unsuitable proven abuser from being an Advocate for domestic violence,ACLU: To remove an unsuitable proven abuser from being an Advocate for domestic violence,active,500,221531924,photos/6/fh/su/DXFhsufkyMCcdxh-fullsize.jpg,//assets.change.org/photos/6/fh/su/DXFhsufkyMCcdxh-400x400-noPad.jpg?1545952177,False,400,400,//assets.change.org/photos/6/fh/su/DXFhsufkyMCcdxh-400x225-noPad.jpg?1545952176,False,400,225,//assets.change.org/photos/6/fh/su/DXFhsufkyMCcdxh-800x450-noPad.jpg?1545952177,False,800,450,//assets.change.org/photos/6/fh/su/DXFhsufkyMCcdxh-1600x900-noPad.jpg?1545952177,False,1600,900,photo,46756,ACLU,,Custom,aclu,,,False,,,en-US,,True,ACLU,,,55116,False,97.8,,,,,,,,,,,,,,,,,,
809208293,"As a victim of abuse, both domestic & random assault; incl rape; as well as a parent to a person who was also abused via DV (as a teen); I can't explain how horrendous this decision is by the ACLU to keep Amber on.  She must be removed, she has admitted numerous times by her own words; she abused, hit & hurt Johnny; this is inexcusable!!",0,0,Event,14094292,0,comment,2020-11-13T03:14:26Z,,1129816334,1129816334,Kay,Elle,Kay,Kay Elle,,,AU,,en-AU,,[],14094292,14094292,To remove an unsuitable proven abuser from being an Advocate for domestic violence,2018-12-26T10:25:17Z,,2018-12-26T10:39:35Z,,en-GB,['en'],ACLU: To remove an unsuitable proven abuser from being an Advocate for domestic violence,"<p>Many people men n women suffer at the hands of an abusive spouse. It takes years for them to open n speak n to reach out n get help. Mainly due to mental, physical, emotional n sexual abuse that makes that person left feeling void, humiliated, no self worth, hollow, have a need to protect their abuser through fear of negative retaliation n much more.Having a known abuser such as Amber Heard as an advocate for sufferers and survivors of DV , is not only making a mockery of a subject that is so severe but runs the risk of of having sufferers not trusting an organization in which they should feel they would be able to come forward n trust. Having this person as an advocate could run the risk n damage of sufferers coming foward n that would be a tragedy in itself.</p>",ACLU,To remove an unsuitable proven abuser from being an Advocate for domestic violence,2019-12-27,,,GB,55.3781,-3.43597,,,,,aclu-to-remove-an-unsuitable-proven-abuser-from-being-an-advocate-for-domestic-violence,published,,,False,False,,False,,[],True,False,,489,489,0,1276,215,0,0,0,0,0,45,,,,,,221531924,photos/6/fh/su/DXFhsufkyMCcdxh-fullsize.jpg,//assets.change.org/photos/6/fh/su/DXFhsufkyMCcdxh-400x400-noPad.jpg?1545952177,False,400,400,//assets.change.org/photos/6/fh/su/DXFhsufkyMCcdxh-400x225-noPad.jpg?1545952176,False,400,225,//assets.change.org/photos/6/fh/su/DXFhsufkyMCcdxh-800x450-noPad.jpg?1545952177,False,800,450,//assets.change.org/photos/6/fh/su/DXFhsufkyMCcdxh-1600x900-noPad.jpg?1545952177,False,1600,900,photo,1,1621134803,2,1653775779.115,1,1653343875.612,811097416,811097416,Nikki-jane,Clark,Nikki-jane,Nikki-jane Clark,Rochester,,GB,,en-GB,,221527748,photos/6/xx/du/PVxXDuPAlyZElOq-fullsize.jpg,//assets.change.org/photos/6/xx/du/PVxXDuPAlyZElOq-48x48-noPad.jpg?1545819986,False,48,48,//assets.change.org/photos/6/xx/du/PVxXDuPAlyZElOq-128x128-noPad.jpg?1545819985,False,128,128,//assets.change.org/photos/6/xx/du/PVxXDuPAlyZElOq-400x400-noPad.jpg?1545819985,False,400,400,//assets.change.org/photos/6/xx/du/PVxXDuPAlyZElOq-800x800-noPad.jpg?1545819986,False,800,800,[],"[{'id': 46756, 'display_name': 'ACLU', 'email': None, 'type': 'Custom', 'slug': 'aclu', 'description': None, 'photo_id': None, 'publicly_visible': False, 'verified_at': None, 'summary': None, 'locale': 'en-US', 'confirmed_at': None, 'is_person': True, 'member_of': {}, 'additional_data': {'first_name': 'ACLU', 'last_name': None, 'title': None, 'id': 55116}, 'has_email': False}]",False,False,False,Nikki-jane Clark,221527748,photos/6/xx/du/PVxXDuPAlyZElOq-fullsize.jpg,//assets.change.org/photos/6/xx/du/PVxXDuPAlyZElOq-48x48-noPad.jpg?1545819986,False,48,48,//assets.change.org/photos/6/xx/du/PVxXDuPAlyZElOq-128x128-noPad.jpg?1545819985,False,128,128,//assets.change.org/photos/6/xx/du/PVxXDuPAlyZElOq-400x400-noPad.jpg?1545819985,False,400,400,//assets.change.org/photos/6/xx/du/PVxXDuPAlyZElOq-800x800-noPad.jpg?1545819986,False,800,800,ACLU: To remove an unsuitable proven abuser from being an Advocate for domestic violence,ACLU: To remove an unsuitable proven abuser from being an Advocate for domestic violence,active,500,221531924,photos/6/fh/su/DXFhsufkyMCcdxh-fullsize.jpg,//assets.change.org/photos/6/fh/su/DXFhsufkyMCcdxh-400x400-noPad.jpg?1545952177,False,400,400,//assets.change.org/photos/6/fh/su/DXFhsufkyMCcdxh-400x225-noPad.jpg?1545952176,False,400,225,//assets.change.org/photos/6/fh/su/DXFhsufkyMCcdxh-800x450-noPad.jpg?1545952177,False,800,450,//assets.change.org/photos/6/fh/su/DXFhsufkyMCcdxh-1600x900-noPad.jpg?1545952177,False,1600,900,photo,46756,ACLU,,Custom,aclu,,,False,,,en-US,,True,ACLU,,,55116,False,97.8,,,,,,,,,,,,,,,,,,
