817741792,"""We are very close to death. All women are. And we are very close to rape and we are very close to beating. And we are inside a system of humiliation from which there is no escape for us. We use statistics not to try to quantify the injuries, but to convince the world that those injuries even exist. Those statistics are not abstractions. It is easy to say, Ah, the statistics, somebody writes them up one way and somebody writes them up another way. That’s true. But I hear about the rapes one by one by one by one by one, which is also how they happen. Those statistics are not abstract to me. Every three minutes a woman is being raped. Every eighteen seconds a woman is being beaten. There is nothing abstract about it. It is happening right now as I am speaking.""
-Andrea Dworkin

"" Women are socially disadvantaged in controlling sexual access to their bodies through socialization to customs that define a woman's body as for sexual use by men. Sexual access is regularly forced or pressured or routinized beyond denial.""
-Catharine MacKinnon

“If we are to fight discrimination and injustice against women we must start from the home for if a woman cannot be safe in her own house then she cannot be expected to feel safe anywhere.”
― Aysha Taryam

“Women face an uphill battle, from sexism and violence to inequality. In some areas, they are forced to deal with a culture that promotes primitive practices that endanger them, not just physically, but emotionally as well.”
― Hagir Elsheikh, Through Tragedy and Triumph: A Life Well Traveled

""All sex, even consensual sex between a married couple, is an act of violence perpetrated against a woman.""
-Catharine MacKinnon

What causes misogynistic thinking? New study finds link with early exposure to pornography !
Have you encountered a man with a sexist attitude? His introduction to pornography could be the stem, according to a new study.
Researchers from the University of Nebraska, U.S., conducted an experiment to determine how exposure to porn for the first time could shape a man’s views on masculinity and sexuality.

To do so, they handed out a 46-question survey to 330 undergraduate men ages 17 to 54. It was designed to measure masculine norms, and it included questions about the first time males saw pornography and whether or not it was an accident.

On average, respondents said they were about 13 years old when they were first exposed to pornography. More than 43 percent said it was by accident, 33 percent said they sought it out and 17 percent said they were forced. About 6 percent declined to answer.

After analyzing the data, scientists found that men who were exposed to porn for the first time at a younger age mostly agreed with statements that asserted male superiority.

However, those who were older when they were first exposed to pornography and had a “greater endorsement of Playboy masculine norms,” such as having multiple sexual partners.

“We expected that the younger the boys were when first exposed to pornography, the more likely they were to adopt playboy norms as well as norms of masculine power over women,” researcher Alyssa Bischmann said in a statement. “We don’t have a lot of theories that would explain this unexpected inverse relationship between pornography use and playboy norms.”However, the scientists did note that their experiment didn’t identify other factors, such as negative sexual experiences, performance anxiety, religiosity and frequency of use, which could be related to the surprising results.

Therefore, more research is needed.

“Future research,” the study said, “should also investigate outcomes of these relations by including measures of relationship satisfaction, wellbeing, and perpetration of violence against women, as these variables may be related to masculine norms and pornography.”

Pornography is the instruction to rape, sexual torture and murder and sexual femicide! There is not only fantasy in porns, there is the real humilation, rape, torture, mutilation and sometimes murder of women, girls and childs. That are heinous sex crimes, nothing more and nothing less.

Hate crime: Deepfakes
Deepfakes: Blackmail 2.0

Naked on the net - without knowing it? That can happen with deepfakes. Videos and photos produced using artificial intelligence are flooding the Internet. They are becoming easier and easier to manufacture. Initially, actresses and pop stars were the victims. Now it can hit any woman - with nude pictures and porn.

In the analog age, there were joke pens with photos of women in their sleeves for horny office stallions. If you turned the pen upside down, the woman was undressed. What wasn't funny back then has now reached an alarming dimension. It's called: Deepfake.

The term is made up of the English words ""deep learning"" and ""fake"" - that is, machine learning with artificial intelligence and falsification. The result is software that creates photos and videos that appear deceptively real, for example by placing Ms. X's head on top of Ms. Y's. A clothed person can also simply be stripped naked in a photo. The victims of photo and video deepfakes are mostly women.

What a few years ago special software was needed for, an app is sufficient today!

What a few years ago required huge amounts of data and special software, an app is sufficient today. The Chinese app ""Zao"", for example, takes a single portrait photo to cut a person's face in video clips, including in porn scenes, of course.

The Dutch company Deeptrace examined around 15,000 deepfake videos last year. The result: 96 percent of the films were pornography - in most cases the heads of Hollywood actresses or pop singers were deceptively realistically mounted in pornography.

A popular victim: feminist Emma Watson. That's especially cool, because she's not just a woman, she's also a feminist. But pretty much every actress and singer who is trendy right now appears in several of these videos. From Reese Witherspoon to Nicole Kidman and Taylor Swift to Kristen Stewart.

But it doesn't just hit stars, it can hit any woman. With the “deepfake revenge porn” a genre of its own has now emerged. The ex-girlfriend's face is tinkered into a porno and sent to friends. Often women are even blackmailed with it. For example, by sending it to the woman's parents or to employers, according to Deeptrace. 55,000 of this “revenge porn” are checked by Facebook every month.

The same principle applies to nude photos that are created using deepfake software. The software inserts deceptively real parts of a synthetically produced woman's body at the point where the body is clothed, according to the body shape. The artificially created naked body is extremely close to the real one.

The messenger service Telegram, for example, which uses a bot to convert photos of women into nude images, has fallen into disrepute. The program is even designed specifically for women. In order to generate a nude picture, the perpetrators send photos of their victims to a program via Telegram. After a short time they get back the photo that has been manipulated into a nude picture.

Fake nude photos and porn videos are often sent to parents.

So far, more than 100,000 AI-generated nude photos have been created on Telegram and shared in dubious channels. Women in the Arab world have already been blackmailed with it. These photos are also gladly sent to parents and employers.

At the end of October, Apple implemented a lock so that iPhones and iPads can no longer access the Telegram bot. It still works on Android devices and Telegram's MacOS app. Telegram was founded by Pawel Durow, known as the ""Russian Mark Zuckerberg"". Most of the users worldwide who use the nude picture function come from Eastern Europe.

Apart from the fact that mostly women are victims of these fakes, fake videos and photos further destroy the trust in the media, which has already been broken. Anything can be a lie. Republican politicians in the vicinity of Trump have already questioned the video showing the violent death of George Floyd. These forgeries undermine democracy.

And the judiciary? Once again, that can't keep up. Every journalistic product must answer in terms of press law. But internet providers seem to operate in an unlawful area, they ""only"" provide the software. The rest is done by the users. Both violate personal rights and copyrights - and human dignity - thousands of times without being prosecuted in any way.

But there is another way. Australia has made making deepfakes a criminal offense. Offenders have been jailed there for several years since 2018. Where there is a will, there is a way.

I have also been a victim of sexual cyber harassment for 17 years by a psychopathic and extrem women hating Islamist Australian ex-renter.
After rent disputes and the tenant moving out, I was able to enjoy the usual stalking incidents damn fast: telephone terror, group stalking, group harassment, lurking professionally and privately, break-in attempts and break-ins, privately, professionally, on vacation and health resort, property damage, then mail and faxes, that Relatives have died, floods of sadistic porn mails, vulgar sex offers, even the famous penis pics with a circumcised penis, harassment of my female friends at home and abroad, on the Internet, through property damage, telephone harassment, break-ins, I also got alleged revenge porn of his Alleged female friends, it was about BDSM porn with tied up women, then my husband's computer was hacked and destroyed several times, obviously photo files were also hacked, because then it got really funny. With my head and name, international porn sites, sex contacts were switched, always the same motto: fucking k.

The really funny thing is, there are no nude photos of me, not a single bikini photo, and I've been fighting pornography with women's organizations since 1977. In the meantime, I wish the stalker that his masculine equipment rots away.
It is now a male hobby to destroy women's and girls' lives worldwide on the Internet, victims of violence and rape are filmed during the act and posted as allegedly sex-horny whores, ex-partners post nude videos and photos on the Internet, send them to friends, Relatives and employers, then the heads of the victims are mounted on perverted porn videos and porn photos and thus the victim is ridiculed and humiliated worldwide. With the exception of Australia, the perpetrators go unpunished worldwide.

We must say it clear and that vilonce is like a big flood worldwide, destroying everything and mostly destroying the female humanity:The biggest hate crime against women right now is: Sexual cyber harassment and sexual witch hunts connected with stalking, rape, murder, defamation, snuff porns and sex slavery!
Computers have changed so much in our daily lives that they have had a huge impact on crime too. Over time, the number of criminal offenses has increased as individuals have used computer technology to better organize every aspect of their lives, from finance and dating to work and process automation. This has created a multitude of gray areas and led to unclear laws that attempt to regulate the types of information that can be posted or shared online.
One aspect of online culture that is changing both the dating and legal landscape is sharing explicit personal photos or nudes. With easy access to amazing cameras right in our pocket, we can share photos with loved ones right away. At the same time, digital technology has made it easier than ever to distribute or share these types of photos online. This has led to an increase in what women worldwide call sexual cyber harassment.
Sexual assaults usually take place via private messages in chats, messengers and communities. Increasingly, harassment can also be observed in public, e.g. as a comment under videos or in the chat on live streams. Even the first pictures and sentences can be annoying, and sometimes the attacks only start after a short small talk. Many victims are minors!
Most of the time, the harassers ask children and young people about their sexual experiences or describe their own sexual practices and wishes. The victims are then asked to perform sexual acts on themselves or others, or even to perform webcam broadcasts. Pornographic files and links are often transmitted.
These crimes are still not punished, why not?

books about:

Anti-Porn: The Resurgence of Anti-Pornography Feminism /Julia Long (Author)
Anti-porn feminism is back. Countering the ongoing ""pornification"" of Western culture and society, anti-porn movements are powerfully re-emerging among a new generation of feminist activists in the UK and worldwide.

Anti-Porn: The Resurgence of Anti-Porn Feminism examines the ways in which the new feminist arguments and campaigns around pornography are articulated, deployed and received. Drawing on original, ethnographic research, it provides an in-depth analysis of the ideological stance, tactical repertoires, impact and significance of campaign groups challenging the pornography industry.
This unique and inspiring book explains the astonishing comeback of anti-porn feminism and challenges liberal perspectives and the mainstreaming on pornography of pornography that changes the nature of our intimate relationships.

Outrageous Acts and Everyday Rebellions/Gloria Steinem (Author)
Outrageous Acts and Everyday Rebellions has sold over half a million copies since its original publication in 1983, acclaimed for its witty, warm, and life-changing view of the world, ""as if women mattered."" Steinem's truly personal writing is here, from the now-famous exposé, ""I Was a Playboy Bunny,"" to the moving tribute to her mother ""Ruth's Song (Because She Could Not Sing It)"". Her prescient essays on female genital mutilation and the difference between erotica and pornography that are still referenced and relevant today, and the hilarious satire, ""If Men Could Menstruate” resonates as much as ever.
As Watson writes of Steinem in her foreword, “She makes what otherwise can be arduous and depressing reading into something not only relatable, but also enjoyable... Her plain common sense, calling things out as they are, will make you laugh out loud. This is her superpower.”

Sex and the Civil War: Soldiers, Pornography, and the Making of American Morality/ Judith Giesberg (Author)
Civil War soldiers enjoyed unprecedented access to obscene materials of all sorts, including mass-produced erotic fiction, cartes de visite, playing cards, and stereographs. A perfect storm of antebellum legal, technological, and commercial developments, coupled with the concentration of men fed into armies, created a demand for, and a deluge of, pornography in the military camps. Illicit materials entered in haversacks, through the mail, or from sutlers; soldiers found pornography discarded on the ground, and civilians discovered it in abandoned camps. Though few examples survived the war, these materials raised sharp concerns among reformers and lawmakers, who launched campaigns to combat it. By the war's end, a victorious, resurgent American nation-state sought to assert its moral authority by redefining human relations of the most intimate sort, including the regulation of sex and reproduction—most evident in the Comstock laws, a federal law and a series of state measures outlawing pornography, contraception, and abortion. With this book, Judith Giesberg has written the first serious study of the erotica and pornography that nineteenth-century American soldiers read and shared and links them to the postwar reaction to pornography and to debates about the future of sex and marriage.

Pornography: Men Possessing Women/Andrea Dworkin (Author)
This strongly argued feminist case against pornography stirred tremendous controversy when first published in 1979, and has lost none of its bite. Dworkin ( Letters from a War Zone ), who lobbies for municipal statutes declaring pornography a violation of women's civil rights, insists that pornography links sex and violence by incorporating violent domination of women as a key element of sexual fantasy: ""Force in high-class pornography is romanticized . . . as if it were dance."" Dworkin also takes what many consider to be an extreme position; she believes that pornography incites men to sexual violence. To support her thesis, she draws parallels between the life and writings of the Marquis de Sade and provides critical summaries of several contemporary pornographic works. Dworkin's style is intense, vivid and eloquent, infused with a sense of urgency.

Pornland: How Porn Has Hijacked Our Sexuality/Gail Dines (Author)
Professor Gail Dines has written about and researched the porn industry for over two decades. She attends industry conferences, interviews producers and performers, and speaks to hundreds of men and women each year about their experience with porn. Students and educators describe her work as “life changing.”
In Pornland—the culmination of her life’s work—Dines takes an unflinching look at porn and its affect on our lives. Astonishingly, the average age of first viewing porn is now 11.5 years for boys, and with the advent of the Internet, it’s no surprise that young people are consuming more porn than ever. But, as Dines shows, today’s porn is strikingly different from yesterday’s Playboy. As porn culture has become absorbed into pop culture, a new wave of entrepreneurs are creating porn that is even more hard-core, violent, sexist, and racist. To differentiate their products in a glutted market, producers have created profitable niche products—like teen sex, torture porn, and gonzo—in order to entice a generation of desensitized users.
Going from the backstreets to Wall Street, Dines traces the extensive money trail behind this multibillion-dollar industry—one that reaps more profits than the film and music industries combined. Like Big Tobacco—with its powerful lobbying groups and sophisticated business practices—porn companies don’t simply sell products. Rather they influence legislators, partner with mainstream media, and develop new technologies like streaming video for cell phones. Proving that this assembly line of content is actually limiting our sexual freedom, Dines argues that porn’s omnipresence has become a public health concern we can no longer ignore.

Sexual Harassment Online: Shaming and Silencing Women in the Digital Age/Tania G. Levey
Women who use social media are often subjected to blatant sexual harassment, facing everything from name calling to threats of violence. Aside from being disturbing, what does this abuse tell us about gender and sexual norms? And can we use the Internet to resist, even transform, destructive misogynistic norms?
Exploring the language of shaming and silencing women in the cybersphere, Tania Levey addresses these questions and also considers how online attempts to regulate women’s behavior intersect with issues of race, ethnicity, and class.

Gender Trolling: How Misogyny Went Viral / Karla Mantilla
Mantilla provides a thoughtful and thorough framework for understanding gender specific harassment and its relationship to broader ""real life"" gender-based abuses of women. She ties online threats and sexual harassment to intimate partner abuse, street harassment, workplace sexual harassment and rape and recommends structural, legal and corporate approaches to increasing women’s safety and free speech online.

Sexting and Revenge Pornography: Legislative and Social Dimensions of a Modern Digital Phenomenon/ Andy Phippen (Author), Maggie Brennan (Author)
This book considers the rapidly evolving, both legally and socially, nature of image-based abuse, for both minors and adults. Drawing mainly from UK data, legislation and case studies, it presents a thesis that the law is, at best, struggling to keep up with some fundamental issues around image based abuse, such as the sexual nature of the crimes and the long term impact on victims, and at worst, in the case of supporting minors, not fit for purpose. It shows, through empirical and legislative analysis, that the dearth of education around this topic, coupled with cultural norms, creates a victim blaming culture that extends into adulthood. It proposes both legislative developments and need for wider stakeholder engagement to understand and support victims, and the impact the non-consensual sharing of intimate images can have on their long-term mental health and life in general. The book is of interest to scholar of law, criminology, sociology, police and socio-technical studies, and is also to those who practice law, law enforcement or wider social care role in both child and adult safeguarding.

Stand Up to Sexting: An Open Conversation for Parents and Tweens/Christy Monson (Author), Heather Boynton (Author),
Sexting-the texting of nude or sexually suggestive images to another person-has become so commonplace that nearly 1 in 4 teens admits to being a participant. The problem is, sexting destroys self-esteem, undermines healthy relationships, leads to depression and self-harm, and can even result to run-ins with the law. It's no wonder that parents recently put sexting among their top-3 parenting concerns-but what's a parent to do?
Stand Up to Sexting is the essential guidebook for parents and tweens to having an open, relaxed conversation about the dangers of sexting. Written in miniature chapters, the book includes friendly illustrations, Q&A prompts for easy conversations, and tools for staying safe. Designed for tweens ages 10-13, the book is the perfect preemptive tool for preparing your kids before their teen years strike.

Bye Felipe: Disses, Dick Pics, and Other Delights of Modern Dating /Alexandra Tweten (Author)
After one too many hostile dating app encounters, Alexandra Tweten set up the Instagram account @ByeFelipe, a place for women to protest the horrors of online dating, and to share stories and screenshots of their own experiences. Three years later, the account has become a forum where women can fight back against the men who have made them uncomfortable, scared, and embarrassed -- and to laugh at the appalling men they encounter.
The name of Bye Felipe is a nod to the ""Bye Felicia"" meme, which Urban Dictionary defines as a cool dismissal of a noxious person. In that spirit, the book helps women navigate the perils that come with swiping right and provides practical steps to overcome the harassment rampant in the dating app ether. Blending humor, feminist theory, and solidarity, this ""field guide"" provides profiles of the worst types of guys (also known as ""Felipes"") -- from the classic fat shamer to the mansplainer to the surprise sociopath -- answers questions like ""How do I react when a guy sends me a dic pic?,"" and gives women the tools they need to take control of their dating life. With stories, screenshots, and Riot Grrrl-esque graphic art throughout, Bye Felipe empowers women to stand up for themselves and uphold the confidence and self-worth Felipes try so desperately to steal.

The Accuser: The True Story of the Big Dan's Gang Rape Victim / Karen Curtis (Autor)
The Accuser written by journalist Karen Curtis delves into the true story of 'Big Dan's Gang Rape Victim,' one of the first televised rape cases in U.S. history. Furthermore, Curtis sheds light on the young woman's untimely death following the trial. Many have seen ""The Accused"" a movie widely based off of real events which landed actress Jodie Foster an Oscar. But this book is the true story that the film, did not tell you. Each page will have you at the edge of your seat and reeling for more of the actual truth. It is a 10/10 must read and an inspiration in the wake of the #MeToo movement.

Caged Eyes: An Air Force Cadet's Story of Rape and Resilience /Lynn K. Hall (Autor)
An insider’s account of misogyny and rape in the US military and her extraordinary path to recovery and activism
Desperate to realize her childhood dream of being an astronaut, Lynn K. Hall was an enthusiastic young cadet. For Hall, the military offered an escape from her chaotic home—her erratic mother, absent biological father, and a man she called “dad” who sexually abused her. Resolute and committed to the Air Force Academy, Hall survived the ordeals of a first-year cadet: intense hazing from upperclassmen, grueling physical training, and demanding coursework. But she’s dismissed from the Academy when, after being raped by an upperclassman and contracting herpes, she is diagnosed with meningitis and left with chronic and debilitating pain.
Betrayed by the Academy and overcome with shame, Hall candidly recounts her loss of self, the dissociation from her body and the forfeiture of her individuality as a result of the military’s demands and her perpetrator’s abuse. Forced to leave the military and return to the civilian world, Hall turns to extreme sports to cope with and overcome PTSD and chronic pain. She, in turn, reclaims herself on the mountain trails of the Colorado Rockies.
An intimate account of grappling with shame and a misogynistic culture that condones rape and blames victims, Caged Eyes is also a transformative story of how it’s possible to help yourself and others in the aftermath of a profound injustice.

Stolen Girls: Survivors of Boko Haram Tell Their Stor/ Wolfgang Bauer
One night in April 2014, members of the terrorist organization Boko Haram raided the small town of Chibok in northeast Nigeria and abducted 276 young girls from the local boarding school. The event caused massive, international outrage. Using the hashtag “Bring Back Our Girls,” politicians, activists, and celebrities from all around the world―among them First Lady Michelle Obama and Nobel Peace Prize winner Malala Yousafzai―protested.
Some of the girls were able to escape and award-winning journalist Wolfgang Bauer spent several weeks with them as they recounted their ordeal. In Stolen Girls, he gives voice to these girls, allowing them to speak for themselves―about their lives before the abduction, about the horrors during their captivity, and their dreams of a better future. Bauer's reportage is complemented by over a dozen stunning portraits by award-winning photographer Andy Spyra.
Bauer also examines the historical and political background of the Islamist terror in the heart of Africa, showing how Boko Haram works and describing the damage it has done to the fragile balance of ethnicities and cultures in one of the world's most diverse regions. His book tells a story of violence, fear, and uncertainty; it is also a story of hope, strength, and courage.

Highway of Tears: A True Story of Racism, Indifference, and the Pursuit of Justice for Missing and Murdered Indigenous Women and Girls/Jessica McDiarmid (Autor)
For decades, Indigenous women and girls have gone missing or been found murdered along an isolated stretch of highway in northwestern British Columbia. The corridor is known as the Highway of Tears, and it has come to symbolize a national crisis.
Journalist Jessica McDiarmid meticulously investigates the devastating effect these tragedies have had on the families of the victims and their communities, and how systemic racism and indifference have created a climate in which Indigenous women and girls are overpoliced yet underprotected. McDiarmid interviews those closest to the victims—mothers and fathers, siblings and friends—and provides an intimate firsthand account of their loss and unflagging fight for justice. Examining the historically fraught social and cultural tensions between settlers and Indigenous peoples in the region, McDiarmid links these cases to others across Canada—now estimated to number up to four thousand—contextualizing them within a broader examination of the undervaluing of Indigenous lives in the country.
Highway of Tears is a piercing exploration of our ongoing failure to provide justice for the victims and a testament to their families’ and communities’ unwavering determination to find it.

Honour: Achieving Justice for Banaz Mahmod/Caroline Goode (Autor)
When Rahmat Sulemani reported his girlfriend Banaz missing, it quickly became clear to DCI Caroline Goode that something was very wrong. In fact, Banaz had contacted her local police station multiple times before, even listing the names of the men she expected to murder her in a so-called honour killing. Her parents didn't seem worried about her whereabouts, but Banaz had already accused them of being in on the conspiracy.
DCI Goode's homicide team took on the investigation before they even had proof that a murder had taken place. What emerged was a shocking story of betrayal and a community-wide web of lies, which would take the team from the suburban streets of south London to the mountain ranges of Kurdistan, making covert recordings and piecing together cell phone data to honour Banaz's memory and finally bring the killers to justice.

The Steubenville Rape Case: Social Media Evidence/ Alexandria Goddard (Autor)
In August 2012, high school football players from Steubenville High School in Steubenville, Ohio were charged with rape. The case made international news because the students documented the crime on social media and no one that night did anything to help the victim. Instead, tweet after tweet they shared humiliating commentary and made fun of her. This book contains screenshots of social media evidence that was collected weeks after the crime as well as tweets that relate to a rape that occurred in April 2012. Again, no one helped the victims. Instead, students and teachers laughed and made jokes.

The Last Girl: My Story of Captivity, and My Fight Against the Islamic State/Nadia Murad (Autor)
Nadia Murad was born and raised in Kocho, a small village of farmers and shepherds in northern Iraq. A member of the Yazidi community, she and her brothers and sisters lived a quiet life. Nadia had dreams of becoming a history teacher or opening her own beauty salon.
On August 15th, 2014, when Nadia was just twenty-one years old, this life ended. Islamic State militants massacred the people of her village, executing men who refused to convert to Islam and women too old to become sex slaves. Six of Nadia’s brothers were killed, and her mother soon after, their bodies swept into mass graves. Nadia was taken to Mosul and forced, along with thousands of other Yazidi girls, into the ISIS slave trade.
Nadia would be held captive by several militants and repeatedly raped and beaten. Finally, she managed a narrow escape through the streets of Mosul, finding shelter in the home of a Sunni Muslim family whose eldest son risked his life to smuggle her to safety.
Today, Nadia's story—as a witness to the Islamic State's brutality, a survivor of rape, a refugee, a Yazidi—has forced the world to pay attention to an ongoing genocide. It is a call to action, a testament to the human will to survive, and a love letter to a lost country, a fragile community, and a family torn apart by war.

The Burning Bed: True Story of Francine Hughes - A Beaten Wife Who Rebelled/Faith McNulty (Autor)
Recounts the tragic story of a battered wife, who in desperation murdered her tormenting husband, and describes how they met and married, and how their relationship deteriorated.
The Burning Bed is the true story of Francine Hughes who killed her abusive ex-husband, Mickey, after enduring over a dozen years of emotional, financial and physical abuse. On March 9, 1977, in her home in Lansing, Michigan, Francine Hughes poured gas around her ex-husband's bed and lit it on fire. She did it after the police had been called for help but then departed without an arrest, and after she had endured a severe beating.

Segrave, K: Lynchings of Women in the United States: The Recorded Cases, 1851-1946/Kerry Segrave (Autor)
Between 1850 and 1950, at least 115 women were lynched by mobs in the United States. The majority of these women were black. This book examines the phenomenon of the lynching of women, a much more rare occurence than the lynching of men. Over the same hundred year period covered in this text, more than 1,000 white men were lynched, while thousands of black men were murdered by mobs. Of particular importance in this examination is the role of race in lynching, particularly the increase in the number of lynchings of black women as the century progressed. Details are provided--when available--in an attempt to shine a light on this form of deadly mob violence.

Rape: Weapon of War and Genocide/John K. Roth (Autor)
Here is a volume that cries out to be read by everyone. It is filled with ""texts of terror"" that must be heard if the human community is truly to respond ""Never again!"" --Margaret A. Farley, Gilbert L. Stark Professor Emerita of Christian Ethics, Yale University Divinity School . . . One of the most nuanced, illuminating, and grimly engaging volumes on rape and mass violence yet published. -- Adam Jones, Executive Director, Gendercide Watch, Author,Genocide: A Comprehensive Introduction Carol Rittner and John K. Roth have brought together a range of very powerful contributions on rape in war and genocide . . . Each chapter deals very personally with the agony of rape and the challenges it poses to male behavior, international law, and political action. -- Hugo Slim, Senior Research Fellow, Institute of Ethics, Law, and Armed Conflict, University of Oxford, Author,Killing Civilians: Method, Madness and Morality in War Resist the urge to put this book down. It . . . calls us to listen to the living and the dead, to their words and their silence. -- Doris L. Bergen, Chancellor Rose and Ray Wolfe Professor of Holocaust Studies, University of Toronto, Author, War and Genocide: A Concise History of the Holocaust

Letters to Sarah - A Child Lost Forever, A Mother's Grief and a Love That Will Never Die/ Sara Payne (Autor)
In the summer of 2000, schoolgirl Sarah Payne went missing from a beach where she played with her siblings. The nation waited with her whole family as the search for the little girl touched the hearts of everyone in the country. After Sarah's body was found, abducted and murdered by convicted paedophile Roy Whiting, her mother, Sara, spoke of how she had survived those terrible times.
Now, seventeen years later, Sara wants to tell the full story of how she coped then, and how she has survived. Through a series of letters to her beloved daughter, she takes the reader on a heart-breaking but uplifting journey through every parent's worst nightmare in a moving account of the ultimate emotional survival. It is a story for the little girl who was taken, but a reminder to us all that hope never dies – and love never ends.

The Natashas: The Horrific Inside Story of Slavery, Rape, and Murder in the Global Sex Trade/Victor Malarek (Autor)
On the black market, they’re the third most profitable commodity, after illegal weapons and drugs. The only difference is that these goods are human, to their handlers they are wholly expendable. They are women and girls, some as young as twelve, from all over the Eastern Bloc, where sinister networks of organized crime have become entrenched in the aftermath of the collapse of the Communist regimes.
In Israel, they’re called Natashas, whether they’re actually from Russia, Bosnia, the Czech Republic, or Ukraine. Lured into vans and onto airplanes with promises of jobs as waitresses, models, nannies, dishwashers, maids, and dancers, they are then stripped of their identification, and their brutal nightmare begins. They are sold into prostitution and kept enslaved; those who resist are beaten, raped, and sometimes killed. They often have nowhere to turn. In many cases, the men who should be rescuing them—immigration officials, police officers, or international peacekeepers—are among their most hostile aggressors. The worldwide traffic in human beings is already a crisis of epic proportions, and it continues to grow. Victor Malarek here exposes the global phenomenon of sexual trafficking, a form of twenty-first century slavery and a multibillion-dollar industry whose scope has, until now, remained largely unknown. The Natashas is an indispensable and startling call to action to seek out institutional corruption and to put a stop to this heinous crime against humanity.

In Fear of Her Life: The True Story of a Violent Marriage/Frances Smyth (Autor)
Frances Smith is the pseudonym for a woman who lived in fear of her life for 22 years. Married at 16 to a Dublin criminal, she endured years of relentless mental and physical torture until she found the strength to fight back.
This is her courageous story told with brutal honesty and at times humour. It chronicles her descent to the brink of suicide and consequent rebuilding of her life.
This unique account is essential reading for all those who have ever endured cruelty at the hands of a man, or another human being for that matter. It gives hope to all those who have been victimised.

One day she found the courage to change the locks, seek a divorce and let his mistress have him for keeps. It was then that she realised he meant the vows he took on his wedding day - 'Till death do us part…'
This is a inspirational story and unless you are a victim, or was a victim of domestic violence, it is never easy to understand why we put up with this abuse.",0,0,Event,25699929,0,comment,2021-04-29T05:46:26Z,,8090682,8090682,Anita,Kanitz,Anita,Anita Kanitz,Stuttgart,,DE,,de-DE,,[],25699929,25699929,Bring back Johnny Depp as Grindelwald,2020-11-06T17:38:53Z,,2020-11-06T17:39:20Z,2020-11-06T17:39:20Z,en-US,['en'],Warner Bros: Bring back Johnny Depp as Grindelwald,"<p>Johnny Depp was forced by Warner Bros to give up position of Grindelwald in the Fantastic beast franchise due to the loss of his legal case.  The lies and Slander Amber heard has spread even after tons of evidence has been released that she herself is the abuser are costing Johnny Depp his career. I refuse to watch or buy anything Warner Bros until this problem is rectified, please join me in support of Johnny Depp and show Warner Bros what a mistake this is.  Let’s also use this to show our support and speak out against domestic violence against men. </p>","Warner Bros, JK Rowling",Bring back Johnny Depp as Grindelwald,2021-11-09,,,US,,,,,,,warner-bros-bring-back-johnny-depp-as-grindelwald,published,,,False,False,,False,,"[{'id': 476127, 'locale': 'en-US', 'name': 'Other', 'slug': 'other-en-us', 'photo_id': None, 'created_by_owner': True, 'created_by_staff_member': False, 'total_count': 166150}]",True,False,,34,34,0,114,10,0,0,0,0,0,1,,,,,,224823231,photos/9/pn/it/cdpnITmjykrbTeK-fullsize.jpg,//assets.change.org/photos/9/pn/it/cdpnITmjykrbTeK-400x400-noPad.jpg?1604684335,False,400,400,//assets.change.org/photos/9/pn/it/cdpnITmjykrbTeK-400x225-noPad.jpg?1604684335,False,400,225,//assets.change.org/photos/9/pn/it/cdpnITmjykrbTeK-800x450-noPad.jpg?1604684335,False,800,450,//assets.change.org/photos/9/pn/it/cdpnITmjykrbTeK-1600x900-noPad.jpg?1604684336,False,1600,900,photo,530036792,530036792,Andrea,Jarvis,Andrea,Andrea Jarvis,Virginia Beach,VA,US,,en-US,,[],1,1651164601.455,"[{'id': 589918, 'display_name': 'Warner Bros', 'email': None, 'type': 'Custom', 'slug': 'warner-bros-3', 'description': None, 'photo_id': None, 'publicly_visible': False, 'verified_at': None, 'summary': None, 'locale': 'en-GB', 'confirmed_at': None, 'is_person': True, 'member_of': {}, 'additional_data': {'first_name': 'Warner', 'last_name': 'Bros', 'title': None, 'id': 34741}, 'has_email': False}, {'id': 597139, 'display_name': 'JK Rowling', 'email': None, 'type': 'Custom', 'slug': 'jk-rowling', 'description': None, 'photo_id': None, 'publicly_visible': False, 'verified_at': None, 'summary': None, 'locale': 'en-US', 'confirmed_at': None, 'is_person': True, 'member_of': {}, 'additional_data': {'first_name': 'JK', 'last_name': 'Rowling', 'title': None, 'id': 42946}, 'has_email': False}]",False,False,False,Andrea Jarvis,Warner Bros: Bring back Johnny Depp as Grindelwald,Warner Bros: Bring back Johnny Depp as Grindelwald,active,100,224823231,photos/9/pn/it/cdpnITmjykrbTeK-fullsize.jpg,//assets.change.org/photos/9/pn/it/cdpnITmjykrbTeK-400x400-noPad.jpg?1604684335,False,400,400,//assets.change.org/photos/9/pn/it/cdpnITmjykrbTeK-400x225-noPad.jpg?1604684335,False,400,225,//assets.change.org/photos/9/pn/it/cdpnITmjykrbTeK-800x450-noPad.jpg?1604684335,False,800,450,//assets.change.org/photos/9/pn/it/cdpnITmjykrbTeK-1600x900-noPad.jpg?1604684336,False,1600,900,photo,589918,Warner Bros,,Custom,warner-bros-3,,,False,,,en-GB,,True,Warner,Bros,,34741,False,34,8419438.0,photos/8/ve/vu/QuveVuBzKPOEulq-fullsize.jpg,//assets.change.org/photos/8/ve/vu/QuveVuBzKPOEulq-48x48-noPad.jpg?1518776370,False,48.0,48.0,//assets.change.org/photos/8/ve/vu/QuveVuBzKPOEulq-128x128-noPad.jpg?1518776892,False,128.0,128.0,//assets.change.org/photos/8/ve/vu/QuveVuBzKPOEulq-400x400-noPad.jpg?1518776892,False,400.0,400.0,//assets.change.org/photos/8/ve/vu/QuveVuBzKPOEulq-800x800-noPad.jpg?1518776892,False,800.0,800.0
