id,comment,parent_id,children_count,commentable_type,commentable_id,likes,role,created_at,deleted_at,user.id,user.slug,user.first_name,user.last_name,user.short_display_name,user.display_name,user.city,user.state_code,user.country_code,user.website,user.locale,user.description,user.roles,commentable_entity.id,commentable_entity.document_id,commentable_entity.ask,commentable_entity.created_at,commentable_entity.deleted_at,commentable_entity.published_at,commentable_entity.last_edited_at,commentable_entity.original_locale,commentable_entity.languages,commentable_entity.title,commentable_entity.description,commentable_entity.targeting_description,commentable_entity.letter_body,commentable_entity.end_date,commentable_entity.goal,commentable_entity.relevant_location.city,commentable_entity.relevant_location.country_code,commentable_entity.relevant_location.lat,commentable_entity.relevant_location.lng,commentable_entity.relevant_location.state_code,commentable_entity.relevant_location.google_places_id,commentable_entity.relevant_location.photo_id,commentable_entity.restricted_location,commentable_entity.slug,commentable_entity.status,commentable_entity.victory_date,commentable_entity.victory_description,commentable_entity.is_verified_victory,commentable_entity.is_victory,commentable_entity.video_id,commentable_entity.is_pledge,commentable_entity.topic,commentable_entity.tags,commentable_entity.discoverable,commentable_entity.sponsored_campaign,commentable_entity.organization_free_email_optins,commentable_entity.displayed_signature_count,commentable_entity.total_signature_count,commentable_entity.weekly_signature_count,commentable_entity.total_page_views,commentable_entity.total_share_count,commentable_entity.daily_signature_count,commentable_entity.monthly_signature_count,commentable_entity.daily_signup_count,commentable_entity.weekly_signup_count,commentable_entity.monthly_signup_count,commentable_entity.total_signup_count,commentable_entity.supporter_message_count,commentable_entity.starter_vanity_url,commentable_entity.featured_title,commentable_entity.media_text,commentable_entity.media_url,commentable_entity.photo.id,commentable_entity.photo.url,commentable_entity.photo.sizes.square.url,commentable_entity.photo.sizes.square.processing,commentable_entity.photo.sizes.square.size.width,commentable_entity.photo.sizes.square.size.height,commentable_entity.photo.sizes.small.url,commentable_entity.photo.sizes.small.processing,commentable_entity.photo.sizes.small.size.width,commentable_entity.photo.sizes.small.size.height,commentable_entity.photo.sizes.medium.url,commentable_entity.photo.sizes.medium.processing,commentable_entity.photo.sizes.medium.size.width,commentable_entity.photo.sizes.medium.size.height,commentable_entity.photo.sizes.large.url,commentable_entity.photo.sizes.large.processing,commentable_entity.photo.sizes.large.size.width,commentable_entity.photo.sizes.large.size.height,commentable_entity.photo.type,commentable_entity.activity.recruit..count,commentable_entity.activity.recruit..last_updated,commentable_entity.activity.recruit.copylink.count,commentable_entity.activity.recruit.copylink.last_updated,commentable_entity.activity.recruit.email.count,commentable_entity.activity.recruit.email.last_updated,commentable_entity.activity.recruit.facebook.count,commentable_entity.activity.recruit.facebook.last_updated,commentable_entity.activity.recruit.facebook_messenger.count,commentable_entity.activity.recruit.facebook_messenger.last_updated,commentable_entity.activity.recruit.twitter.count,commentable_entity.activity.recruit.twitter.last_updated,commentable_entity.activity.recruit.whatsapp.count,commentable_entity.activity.recruit.whatsapp.last_updated,commentable_entity.activity.share.copylink.count,commentable_entity.activity.share.copylink.last_updated,commentable_entity.activity.share.custom_url.count,commentable_entity.activity.share.custom_url.last_updated,commentable_entity.activity.share.email.count,commentable_entity.activity.share.email.last_updated,commentable_entity.activity.share.facebook.count,commentable_entity.activity.share.facebook.last_updated,commentable_entity.activity.share.facebook_messenger.count,commentable_entity.activity.share.facebook_messenger.last_updated,commentable_entity.activity.share.sms.count,commentable_entity.activity.share.sms.last_updated,commentable_entity.activity.share.twitter.count,commentable_entity.activity.share.twitter.last_updated,commentable_entity.activity.share.whatsapp.count,commentable_entity.activity.share.whatsapp.last_updated,commentable_entity.user.id,commentable_entity.user.slug,commentable_entity.user.first_name,commentable_entity.user.last_name,commentable_entity.user.short_display_name,commentable_entity.user.display_name,commentable_entity.user.city,commentable_entity.user.state_code,commentable_entity.user.country_code,commentable_entity.user.website,commentable_entity.user.locale,commentable_entity.user.description,commentable_entity.user.photo.id,commentable_entity.user.photo.url,commentable_entity.user.photo.sizes.small.url,commentable_entity.user.photo.sizes.small.processing,commentable_entity.user.photo.sizes.small.size.width,commentable_entity.user.photo.sizes.small.size.height,commentable_entity.user.photo.sizes.medium.url,commentable_entity.user.photo.sizes.medium.processing,commentable_entity.user.photo.sizes.medium.size.width,commentable_entity.user.photo.sizes.medium.size.height,commentable_entity.user.photo.sizes.large.url,commentable_entity.user.photo.sizes.large.processing,commentable_entity.user.photo.sizes.large.size.width,commentable_entity.user.photo.sizes.large.size.height,commentable_entity.user.photo.sizes.xlarge.url,commentable_entity.user.photo.sizes.xlarge.processing,commentable_entity.user.photo.sizes.xlarge.size.width,commentable_entity.user.photo.sizes.xlarge.size.height,commentable_entity.user.roles,commentable_entity.targets,commentable_entity.hide_comments,commentable_entity.hide_dm_action_panel,commentable_entity.enable_human_verification,commentable_entity.creator_name,commentable_entity.creator_photo.id,commentable_entity.creator_photo.url,commentable_entity.creator_photo.sizes.small.url,commentable_entity.creator_photo.sizes.small.processing,commentable_entity.creator_photo.sizes.small.size.width,commentable_entity.creator_photo.sizes.small.size.height,commentable_entity.creator_photo.sizes.medium.url,commentable_entity.creator_photo.sizes.medium.processing,commentable_entity.creator_photo.sizes.medium.size.width,commentable_entity.creator_photo.sizes.medium.size.height,commentable_entity.creator_photo.sizes.large.url,commentable_entity.creator_photo.sizes.large.processing,commentable_entity.creator_photo.sizes.large.size.width,commentable_entity.creator_photo.sizes.large.size.height,commentable_entity.creator_photo.sizes.xlarge.url,commentable_entity.creator_photo.sizes.xlarge.processing,commentable_entity.creator_photo.sizes.xlarge.size.width,commentable_entity.creator_photo.sizes.xlarge.size.height,commentable_entity.display_title,commentable_entity.petition_title,commentable_entity.petition_status,commentable_entity.calculated_goal,commentable_entity.media.id,commentable_entity.media.url,commentable_entity.media.sizes.square.url,commentable_entity.media.sizes.square.processing,commentable_entity.media.sizes.square.size.width,commentable_entity.media.sizes.square.size.height,commentable_entity.media.sizes.small.url,commentable_entity.media.sizes.small.processing,commentable_entity.media.sizes.small.size.width,commentable_entity.media.sizes.small.size.height,commentable_entity.media.sizes.medium.url,commentable_entity.media.sizes.medium.processing,commentable_entity.media.sizes.medium.size.width,commentable_entity.media.sizes.medium.size.height,commentable_entity.media.sizes.large.url,commentable_entity.media.sizes.large.processing,commentable_entity.media.sizes.large.size.width,commentable_entity.media.sizes.large.size.height,commentable_entity.media.type,commentable_entity.primary_target.id,commentable_entity.primary_target.display_name,commentable_entity.primary_target.email,commentable_entity.primary_target.type,commentable_entity.primary_target.slug,commentable_entity.primary_target.description,commentable_entity.primary_target.publicly_visible,commentable_entity.primary_target.verified_at,commentable_entity.primary_target.summary,commentable_entity.primary_target.locale,commentable_entity.primary_target.confirmed_at,commentable_entity.primary_target.is_person,commentable_entity.primary_target.additional_data.first_name,commentable_entity.primary_target.additional_data.last_name,commentable_entity.primary_target.additional_data.title,commentable_entity.primary_target.additional_data.id,commentable_entity.primary_target.has_email,commentable_entity.primary_target.photo.id,commentable_entity.primary_target.photo.url,commentable_entity.primary_target.photo.sizes.small.url,commentable_entity.primary_target.photo.sizes.small.processing,commentable_entity.primary_target.photo.sizes.small.size.width,commentable_entity.primary_target.photo.sizes.small.size.height,commentable_entity.primary_target.photo.sizes.medium.url,commentable_entity.primary_target.photo.sizes.medium.processing,commentable_entity.primary_target.photo.sizes.medium.size.width,commentable_entity.primary_target.photo.sizes.medium.size.height,commentable_entity.primary_target.photo.sizes.large.url,commentable_entity.primary_target.photo.sizes.large.processing,commentable_entity.primary_target.photo.sizes.large.size.width,commentable_entity.primary_target.photo.sizes.large.size.height,commentable_entity.primary_target.photo.sizes.xlarge.url,commentable_entity.primary_target.photo.sizes.xlarge.processing,commentable_entity.primary_target.photo.sizes.xlarge.size.width,commentable_entity.primary_target.photo.sizes.xlarge.size.height,commentable_entity.progress,user.photo.id,user.photo.url,user.photo.sizes.small.url,user.photo.sizes.small.processing,user.photo.sizes.small.size.width,user.photo.sizes.small.size.height,user.photo.sizes.medium.url,user.photo.sizes.medium.processing,user.photo.sizes.medium.size.width,user.photo.sizes.medium.size.height,user.photo.sizes.large.url,user.photo.sizes.large.processing,user.photo.sizes.large.size.width,user.photo.sizes.large.size.height,user.photo.sizes.xlarge.url,user.photo.sizes.xlarge.processing,user.photo.sizes.xlarge.size.width,user.photo.sizes.xlarge.size.height
835735116,She's a bully and spreads misinformation!,0,0,Event,33465800,0,comment,2022-09-09T00:14:05Z,,323842094,323842094,isabel,acevedo,isabel,isabel acevedo,Stockton,CA,US,,en-US,,[],33465800,33465800,Remove Eve Barlow from twitter,2022-05-27T06:00:13Z,,2022-05-27T06:00:13Z,2022-05-31T02:05:40Z,en-US,['en'],Remove Eve Barlow from twitter,"<p>Eve Barlow is a dangerous Twitter user who is spreading misinformation and propaganda. She has over 60,000 followers, and her account is followed by many celebrities, including Amber Heard. Barlow has been tweeting in support of Heard since she filed for divorce from Johnny Depp, and she has been using her platform to attack Depp and his fans. Some of Barlow's tweets are protected, so you can't reply to them, which only adds to the sense that she is trying to silence dissent </p>
<p> </p>
<p>Eve Barlow, a journalist has been called out on social media for disabling replies on her Twitter account. Critics argue that this move makes her unsuitable to be a journalist, as it prevents her from engaging in open dialogue with her followers and readers. Barlow has not commented on the matter, but it is clear that she does not intend to engage with anyone who disagrees with her views. This raises serious questions about her ability to be unbiased and impartial in her journalism</p>","Twitter, Inc, Jack Dorsey",Remove Eve Barlow from twitter,,,,US,,,,,,,remove-eve-barlow-from-twitter,published,,,False,False,,False,,[],True,False,,563,563,3,3823,231,1,13,0,0,1,0,,StopEveBarlowshsisdangerous,,,,226647732,photos/0/gz/ef/FngZEfcBIvIrmtb-fullsize.jpg,//assets.change.org/photos/0/gz/ef/FngZEfcBIvIrmtb-400x400-noPad.jpg?1653631218,False,400,400,//assets.change.org/photos/0/gz/ef/FngZEfcBIvIrmtb-400x225-noPad.jpg?1653631218,False,400,225,//assets.change.org/photos/0/gz/ef/FngZEfcBIvIrmtb-800x450-noPad.jpg?1653631219,False,800,450,//assets.change.org/photos/0/gz/ef/FngZEfcBIvIrmtb-1600x900-noPad.jpg?1653631218,False,1600,900,photo,1,1657696434,28,1657696251,2,1654772148,2,1654522869,1,1656315499,38,1661635781,1,1657691352,94,1664121973.831,1,1653962751.175,30,1659676970.063,13,1657806167.421,4,1656315224.122,10,1658637291.404,31,1661631198.824,15,1657691307.434,1265599195,1265599195,Mera,Brown,Mera,Mera Brown,Providence,RI,US,,en-US,,226613251,photos/8/nt/fd/GkNTFDMcBeVfJyt-fullsize.jpg,//assets.change.org/photos/8/nt/fd/GkNTFDMcBeVfJyt-48x48-noPad.jpg?1652391180,False,48,48,//assets.change.org/photos/8/nt/fd/GkNTFDMcBeVfJyt-128x128-noPad.jpg?1652391181,False,128,128,//assets.change.org/photos/8/nt/fd/GkNTFDMcBeVfJyt-400x400-noPad.jpg?1652391181,False,400,400,//assets.change.org/photos/8/nt/fd/GkNTFDMcBeVfJyt-800x800-noPad.jpg?1652391181,False,800,800,[],"[{'id': 656089, 'display_name': 'Twitter, Inc', 'email': None, 'type': 'Custom', 'slug': 'twitter', 'description': '', 'publicly_visible': True, 'verified_at': None, 'summary': None, 'locale': 'en-US', 'confirmed_at': '2014-05-15T20:28:15Z', 'is_person': True, 'member_of': {}, 'additional_data': {'first_name': 'Twitter,', 'last_name': 'Inc', 'title': None, 'id': 107241}, 'has_email': False, 'photo': {'id': 18694565, 'url': 'photos/3/gv/zl/UbgvzliXcUicIAL-fullsize.jpg', 'sizes': {'small': {'url': '//assets.change.org/photos/3/gv/zl/UbgvzliXcUicIAL-48x48-noPad.jpg?1521488804', 'processing': False, 'size': {'width': 48, 'height': 48}}, 'medium': {'url': '//assets.change.org/photos/3/gv/zl/UbgvzliXcUicIAL-128x128-noPad.jpg?1521488805', 'processing': False, 'size': {'width': 128, 'height': 128}}, 'large': {'url': '//assets.change.org/photos/3/gv/zl/UbgvzliXcUicIAL-400x400-noPad.jpg?1521488804', 'processing': False, 'size': {'width': 400, 'height': 400}}, 'xlarge': {'url': '//assets.change.org/photos/3/gv/zl/UbgvzliXcUicIAL-800x800-noPad.jpg?1521488805', 'processing': False, 'size': {'width': 800, 'height': 800}}}}}, {'id': 1337825, 'display_name': 'Jack Dorsey', 'email': None, 'type': 'Custom', 'slug': 'jack-dorsey', 'description': '', 'publicly_visible': True, 'verified_at': None, 'summary': None, 'locale': 'en-US', 'confirmed_at': '2016-06-16T21:45:31Z', 'is_person': True, 'member_of': {}, 'additional_data': {'first_name': 'Jack', 'last_name': 'Dorsey', 'title': 'Twitter and Square CEO', 'id': 1269860}, 'has_email': False, 'photo': {'id': 141027137, 'url': 'photos/1/hi/zs/pEHIZsIdoSNfjir-fullsize.jpg', 'sizes': {'small': {'url': '//assets.change.org/photos/1/hi/zs/pEHIZsIdoSNfjir-48x48-noPad.jpg?1528862395', 'processing': False, 'size': {'width': 48, 'height': 48}}, 'medium': {'url': '//assets.change.org/photos/1/hi/zs/pEHIZsIdoSNfjir-128x128-noPad.jpg?1528862395', 'processing': False, 'size': {'width': 128, 'height': 128}}, 'large': {'url': '//assets.change.org/photos/1/hi/zs/pEHIZsIdoSNfjir-400x400-noPad.jpg?1528862395', 'processing': False, 'size': {'width': 400, 'height': 400}}, 'xlarge': {'url': '//assets.change.org/photos/1/hi/zs/pEHIZsIdoSNfjir-800x800-noPad.jpg?1528862396', 'processing': False, 'size': {'width': 800, 'height': 800}}}}}]",False,False,False,Mera Brown,226613251,photos/8/nt/fd/GkNTFDMcBeVfJyt-fullsize.jpg,//assets.change.org/photos/8/nt/fd/GkNTFDMcBeVfJyt-48x48-noPad.jpg?1652391180,False,48,48,//assets.change.org/photos/8/nt/fd/GkNTFDMcBeVfJyt-128x128-noPad.jpg?1652391181,False,128,128,//assets.change.org/photos/8/nt/fd/GkNTFDMcBeVfJyt-400x400-noPad.jpg?1652391181,False,400,400,//assets.change.org/photos/8/nt/fd/GkNTFDMcBeVfJyt-800x800-noPad.jpg?1652391181,False,800,800,Remove Eve Barlow from twitter,Remove Eve Barlow from twitter,active,1000,226647732,photos/0/gz/ef/FngZEfcBIvIrmtb-fullsize.jpg,//assets.change.org/photos/0/gz/ef/FngZEfcBIvIrmtb-400x400-noPad.jpg?1653631218,False,400,400,//assets.change.org/photos/0/gz/ef/FngZEfcBIvIrmtb-400x225-noPad.jpg?1653631218,False,400,225,//assets.change.org/photos/0/gz/ef/FngZEfcBIvIrmtb-800x450-noPad.jpg?1653631219,False,800,450,//assets.change.org/photos/0/gz/ef/FngZEfcBIvIrmtb-1600x900-noPad.jpg?1653631218,False,1600,900,photo,656089,"Twitter, Inc",,Custom,twitter,,True,,,en-US,2014-05-15T20:28:15Z,True,"Twitter,",Inc,,107241,False,18694565,photos/3/gv/zl/UbgvzliXcUicIAL-fullsize.jpg,//assets.change.org/photos/3/gv/zl/UbgvzliXcUicIAL-48x48-noPad.jpg?1521488804,False,48,48,//assets.change.org/photos/3/gv/zl/UbgvzliXcUicIAL-128x128-noPad.jpg?1521488805,False,128,128,//assets.change.org/photos/3/gv/zl/UbgvzliXcUicIAL-400x400-noPad.jpg?1521488804,False,400,400,//assets.change.org/photos/3/gv/zl/UbgvzliXcUicIAL-800x800-noPad.jpg?1521488805,False,800,800,56.3,,,,,,,,,,,,,,,,,,
835461677,Lines have been crossed,0,0,Event,33465800,0,comment,2022-08-29T23:58:22Z,,1148429163,1148429163,Kait,Leonard,Kait,Kait Leonard,Los Angeles,CA,US,,en-US,,[],33465800,33465800,Remove Eve Barlow from twitter,2022-05-27T06:00:13Z,,2022-05-27T06:00:13Z,2022-05-31T02:05:40Z,en-US,['en'],Remove Eve Barlow from twitter,"<p>Eve Barlow is a dangerous Twitter user who is spreading misinformation and propaganda. She has over 60,000 followers, and her account is followed by many celebrities, including Amber Heard. Barlow has been tweeting in support of Heard since she filed for divorce from Johnny Depp, and she has been using her platform to attack Depp and his fans. Some of Barlow's tweets are protected, so you can't reply to them, which only adds to the sense that she is trying to silence dissent </p>
<p> </p>
<p>Eve Barlow, a journalist has been called out on social media for disabling replies on her Twitter account. Critics argue that this move makes her unsuitable to be a journalist, as it prevents her from engaging in open dialogue with her followers and readers. Barlow has not commented on the matter, but it is clear that she does not intend to engage with anyone who disagrees with her views. This raises serious questions about her ability to be unbiased and impartial in her journalism</p>","Twitter, Inc, Jack Dorsey",Remove Eve Barlow from twitter,,,,US,,,,,,,remove-eve-barlow-from-twitter,published,,,False,False,,False,,[],True,False,,563,563,3,3823,231,1,13,0,0,1,0,,StopEveBarlowshsisdangerous,,,,226647732,photos/0/gz/ef/FngZEfcBIvIrmtb-fullsize.jpg,//assets.change.org/photos/0/gz/ef/FngZEfcBIvIrmtb-400x400-noPad.jpg?1653631218,False,400,400,//assets.change.org/photos/0/gz/ef/FngZEfcBIvIrmtb-400x225-noPad.jpg?1653631218,False,400,225,//assets.change.org/photos/0/gz/ef/FngZEfcBIvIrmtb-800x450-noPad.jpg?1653631219,False,800,450,//assets.change.org/photos/0/gz/ef/FngZEfcBIvIrmtb-1600x900-noPad.jpg?1653631218,False,1600,900,photo,1,1657696434,28,1657696251,2,1654772148,2,1654522869,1,1656315499,38,1661635781,1,1657691352,94,1664121973.831,1,1653962751.175,30,1659676970.063,13,1657806167.421,4,1656315224.122,10,1658637291.404,31,1661631198.824,15,1657691307.434,1265599195,1265599195,Mera,Brown,Mera,Mera Brown,Providence,RI,US,,en-US,,226613251,photos/8/nt/fd/GkNTFDMcBeVfJyt-fullsize.jpg,//assets.change.org/photos/8/nt/fd/GkNTFDMcBeVfJyt-48x48-noPad.jpg?1652391180,False,48,48,//assets.change.org/photos/8/nt/fd/GkNTFDMcBeVfJyt-128x128-noPad.jpg?1652391181,False,128,128,//assets.change.org/photos/8/nt/fd/GkNTFDMcBeVfJyt-400x400-noPad.jpg?1652391181,False,400,400,//assets.change.org/photos/8/nt/fd/GkNTFDMcBeVfJyt-800x800-noPad.jpg?1652391181,False,800,800,[],"[{'id': 656089, 'display_name': 'Twitter, Inc', 'email': None, 'type': 'Custom', 'slug': 'twitter', 'description': '', 'publicly_visible': True, 'verified_at': None, 'summary': None, 'locale': 'en-US', 'confirmed_at': '2014-05-15T20:28:15Z', 'is_person': True, 'member_of': {}, 'additional_data': {'first_name': 'Twitter,', 'last_name': 'Inc', 'title': None, 'id': 107241}, 'has_email': False, 'photo': {'id': 18694565, 'url': 'photos/3/gv/zl/UbgvzliXcUicIAL-fullsize.jpg', 'sizes': {'small': {'url': '//assets.change.org/photos/3/gv/zl/UbgvzliXcUicIAL-48x48-noPad.jpg?1521488804', 'processing': False, 'size': {'width': 48, 'height': 48}}, 'medium': {'url': '//assets.change.org/photos/3/gv/zl/UbgvzliXcUicIAL-128x128-noPad.jpg?1521488805', 'processing': False, 'size': {'width': 128, 'height': 128}}, 'large': {'url': '//assets.change.org/photos/3/gv/zl/UbgvzliXcUicIAL-400x400-noPad.jpg?1521488804', 'processing': False, 'size': {'width': 400, 'height': 400}}, 'xlarge': {'url': '//assets.change.org/photos/3/gv/zl/UbgvzliXcUicIAL-800x800-noPad.jpg?1521488805', 'processing': False, 'size': {'width': 800, 'height': 800}}}}}, {'id': 1337825, 'display_name': 'Jack Dorsey', 'email': None, 'type': 'Custom', 'slug': 'jack-dorsey', 'description': '', 'publicly_visible': True, 'verified_at': None, 'summary': None, 'locale': 'en-US', 'confirmed_at': '2016-06-16T21:45:31Z', 'is_person': True, 'member_of': {}, 'additional_data': {'first_name': 'Jack', 'last_name': 'Dorsey', 'title': 'Twitter and Square CEO', 'id': 1269860}, 'has_email': False, 'photo': {'id': 141027137, 'url': 'photos/1/hi/zs/pEHIZsIdoSNfjir-fullsize.jpg', 'sizes': {'small': {'url': '//assets.change.org/photos/1/hi/zs/pEHIZsIdoSNfjir-48x48-noPad.jpg?1528862395', 'processing': False, 'size': {'width': 48, 'height': 48}}, 'medium': {'url': '//assets.change.org/photos/1/hi/zs/pEHIZsIdoSNfjir-128x128-noPad.jpg?1528862395', 'processing': False, 'size': {'width': 128, 'height': 128}}, 'large': {'url': '//assets.change.org/photos/1/hi/zs/pEHIZsIdoSNfjir-400x400-noPad.jpg?1528862395', 'processing': False, 'size': {'width': 400, 'height': 400}}, 'xlarge': {'url': '//assets.change.org/photos/1/hi/zs/pEHIZsIdoSNfjir-800x800-noPad.jpg?1528862396', 'processing': False, 'size': {'width': 800, 'height': 800}}}}}]",False,False,False,Mera Brown,226613251,photos/8/nt/fd/GkNTFDMcBeVfJyt-fullsize.jpg,//assets.change.org/photos/8/nt/fd/GkNTFDMcBeVfJyt-48x48-noPad.jpg?1652391180,False,48,48,//assets.change.org/photos/8/nt/fd/GkNTFDMcBeVfJyt-128x128-noPad.jpg?1652391181,False,128,128,//assets.change.org/photos/8/nt/fd/GkNTFDMcBeVfJyt-400x400-noPad.jpg?1652391181,False,400,400,//assets.change.org/photos/8/nt/fd/GkNTFDMcBeVfJyt-800x800-noPad.jpg?1652391181,False,800,800,Remove Eve Barlow from twitter,Remove Eve Barlow from twitter,active,1000,226647732,photos/0/gz/ef/FngZEfcBIvIrmtb-fullsize.jpg,//assets.change.org/photos/0/gz/ef/FngZEfcBIvIrmtb-400x400-noPad.jpg?1653631218,False,400,400,//assets.change.org/photos/0/gz/ef/FngZEfcBIvIrmtb-400x225-noPad.jpg?1653631218,False,400,225,//assets.change.org/photos/0/gz/ef/FngZEfcBIvIrmtb-800x450-noPad.jpg?1653631219,False,800,450,//assets.change.org/photos/0/gz/ef/FngZEfcBIvIrmtb-1600x900-noPad.jpg?1653631218,False,1600,900,photo,656089,"Twitter, Inc",,Custom,twitter,,True,,,en-US,2014-05-15T20:28:15Z,True,"Twitter,",Inc,,107241,False,18694565,photos/3/gv/zl/UbgvzliXcUicIAL-fullsize.jpg,//assets.change.org/photos/3/gv/zl/UbgvzliXcUicIAL-48x48-noPad.jpg?1521488804,False,48,48,//assets.change.org/photos/3/gv/zl/UbgvzliXcUicIAL-128x128-noPad.jpg?1521488805,False,128,128,//assets.change.org/photos/3/gv/zl/UbgvzliXcUicIAL-400x400-noPad.jpg?1521488804,False,400,400,//assets.change.org/photos/3/gv/zl/UbgvzliXcUicIAL-800x800-noPad.jpg?1521488805,False,800,800,56.3,,,,,,,,,,,,,,,,,,
